Raya and the Last Dragon,"Animation, Action, Adventure","In a realm known as Kumandra, a re-imagined Earth inhabited by an ancient civilization, a warrior named Raya is determined to find the last dragon."
The Silencing,"Action, Crime, Mystery",A reformed hunter living in isolation on a wildlife sanctuary becomes involved in a deadly game of cat and mouse when he and the local Sheriff set out to track a vicious killer who may have kidnapped his daughter years ago.
Spiderhead,"Action, Crime, Drama","In the near future, convicts are offered the chance to volunteer as medical subjects to shorten their sentence. One such subject for a new drug capable of generating feelings of love begins questioning the reality of his emotions."
Romancing the Stone,"Action, Adventure, Comedy","A mousy romance novelist sets off for Colombia to ransom her kidnapped sister, and soon finds herself in the middle of a dangerous adventure hunting for treasure with a mercenary rogue."
Fallen,"Action, Crime, Drama","Homicide detective John Hobbes witnesses the execution of serial killer Edgar Reese. Soon after the execution, the killings start again, and they are very similar to Reese's style."
The Collective,Action,"A young recruit to a mysterious agency of assassins finds himself going rogue on his first assignment, tracking down a dangerous group of human traffickers."
The Shallows,"Action, Drama, Horror","A mere 200 yards from shore, surfer Nancy is attacked by a great white shark, with her short journey to safety becoming the ultimate contest of wills."
Spectre,"Action, Adventure, Thriller","A cryptic message from James Bond's past sends him on a trail to uncover the existence of a sinister organisation named SPECTRE. With a new threat dawning, Bond learns the terrible truth about the author of all his pain in his most recent missions."
Memory,"Action, Crime, Thriller",An assassin-for-hire finds that he's become a target after he refuses to complete a job for a dangerous criminal organization.
The Twilight Saga: Eclipse,"Action, Adventure, Drama","As a string of mysterious killings grips Seattle, Bella, whose high school graduation is fast approaching, is forced to choose between her love for vampire Edward and her friendship with werewolf Jacob."
The Italian Job,"Action, Crime, Thriller","After being betrayed and left for dead in Italy, Charlie Croker and his team plan an elaborate gold heist against their former ally."
Sonic the Hedgehog 3,"Animation, Action, Adventure",Plot under wraps
Winchester '73,"Action, Drama, Western",A cowboy's obsession with a stolen rifle leads to a bullet-ridden odyssey through the American West.
Fantastic Four,"Action, Adventure, Sci-Fi",Four young outsiders teleport to an alternate and dangerous universe which alters their physical form in shocking ways. The four must learn to harness their new abilities and work together to save Earth from a former friend turned enemy.
Venom 3,"Action, Adventure, Sci-Fi",Add a Plot
Training Day,"Action, Crime, Drama",A rookie cop spends his first day as a Los Angeles narcotics officer with a rogue detective who isn't what he appears to be.
Cloverfield,"Action, Adventure, Horror",A group of friends venture deep into the streets of New York on a rescue mission during a rampaging monster attack.
iNumber Number: Jozi Gold,"Action, Adventure, Crime","When an undercover cop is tasked with investigating a historic gold heist in Johannesburg, he’s forced to choose between his conscience and the law."
The Harder They Fall,"Action, Drama, Western","When an outlaw discovers his enemy is being released from prison, he reunites his gang to seek revenge."
The Final Countdown,"Action, Adventure, Sci-Fi","A modern aircraft carrier is thrown back in time to 1941 near Hawaii, just hours before the Japanese attack on Pearl Harbor."
Lightyear,"Animation, Action, Adventure","While spending years attempting to return home, marooned Space Ranger Buzz Lightyear encounters an army of ruthless robots commanded by Zurg who are attempting to steal his fuel source."
King Arthur: Legend of the Sword,"Action, Adventure, Drama","Robbed of his birthright, Arthur comes up the hard way in the back alleys of the city. But once he pulls the sword from the stone, he is forced to acknowledge his true legacy - whether he likes it or not."
The Predator,"Action, Adventure, Horror","When a young boy accidentally triggers the universe's most lethal hunters' return to Earth, only a ragtag crew of ex-soldiers and a disgruntled scientist can prevent the end of the human race."
Den of Thieves,"Action, Crime, Drama",An elite unit of the LA County Sheriff's Dept. and the state's most successful bank robbery crew clash as the outlaws plan a seemingly impossible heist on the Federal Reserve Bank.
The Lego Batman Movie,"Animation, Action, Adventure","A cooler-than-ever Bruce Wayne must deal with the usual suspects as they plan to rule Gotham City, while discovering that he has accidentally adopted a teenage orphan who wishes to become his sidekick."
Tomb Raider,"Action, Adventure, Fantasy","Lara Croft, the fiercely independent daughter of a missing adventurer, must push herself beyond her limits when she discovers the island where her father, Lord Richard Croft disappeared."
Rise of the Planet of the Apes,"Action, Drama, Sci-Fi",A substance designed to help the brain repair itself gives advanced intelligence to a chimpanzee who leads an ape uprising.
Warcraft,"Action, Adventure, Fantasy","As an Orc horde invades the planet Azeroth using a magic portal, a few human heroes and dissenting Orcs must attempt to stop the true evil behind this war."
Oldboy,"Action, Drama, Mystery","Obsessed with vengeance, a man sets out to find out why he was kidnapped and locked into solitary confinement for twenty years without reason."
Rambo: Last Blood,"Action, Crime, Thriller",Rambo must confront his past and unearth his ruthless combat skills to exact revenge in a final mission.
Hotel Artemis,"Action, Crime, Drama","Set in riot-torn, near-future Los Angeles, 'Hotel Artemis' follows the Nurse, who runs a secret, members-only emergency room for criminals."
Shichinin no samurai,"Action, Drama","Farmers from a village exploited by bandits hire a veteran samurai for protection, who gathers six other samurai to join him."
District 9,"Action, Sci-Fi, Thriller",Violence ensues after an extraterrestrial race forced to live in slum-like conditions on Earth finds a kindred spirit in a government agent exposed to their biotechnology.
Deepwater Horizon,"Action, Drama, History","A dramatization of the disaster in April 2010, when the offshore drilling rig called the Deepwater Horizon exploded, resulting in the worst oil spill in American history."
The Forever Purge,"Action, Crime, Horror",All the rules are broken as a sect of lawless marauders decides that the annual Purge does not stop at daybreak and instead should never end.
Sicario: Day of the Soldado,"Action, Crime, Drama","The drug war on the U.S.-Mexico border has escalated as the cartels have begun trafficking terrorists across the US border. To fight the war, federal agent Matt Graver re-teams with the mercurial Alejandro."
Olympus Has Fallen,"Action, Thriller",Secret Service agent Mike Banning finds himself trapped inside the White House in the wake of a terrorist attack and works with national security to rescue the President from his kidnappers.
Planet Terror,"Action, Comedy, Horror","After an experimental bio-weapon is released, turning thousands into zombie-like creatures, it's up to a rag-tag group of survivors to stop the infected and those behind its release."
Poker Face,"Action, Crime, Thriller","A tech billionaire hosts a high-stakes poker game between friends, but the evening takes a turn when long-held secrets are revealed, an elaborate revenge plot unfolds, and thieves break in."
Quantum of Solace,"Action, Adventure, Mystery",James Bond descends into mystery as he tries to stop a mysterious organisation from eliminating a country's most valuable resource.
Ang-ma-reul bo-at-da,"Action, Crime, Thriller",A secret agent exacts revenge on a serial killer through a series of captures and releases.
Avatar 3,"Action, Adventure, Fantasy",Sequel ofAvatar: The Way of Water(2022). The plot is unknown.
Jason Bourne,"Action, Thriller",The CIA's most dangerous former operative is drawn out of hiding to uncover more explosive truths about his past.
Terminator Salvation,"Action, Adventure, Sci-Fi","In 2018, a mysterious new weapon in the war against the machines, half-human and half-machine, comes to John Connor on the eve of a resistance attack on Skynet. But whose side is he on, and can he be trusted?"
300: Rise of an Empire,"Action, Drama","Greek general Themistocles of Athens leads the naval charge against invading Persian forces led by mortal-turned-god Xerxes and Artemisia, vengeful commander of the Persian navy."
Borderlands,"Action, Adventure, Comedy",A feature film based on the popular video game set on the abandoned fictional planet of Pandora where people search for a mysterious relic.
Escape to Athena,"Action, Adventure, Comedy","A World War II adventure involving a group of Allied P.O.W.s, Nazis, black market priceless art treasures, Greek resistance, a Greek monastery, and a secret German rocket base."
Dredd,"Action, Crime, Sci-Fi","In a violent, futuristic city where the police have the authority to act as judge, jury and executioner, a cop teams with a trainee to take down a gang that deals the reality-altering drug, SLO-MO."
The Man from Toronto,"Action, Adventure, Comedy",The world's deadliest assassin and New York's biggest screw-up are mistaken for each other at an Airbnb rental.
Rocky Balboa,"Action, Drama, Sport","Thirty years after the ring of the first bell, Rocky Balboa comes out of retirement and dons his gloves for his final fight against the reigning heavyweight champ Mason 'The Line' Dixon."
You Don't Mess with the Zohan,"Action, Comedy",An Israeli Special Forces Soldier fakes his death so he can re-emerge in New York City as a hair stylist.
Shaft,"Action, Crime, Thriller",New York City police detective John Shaft (nephew of the original 1970s detective) goes on a personal mission to make sure the son of a real estate tycoon is brought to justice after a racially-motivated murder.
Law Abiding Citizen,"Action, Crime, Drama",A frustrated man decides to take justice into his own hands after a plea bargain sets one of his family's killers free.
Tomorrowland,"Action, Adventure, Family","Bound by a shared destiny, a teen bursting with scientific curiosity and a former boy-genius inventor embark on a mission to unearth the secrets of a place somewhere in time and space that exists in their collective memory."
X-Men: The Last Stand,"Action, Adventure, Sci-Fi","The human government develops a cure for mutations, and Jean Gray becomes a darker uncontrollable persona called the Phoenix who allies with Magneto, causing escalation into an all-out battle for the X-Men."
Elysium,"Action, Drama, Sci-Fi","In the year 2154, the very wealthy live on a man-made space station while the rest of the population resides on a ruined Earth. A man takes on a mission that could bring equality to the polarized worlds."
Kisi Ka Bhai Kisi Ki Jaan,"Action, Comedy, Drama","The eldest brother refuses to marry since he believes it may create disharmony in his big family. His brothers, who've already found partners, come together to find a match for him."
Natural Born Killers,"Action, Crime, Romance",Two victims of traumatized childhoods become lovers and psychopathic serial murderers irresponsibly glorified by the mass media.
Teen Wolf: The Movie,"Action, Drama, Fantasy","A terrifying evil has emerged. The wolves howl once again, but only a Werewolf like Scott McCall, can gather both new allies and reunite trusted friends to fight back against what could be the most powerful and deadliest enemy."
They Live,"Action, Horror, Sci-Fi",They influence our decisions without us knowing it. They numb our senses without us feeling it. They control our lives without us realizing it. They live.
The Bourne Supremacy,"Action, Mystery, Thriller","When Jason Bourne is framed for a CIA operation gone awry, he is forced to resume his former life as a trained assassin to survive."
Hercules,"Action, Adventure, Fantasy","Having endured his legendary twelve labors, Hercules, the Greek demigod, has his life as a sword-for-hire tested when the King of Thrace and his daughter seek his aid in defeating a tyrannical warlord."
Underwater,"Action, Horror, Sci-Fi",A crew of oceanic researchers working for a deep sea drilling company try to get to safety after a mysterious earthquake devastates their deepwater research and drilling facility located at the bottom of the Mariana Trench.
Ambush,"Action, Thriller, War","A group of young elite commandos, led by Captain Drummond are tasked with collecting highly classified information that can change the fate of the war."
Kick-Ass 2,"Action, Comedy, Crime","Following Kick-Ass' heroics, other citizens are inspired to become masked crusaders. But Red Mist leads his own group of evil supervillains to get revenge, kill Kick-Ass and destroy everything he stands for."
Big Hero 6,"Animation, Action, Adventure","A special bond develops between plus-sized inflatable robot Baymax and prodigy Hiro Hamada, who together team up with a group of friends to form a band of high-tech heroes."
The Rocketeer,"Action, Adventure, Family",A young pilot stumbles onto a prototype jetpack that allows him to become a high-flying masked hero.
Lou,"Action, Adventure, Crime","A storm rages. A young girl is kidnapped. Her mother teams up with the mysterious woman next door to pursue the kidnapper, a journey that tests their limits and exposes shocking secrets from their pasts."
Smokin' Aces,"Action, Comedy, Crime","When a Las Vegas performer-turned-snitch named Buddy Israel decides to turn state's evidence and testify against the mob, it seems that a whole lot of people would like to make sure he's no longer breathing."
The Expendables,"Action, Adventure, Thriller",A CIA operative hires a team of mercenaries to eliminate a Latin dictator and a renegade CIA agent.
Young Guns II,"Action, Drama, Western","In 1881, cattle baron John Chisum pays a bounty to Patrick Floyd Garrett to kill outlaw Billy the Kid."
Godzilla,"Action, Adventure, Sci-Fi","The world is beset by the appearance of monstrous creatures, but one of them may be the only one who can save humanity."
Daredevil,"Action, Crime",A man blinded by toxic waste which also enhanced his remaining senses fights crime as an acrobatic martial arts superhero.
A View to a Kill,"Action, Adventure, Thriller",The recovery of a microchip off the body of a fellow agent leads James Bond to a mad industrialist who plans to create a worldwide microchip monopoly by destroying California's Silicon Valley.
Atlantis: The Lost Empire,"Animation, Action, Adventure",A young linguist named Milo Thatch joins an intrepid group of explorers to find the mysterious lost continent of Atlantis.
Game Night,"Action, Adventure, Comedy",A group of friends who meet regularly for game nights find themselves entangled in a real-life mystery when the shady brother of one of them is seemingly kidnapped by dangerous gangsters.
The A-Team,"Action, Adventure, Crime","A group of Iraq War veterans look to clear their name with the U.S. Military, who suspect the four men of committing a crime for which they were framed."
G.I. Joe: Retaliation,"Action, Adventure, Sci-Fi",The G.I. Joes are not only fighting their mortal enemy Cobra; they are forced to contend with threats from within the government that jeopardize their very existence.
The Running Man,"Action, Sci-Fi, Thriller","In a dystopian America, a falsely convicted policeman gets his shot at freedom when he must forcibly participate in a TV game show where convicts, runners, must battle killers for their freedom."
Jurassic Park III,"Action, Adventure, Sci-Fi","A decidedly odd couple with ulterior motives convince Dr. Grant to go to Isla Sorna for a holiday, but their unexpected landing startles the island's new inhabitants."
Blacklight,"Action, Drama, Thriller","Travis Block is a government operative coming to terms with his shadowy past. When he discovers a plot targeting U.S. citizens, Block finds himself in the crosshairs of the FBI director he once helped protect."
Last Seen Alive,"Action, Mystery, Thriller",Will's soon-to-be ex-wife mysteriously vanishes at a gas station. He delves into the town's criminal underbelly while running from the authorities in a race against time to find her.
Clash of the Titans,"Action, Adventure, Family",Perseus must battle Medusa and the Kraken to save the Princess Andromeda.
Legion,"Action, Fantasy, Horror","When a group of strangers at a dusty roadside diner come under attack by demonic forces, their only chance for survival lies with an archangel named Michael, who informs a pregnant waitress that her unborn child is humanity's last hope."
Waterworld,"Action, Adventure, Sci-Fi","In a future where the polar ice-caps have melted and Earth is almost entirely submerged, a mutated mariner fights starvation and outlaw ""smokers,"" and reluctantly helps a woman and a young girl try to find dry land."
North by Northwest,"Action, Adventure, Mystery","A New York City advertising executive goes on the run after being mistaken for a government agent by a group of foreign spies, and falls for a woman whose loyalties he begins to doubt."
The Wolverine,"Action, Sci-Fi","Wolverine comes to Japan to meet an old friend whose life he saved years ago, and gets embroiled in a conspiracy involving yakuza and mutants."
The Transporter,"Action, Crime, Thriller","Frank Martin, who ""transports"" packages for unknown clients, is asked to move a package that soon begins moving, and complications arise."
Deja Vu,"Action, Crime, Sci-Fi","After a ferry is bombed in New Orleans, an A.T.F. agent joins a unique investigation using experimental surveillance technology to find the bomber, but soon finds himself becoming obsessed with one of the victims."
Beomjoidosi 2,"Action, Crime, Thriller","Followed by Ma Seok-do, who heads to a foreign country to extradite a suspect. However, he discovers additional murder cases and learns about a killer who had committed crimes against tourists for many years."
Guns Akimbo,"Action, Comedy, Crime",A guy relies on his newly-acquired gladiator skills to save his ex-girlfriend from kidnappers.
Enter the Dragon,"Action, Crime, Thriller",A Shaolin martial artist travels to an island fortress to spy on an opium lord - who is also a former monk from his temple - under the guise of attending a fighting tournament.
Perfect Addiction,"Action, Drama, Romance","A successful boxing trainer discovers that her boyfriend, a reigning champion, has been cheating on her with her own sister. She sets out to get revenge by training the one man capable of dethroning him: his arch-nemesis Kayden."
The New Mutants,"Action, Horror, Mystery","Five young mutants, just discovering their abilities while held in a secret facility against their will, fight to escape their past sins and save themselves."
Open Range,"Action, Drama, Romance",A former gunslinger is forced to take up arms again when he and his cattle crew are threatened by a corrupt lawman.
The League of Extraordinary Gentlemen,"Action, Adventure, Fantasy","In an alternate Victorian Age world, a group of famous contemporary fantasy, science fiction, and adventure characters team up on a secret mission."
Atomic Blonde,"Action, Thriller",An undercover MI6 agent is sent to Berlin during the Cold War to investigate the murder of a fellow agent and recover a missing list of double agents.
Indiana Jones and the Sanctuary of the Black Order,"Action, Adventure, Romance","1938. A group of American archaeologists are taken prisoners in the Castle of Wewelsburg. Indiana Jones with Sallah and Husani will travel to the Nazi Vatican, to discover the last and the darkest plan of the Third Reich."
Avengers: The Kang Dynasty,"Action, Adventure, Sci-Fi",Plot under wraps.
Angel Has Fallen,"Action, Thriller",Mike Banning is framed for the attempted assassination of the President and must evade his own agency and the FBI as he tries to uncover the real threat.
Gods of Egypt,"Action, Adventure, Drama","Mortal hero Bek teams with the god Horus in an alliance against Set, the merciless god of darkness, who has usurped Egypt's throne, plunging the once peaceful and prosperous empire into chaos and conflict."
Hanna,"Action, Adventure, Drama","A sixteen-year-old girl who was raised by her father to be the perfect assassin is dispatched on a mission across Europe, tracked by a ruthless intelligence agent and her operatives."
Beverly Hills Cop,"Action, Comedy, Crime",A freewheeling Detroit cop pursuing a murder investigation finds himself dealing with the very different culture of Beverly Hills.
Gumraah,"Action, Crime, Drama",The murder investigation of a young man takes an unexpected turn when the cops discover that the prime suspect has a lookalike.
The Matrix Reloaded,"Action, Sci-Fi","Freedom fighters Neo, Trinity and Morpheus continue to lead the revolt against the Machine Army, unleashing their arsenal of extraordinary skills and weaponry against the systematic forces of repression and exploitation."
X2,"Action, Sci-Fi, Thriller","When anti-mutant Colonel William Stryker kidnaps Professor X and attacks his school, the X-Men must ally with their archenemy Magneto to stop him."
Thirteen Lives,"Action, Adventure, Biography",A rescue mission is assembled in Thailand where a group of young boys and their soccer coach are trapped in a system of underground caves that are flooding.
G.I. Joe: The Rise of Cobra,"Action, Adventure, Sci-Fi","An elite military unit comprised of special operatives known as G.I. Joe, operating out of The Pit, takes on an evil organization led by a notorious arms dealer."
Dark Phoenix,"Action, Adventure, Sci-Fi","Jean Grey begins to develop incredible powers that corrupt and turn her into a Dark Phoenix, causing the X-Men to decide if her life is worth more than all of humanity."
Resident Evil,"Action, Horror, Sci-Fi","A special military unit fights a powerful, out-of-control supercomputer and hundreds of scientists who have mutated into flesh-eating creatures after a laboratory accident."
Demolition Man,"Action, Sci-Fi, Thriller",A police officer is brought out of suspended animation in prison to pursue an old ultra-violent nemesis who is loose in a non-violent future society.
Falling Down,"Action, Crime, Drama",An ordinary man frustrated with the various flaws he sees in society begins to psychotically and violently lash out against them.
Escape from New York,"Action, Adventure, Sci-Fi","In 1997, when the U.S. president crashes into Manhattan, now a giant maximum security prison, a convicted bank robber is sent in to rescue him."
The Sum of All Fears,"Action, Drama, Thriller","CIA analyst Jack Ryan must stop the plans of a Neo-Nazi faction that threatens to induce a catastrophic conflict between the United States and Russia's President by detonating a nuclear weapon at a football game in Baltimore, Maryland."
The Bourne Legacy,"Action, Adventure, Thriller","An expansion of the universe from Robert Ludlum's novels, centered on a new hero whose stakes have been triggered by the events of the previous three films."
PAW Patrol: The Mighty Movie,"Animation, Action, Adventure","A magical meteor crash lands in Adventure City, and gives the PAW Patrol pups superpowers, transforming them into The Mighty Pups"
Source Code,"Action, Drama, Mystery",A soldier wakes up in someone else's body and discovers he's part of an experimental government program to find the bomber of a commuter train within 8 minutes.
The Core,"Action, Adventure, Sci-Fi",The only way to save Earth from catastrophe is to drill down to the core and set it spinning again.
The Boondock Saints,"Action, Thriller",Two Irish Catholic brothers become vigilantes and wipe out Boston's criminal underworld in the name of God.
Akira,"Animation, Action, Drama","A secret military project endangers Neo-Tokyo when it turns a biker gang member into a rampaging psychic psychopath who can only be stopped by a teenager, his gang of biker friends and a group of psychics."
Get Smart,"Action, Adventure, Comedy","Maxwell Smart, a highly intellectual but bumbling spy working for the CONTROL agency, is tasked with preventing a terrorist attack from rival spy agency KAOS."
The Punisher,"Action, Crime, Drama",An undercover FBI agent becomes a vigilante and sets out to unleash his wrath upon the corrupt businessman who slaughtered his entire family at a reunion.
Sky High,"Action, Comedy, Family","Set in an era where superheroes are commonly known and accepted, young William Stronghold, the son of the Commander and Jetstream, tries to find a balance between being a normal teenager and an extraordinary being."
I Am Legend,"Action, Drama, Horror","Years after a plague kills most of humanity and transforms the rest into monsters, the sole survivor in New York City struggles valiantly to find a cure."
Day Shift,"Action, Comedy, Fantasy","A hard-working, blue-collar dad just wants to provide a good life for his quick-witted 10-year-old daughter. His mundane San Fernando Valley pool cleaning job is a front for his real source of income: hunting and killing vampires."
Fantastic Four,"Action, Adventure, Sci-Fi","One of Marvel's most iconic families makes it back to the big screen, the Fantastic Four."
The Expendables 3,"Action, Adventure, Thriller","Barney augments his team with new blood for a personal battle: to take down Conrad Stonebanks, the Expendables co-founder and notorious arms trader who is hell bent on wiping out Barney and every single one of his associates."
