Spider-Man 2,"Action, Adventure, Sci-Fi",Peter Parker is beset with troubles in his failing personal life as he battles a brilliant scientist named Doctor Otto Octavius.
Thor,"Action, Fantasy","The powerful but arrogant god Thor is cast out of Asgard to live amongst humans in Midgard (Earth), where he soon becomes one of their finest defenders."
Big Trouble in Little China,"Action, Adventure, Comedy",A rough-and-tumble trucker and his side kick face off with an ancient sorcerer in a supernatural battle beneath Chinatown.
Baywatch,"Action, Comedy, Crime","Devoted lifeguard Mitch Buchannon butts heads with a brash new recruit, as they uncover a criminal plot that threatens the future of the bay."
Murder Mystery 2,"Action, Comedy, Crime","Full-time detectives Nick and Audrey are struggling to get their private eye agency off the ground. They find themselves at the center of international abduction when their friend Maharaja, is kidnapped at his own lavish wedding."
X-Men,"Action, Adventure, Sci-Fi","In a world where mutants (evolved super-powered humans) exist and are discriminated against, two groups form for an inevitable clash: the supremacist Brotherhood, and the pacifist X-Men."
Aquaman,"Action, Adventure, Fantasy","Arthur Curry, the human-born heir to the underwater kingdom of Atlantis, goes on a quest to prevent a war between the worlds of ocean and land."
Pirates of the Caribbean: At World's End,"Action, Adventure, Fantasy","Captain Barbossa, Will Turner and Elizabeth Swann must sail off the edge of the map, navigate treachery and betrayal, find Jack Sparrow, and make their final alliances for one last decisive battle."
Air Force One,"Action, Drama, Thriller","Communist radicals hijack Air Force One with the U.S. President and his family on board. The Vice President negotiates from Washington D.C., while the President, a veteran, fights to rescue the hostages on board."
Miraculous - Le film,"Animation, Action, Adventure","Ordinary teenager Marinette's life in Paris goes superhuman when she becomes Ladybug. Bestowed with magical powers of creation, Ladybug must unite with her opposite, Cat Noir, to save Paris as a new villain unleashes chaos unto the city."
Kingdom of Heaven,"Action, Adventure, Drama","Balian of Ibelin travels to Jerusalem during the Crusades of the 12th century, and there he finds himself as the defender of the city and its people."
Venom: Let There Be Carnage,"Action, Sci-Fi, Thriller","Eddie Brock attempts to reignite his career by interviewing serial killer Cletus Kasady, who becomes the host of the symbiote Carnage and escapes prison after a failed execution."
Scott Pilgrim vs. the World,"Action, Comedy, Fantasy","In a magically realistic version of Toronto, a young man must defeat his new girlfriend's seven evil exes one by one in order to win her heart."
Greyhound,"Action, Drama, History","Several months after the U.S. entry into World War II, an inexperienced U.S. Navy commander must lead an Allied convoy being stalked by a German submarine wolf pack."
World War Z,"Action, Adventure, Horror",Former United Nations employee Gerry Lane traverses the world in a race against time to stop a zombie pandemic that is toppling armies and governments and threatens to destroy humanity itself.
Casino Royale,"Action, Adventure, Thriller","After earning 00 status and a licence to kill, secret agent James Bond sets out on his first mission as 007. Bond must defeat a private banker funding terrorists in a high-stakes game of poker at Casino Royale, Montenegro."
The Man from U.N.C.L.E.,"Action, Adventure, Comedy","In the early 1960s, CIA agent Napoleon Solo and KGB operative Illya Kuryakin participate in a joint mission against a mysterious criminal organization, which is working to proliferate nuclear weapons."
Thunderbolts,"Action, Adventure, Crime",A group of supervillains are recruited to go on missions for the government.
Shazam!,"Action, Adventure, Comedy",A newly fostered young boy in search of his mother instead finds unexpected super powers and soon gains a powerful enemy.
The Matrix Resurrections,"Action, Sci-Fi","Return to a world of two realities: one, everyday life; the other, what lies behind it. To find out if his reality is a construct, to truly know himself, Mr. Anderson will have to choose to follow the white rabbit once more."
Rush Hour,"Action, Comedy, Crime","A loyal and dedicated Hong Kong Inspector teams up with a reckless and loudmouthed L.A.P.D. detective to rescue the Chinese Consul's kidnapped daughter, while trying to arrest a dangerous crime lord along the way."
Deep Impact,"Action, Drama, Sci-Fi","A comet is discovered to be on a collision course with Earth. As doomsday nears, the human race prepares for the worst."
The Warriors,"Action, Crime, Thriller",A street gang known as The Warriors must fight their way from the Bronx to their home turf on Coney Island when they are falsely accused of assassinating a respected gang leader.
Fast & Furious,"Action, Crime, Thriller","Brian O'Conner, back working for the FBI in Los Angeles, teams up with Dominic Toretto to bring down a heroin importer by infiltrating his operation."
Shang-Chi and the Legend of the Ten Rings,"Action, Adventure, Fantasy","Shang-Chi, the master of weaponry-based Kung Fu, is forced to confront his past after being drawn into the Ten Rings organization."
The Bourne Identity,"Action, Mystery, Thriller","A man is picked up by a fishing boat, bullet-riddled and suffering from amnesia, before racing to elude assassins and attempting to regain his memory."
Run Hide Fight,"Action, Crime, Drama","17-year-old Zoe Hull uses her wits, survival skills, and compassion to fight for her life, and those of her fellow classmates, against a group of live-streaming school shooters."
Terminator 3: Rise of the Machines,"Action, Sci-Fi",A machine from a post-apocalyptic future travels back in time to protect a man and a woman from an advanced robotic assassin to ensure they both survive a nuclear attack.
Batman & Robin,"Action, Sci-Fi",Batman and Robin try to keep their relationship together even as they must stop Mr. Freeze and Poison Ivy from freezing Gotham City.
Alien³,"Action, Horror, Sci-Fi","Returning from LV-426, Ellen Ripley crash-lands on the maximum-security prison Fiorina 161, where she discovers that she has unwittingly brought along an unwelcome visitor."
The Mask,"Action, Comedy, Crime",Bank clerk Stanley Ipkiss is transformed into a manic superhero when he wears a mysterious mask.
Batman Forever,"Action, Adventure","Batman must battle former district attorney Harvey Dent, who is now Two-Face and Edward Nygma, The Riddler with help from an amorous psychologist and a young circus acrobat who becomes his sidekick, Robin."
The Day After Tomorrow,"Action, Adventure, Sci-Fi","Jack Hall, paleoclimatologist, must make a daring trek from Washington, D.C. to New York City to reach his son, trapped in the cross-hairs of a sudden international storm which plunges the planet into a new Ice Age."
Moonfall,"Action, Adventure, Sci-Fi",A mysterious force knocks the moon from its orbit and sends it hurtling on a collision course toward earth.
Death Proof,"Action, Thriller","Two separate sets of voluptuous women are stalked at different times by a scarred stuntman who uses his ""death proof"" cars to execute his murderous plans."
Point Break,"Action, Crime, Thriller",An F.B.I. Agent goes undercover to catch a gang of surfers who may be bank robbers.
Adipurush,"Action, Adventure, Drama",Adaptation of Indian mythology that depicts the triumph of good over evil.
The Lost World: Jurassic Park,"Action, Adventure, Sci-Fi","A research team is sent to the Jurassic Park Site B island to study the dinosaurs there, while an InGen team approaches with another agenda."
RoboCop,"Action, Crime, Sci-Fi","In a dystopic and crime-ridden Detroit, a terminally wounded cop returns to the force as a powerful cyborg haunted by submerged memories."
Robin Hood: Prince of Thieves,"Action, Adventure, Drama",Robin Hood decides to fight back as an outlaw when faced with the tyranny of the Sheriff of Nottingham.
The Hunt,"Action, Horror, Thriller","Twelve strangers wake up in a clearing. They don't know where they are, or how they got there. They don't know they've been chosen - for a very specific purpose - The Hunt."
The Last Duel,"Action, Drama, History",King Charles VI declares that Knight Jean de Carrouges settle his dispute with his squire by challenging him to a duel.
3:10 to Yuma,"Action, Crime, Drama",A small-time rancher agrees to hold a captured outlaw who's awaiting a train to go to court in Yuma. A battle of wills ensues as the outlaw tries to psych out the rancher.
Avengers: Age of Ultron,"Action, Adventure, Sci-Fi","When Tony Stark and Bruce Banner try to jump-start a dormant peacekeeping program called Ultron, things go horribly wrong and it's up to Earth's mightiest heroes to stop the villainous Ultron from enacting his terrible plan."
Jumanji: The Next Level,"Action, Adventure, Comedy","In Jumanji: The Next Level, the gang is back but the game has changed. As they return to rescue one of their own, the players will have to brave parts unknown from arid deserts to snowy mountains, to escape the world's most dangerous game."
Shotgun Wedding,"Action, Comedy, Romance",Darcy and Tom gather their families for the ultimate destination wedding but when the entire wedding party is taken hostage the bride and groom must save their loved ones--if they don't kill each other first.
Mortal Kombat,"Action, Adventure, Fantasy",MMA fighter Cole Young seeks out Earth's greatest champions in order to stand against the enemies of Outworld in a high stakes battle for the universe.
The Fugitive,"Action, Crime, Drama","Dr. Richard Kimble, unjustly accused of murdering his wife, must find the real killer while being the target of a nationwide manhunt led by a seasoned U.S. Marshal."
The Spy Who Loved Me,"Action, Adventure, Thriller","James Bond investigates the hijacking of British and Russian submarines carrying nuclear warheads, with the help of a K.G.B. agent whose lover he killed."
13 Hours,"Action, Drama, History","During an attack on a U.S. compound in Libya, a security team struggles to make sense out of the chaos."
Creed,"Action, Drama, Sport","The former World Heavyweight Champion Rocky Balboa serves as a trainer and mentor to Adonis Johnson, the son of his late friend and former rival Apollo Creed."
Old Henry,"Action, Drama, Western","An action western about a farmer who takes in an injured man with a satchel of cash. When a posse comes for the money, he must decide who to trust. Defending a siege, he reveals a gunslinging talent calling his true identity into question."
2012,"Action, Adventure, Sci-Fi",A frustrated writer struggles to keep his family alive when a series of global catastrophes threatens to annihilate mankind.
Kingsman: The Golden Circle,"Action, Adventure, Comedy","After the Kingsman's headquarters are destroyed and the world is held hostage, an allied spy organization in the United States is discovered. These two elite secret agencies must band together to defeat a common enemy."
The Last Kingdom: Seven Kings Must Die,"Action, Drama, History","In the wake of King Edward's death, Uhtred of Bebbanburg and his comrades adventure across a fractured kingdom in the hopes of uniting England at last."
Speed,"Action, Adventure, Thriller",A young police officer must prevent a bomb exploding aboard a city bus by keeping its speed above 50 mph.
Red Notice,"Action, Comedy, Thriller",An Interpol agent successfully tracks down the world's most wanted art thief with help from a rival thief. But nothing is as it seems as a series of double-crosses ensues.
The Incredible Hulk,"Action, Adventure, Sci-Fi","Bruce Banner, a scientist on the run from the U.S. Government, must find a cure for the monster he turns into whenever he loses his temper."
The Last of the Mohicans,"Action, Adventure, Drama",Three trappers protect the daughters of a British Colonel in the midst of the French and Indian War.
Deep Blue Sea,"Action, Adventure, Sci-Fi","Searching for a cure to Alzheimer's disease, a group of scientists on an isolated research facility become the prey, as a trio of intelligent sharks fight back."
Alita: Battle Angel,"Action, Adventure, Sci-Fi","A deactivated cyborg's revived, but can't remember anything of her past and goes on a quest to find out who she is."
Smokey and the Bandit,"Action, Adventure, Comedy","The Bandit is hired on to run a tractor-trailer full of beer over state lines, in hot pursuit by a pesky sheriff."
Superman Returns,"Action, Adventure, Sci-Fi","Superman returns to Earth after spending five years in space examining his homeworld Krypton. But he finds things have changed while he was gone, and he must once again prove himself important to the world."
Star Trek Into Darkness,"Action, Adventure, Sci-Fi","After the crew of the Enterprise find an unstoppable force of terror from within their own organization, Captain Kirk leads a manhunt to a war-zone world to capture a one-man weapon of mass destruction."
X-Men: Apocalypse,"Action, Adventure, Sci-Fi","In the 1980s the X-Men must defeat an ancient all-powerful mutant, En Sabah Nur, who intends to thrive through bringing destruction to the world."
Pixels,"Action, Comedy, Fantasy","When aliens misinterpret video feeds of classic arcade games as a declaration of war, they attack the Earth in the form of the video games."
Star Wars: Episode III - Revenge of the Sith,"Action, Adventure, Fantasy","Three years into the Clone Wars, Obi-Wan pursues a new threat, while Anakin is lured by Chancellor Palpatine into a sinister plot to rule the galaxy."
X-Men: Days of Future Past,"Action, Adventure, Sci-Fi",The X-Men send Wolverine to the past in a desperate effort to change history and prevent an event that results in doom for both humans and mutants.
Polite Society,"Action, Comedy","Ria Khan believes she must save her older sister Lena from her impending marriage. After enlisting her friends' help, she attempts to pull off the most ambitious of all wedding heists in the name of independence and sisterhood."
Teenage Mutant Ninja Turtles,"Action, Adventure, Comedy",Four teenage mutant ninja turtles emerge from the shadows to protect New York City from a gang of criminal ninjas.
Harry Potter and the Order of the Phoenix,"Action, Adventure, Family","With their warning about Lord Voldemort's return scoffed at, Harry and Dumbledore are targeted by the Wizard authorities as an authoritarian bureaucrat slowly seizes power at Hogwarts."
12 Strong,"Action, Drama, History","12 Strong tells the story of the first Special Forces team deployed to Afghanistan after 9/11; under the leadership of a new captain, the team must work with an Afghan warlord to take down the Taliban."
V for Vendetta,"Action, Drama, Sci-Fi","In a future British dystopian society, a shadowy freedom fighter, known only by the alias of ""V"", plots to overthrow the tyrannical government - with the help of a young woman."
Thor: Ragnarok,"Action, Adventure, Comedy","Imprisoned on the planet Sakaar, Thor must race against time to return to Asgard and stop Ragnarök, the destruction of his world, at the hands of the powerful and ruthless villain Hela."
Sonic the Hedgehog 2,"Action, Adventure, Comedy","When the manic Dr. Robotnik returns to Earth with a new ally, Knuckles the Echidna, Sonic and his new friend Tails is all that stands in their way."
Harry Potter and the Half-Blood Prince,"Action, Adventure, Family","As Harry Potter begins his sixth year at Hogwarts, he discovers an old book marked as ""the property of the Half-Blood Prince"" and begins to learn more about Lord Voldemort's dark past."
Divergent,"Action, Adventure, Mystery","In a world divided by factions based on virtues, Tris learns she's Divergent and won't fit in. When she discovers a plot to destroy Divergents, Tris and the mysterious Four must find out what makes Divergents dangerous before it's too late."
Twister,"Action, Adventure, Thriller","Bill and Jo Harding, advanced storm chasers on the brink of divorce, must join together to create an advanced weather alert system by putting themselves in the cross-hairs of extremely violent tornadoes."
Iron Man 2,"Action, Sci-Fi","With the world now aware of his identity as Iron Man, Tony Stark must contend with both his declining health and a vengeful mad man with ties to his father's legacy."
The Adam Project,"Action, Adventure, Comedy","After accidentally crash-landing in 2022, time-traveling fighter pilot Adam Reed teams up with his 12-year-old self for a mission to save the future."
Alien Resurrection,"Action, Horror, Sci-Fi","Two centuries after her death, a powerful human/alien hybrid clone of Ellen Ripley aids a crew of space pirates in stopping the aliens from reaching Earth."
Blade,"Action, Horror, Sci-Fi","A half-vampire, half-mortal man becomes a protector of the mortal race, while slaying evil vampires."
Clear and Present Danger,"Action, Crime, Drama",CIA Analyst Jack Ryan is drawn into an illegal war fought by the US government against a Colombian drug cartel.
Team America: World Police,"Action, Comedy","Popular Broadway actor Gary Johnston is recruited by the elite counter-terrorism organization Team America: World Police. As the world begins to crumble around him, he must battle with terrorists, celebrities and falling in love."
Ambulance,"Action, Crime, Drama",Two robbers steal an ambulance after their heist goes awry.
Deep Valley,"Action, Crime, Drama","A girl living with her parents on an isolated California farm falls in love with a chain-gang convict working at a nearby highway construction site, and sets out to help him when he escapes."
Ender's Game,"Action, Adventure, Sci-Fi","Young Ender Wiggin is recruited by the International Military to lead the fight against the Formics, an insectoid alien race who had previously tried to invade Earth and had inflicted heavy losses on humankind."
Spider-Man: Far from Home,"Action, Adventure, Comedy","Following the events ofAvengers: Endgame(2019), Spider-Man must step up to take on new threats in a world that has changed forever."
Lone Survivor,"Action, Biography, Drama","Marcus Luttrell and his team set out on a mission to capture or kill notorious Taliban leader Ahmad Shah, in late June 2005. Marcus and his team are left to fight for their lives in one of the most valiant efforts of modern warfare."
The Hunger Games: Mockingjay - Part 2,"Action, Adventure, Sci-Fi",Katniss and a team of rebels from District 13 prepare for the final battle that will decide the fate of Panem.
X: First Class,"Action, Sci-Fi","In the 1960s, superpowered humans Charles Xavier and Erik Lensherr work together to find others like them, but Erik's vengeful pursuit of an ambitious mutant who ruined his life causes a schism to divide them."
El Camino: A Breaking Bad Movie,"Action, Crime, Drama","Fugitive Jesse Pinkman runs from his captors, the law, and his past."
Rush,"Action, Biography, Drama",The merciless 1970s rivalry between Formula One rivalsJames HuntandNiki Lauda.
Shooter,"Action, Drama, Thriller","A marksman living in exile is coaxed back into action after hearing of a plot to kill the President. After being-double crossed for the attempt and on the run, he sets out for the real killer and the truth."
Morbius,"Action, Adventure, Horror","Biochemist Michael Morbius tries to cure himself of a rare blood disease, but he inadvertently infects himself with a form of vampirism instead."
DC League of Super-Pets,"Animation, Action, Adventure","Krypto the Super-Dog and Superman are inseparable best friends, sharing the same superpowers and fighting crime side by side in Metropolis. However, Krypto must master his own powers for a rescue mission when Superman is kidnapped."
Iron Man Three,"Action, Adventure, Sci-Fi","When Tony Stark's world is torn apart by a formidable terrorist called the Mandarin, he starts an odyssey of rebuilding and retribution."
Kung Fu Panda,"Animation, Action, Adventure","To everyone's surprise, including his own, Po, an overweight, clumsy panda, is chosen as protector of the Valley of Peace. His suitability will soon be tested as the valley's arch-enemy is on his way."
The Covenant,"Action, Adventure, Fantasy","Four young men who belong to a New England supernatural legacy are forced to battle a fifth power long thought to have died out. Meanwhile, jealousy and suspicion threaten to tear them apart."
Joy Ride,"Action, Mystery, Thriller","Three young people on a road trip from Colorado to New Jersey talk to a trucker on their CB radio, then must escape when he turns out to be a psychopathic killer."
Warrior,"Action, Drama, Sport","The youngest son of an alcoholic former boxer returns home, where he's trained by his father for competition in a mixed martial arts tournament - a path that puts the fighter on a collision course with his estranged, older brother."
Army of the Dead,"Action, Crime, Drama","Following a zombie outbreak in Las Vegas, a group of mercenaries take the ultimate gamble, venturing into the quarantine zone to pull off the greatest heist ever attempted."
21 Jump Street,"Action, Comedy, Crime",A pair of underachieving cops are sent back to a local high school to blend in and bring down a synthetic drug ring.
Total Recall,"Action, Adventure, Sci-Fi","When a man goes in to have virtual vacation memories of the planet Mars implanted in his mind, an unexpected and harrowing series of events forces him to go to the planet for real - or is he?"
Snowpiercer,"Action, Drama, Sci-Fi","In a future where a failed climate change experiment has killed all life except for the survivors who boarded the Snowpiercer (a train that travels around the globe), a new class system emerges."
Kong: Skull Island,"Action, Adventure, Fantasy","After the Vietnam war, a team of scientists explores an uncharted island in the Pacific, venturing into the domain of the mighty Kong and must fight to escape a primal Eden."
The Wraith,"Action, Horror, Romance","In a small town in Arizona, a mysterious man/spirit descends from the sky and manifests in a sports car and targets a local violent road-racing gang of motor heads, headed by a ruthless bully who'll do anything to get what he wants."
Fast & Furious 7,"Action, Crime, Thriller",Deckard Shaw seeks revenge against Dominic Toretto and his family for his comatose brother.
Batman Returns,"Action, Crime, Fantasy","While Batman deals with a deformed man calling himself the Penguin wreaking havoc across Gotham with the help of a cruel businessman, a female employee of the latter becomes the Catwoman with her own vendetta."
Captain America: Civil War,"Action, Sci-Fi",Political involvement in the Avengers' affairs causes a rift between Captain America and Iron Man.
Highlander,"Action, Adventure, Fantasy","An immortal Scottish swordsman must confront the last of his immortal opponents, a murderously brutal barbarian who lusts for the fabled ""Prize""."
Beast,"Action, Adventure, Drama",A father and his two teenage daughters find themselves hunted by a massive rogue lion intent on proving that the Savanna has but one apex predator.
Captain Phillips,"Action, Biography, Crime","The true story of CaptainRichard Phillipsand the 2009 hijacking by Somali pirates of the U.S.-flagged MV Maersk Alabama, the first American cargo ship to be hijacked in two hundred years."
Lucy,"Action, Sci-Fi, Thriller","A woman, accidentally caught in a dark deal, turns the tables on her captors and transforms into a merciless warrior evolved beyond human logic."
Violent Night,"Action, Comedy, Crime","When a group of mercenaries attack the estate of a wealthy family, Santa Claus must step in to save the day (and Christmas)."
The Fast and the Furious: Tokyo Drift,"Action, Crime, Thriller",A teenager becomes a major competitor in the world of drift racing after moving in with his father in Tokyo to avoid a jail sentence in America.
The School for Good and Evil,"Action, Comedy, Drama",Best friends Sophie and Agatha find themselves on opposing sides of an epic battle when they're swept away into an enchanted school where aspiring heroes and villains are trained to protect the balance between Good and Evil.
Monster Trucks,"Action, Adventure, Comedy",A young man working at a small town junkyard discovers and befriends a creature which feeds on oil being sought by a fracking company.
6 Underground,"Action, Thriller","Six individuals from all around the globe, each the very best at what they do, have been chosen not only for their skill, but for a unique desire to delete their pasts to change the future."
The Mummy,"Action, Adventure, Fantasy","An ancient Egyptian princess is awakened from her crypt beneath the desert, bringing with her malevolence grown over millennia, and terrors that defy human comprehension."
Kindergarten Cop,"Action, Comedy, Crime","A tough cop must pose as a kindergarten teacher in order to locate a dangerous criminal's ex-wife, who may hold the key to putting him behind bars."
Battleship,"Action, Adventure, Sci-Fi",A fleet of ships is forced to do battle with an armada of unknown origins in order to discover and thwart their destructive goals.
Incredibles 2,"Animation, Action, Adventure",The Incredibles family takes on a new mission which involves a change in family roles: Bob Parr (Mr. Incredible) must manage the house while his wife Helen (Elastigirl) goes out to save the world.
Young Guns,"Action, Drama, Western","A group of young gunmen, led by Billy the Kid, become deputies to avenge the murder of the rancher who became their benefactor. But when Billy takes their authority too far, they become the hunted."
Sonic the Hedgehog,"Action, Adventure, Comedy","After discovering a small, blue, fast hedgehog, a small-town police officer must help him defeat an evil genius who wants to do experiments on him."
