The Quick and the Dead,"Action, Drama, Romance","A female gunfighter returns to a frontier town where a dueling tournament is being held, which she enters in an effort to avenge her father's death."
Godzilla: King of the Monsters,"Action, Adventure, Fantasy","The crypto-zoological agency Monarch faces off against a battery of god-sized monsters, including the mighty Godzilla, who collides with Mothra, Rodan, and his ultimate nemesis, the three-headed King Ghidorah."
Constantine 2,"Action, Fantasy, Horror","Reeves will reprise his role as supernatural exorcist and demonologist John Constantine, who in the original is dying but stays around to save his soul by keeping demons from hell from breaching earth."
The Three Musketeers,"Action, Adventure, Romance","France, 1625: Young d'Artagnan heads to Paris to join the Musketeers but the evil cardinal has disbanded them - save 3. He meets the 3, Athos, Porthos and Aramis, and joins them on their quest to save the king and country."
Kôkaku kidôtai,"Animation, Action, Crime",A cyborg policewoman and her partner hunt a mysterious and powerful hacker called the Puppet Master.
Pitch Black,"Action, Horror, Sci-Fi",A transport ship crashes and leaves its crew stranded on a desert planet inhabited by bloodthirsty creatures that come out during an eclipse.
Willow,"Action, Adventure, Drama",A young farmer is chosen to undertake a perilous journey in order to protect a special baby from an evil queen.
Bad Boys 4,"Action, Adventure, Comedy",Plot unknown. Fourth installment of the 'Bad Boys' film series.
Southpaw,"Action, Crime, Drama","After a fatal incident sends him on a rampant path of destruction, a champion boxer fights to get custody of his daughter and revive his professional career."
Green Lantern,"Action, Adventure, Sci-Fi","Reckless test pilot Hal Jordan is granted an alien ring that bestows him with otherworldly powers that inducts him into an intergalactic police force, the Green Lantern Corps."
News of the World,"Action, Adventure, Drama",A Civil War veteran agrees to deliver a girl taken by the Kiowa people years ago to her aunt and uncle against her will. They travel hundreds of miles and face grave dangers as they search for a place that either can call home.
No Way Out,"Action, Crime, Drama",A coverup and witchhunt occur after a politician accidentally kills his mistress.
Fantastic Four,"Action, Adventure, Fantasy","A group of astronauts gain superpowers after a cosmic radiation exposure and must use them to oppose the plans of their enemy, Doctor Victor Von Doom."
Shaft,"Action, Comedy, Crime","JJ Shaft, a cyber security expert with a degree from MIT, enlists his family's help to uncover the truth behind his best friend's untimely death."
Banshee,Action,"A thief gets out of prison after many years and decides to try and locate someone from his past. After a series of events, he ends up becoming sheriff. Now he has to face his past while in his new position as sheriff."
Supergirl,"Action, Adventure, Fantasy","After losing a powerful orb, Kara Zor-El, Superman's cousin, comes to Earth to retrieve it and instead finds herself up against a wicked witch."
Gone in Sixty Seconds,"Action, Crime, Thriller",A retired master car thief must come back to the industry and steal fifty cars with his crew in one night to save his brother's life.
Interceptor,"Action, Adventure, Drama",One Army captain must use her years of tactical training and military expertise when a simultaneous coordinated attack threatens the remote missile interceptor station she is in command of.
Supercell,"Action, Adventure, Drama","A teenage boy runs away to follow his fathers footsteps, legendary storm chaser Bill Brody."
Fast X: Part 2,"Action, Crime, Thriller",Plot kept under wraps.
Munich,"Action, Drama, History","After the Black September capture and massacre of Israeli athletes at the 1972 Olympics, five men are chosen to eliminate the people responsible for that fateful day."
Serbuan maut,"Action, Crime, Thriller",A S.W.A.T. team becomes trapped in a tenement run by a ruthless mobster and his army of killers and thugs.
The Mask of Zorro,"Action, Adventure, Comedy","A young thief seeking revenge for his brother's death is trained by the once-great, aging Zorro, who is pursuing his own vengeance."
In the Line of Fire,"Action, Crime, Drama","Secret Service agent Frank Horrigan couldn't save Kennedy, but he's determined not to let a clever assassin take out this president."
National Treasure: Book of Secrets,"Action, Adventure, Mystery",Benjamin Gates must follow a clue left inJohn Wilkes Booth's diary to prove his ancestor's innocence in the assassination ofAbraham Lincoln.
Dragged Across Concrete,"Action, Crime, Drama","Once two overzealous cops get suspended from the force, they must delve into the criminal underworld to get their proper compensation."
22 Jump Street,"Action, Comedy, Crime","After making their way through high school (twice), big changes are in store for officers Schmidt and Jenko when they go deep undercover at a local college."
Rush Hour 3,"Action, Comedy, Crime","After an attempted assassination on Ambassador Han, Lee and Carter head to Paris to protect a French woman with knowledge of the Triads' secret leaders."
Bholaa,"Action, Adventure, Crime","After getting out of prison with the desire to meet his daughter, Bholaa's plans are interrupted by a well-orchestrated drug bust."
Samaritan,"Action, Drama, Fantasy",A young boy learns that a superhero who was thought to have died after an epic battle twenty-five years ago may in fact still be alive.
Assassin's Creed,"Action, Adventure, Sci-Fi","Callum Lynch explores the memories of his ancestor Aguilar de Nerha and gains the skills of a Master Assassin, before taking on the secret Templar society."
Knowing,"Action, Mystery, Sci-Fi",M.I.T. professor John Koestler links a mysterious list of numbers from a time capsule to past and future disasters and sets out to prevent the ultimate catastrophe.
End of Watch,"Action, Adventure, Crime","Shot documentary-style, this film follows the daily grind of two young police officers in LA who are partners and friends and what happens when they meet criminal forces greater than themselves."
Spy Kids,"Action, Adventure, Comedy","Using high tech gadgets, two kids have to save their reactivated OSS top spy parents when they're taken by an evil, high tech enemy."
Desperado,"Action, Crime, Drama",Former musician and gunslinger El Mariachi arrives at a small Mexican border town after being away for a long time. His past quickly catches up with him and he soon gets entangled with the local drug kingpin Bucho and his gang.
Innerspace,"Action, Adventure, Comedy","A test pilot is miniaturized in a secret experiment, and accidentally injected into a hapless store clerk."
King Arthur,"Action, Adventure, Drama",A demystified take on the tale of King Arthur and the Knights of the Round Table.
Predators,"Action, Adventure, Fantasy",A group of elite warriors parachute into an unfamiliar jungle and are hunted by members of a merciless alien race.
The Last Stand,"Action, Thriller, Western","The leader of a drug cartel busts out of a courthouse and speeds to the Mexican border, where the only thing in his path is a sheriff and his inexperienced staff."
The Foreigner,"Action, Thriller","A humble businessman with a buried past seeks justice when his daughter is killed in an act of terrorism. A cat-and-mouse conflict ensues with a government official, whose past may hold clues to the killers' identities."
Live Free or Die Hard,"Action, Thriller",John McClane and a young hacker join forces to take down master cyber-terrorist Thomas Gabriel in Washington D.C.
Masters of the Universe,"Action, Adventure, Fantasy",The heroic warrior He-Man battles against the evil lord Skeletor and his armies of darkness for control of Castle Grayskull.
Without Remorse,"Action, Thriller, War",An elite Navy SEAL goes on a path to avenge his wife's murder only to find himself inside of a larger conspiracy.
New Jack City,"Action, Crime, Drama",A crime lord ascends to power and becomes megalomaniacal while a maverick police detective vows to stop him.
Love and Monsters,"Action, Adventure, Comedy","Seven years after he survived the monster apocalypse, lovably hapless Joel leaves his cozy underground bunker behind on a quest to reunite with his ex."
Earthquake,"Action, Drama, Thriller","Various interconnected people struggle to survive when an earthquake of unimaginable magnitude hits Los Angeles, California."
Infidel,"Action, Thriller","An American man (Jim Caviezel) is kidnapped after a friend invites him to Cairo to speak out about recent militant uprisings. His wife heads to the city after hearing the news, determined to get him back."
Species,"Action, Horror, Sci-Fi",A group of scientists try to track down and trap a killer alien seductress before she successfully mates with a human.
Spenser Confidential,"Action, Comedy, Crime","When two Boston police officers are murdered, ex-cop Spenser teams up with his no-nonsense roommate Hawk to take down criminals."
RoboCop,"Action, Crime, Sci-Fi","In 2028 Detroit, when Alex Murphy, a loving husband, father and good cop, is critically injured in the line of duty, the multinational conglomerate OmniCorp sees their chance for a part-man, part-robot police officer."
Safe House,"Action, Thriller","A young CIA agent is tasked with looking after a fugitive in a safe house. But when the safe house is attacked, he finds himself on the run with his charge."
Noah,"Action, Adventure, Drama",Noah is chosen by God to undertake a momentous mission before an apocalyptic flood cleanses the world.
The Mummy: Tomb of the Dragon Emperor,"Action, Adventure, Fantasy","In the Far East, Alex O'Connell, the son of famed mummy fighters Rick and Evy O'Connell, unearths the mummy of the first Emperor of Qin -- a shape-shifting entity cursed by a witch centuries ago."
Journey 2: The Mysterious Island,"Action, Adventure, Comedy","Sean Anderson partners with his mom's husband on a mission to find his grandfather, who is thought to be missing on a mythical island."
Adrift,"Action, Adventure, Biography","A true story of survival, as a young couple's chance encounter leads them first to love, and then on the adventure of a lifetime as they face one of the most catastrophic hurricanes in recorded history."
Cobra,"Action, Crime, Thriller",A tough-on-crime street cop must protect the only surviving witness to a strange murderous cult with far-reaching plans.
Layer Cake,"Action, Crime, Drama",A successful cocaine dealer gets two tough assignments from his boss on the eve of his planned early retirement.
Austin Powers: The Spy Who Shagged Me,"Action, Adventure, Comedy","Dr. Evil is back and has invented a new time machine that allows him to go back to the 1960s and steal Austin Powers' mojo, inadvertently leaving him ""shagless""."
Bad Boys for Life,"Action, Comedy, Crime",Miami detectives Mike Lowrey and Marcus Burnett must face off against a mother-and-son pair of drug lords who wreak vengeful havoc on their city.
Blade,"Action, Adventure, Fantasy",Plot is unknown at this time.
Exodus: Gods and Kings,"Action, Adventure, Drama","The defiant leader Moses rises up against Egyptian Pharaoh Ramses II, setting six hundred thousand slaves on a monumental journey of escape from Egypt and its terrifying cycle of deadly plagues."
1941,"Action, Comedy, War",Hysterical Californians prepare for a Japanese invasion in the days after Pearl Harbor.
The Bourne Ultimatum,"Action, Mystery, Thriller",Jason Bourne dodges a ruthless C.I.A. official and his Agents from a new assassination program while searching for the origins of his life as a trained killer.
The Chronicles of Riddick,"Action, Adventure, Sci-Fi","The wanted criminal Richard Bruno Riddick arrives on a planet called Helion Prime and finds himself up against an invading empire called the Necromongers, an army that plans to convert or kill all humans in the universe."
Acts of Violence,"Action, Crime, Thriller","At a bachelorette party in a nightclub, the bride tells 2 guys offering blow to go away. They abduct her. The groom's 2 big brothers looked after their kid brother as kids and do so now again as veterans, ""looking"" for her and the 2 guys."
Zombieland: Double Tap,"Action, Comedy, Horror","Columbus, Tallahassee, Wichita, and Little Rock move to the American heartland as they face off against evolved zombies, fellow survivors, and the growing pains of the snarky makeshift family."
Assassin Club,"Action, Thriller",An assassin is given a contract to kill seven people around the world only to discover the targets are also assassins who have been hired to kill him.
Seppuku,"Action, Drama, Mystery","When a ronin requesting seppuku at a feudal lord's palace is told of the brutal suicide of another ronin who previously visited, he reveals how their pasts are intertwined - and in doing so challenges the clan's integrity."
Robin Hood,"Action, Adventure, Drama","In twelfth-century England, Robin Longstride and his band of marauders confront corruption in a local village and lead an uprising against the crown that will forever alter the balance of world power."
The Bodyguard,"Action, Drama, Music","A former Secret Service agent takes on the job of bodyguard to an R&B singer, whose lifestyle is most unlike a President's."
The Dark Tower,"Action, Adventure, Fantasy",A boy haunted by visions of a dark tower from a parallel reality teams up with the tower's disillusioned guardian to stop an evil warlock known as the Man in Black who plans to use the boy to destroy the tower and open the gates of Hell.
Gekijouban Jujutsu Kaisen 0,"Animation, Action, Fantasy","Yuta Okkotsu, a high schooler who gains control of an extremely powerful Cursed Spirit and gets enrolled in the Tokyo Prefectural Jujutsu High School by Jujutsu Sorcerers to help him control his power and keep an eye on him."
Tron,"Action, Adventure, Sci-Fi",A computer hacker is abducted into the digital world and forced to participate in gladiatorial games where his only chance of escape is with the help of a heroic security program.
Johnny Mnemonic,"Action, Drama, Sci-Fi","A data courier, literally carrying a data package inside his head, must deliver it before he dies from the burden or is killed by the Yakuza."
Street Fighter,"Action, Adventure, Comedy",Col. Guile and various other martial arts heroes fight against the tyranny of Dictator M. Bison and his cohorts.
Prince of Persia: The Sands of Time,"Action, Adventure, Fantasy",A young fugitive prince and princess must stop a villain who unknowingly threatens to destroy the world with a special dagger that enables the magic sand inside to reverse time.
Riddick,"Action, Adventure, Sci-Fi","Left for dead on a sun-scorched planet, Riddick finds himself up against an alien race of predators. Activating an emergency beacon alerts two ships: one carrying a new breed of mercenary, the other captained by a man from Riddick's past."
The Living Daylights,"Action, Adventure, Thriller",James Bond is sent to investigate a KGB policy to kill all enemy spies and uncovers an arms deal that potentially has major global ramifications.
Conan the Destroyer,"Action, Adventure, Fantasy",Conan leads a ragtag group of adventurers on a quest for a princess.
Mad Max Beyond Thunderdome,"Action, Adventure, Sci-Fi","After being exiled from the most advanced town in post apocalyptic Australia, a drifter travels with a group of abandoned children to rebel against the town's queen."
Ip Man,"Action, Biography, Drama","During the Japanese invasion of China, a wealthy martial artist is forced to leave his home when his city is occupied. With little means of providing for themselves, Ip Man and the remaining members of the city must find a way to survive."
Flash Gordon,"Action, Adventure, Sci-Fi",A football player and his friends travel to the planet Mongo and find themselves fighting the tyranny of Ming the Merciless to save Earth.
Dragonball Evolution,"Action, Adventure, Fantasy","The young warrior Son Goku sets out on a quest, racing against time and the vengeful King Piccolo, to collect a set of seven magical orbs that will grant their wielder unlimited power."
The Man with the Golden Gun,"Action, Adventure, Thriller","James Bond is targeted by the world's most expensive assassin, while he attempts to recover sensitive solar cell technology that is being sold to the highest bidder."
Pacific Rim: Uprising,"Action, Adventure, Fantasy","Jake Pentecost, son of Stacker Pentecost, reunites with Mako Mori to lead a new generation of Jaeger pilots, including rival Lambert and 15-year-old hacker Amara, against a new Kaiju threat."
G.I. Jane,"Action, Drama, War",A female Senator succeeds in enrolling a woman into Combined Reconnaissance Team training where everyone expects her to fail.
Le pacte des loups,"Action, Adventure, Drama","In 18th-century France, the Chevalier de Fronsac and his Native American friend Mani are sent to the Gevaudan province at the king's behest to investigate the killings of hundreds by a mysterious beast."
We Can Be Heroes,"Action, Comedy, Drama","When alien invaders capture the Earth's superheroes, their kids must learn to work together to save their parents and the planet."
Kate,"Action, Adventure, Crime",A jaded assassin assigned to target a yakuza clan has 24 hours to find out who poisoned her and get vengeance before she dies.
Blade II,"Action, Horror, Sci-Fi","Blade forms an uneasy alliance with the vampire council in order to combat the Reapers, who are feeding on vampires."
Bullitt,"Action, Crime, Thriller","An all-guts, no-glory San Francisco cop becomes determined to find the underworld kingpin that killed the witness in his protection."
Honest Thief,"Action, Thriller","Wanting to lead an honest life, a notorious bank robber turns himself in, only to be double-crossed by two ruthless FBI agents."
Now You See Me 2,"Action, Adventure, Comedy","The Four Horsemen resurface, and are forcibly recruited by a tech genius to pull off their most impossible heist yet."
Ghost Rider,"Action, Fantasy, Thriller","When motorcycle rider Johnny Blaze sells his soul to the Devil to save his father's life, he is transformed into the Ghost Rider, the Devil's own bounty hunter, and is sent to hunt down sinners."
The Last Boy Scout,"Action, Comedy, Crime","A private detective's protected female witness is murdered, prompting him and the victim's boyfriend to investigate the crime that leads to a corrupt politician and a crooked football team owner."
Grosse Pointe Blank,"Action, Comedy, Crime","Martin Blank is a professional assassin. He is sent on a mission to a small Detroit suburb, Grosse Pointe, and, by coincidence, his ten-year high school reunion party is taking place there at the same time."
Ronin,"Action, Crime, Thriller",A freelancing former U.S. Intelligence Agent tries to track down a mysterious package that is wanted by the Irish and the Russians.
Star Trek II: The Wrath of Khan,"Action, Adventure, Sci-Fi","With the assistance of the Enterprise crew, Admiral Kirk must stop an old nemesis, Khan Noonien Singh, from using the life-generating Genesis Device as the ultimate weapon."
The Book of Eli,"Action, Adventure, Drama","A post-apocalyptic tale, in which a lone man fights his way across America in order to protect a sacred book that holds the secrets to saving humankind."
London Has Fallen,"Action, Thriller","In London for the Prime Minister's funeral, Mike Banning is caught up in a plot to assassinate all the attending world leaders."
Dracula Untold,"Action, Drama, Fantasy","As his kingdom is being threatened by the Turks, young prince Vlad Tepes must become a monster feared by his own people in order to obtain the power needed to protect his own family, and the families of his kingdom."
Monster Hunter,"Action, Adventure, Fantasy","When Cpt. Artemis and her loyal soldiers are transported to a new world, they engage in a desperate battle for survival against enormous enemies with incredible powers. Feature film based on the video game by Capcom."
Transcendence,"Action, Drama, Sci-Fi",A scientist's drive for artificial intelligence takes on dangerous implications when his own consciousness is uploaded into one such program.
Snake Eyes: G.I. Joe Origins,"Action, Adventure, Crime",A G.I. Joe spin-off centered around the character of Snake Eyes.
Never Say Never Again,"Action, Adventure, Thriller","A S.P.E.C.T.R.E. agent has stolen two American nuclear warheads, and James Bond must find their targets before they are detonated."
Superman II,"Action, Adventure, Sci-Fi","Superman agrees to sacrifice his powers to start a relationship with Lois Lane, unaware that three Kryptonian criminals he inadvertently released are conquering Earth."
30 Days of Night,"Action, Adventure, Horror","After an Alaskan town is plunged into darkness for a month, it is attacked by a bloodthirsty gang of vampires."
Doragon bôru sûpâ: Sûpâ hîrô,"Animation, Action, Adventure",The Red Ribbon Army from Goku's past has returned with two new androids to challenge him and his friends.
Allied,"Action, Drama, Romance","In 1942, a Canadian intelligence officer in North Africa encounters a female French Resistance fighter on a deadly mission behind enemy lines. When they reunite in London, their relationship is tested by the pressures of war."
Goldfinger,"Action, Adventure, Thriller","While investigating a gold magnate's smuggling, James Bond uncovers a plot to contaminate the Fort Knox gold reserve."
xXx,"Action, Adventure, Thriller","The US government recruits extreme sports athlete Xander Cage to infiltrate a Russian criminal ring, which is plotting the destruction of the world."
Blade: Trinity,"Action, Horror, Sci-Fi","Blade, now a wanted man by the FBI, must join forces with the Nightstalkers to face his most challenging enemy yet: Dracula."
The Darkest Hour,"Action, Adventure, Horror","In Moscow, five young people lead the charge against an alien race who have attacked Earth via our power supply."
The Mortal Instruments: City of Bones,"Action, Adventure, Fantasy","When her mother disappears, Clary Fray learns that she descends from a line of warriors who protect our world from demons. She joins forces with others like her and heads into a dangerous alternate New York called the Shadow World."
Godzilla,"Action, Sci-Fi, Thriller",French nuclear tests irradiate an iguana into a giant monster that heads off to New York City. The American military must chase the monster across the city to stop it before it reproduces.
Tres metros sobre el cielo,"Action, Drama, Romance",A privileged woman and a reckless man fall in love despite their different social classes.
Rambo III,"Action, Adventure, Thriller",Rambo mounts a one-man mission to rescue his friend Colonel Trautman from the clutches of the formidable invading Soviet forces in Afghanistan.
Kimetsu no Yaiba: Mugen Ressha-Hen,"Animation, Action, Adventure","After his family was brutally murdered and his sister turned into a demon, Tanjiro Kamado's journey as a demon slayer began. Tanjiro and his comrades embark on a new mission aboard the Mugen Train, on track to despair."
Lifeforce,"Action, Horror, Mystery","A race of space vampires arrives in London and infects the populace, beginning an apocalyptic descent into chaos."
Hellboy,"Action, Adventure, Fantasy","A demon raised from infancy after being conjured by and rescued from the Nazis, grows up to become a defender against the forces of darkness."
The Last Starfighter,"Action, Adventure, Sci-Fi","High schooler Alex Rogan conquers the Starfighter video game, only to find out it was just a test, and is transported to another planet. He has been recruited to join a team of the best starfighters to defend their world from the attack."
Night Train,"Action, Thriller",A single mom struggling to make ends meet as a Hollywood teamster evades capture by a ruthless FBI Agent while running black market medical supplies in her legendary souped-up pickup truck.
Savages,"Action, Crime, Drama",Pot growers Ben and Chon face off against the Mexican drug cartel who kidnapped their shared girlfriend.
Blood Alley,"Action, Adventure","His ship seized by the Chinese Communists, American Merchant Captain Tom Wilder languishes in prison but Chinese villagers help him escape to sail them to Hong-Kong."
Godzilla x Kong: The New Empire,"Action, Adventure, Sci-Fi",Plot kept under wraps.
The Expendables 2,"Action, Adventure, Thriller","Mr. Church reunites the Expendables for what should be an easy paycheck, but when one of their men is murdered on the job, their quest for revenge puts them deep in enemy territory and up against an unexpected threat."
Only God Forgives,"Action, Crime, Drama","Julian, a drug-smuggler thriving in Bangkok's criminal underworld, sees his life get even more complicated when his mother compels him to find and kill whoever is responsible for his brother's recent death."
Austin Powers in Goldmember,"Action, Adventure, Comedy","Upon learning that his father has been kidnapped, Austin Powers must travel to 1975 and defeat the aptly named villain Goldmember, who is working with Dr. Evil."
Ghostbusters,"Action, Comedy, Fantasy","Following a ghost invasion of Manhattan, paranormal enthusiasts Erin Gilbert and Abby Yates, nuclear engineer Jillian Holtzmann, and subway worker Patty Tolan band together to stop the otherworldly threat."
Need for Speed,"Action, Adventure, Crime","Fresh from prison, a street racer who was framed by a wealthy business associate joins a cross-country race with revenge in mind. His ex-partner, learning of the plan, places a massive bounty on his head as the race begins."
