Indiana Jones and the Dial of Destiny,"Action, Adventure",Archaeologist Indiana Jones races against time to retrieve a legendary artifact that can change the course of history.
Sound of Freedom,"Action, Biography, Drama",The incredible true story of a former government agent turned vigilante who embarks on a dangerous mission to rescue hundreds of children from sex traffickers.
Spider-Man: Across the Spider-Verse,"Animation, Action, Adventure","Miles Morales catapults across the Multiverse, where he encounters a team of Spider-People charged with protecting its very existence. When the heroes clash on how to handle a new threat, Miles must redefine what it means to be a hero."
Mission: Impossible - Dead Reckoning Part One,"Action, Adventure, Thriller",Ethan Hunt and his IMF team must track down a dangerous weapon before it falls into the wrong hands.
The Flash,"Action, Adventure, Fantasy","Barry Allen uses his super speed to change the past, but his attempt to save his family creates a world without super heroes, forcing him to race for his life in order to save the future."
Nimona,"Animation, Action, Adventure","When a knight in a futuristic medieval world is framed for a crime he didn't commit, the only one who can help him prove his innocence is Nimona -- a mischievous teen who happens to be a shapeshifting creature he's sworn to destroy."
Extraction 2,"Action, Thriller","After barely surviving his grievous wounds from his mission in Dhaka, Bangladesh, Tyler Rake is back, and his team is ready to take on their next mission."
Guardians of the Galaxy Vol. 3,"Action, Adventure, Comedy","Still reeling from the loss of Gamora, Peter Quill rallies his team to defend the universe and one of their own - a mission that could mean the end of the Guardians if not successful."
Raiders of the Lost Ark,"Action, Adventure","In 1936, archaeologist and adventurer Indiana Jones is hired by the U.S. government to find the Ark of the Covenant before the Nazis can obtain its awesome powers."
The Out-Laws,"Action, Comedy, Crime","A straight-laced bank manager about to marry the love of his life. When his bank is held up by infamous Ghost Bandits during his wedding week, he believes his future in-laws who just arrived in town, are the infamous Out-Laws."
Dune: Part Two,"Action, Adventure, Drama",Paul Atreides unites with Chani and the Fremen while seeking revenge against the conspirators who destroyed his family.
Avatar: The Way of Water,"Action, Adventure, Fantasy","Jake Sully lives with his newfound family formed on the extrasolar moon Pandora. Once a familiar threat returns to finish what was previously started, Jake must work with Neytiri and the army of the Na'vi race to protect their home."
John Wick: Chapter 4,"Action, Crime, Thriller","John Wick uncovers a path to defeating The High Table. But before he can earn his freedom, Wick must face off against a new enemy with powerful alliances across the globe and forces that turn old friends into foes."
Indiana Jones and the Kingdom of the Crystal Skull,"Action, Adventure","In 1957, Indiana Jones becomes entangled in a Soviet plot to uncover the secret behind mysterious artifacts known as the Crystal Skulls."
Dungeons & Dragons: Honor Among Thieves,"Action, Adventure, Comedy","A charming thief and a band of unlikely adventurers embark on an epic quest to retrieve a lost relic, but things go dangerously awry when they run afoul of the wrong people."
Guy Ritchie's The Covenant,"Action, Thriller, War","During the war in Afghanistan, a local interpreter risks his own life to carry an injured sergeant across miles of grueling terrain."
Transformers: Rise of the Beasts,"Action, Adventure, Sci-Fi","During the '90s, a new faction of Transformers - the Maximals - join the Autobots as allies in the battle for Earth."
Independence Day,"Action, Adventure, Sci-Fi","The aliens are coming and their goal is to invade and destroy Earth. Fighting superior technology, mankind's best weapon is the will to survive."
Indiana Jones and the Last Crusade,"Action, Adventure","In 1938, after his father goes missing while pursuing the Holy Grail, Indiana Jones finds himself up against the Nazis again to stop them from obtaining its powers."
Indiana Jones and the Temple of Doom,"Action, Adventure","In 1935, Indiana Jones is tasked by Indian villagers with reclaiming a rock stolen from them by a secret cult beneath the catacombs of an ancient palace."
Extraction,"Action, Thriller","Tyler Rake, a fearless black market mercenary, embarks on the most deadly extraction of his career when he's enlisted to rescue the kidnapped son of an imprisoned international crime lord."
Fast X,"Action, Adventure, Crime",Dom Toretto and his family are targeted by the vengeful son of drug kingpin Hernan Reyes.
"Ruby Gillman, Teenage Kraken","Animation, Action, Adventure","A shy adolescent learns that she comes from a fabled royal family of legendary sea krakens and that her destiny lies in the depths of the waters, which is bigger than she could have ever imagined."
Dune: Part One,"Action, Adventure, Drama",A noble family becomes embroiled in a war for control over the galaxy's most valuable asset while its heir becomes troubled by visions of a dark future.
Knights of the Zodiac,"Action, Adventure, Drama","When a goddess of war reincarnates in the body of a young girl, street orphan Seiya discovers that he is destined to protect her and save the world. But only if he can face his own past and become a Knight of the Zodiac."
Rebel Moon,"Action, Adventure, Drama",A young woman seeks out warriors from other planets to fight the tyrannical armies terrorizing her peaceful colony.
Spider-Man: Into the Spider-Verse,"Animation, Action, Adventure",Teen Miles Morales becomes the Spider-Man of his universe and must join with five spider-powered individuals from other dimensions to stop a threat for all realities.
Top Gun: Maverick,"Action, Drama","After thirty years, Maverick is still pushing the envelope as a top naval aviator, but must confront ghosts of his past when he leads TOP GUN's elite graduates on a mission that demands the ultimate sacrifice from those chosen to fly it."
Mission: Impossible,"Action, Adventure, Thriller","An American agent, under false suspicion of disloyalty, must discover and expose the real spy without the help of his organization."
Kandahar,"Action, Thriller",A CIA operative and his translator flee from special forces in Afghanistan after exposing a covert mission.
Mission: Impossible - Fallout,"Action, Adventure, Thriller","Ethan Hunt and his IMF team, along with some familiar allies, race against time after a mission gone wrong."
The Car,"Action, Horror, Mystery","A small desert town is terrorized by a powerful, seemingly possessed car, and the local sheriff may be the only one who can stop it."
Nobody,"Action, Crime, Drama","A docile family man slowly reveals his true character after his house gets burgled by two petty thieves, which, coincidentally, leads him into a bloody war with a Russian crime boss."
Everything Everywhere All at Once,"Action, Adventure, Comedy",A middle-aged Chinese immigrant is swept up into an insane adventure in which she alone can save existence by exploring other universes and connecting with the lives she could have led.
Sisu,"Action, War","When an ex-soldier who discovers gold in the Lapland wilderness tries to take the loot into the city, Nazi soldiers led by a brutal SS officer battle him."
The Batman,"Action, Crime, Drama","When a sadistic serial killer begins murdering key political figures in Gotham, Batman is forced to investigate the city's hidden corruption and question his family's involvement."
The Dark Knight,"Action, Crime, Drama","When the menace known as the Joker wreaks havoc and chaos on the people of Gotham, Batman must accept one of the greatest psychological and physical tests of his ability to fight injustice."
The Machine,"Action, Comedy",Bert's drunken past catches up with him 20 years down the road when he and his father are kidnapped by those Bert wronged 20 years ago while drunk on a college semester abroad in Russia.
Ant-Man and the Wasp: Quantumania,"Action, Adventure, Comedy","Scott Lang and Hope Van Dyne are dragged into the Quantum Realm, along with Hope's parents and Scott's daughter Cassie. Together they must find a way to escape, but what secrets is Hope's mother hiding? And who is the mysterious Kang?"
Teenage Mutant Ninja Turtles: Mutant Mayhem,"Animation, Action, Adventure",The Turtle brothers as they work to earn the love of New York City while facing down an army of mutants.
Mission: Impossible - Rogue Nation,"Action, Adventure, Thriller",Ethan and his team take on their most impossible mission yet when they have to eradicate an international rogue organization as highly skilled as they are and committed to destroying the IMF.
Inception,"Action, Adventure, Sci-Fi","A thief who steals corporate secrets through the use of dream-sharing technology is given the inverse task of planting an idea into the mind of a C.E.O., but his tragic past may doom the project and his team to disaster."
Bullet Train,"Action, Comedy, Thriller",Five assassins aboard a swiftly-moving bullet train find out that their missions have something in common.
Priyotoma,"Action, Drama, Romance","A tragic love story that left an indelible mark on Sumon's life, shattering his world and leaving him forever transformed."
The Patriot,"Action, Drama, History",Peaceful farmer Benjamin Martin is driven to lead the Colonial Militia during the American Revolution when a sadistic British officer murders his son.
Mission: Impossible III,"Action, Adventure, Thriller",IMF agent Ethan Hunt comes into conflict with a dangerous and sadistic arms dealer who threatens his life and his fiancée in response.
Mission: Impossible II,"Action, Adventure, Thriller","IMF agent Ethan Hunt is sent to Sydney to find and destroy a genetically modified disease called ""Chimera""."
Mission: Impossible - Ghost Protocol,"Action, Adventure, Thriller","The IMF is shut down when it's implicated in the bombing of the Kremlin, causing Ethan Hunt and his new team to go rogue to clear their organization's name."
Top Gun,"Action, Drama","As students at the United States Navy's elite fighter weapons school compete to be best in the class, one daring young pilot learns a few things from a civilian instructor that are not taught in the classroom."
Shazam! Fury of the Gods,"Action, Adventure, Comedy","The film continues the story of teenage Billy Batson who, upon reciting the magic word ""SHAZAM!"" is transformed into his adult Super Hero alter ego, Shazam."
Blade Runner 2049,"Action, Drama, Mystery","Young Blade Runner K's discovery of a long-buried secret leads him to track down former Blade Runner Rick Deckard, who's been missing for thirty years."
Ghosted,"Action, Adventure, Comedy","Cole falls head over heels for enigmatic Sadie, but then makes the shocking discovery that she's a secret agent. Before they can decide on a second date, Cole and Sadie are swept away on an international adventure to save the world."
Spider-Man: No Way Home,"Action, Adventure, Fantasy","With Spider-Man's identity now revealed, Peter asks Doctor Strange for help. When a spell goes wrong, dangerous foes from other worlds start to appear, forcing Peter to discover what it truly means to be Spider-Man."
The Hunger Games,"Action, Adventure, Sci-Fi",Katniss Everdeen voluntarily takes her younger sister's place in the Hunger Games: a televised competition in which two teenagers from each of the twelve Districts of Panem are chosen at random to fight to the death.
Hypnotic,"Action, Mystery, Thriller",A detective investigates a mystery involving his missing daughter and a secret government program.
The Meg,"Action, Horror, Sci-Fi",A group of scientists exploring the Marianas Trench encounter the largest marine predator that has ever existed - the Megalodon.
Jurassic Park,"Action, Adventure, Sci-Fi",A pragmatic paleontologist touring an almost complete theme park on an island in Central America is tasked with protecting a couple of kids after a power failure causes the park's cloned dinosaurs to run loose.
Superman: Legacy,"Action, Adventure, Fantasy","It follows Superman as he reconciles his heritage with his human upbringing. He is the embodiment of truth, justice and the American way in a world that views kindness as old-fashioned."
Independence Day: Resurgence,"Action, Adventure, Sci-Fi","Two decades after the first Independence Day invasion, Earth is faced with a new extra-Solar threat. But will mankind's new space defenses be enough?"
The Wrath of Becky,"Action, Horror, Thriller","Two years after escaping a violent attack, a teenage girl must defend herself against a terrorist cell."
Aliens,"Action, Adventure, Sci-Fi","Decades after surviving the Nostromo incident, Ellen Ripley is sent out to re-establish contact with a terraforming colony but finds herself battling the Alien Queen and her offspring."
Avatar,"Action, Adventure, Fantasy",A paraplegic Marine dispatched to the moon Pandora on a unique mission becomes torn between following his orders and protecting the world he feels is his home.
65,"Action, Adventure, Drama",An astronaut crash lands on a mysterious planet only to discover he's not alone.
Operation Fortune: Ruse de Guerre,"Action, Comedy, Thriller",Special agent Orson Fortune and his team of operatives recruit one of Hollywood's biggest movie stars to help them on an undercover mission when the sale of a deadly new weapons technology threatens to disrupt the world order.
John Wick,"Action, Crime, Thriller",An ex-hitman comes out of retirement to track down the gangsters who killed his dog and stole his car.
Deadpool 3,"Action, Comedy, Sci-Fi","Wolverine joins the ""merc with a mouth"" in the third installment of the Deadpool film franchise."
Heat,"Action, Crime, Drama",A group of high-end professional thieves start to feel the heat from the LAPD when they unknowingly leave a clue at their latest heist.
White House Down,"Action, Drama, Thriller","While on a tour of the White House with his young daughter, a Capitol policeman springs into action to save his child and protect the president from a heavily armed group of paramilitary invaders."
The Lord of the Rings: The Fellowship of the Ring,"Action, Adventure, Drama",A meek Hobbit from the Shire and eight companions set out on a journey to destroy the powerful One Ring and save Middle-earth from the Dark Lord Sauron.
Pirates of the Caribbean: The Curse of the Black Pearl,"Action, Adventure, Fantasy","Blacksmith Will Turner teams up with eccentric pirate ""Captain"" Jack Sparrow to save his love, the governor's daughter, from Jack's former pirate allies, who are now undead."
Transformers,"Action, Adventure, Sci-Fi","An ancient struggle between two Cybertronian races, the heroic Autobots and the evil Decepticons, comes to Earth, with a clue to the ultimate power held by a teenager."
Immortals,"Action, Drama, Fantasy","Theseus is a mortal man chosen by Zeus to lead the fight against the ruthless King Hyperion, who is on a rampage across Greece to obtain a weapon that can destroy humanity."
Avengers: Endgame,"Action, Adventure, Drama","After the devastating events ofAvengers: Infinity War(2018), the universe is in ruins. With the help of remaining allies, the Avengers assemble once more in order to reverse Thanos' actions and restore balance to the universe."
Misanthrope,"Action, Crime, Drama",Baltimore. New Year's Eve. A talented but troubled police officer (Shailene Woodley) is recruited by the FBI's chief investigator (Ben Mendelsohn) to help profile and track down a disturbed individual terrorizing the city.
Guardians of the Galaxy,"Action, Adventure, Comedy",A group of intergalactic criminals must pull together to stop a fanatical warrior with plans to purge the universe.
Gladiator,"Action, Adventure, Drama",A former Roman General sets out to exact vengeance against the corrupt emperor who murdered his family and sent him into slavery.
Terminator 2: Judgment Day,"Action, Sci-Fi","A cyborg, identical to the one who failed to kill Sarah Connor, must now protect her ten year old son John from an even more advanced and powerful cyborg."
The Woman King,"Action, Drama, History","A historical epic inspired by true events that took place in The Kingdom of Dahomey, one of the most powerful states of Africa in the 18th and 19th centuries."
Meg 2: The Trench,"Action, Adventure, Horror",Plot unknown. Sequel to the 2018 film 'The Meg.'
Tenet,"Action, Sci-Fi, Thriller","Armed with only one word, Tenet, and fighting for the survival of the entire world, a Protagonist journeys through a twilight world of international espionage on a mission that will unfold in something beyond real time."
Dune,"Action, Adventure, Sci-Fi",A Duke's son leads desert warriors against the galactic emperor and his father's evil nemesis to free their desert world from the emperor's rule.
Kraven the Hunter,"Action, Adventure, Sci-Fi",Russian immigrant Sergei Kravinoff is on a mission to prove that he is the greatest hunter in the world.
Black Adam,"Action, Adventure, Fantasy","Nearly 5,000 years after he was bestowed with the almighty powers of the Egyptian gods--and imprisoned just as quickly--Black Adam is freed from his earthly tomb, ready to unleash his unique form of justice on the modern world."
Retribution,"Action, Crime, Drama",A bank executive receives a bomb threat while driving his children to school that his car will explode if they stop and get out.
The Gentlemen,"Action, Comedy, Crime","An American expat tries to sell off his highly profitable marijuana empire in London, triggering plots, schemes, bribery and blackmail in an attempt to steal his domain out from under him."
The Unbearable Weight of Massive Talent,"Action, Comedy, Crime",Moviestar Nick Cage is channeling his iconic characters as he's caught between a superfan and a CIA agent.
The Huntsman: Winter's War,"Action, Adventure, Drama","Eric and fellow warrior Sara, raised as members of ice Queen Freya's army, try to conceal their forbidden love as they fight to survive the wicked intentions of both Freya and her sister Ravenna."
The Terminator,"Action, Sci-Fi","A human soldier is sent from 2029 to 1984 to stop an almost indestructible cyborg killing machine, sent from the same year, which has been programmed to execute a young woman whose unborn son is the key to humanity's future salvation."
No Time to Die,"Action, Adventure, Thriller","James Bond has left active service. His peace is short-lived when Felix Leiter, an old friend from the CIA, turns up asking for help, leading Bond onto the trail of a mysterious villain armed with dangerous new technology."
Dunkirk,"Action, Drama, History","Allied soldiers from Belgium, the British Commonwealth and Empire, and France are surrounded by the German Army and evacuated during a fierce battle in World War II."
Long ma jing shen,"Action, Comedy, Drama",A washed-up stuntman and his stunt horse become an overnight social media sensation when their real-life fight with debt collectors goes viral.
The Suicide Squad,"Action, Adventure, Comedy","Supervillains Harley Quinn, Bloodsport, Peacemaker, and a collection of nutty cons at Belle Reve prison join the super-secret, super-shady Task Force X as they are dropped off at the remote, enemy-infused island of Corto Maltese."
Oldeuboi,"Action, Drama, Mystery","After being kidnapped and imprisoned for fifteen years, Oh Dae-Su is released, only to find that he must find his captor in five days."
The Matrix,"Action, Sci-Fi","When a beautiful stranger leads computer hacker Neo to a forbidding underworld, he discovers the shocking truth--the life he knows is the elaborate deception of an evil cyber-intelligence."
The Nice Guys,"Action, Comedy, Crime","In 1970s Los Angeles, a mismatched pair of private eyes investigate a missing girl and the mysterious death of a porn star."
Deadpool 2,"Action, Adventure, Comedy","Foul-mouthed mutant mercenary Wade Wilson (a.k.a. Deadpool) assembles a team of fellow mutant rogues to protect a young boy with supernatural abilities from the brutal, time-traveling cyborg Cable."
Mulan,"Action, Adventure, Drama",A young Chinese maiden disguises herself as a male warrior in order to save her father.
American Sniper,"Action, Biography, Drama","Navy S.E.A.L. sniper Chris Kyle's pinpoint accuracy saves countless lives on the battlefield and turns him into a legend. Back home with his family after four tours of duty, however, Chris finds that it is the war he can't leave behind."
Zack Snyder's Justice League,"Action, Adventure, Fantasy","Determined to ensure that Superman's ultimate sacrifice wasn't in vain, Bruce Wayne recruits a team of metahumans to protect the world from an approaching threat of catastrophic proportions."
Blade Runner,"Action, Drama, Sci-Fi",A blade runner must pursue and terminate four replicants who stole a ship in space and have returned to Earth to find their creator.
Star Wars,"Action, Adventure, Fantasy","Luke Skywalker joins forces with a Jedi Knight, a cocky pilot, a Wookiee and two droids to save the galaxy from the Empire's world-destroying battle station, while also attempting to rescue Princess Leia from the mysterious Darth Vader."
Thor: Love and Thunder,"Action, Adventure, Comedy","Thor enlists the help of Valkyrie, Korg and ex-girlfriend Jane Foster to fight Gorr the God Butcher, who intends to make the gods extinct."
Captain America: Brave New World,"Action, Adventure, Sci-Fi",Plot kept under wraps. Fourth movie in the Captain America franchise.
Spider-Man,"Action, Adventure, Sci-Fi","After being bitten by a genetically-modified spider, a shy teenager gains spider-like abilities that he uses to fight injustice as a masked superhero and face a vengeful enemy."
Deadpool,"Action, Comedy","A wisecracking mercenary gets experimented on and becomes immortal but ugly, and sets out to track down the man who ruined his looks."
Man of Steel,"Action, Adventure, Sci-Fi",An alien child is evacuated from his dying world and sent to Earth to live among humans. His peace is threatened when other survivors of his home planet invade Earth.
Hidden Strike,"Action, Adventure, Comedy","Two ex-special forces soldiers must escort a group of civilians along Baghdad's ""Highway of Death"" to the safety of the Green Zone."
Drive-Away Dolls,"Action, Comedy, Thriller","Jamie regrets her breakup with her girlfriend, while Marian needs to relax. In search of a fresh start, they embark on an unexpected road trip to Tallahassee, but things quickly go awry when they cross paths with a group of inept criminals."
Expend4bles,"Action, Adventure, Thriller",The Expendables will square up against: an arms dealer who commands the might of a massive private army.
Léon,"Action, Crime, Drama","12-year-old Mathilda is reluctantly taken in by Léon, a professional assassin, after her family is murdered. An unusual relationship forms as she becomes his protégée and learns the assassin's trade."
The Mother,"Action, Thriller","While fleeing from dangerous assailants, an assassin comes out of hiding to protect the daughter she left earlier in life."
The Hunger Games: The Ballad of Songbirds and Snakes,"Action, Adventure, Drama",Coriolanus Snow mentors and develops feelings for the female District 12 tribute during the 10th Hunger Games.
Jurassic World: Dominion,"Action, Adventure, Sci-Fi","Four years after the destruction of Isla Nublar, Biosyn operatives attempt to track down Maisie Lockwood, while Dr Ellie Sattler investigates a genetically engineered swarm of giant insects."
The Dark Knight Rises,"Action, Drama, Thriller","Eight years after the Joker's reign of chaos, Batman is coerced out of exile with the assistance of the mysterious Selina Kyle in order to defend Gotham City from the vicious guerrilla terrorist Bane."
The Gray Man,"Action, Thriller","When the CIA's most skilled operative, whose true identity is known to none, accidentally uncovers dark agency secrets, a psychopathic former colleague puts a bounty on his head, setting off a global manhunt by international assassins."
Pirates of the Caribbean: Dead Men Tell No Tales,"Action, Adventure, Fantasy",Captain Jack Sparrow is pursued by old rival Captain Salazar and a crew of deadly ghosts who have escaped from the Devil's Triangle. They're determined to kill every pirate at sea...notably Jack.
Plane,"Action, Adventure, Thriller",A pilot finds himself caught in a war zone after he's forced to land his commercial aircraft during a terrible storm.
Star Wars: Episode IX - The Rise of Skywalker,"Action, Adventure, Fantasy","In the riveting conclusion of the landmark Skywalker saga, new legends will be born-and the final battle for freedom is yet to come."
The Mummy,"Action, Adventure, Fantasy","At an archaeological dig in the ancient city of Hamunaptra, an American serving in the French Foreign Legion accidentally awakens a mummy who begins to wreak havoc as he searches for the reincarnation of his long-lost love."
IB 71,"Action, Thriller",A two- front war between Indian intelligence agencies and the Pakistani establishment.
Spider-Man: Beyond the Spider-Verse,"Animation, Action, Adventure","After leaving off from Spider-Man: Across the Spider-Verse, the story continues."
Venom,"Action, Adventure, Sci-Fi","A failed reporter is bonded to an alien entity, one of many symbiotes who have invaded Earth. But the being takes a liking to Earth and decides to protect it."
The Revenant,"Action, Adventure, Drama",A frontiersman on a fur trading expedition in the 1820s fights for survival after being mauled by a bear and left for dead by members of his own hunting team.
Im Westen nichts Neues,"Action, Drama, War",A young German soldier's terrifying experiences and distress on the western front during World War I.
