Spider-Man: Across the Spider-Verse,"Animation, Action, Adventure","Miles Morales catapults across the Multiverse, where he encounters a team of Spider-People charged with protecting its very existence. When the heroes clash on how to handle a new threat, Miles must redefine what it means to be a hero."
Nimona,"Animation, Action, Adventure","When a knight in a futuristic medieval world is framed for a crime he didn't commit, the only one who can help him prove his innocence is Nimona -- a mischievous teen who happens to be a shapeshifting creature he's sworn to destroy."
Elemental,"Animation, Adventure, Comedy","Follows Ember and Wade, in a city where fire-, water-, land- and air-residents live together."
The Super Mario Bros. Movie,"Animation, Adventure, Comedy","A plumber named Mario travels through an underground labyrinth with his brother, Luigi, trying to save a captured princess."
"Ruby Gillman, Teenage Kraken","Animation, Action, Adventure","A shy adolescent learns that she comes from a fabled royal family of legendary sea krakens and that her destiny lies in the depths of the waters, which is bigger than she could have ever imagined."
Spider-Man: Into the Spider-Verse,"Animation, Action, Adventure",Teen Miles Morales becomes the Spider-Man of his universe and must join with five spider-powered individuals from other dimensions to stop a threat for all realities.
Teenage Mutant Ninja Turtles: Mutant Mayhem,"Animation, Action, Adventure",The Turtle brothers as they work to earn the love of New York City while facing down an army of mutants.
Puss in Boots: The Last Wish,"Animation, Adventure, Comedy","When Puss in Boots discovers that his passion for adventure has taken its toll and he has burned through eight of his nine lives, he launches an epic journey to restore them by finding the mythical Last Wish."
Mulan,"Animation, Adventure, Comedy","To save her father from death in the army, a young maiden secretly goes in his place and becomes one of China's greatest heroines in the process."
Spider-Man: Beyond the Spider-Verse,"Animation, Action, Adventure","After leaving off from Spider-Man: Across the Spider-Verse, the story continues."
Sing 2,"Animation, Adventure, Comedy",Buster Moon and his friends must persuade reclusive rock star Clay Calloway to join them for the opening of a new show.
Cars,"Animation, Adventure, Comedy","On the way to the biggest race of his life, a hotshot rookie race car gets stranded in a rundown town and learns that winning isn't everything in life."
Fantastic Mr. Fox,"Animation, Adventure, Comedy",An urbane fox cannot resist returning to his farm raiding ways and then must help his community survive the farmers' retaliation.
Encanto,"Animation, Comedy, Family",A Colombian teenage girl has to face the frustration of being the only member of her family without magical powers.
Resident Evil: Death Island,"Animation, Action, Adventure","D.S.O. agent Leon S. Kennedy is on a mission to rescue Dr. Antonio Taylor from kidnappers, when a mysterious woman thwarts his pursuit. Meanwhile, B.S.A.A. agent Chris Redfield is ...See full summary»"
Mavka. Lisova pisnya,"Animation, Adventure, Comedy",Mavka must choose between love and duty to protect the Heart of the Forest.
Sen to Chihiro no kamikakushi,"Animation, Adventure, Family","During her family's move to the suburbs, a sullen 10-year-old girl wanders into a world ruled by gods, witches and spirits, a world where humans are changed into beasts."
Ratatouille,"Animation, Adventure, Comedy",A rat who can cook makes an unusual alliance with a young kitchen worker at a famous Paris restaurant.
Moana,"Animation, Adventure, Comedy","In Ancient Polynesia, when a terrible curse incurred by the Demigod Maui reaches Moana's island, she answers the Ocean's call to seek out the Demigod to set things right."
The Lion King,"Animation, Adventure, Drama","Lion prince Simba and his father are targeted by his bitter uncle, who wants to ascend the throne himself."
Toy Story,"Animation, Adventure, Comedy",A cowboy doll is profoundly threatened and jealous when a new spaceman action figure supplants him as top toy in a boy's bedroom.
Inside Out,"Animation, Adventure, Comedy","After young Riley is uprooted from her Midwest life and moved to San Francisco, her emotions - Joy, Fear, Anger, Disgust and Sadness - conflict on how best to navigate a new city, house, and school."
Sing,"Animation, Comedy, Family","In a city of humanoid animals, a hustling theater impresario's attempt to save his theater with a singing competition becomes grander than he anticipates even as its finalists find that their lives will never be the same."
The Incredibles,"Animation, Action, Adventure","While trying to lead a quiet suburban life, a family of undercover superheroes are forced into action to save the world."
Luck,"Animation, Adventure, Comedy",The curtain is pulled back on the millennia-old battle between the organizations of good luck and bad luck that secretly affects everyday lives.
Zootopia,"Animation, Adventure, Comedy","In a city of anthropomorphic animals, a rookie bunny cop and a cynical con artist fox must work together to uncover a conspiracy."
Hauru no ugoku shiro,"Animation, Adventure, Family","When an unconfident young woman is cursed with an old body by a spiteful witch, her only chance of breaking the spell lies with a self-indulgent yet insecure young wizard and his companions in his legged, walking castle."
Suzume no Tojimari,"Animation, Action, Adventure",A modern action adventure road story where a 17-year-old girl named Suzume helps a mysterious young man close doors from the other side that are releasing disasters all over in Japan.
Coco,"Animation, Adventure, Drama","Aspiring musician Miguel, confronted with his family's ancestral ban on music, enters the Land of the Dead to find his great-great-grandfather, a legendary singer."
Finding Nemo,"Animation, Adventure, Comedy","After his son is captured in the Great Barrier Reef and taken to Sydney, a timid clownfish sets out on a journey to bring him home."
Miraculous - Le film,"Animation, Action, Adventure","Ordinary teenager Marinette's life in Paris goes superhuman when she becomes Ladybug. Bestowed with magical powers of creation, Ladybug must unite with her opposite, Cat Noir, to save Paris as a new villain unleashes chaos unto the city."
The Lion King,"Animation, Adventure, Drama","After the murder of his father, a young lion prince flees his kingdom only to learn the true meaning of responsibility and bravery."
The Little Mermaid,"Animation, Adventure, Family",A mermaid princess makes a Faustian bargain in an attempt to become human and win a prince's love.
The Bad Guys,"Animation, Adventure, Comedy","To avoid prison, a gang of notorious animal criminals pretends to seek being rehabilitated, only for their leader to realize that he genuinely wants to change his ways."
Kimi no na wa.,"Animation, Drama, Fantasy","Two teenagers share a profound, magical connection upon discovering they are swapping bodies. Things manage to become even more complicated when the boy and girl decide to meet in person."
Hercules,"Animation, Adventure, Comedy",The son of Zeus and Hera is stripped of his immortality as an infant and must become a true hero in order to reclaim it.
Up,"Animation, Adventure, Comedy","78-year-old Carl Fredricksen travels to Paradise Falls in his house equipped with balloons, inadvertently taking a young stowaway."
Turning Red,"Animation, Adventure, Comedy","A thirteen-year-old girl named Mei Lee is torn between staying her mother's dutiful daughter and the changes of adolescence. And as if the challenges were not enough, whenever she gets overly excited she transforms into a giant red panda."
"Monsters, Inc.","Animation, Adventure, Comedy","In order to power the city, monsters have to scare children so that they scream. However, the children are toxic to the monsters, and after a child gets through, two monsters realize things may not be what they think."
Coraline,"Animation, Drama, Family","An adventurous 11-year-old girl finds another world that is a strangely idealized version of her frustrating home, but it has sinister secrets."
Shrek,"Animation, Adventure, Comedy","A mean lord exiles fairytale creatures to the swamp of a grumpy ogre, who must go on a quest and rescue a princess for the lord in order to get his land back."
Frozen,"Animation, Adventure, Comedy","When the newly crowned Queen Elsa accidentally uses her power to turn things into ice to curse her home in infinite winter, her sister Anna teams up with a mountain man, his playful reindeer, and a snowman to change the weather condition."
DC League of Super-Pets,"Animation, Action, Adventure","Krypto the Super-Dog and Superman are inseparable best friends, sharing the same superpowers and fighting crime side by side in Metropolis. However, Krypto must master his own powers for a rescue mission when Superman is kidnapped."
Kung Fu Panda,"Animation, Action, Adventure","To everyone's surprise, including his own, Po, an overweight, clumsy panda, is chosen as protector of the Valley of Peace. His suitability will soon be tested as the valley's arch-enemy is on his way."
Luca,"Animation, Adventure, Comedy","On the Italian Riviera, an unlikely but strong friendship grows between a human being and a sea monster disguised as a human."
Who Framed Roger Rabbit,"Animation, Adventure, Comedy",A toon-hating detective is a cartoon rabbit's only hope to prove his innocence when he is accused of murder.
Isle of Dogs,"Animation, Adventure, Comedy","Set in Japan, Isle of Dogs follows a boy's odyssey in search of his lost dog."
Toy Story 2,"Animation, Adventure, Comedy","When Woody is stolen by a toy collector, Buzz and his friends set out on a rescue mission to save Woody before he becomes a museum toy property with his roundup gang Jessie, Prospector, and Bullseye."
WALL·E,"Animation, Adventure, Family","In the distant future, a small waste-collecting robot inadvertently embarks on a space journey that will ultimately decide the fate of mankind."
Incredibles 2,"Animation, Action, Adventure",The Incredibles family takes on a new mission which involves a change in family roles: Bob Parr (Mr. Incredible) must manage the house while his wife Helen (Elastigirl) goes out to save the world.
Sausage Party,"Animation, Adventure, Comedy",A sausage strives to discover the truth about his existence.
A Bug's Life,"Animation, Adventure, Comedy","A misfit ant, looking for ""warriors"" to save his colony from greedy grasshoppers, recruits a group of bugs that turn out to be an inept circus troupe."
How to Train Your Dragon,"Animation, Action, Adventure","A hapless young Viking who aspires to hunt dragons becomes the unlikely friend of a young dragon himself, and learns there may be more to the creatures than he assumed."
The Lorax,"Animation, Adventure, Comedy","A 12-year-old boy searches for the one thing that will enable him to win the affection of the girl of his dreams. To find it he must discover the story of the Lorax, the grumpy yet charming creature who fights to protect his world."
Soul,"Animation, Adventure, Comedy","After landing the gig of a lifetime, a New York jazz pianist suddenly finds himself trapped in a strange land between Earth and the afterlife."
Tangled,"Animation, Adventure, Comedy","The magically long-haired Rapunzel has spent her entire life in a tower, but now that a runaway thief has stumbled upon her, she is about to discover the world for the first time, and who she really is."
Strays,"Animation, Adventure, Comedy",An abandoned dog teams up with other strays to get revenge on his former owner.
Lilo & Stitch,"Animation, Adventure, Comedy","A young and parentless girl adopts a 'dog' from the local pound, completely unaware that it's supposedly a dangerous scientific experiment that's taken refuge on Earth and is now hiding from its creator and those who see it as a menace."
The Lego Movie,"Animation, Action, Adventure","An ordinary LEGO construction worker, thought to be the prophesied as ""special"", is recruited to join a quest to stop an evil tyrant from gluing the LEGO universe into eternal stasis."
The First Slam Dunk,"Animation, Comedy, Drama","Follows Ryota Miyagi, a 17 years boy who after to lose his elder brother Sota when he was a kid struggles to accomplish Sota's dream to be a basketball star."
Guillermo del Toro's Pinocchio,"Animation, Drama, Family","A father's wish magically brings a wooden boy to life in Italy, giving him a chance to care for the child."
Aladdin,"Animation, Adventure, Comedy",A kind-hearted street urchin and a power-hungry Grand Vizier vie for a magic lamp that has the power to make their deepest wishes come true.
Black Clover: Sword of the Wizard King,"Animation, Action, Adventure","In a world where magic is everything, Asta, a boy who was born with no magic, aims to become the ""Wizard King,"" to overcome adversity, prove his power, and keep his oath with his friends."
Toy Story 3,"Animation, Adventure, Comedy","The toys are mistakenly delivered to a day-care center instead of the attic right before Andy leaves for college, and it's up to Woody to convince the other toys that they weren't abandoned and to return home."
FernGully: The Last Rainforest,"Animation, Adventure, Family","The magical inhabitants of a rainforest fight to save their home, which is threatened by logging and a polluting force of destruction called Hexxus."
Toy Story 4,"Animation, Adventure, Comedy","When a new toy called ""Forky"" joins Woody and the gang, a road trip alongside old and new friends reveals how big the world can be for a toy."
Strange World,"Animation, Action, Adventure",The legendary Clades are a family of explorers whose differences threaten to topple their latest and most crucial mission.
Hotel Transylvania,"Animation, Adventure, Comedy","Dracula, who operates a high-end resort away from the human world, goes into overprotective mode when a boy discovers the resort and falls for the count's teenaged daughter."
Hotaru no haka,"Animation, Drama, War",A young boy and his little sister struggle to survive in Japan during World War II.
Minions: The Rise of Gru,"Animation, Adventure, Comedy",The untold story of one twelve-year-old's dream to become the world's greatest supervillain.
The Mitchells vs the Machines,"Animation, Adventure, Comedy","A quirky, dysfunctional family's road trip is upended when they find themselves in the middle of the robot apocalypse and suddenly become humanity's unlikeliest last hope."
Mononoke-hime,"Animation, Action, Adventure","On a journey to find the cure for a Tatarigami's curse, Ashitaka finds himself in the middle of a war between the forest gods and Tatara, a mining colony. In this quest he also meets San, the Mononoke Hime."
Shrek 2,"Animation, Adventure, Comedy","Shrek and Fiona travel to the Kingdom of Far Far Away, where Fiona's parents are King and Queen, to celebrate their marriage. When they arrive, they find they are not as welcome as they thought they would be."
Finding Dory,"Animation, Adventure, Comedy",Friendly but forgetful blue tang Dory begins a search for her long-lost parents and everyone learns a few things about the real meaning of family along the way.
Raya and the Last Dragon,"Animation, Action, Adventure","In a realm known as Kumandra, a re-imagined Earth inhabited by an ancient civilization, a warrior named Raya is determined to find the last dragon."
Sonic the Hedgehog 3,"Animation, Action, Adventure",Plot under wraps
Pâfekuto burû,"Animation, Crime, Drama","A pop singer gives up her career to become an actress, but she slowly goes insane when she starts being stalked by an obsessed fan and what seems to be a ghost of her past."
"Lyle, Lyle, Crocodile","Animation, Adventure, Comedy",Feature film based on the children's book about a crocodile that lives in New York City.
Anastasia,"Animation, Adventure, Drama","The last surviving child of the Russian Royal Family joins two con men to reunite with her grandmother, the Dowager Empress, while the undead Rasputin seeks her death."
Lightyear,"Animation, Action, Adventure","While spending years attempting to return home, marooned Space Ranger Buzz Lightyear encounters an army of ruthless robots commanded by Zurg who are attempting to steal his fuel source."
The Lego Batman Movie,"Animation, Action, Adventure","A cooler-than-ever Bruce Wayne must deal with the usual suspects as they plan to rule Gotham City, while discovering that he has accidentally adopted a teenage orphan who wishes to become his sidekick."
Ice Age,"Animation, Adventure, Comedy","The story revolves around sub-zero heroes: a woolly mammoth, a saber-toothed tiger, a sloth and a prehistoric combination of a squirrel and rat, known as Scrat."
Wreck-It Ralph,"Animation, Adventure, Comedy","A video game villain wants to be a hero and sets out to fulfill his dream, but his quest brings havoc to the whole arcade where he lives."
The Princess and the Frog,"Animation, Adventure, Comedy","A waitress, desperate to fulfill her dreams as a restaurant owner, is set on a journey to turn a frog prince back into a human being, but she has to face the same problem after she kisses him."
Big Hero 6,"Animation, Action, Adventure","A special bond develops between plus-sized inflatable robot Baymax and prodigy Hiro Hamada, who together team up with a group of friends to form a band of high-tech heroes."
Atlantis: The Lost Empire,"Animation, Action, Adventure",A young linguist named Milo Thatch joins an intrepid group of explorers to find the mysterious lost continent of Atlantis.
Robots,"Animation, Adventure, Comedy","In a robot world, a young idealistic inventor travels to the big city to join his inspiration's company, only to find himself opposing its sinister new management."
Beauty and the Beast,"Animation, Family, Fantasy",A prince cursed to spend his days as a hideous monster sets out to regain his humanity by earning a young woman's love.
Monsters University,"Animation, Adventure, Comedy","A look at the relationship between Mike Wazowski (Billy Crystal) and James P. ""Sully"" Sullivan (John Goodman) during their days at Monsters University, when they weren't necessarily the best of friends."
Madagascar,"Animation, Adventure, Comedy","A group of animals who have spent all their life in a New York zoo end up in the jungles of Madagascar, and must adjust to living in the wild."
Trolls,"Animation, Adventure, Comedy","After the Bergens invade Troll Village, Poppy, the happiest Troll ever born, and the curmudgeonly Branch set off on a journey to rescue her friends."
Rio,"Animation, Adventure, Comedy","When Blu, a domesticated macaw from small-town Minnesota, meets the fiercely independent Jewel, he takes off on an adventure to Rio de Janeiro with the bird of his dreams."
PAW Patrol: The Mighty Movie,"Animation, Action, Adventure","A magical meteor crash lands in Adventure City, and gives the PAW Patrol pups superpowers, transforming them into The Mighty Pups"
Akira,"Animation, Action, Drama","A secret military project endangers Neo-Tokyo when it turns a biker gang member into a rampaging psychic psychopath who can only be stopped by a teenager, his gang of biker friends and a group of psychics."
Tarzan,"Animation, Adventure, Comedy",A man raised by gorillas must decide where he really belongs when he discovers he is a human.
Mad God,"Animation, Fantasy, Horror","The Assassin travels through a nightmare underworld of tortured souls, ruined cities and wretched monstrosities forged from the primordial horrors of the unconscious mind of Phil Tippett, the world's preeminent stop-motion animator."
Mummies,"Animation, Comedy, Family","It follows three mummies as they end up in present-day London and embark on a journey in search of an old ring belonging to the Royal Family, stolen by the ambitious archaeologist Lord Carnaby."
Despicable Me,"Animation, Adventure, Comedy","When a criminal mastermind uses a trio of orphan girls as pawns for a grand scheme, he finds their love is profoundly changing him for the better."
Brave,"Animation, Adventure, Comedy","Determined to make her own path in life, Princess Merida defies a custom that brings chaos to her kingdom. Granted one wish, Merida must rely on her bravery and her archery skills to undo a beastly curse."
The Boss Baby,"Animation, Adventure, Comedy","A suit-wearing, briefcase-carrying baby pairs up with his 7-year old brother to stop the dastardly plot of the CEO of Puppy Co."
Cars 3,"Animation, Adventure, Comedy",Lightning McQueen sets out to prove to a new generation of racers that he's still the best race car in the world.
Wish,"Animation, Adventure, Comedy",Wish will follow a young girl named Asha who wishes on a star and gets a more direct answer than she bargained for when a trouble-making star comes down from the sky to join her.
Ralph Breaks the Internet,"Animation, Adventure, Comedy","Six years after the events of ""Wreck-It Ralph,"" Ralph and Vanellope, now friends, discover a wi-fi router in their arcade, leading them into a new adventure."
Treasure Planet,"Animation, Adventure, Family","In this science fiction rendering of the classic novel ""Treasure Island"", Jim Hawkins (Joseph Gordon-Levitt) is a rebellious teen seen by the world as an aimless slacker. After he receives ...See full summary»"
Tonari no Totoro,"Animation, Comedy, Family","When two girls move to the country to be near their ailing mother, they have adventures with the wondrous forest spirits who live nearby."
The Lord of the Rings: The War of the Rohirrim,"Animation, Action, Adventure","The untold story behind Helm's Deep, hundreds of years before the fateful war, telling the life and bloodsoaked times of its founder, Helm Hammerhand, the King of Rohan."
How to Train Your Dragon: The Hidden World,"Animation, Action, Adventure","When Hiccup discovers Toothless isn't the only Night Fury, he must seek ""The Hidden World"", a secret Dragon Utopia before a hired tyrant named Grimmel finds it first."
The Emperor's New Groove,"Animation, Adventure, Comedy","Emperor Kuzco is turned into a llama by his ex-administrator Yzma, and must now regain his throne with the help of Pacha, the gentle llama herder."
Cars 2,"Animation, Adventure, Comedy",Star race car Lightning McQueen and his pal Mater head overseas to compete in the World Grand Prix race. But the road to the championship becomes rocky as Mater gets caught up in an intriguing adventure of his own: international espionage.
How to Train Your Dragon 2,"Animation, Action, Adventure","When Hiccup and Toothless discover an ice cave that is home to hundreds of new wild dragons and the mysterious Dragon Rider, the two friends find themselves at the center of a battle to protect the peace."
Puss in Boots,"Animation, Adventure, Comedy","An outlaw cat, his childhood egg-friend, and a seductive thief kitty set out in search for the eggs of the fabled Golden Goose to clear his name, restore his lost honor, and regain the trust of his mother and town."
Enchanted,"Animation, Adventure, Comedy","A young maiden in a land called Andalasia, who is prepared to be wed, is sent away to New York City by an evil Queen, where she falls in love with a lawyer."
The Iron Giant,"Animation, Action, Adventure",A young boy befriends a giant robot from outer space that a paranoid government agent wants to destroy.
Disenchanted,"Animation, Adventure, Comedy","Fifteen years after her happily ever after, Giselle questions her happiness, inadvertently turning the lives of those in the real world and Andalasia upside down in the process."
Shark Tale,"Animation, Adventure, Comedy","When a son of a gangster shark boss is accidentally killed while on the hunt, his would-be prey and his vegetarian brother decide to use the incident to their own advantage."
Onward,"Animation, Adventure, Comedy","In a magical world full of technological advances, elven brothers Ian and Barley Lightfoot set out on an adventure to resurrect their late father for a day."
The Amazing Maurice,"Animation, Adventure, Comedy",A streetwise cat and his gang of rats come up with the perfect money making scheme.
Frozen II,"Animation, Adventure, Comedy","Anna, Elsa, Kristoff, Olaf and Sven leave Arendelle to travel to an ancient, autumn-bound forest of an enchanted land. They set out to find the origin of Elsa's powers in order to save their kingdom."
Angry Birds,"Animation, Action, Adventure","When an island populated by happy, flightless birds is visited by mysterious green piggies, it's up to three unlikely outcasts - Red, Chuck and Bomb - to figure out what the pigs are up to."
Surf's Up,"Animation, Adventure, Comedy","A behind-the-scenes look at the annual Penguin World Surfing Championship, and its newest participant, up-and-comer Cody Maverick."
The Secret Life of Pets,"Animation, Adventure, Comedy","The quiet life of a terrier named Max is upended when his owner takes in Duke, a stray whom Max instantly dislikes."
The Witcher: Nightmare of the Wolf,"Animation, Action, Adventure","Escaping from poverty to become a witcher, Vesemir slays monsters for coin and glory, but when a new menace rises, he must face the demons of his past."
Demon Slayer: Kimetsu No Yaiba - To the Swordsmith Village,"Animation, Action, Adventure",All the Upper Rank Demons assemble at the Infinity Castle after Upper Six Demons' defeat.
Megamind,"Animation, Action, Comedy","Evil genius Megamind finally defeats his do-gooder nemesis, Metro Man, but is left without a purpose in a superhero-free world."
Home,"Animation, Adventure, Comedy","An alien on the run from his own people makes friends with a girl. He tries to help her on her quest, but can be an interference."
Rango,"Animation, Action, Adventure","Rango is an ordinary chameleon who accidentally winds up in the town of Dirt, a lawless outpost in the Wild West in desperate need of a new sheriff."
