Minuscule: La vallée des fourmis perdues,"Animation, Action, Adventure","Somewhere in the forest, a stranded ladybug joins forces with a squad of black ants to retrieve a tin box of delicious sugar cubes to the hive. A battalion of fierce red ants has already set their sights on the loot. Who shall prevail?"
Walking with Dinosaurs 3D,"Animation, Adventure, Comedy","See and feel what it was like when dinosaurs ruled the Earth, in a story where an underdog dino triumphs to become a hero for the ages."
Blame!,"Animation, Action, Drama","In the distant future, humans are declared ""illegal residents"" and hunted to near extinction by murderous robots. One day, a group of human scavengers come across a strange man named Killy, who may be the key to humanity's survival."
Jack et la mécanique du coeur,"Animation, Adventure, Drama","A 19th-century drama about a man whose heart was replaced with a clock when he was born. The situation dictates that he should avoid feeling strong emotions -- love, most of all -- but he just can't keep his feelings under wraps."
The SpongeBob SquarePants Movie Rehydrated,"Animation, Adventure, Comedy","In the fan reanimation of the 2004 classic, SpongeBob SquarePants and Patrick Star are in for the adventure of a lifetime when they have to go on a journey to save King Neptune's stolen crown."
Open Season 3,"Animation, Adventure, Comedy",Boog's friends rally to bring him home from a Russian traveling circus.
Batman: Return of the Caped Crusaders,"Animation, Action, Adventure",Batman and Robin of the 1960s live action series are back in action to take down their fiendish foes united once more against them.
Starchaser: The Legend of Orin,"Animation, Action, Adventure","Set on the subterranean Mine-World, a band of human worker are treated like slaves under the power of the evil overlord Zygon until one, Orin, unearths the hilt of a mythical sword that ...See full summary»"
Gekijôban Tensei shitara slime datta ken,"Animation, Action, Adventure","Corporate worker Mikami is stabbed by a random killer, is reborn to an alternate world. But he is reborn as a slime. He is Thrown into this new world with the name Rimuru, he begins his quest to create a world that's welcoming to all races"
Shaun the Sheep Movie,"Animation, Adventure, Comedy","When Shaun decides to take the day off and have some fun, he gets a little more action than he bargained for. A mix up with the Farmer, a caravan and a very steep hill lead them all to the Big City and it's up to Shaun and the flock to return everyone safely to the green grass of home."
The Nut Job 2: Nutty by Nature,"Animation, Adventure, Comedy","Following the events of the first movie, Surly and his friends must stop Oakton City's Mayor from destroying their home to make way for a dysfunctional amusement park."
Regular Show: The Movie,"Animation, Action, Adventure","To save the universe, and their friendship, Mordecai and Rigby must defeat an evil volleyball coach."
Hôhokekyo tonari no Yamada-kun,"Animation, Comedy, Family",The life and misadventures of a family in contemporary Japan.
Gojira: Kaijû Wakusei,"Animation, Action, Adventure","A desperate group of refugees attempts to recolonize Earth 20,000 years after Godzilla took over, but one young man wants revenge above all else."
Lonely Castle in the Mirror,"Animation, Adventure, Drama","Seven teens discover their bedroom mirrors are portals, and they're pulled from their lonely lives to a wondrous castle filled with winding stairways and watchful portraits. A girl in a wolf mask invites them to play a game."
Atrapa la bandera,"Animation, Adventure, Comedy","A young surfer rallies his friends to stop a billionaire from rewriting history as a way to hoard Helium 3, the clean energy of the future."
Gekijô-ban poketto monsutâ: Kesshô-tô no teiô,"Animation, Action, Adventure","In the town of Greenfield, a young, lonely girl's dreams and wishes are brought into reality by a collective of reality-warping Pokémon."
Interstella 5555: The 5tory of the 5ecret 5tar 5ystem,"Animation, Adventure, Music","A continuation of the story told in the Daft Punk music videos ""One More Time,"" ""Aerodynamic,"" ""Digital Love,"" and ""Harder, Better, Faster, Stronger."""
Space Chimps,"Animation, Adventure, Comedy",Three chimps are sent into space to explore the possibility of alien life when an unmanned space shuttle crash lands on an uncharted planet.
Supurigan,"Animation, Action, Adventure",An elite superhuman agent must stop a foreign military unit from seizing control of an ancient artifact that holds the key to ultimate power.
Knor,"Animation, Comedy, Family",A nine-year-old girl gets a pig named Oink as a gift from her grandfather.
The Wiggles Movie,"Animation, Adventure, Comedy","The Wiggles throw a surprise party for Dorothy the Dinosaur, while she goes after a magician who takes Greg's magic wand to become popular."
Appurushîdo,"Animation, Action, Adventure","In a utopian society created at the end of the third world war, a female warrior who has been plucked from the badlands begins to see cracks in this new facade. And what does this community have planned for the rest of humankind?"
Checkered Ninja,"Animation, Action, Adventure",A possessed Ninja doll teams up with a teenage boy to avenge the murder of a poor child factory worker.
My Hero Academia - Boku no hîrô akademia THE MOVIE - Heroes: Rising - Hîrôzu: Raijingu,"Animation, Action, Adventure","A group of youths aspiring to become professional superheroes, fight in a world full of people with abilities, also known as quirks. Deku and his fellow classmates from Hero Academy face Nine, the strongest villain yet."
Double Dutchess: Seeing Double,"Animation, Drama, Fantasy","All of the high-wire action, tearful drama, sexy romance, and dark humor that defines the Double Dutchess."
Kidô senshi Gandamu: Senkô no Hasauei,"Animation, Action, Drama","Hathaway Noa, still haunted by his past actions, joins a terrorist organization called Mufti and adopts the alias ""Mufti Nabiyy Erin"". Mufti is fighting a terrorist campaign against the Earth Federation government."
Terra,"Animation, Action, Adventure","A peaceful alien planet faces annihilation, as the homeless remainder of the human race sets its eyes on Terra. Mala, a rebellious Terrian teenager, will do everything she can to stop it."
Eiga Kono subarashii sekai ni shukufuku o!: Kurenai densetsu,"Animation, Action, Adventure","Kazuma's party is suddenly alerted by an outrageous letter delivered by Yunyun. The letter requested that they come to the Crimson Demon Clan's village, that is facing a threat that could mean it's ending."
Nicktoons,"Animation, Action, Adventure",Plot unknown.
The Seven Deadly Sins: Grudge of Edinburgh Part 1,"Animation, Action, Adventure","When sinister forces threaten the peace of Britannia, a young prince embarks on a perilous journey to save his loved ones and discover his true powers."
Une vie de chat,"Animation, Adventure, Comedy","In Paris, a cat who lives a secret life as a cat burglar's aide must come to the rescue of Zoe, the little girl he lives with, after she falls into a gangster's clutches."
Rock Dog 3 Battle the Beat,"Animation, Adventure, Comedy","When the young performers on a music contest show admit they have never heard of Angus Scattergood, Bodi is compelled to join the show to restore the Rock Legend's good name."
Croc-Blanc,"Animation, Adventure, Drama",Based on the timeless novel by Jack London. A loyal wolfdog's curiosity leads him on the adventure of a lifetime while serving a series of three distinctly different masters.
Ozzy,"Animation, Adventure, Comedy","When his family goes on vacation, a young dog finds himself at a dog prison where he must escape with the help of his new friends."
The Pebble and the Penguin,"Animation, Adventure, Comedy",A lovable but introverted penguin named Hubie plans to present his betrothal pebble to the bird of his dreams.
All Dogs Go to Heaven 2,"Animation, Adventure, Family","Charlie and Itchy return to Earth to find Gabriel's Horn, but along the way meet up with a young boy named David, who ran away from home."
Meikyû monogatari,"Animation, Adventure, Fantasy","A trilogy of separate stories. In ""Labyrinth labyrinthos"", a girl and her cat enter a strange world. In ""Running Man"", a racer takes on the ultimate opponent. In ""Construction Cancellation Order"", a man must shut down worker robots."
Charlotte,"Animation, Biography, Drama","An account of German-Jewish artist Charlotte Salomon's life in the south of France between 1941 and 1943, before she was sent to Auschwitz during World War II. Inspired by her memoir ""Life? or Theatre?""."
Ernest et Célestine: Le voyage en Charabie,"Animation, Adventure, Family",Ernest and Célestine return to Ernest's country to have his broken violin repaired. They discover that music is banned throughout the country. They will attempt to right this injustice in order to bring joy back to bear country.
Puffin Rock and the New Friends,Animation,"Follow the disappearance of the final Little Egg of the season in strange circumstances, leading Oona and her friends to embark on a race against time to try to save it before a big storm hits Puffin Rock and puts the island in danger."
Flåklypa Grand Prix,"Animation, Comedy, Family",Reodor Felgen decides that he will enter a car race to defeat his former friend who has stolen his plans for a car.
High in the Clouds,"Animation, Adventure, Comedy",A squirrel embarks on a journey to find an animal sanctuary.
Deathstroke Knights & Dragons: The Movie,"Animation, Action, Adventure",Assassin Slade Wilson leads two lives: a relentless killer known as Deathstroke and a family man. Can he atone for the sins of the past-or will his family pay the ultimate price?
One piece: Omatsuri danshaku to himitsu no shima,"Animation, Action, Adventure","The Straw Hat Pirates received an advertisement on a recreational island. The offers all looked promising, so they sailed to the island for an opportunity to kick back and relax from their ...See full summary»"
The Point,"Animation, Adventure, Family","A father reads his son a bedtime story about young Oblio, who is banished from the fantastical kingdom of pointed heads and things for having no point."
Folk og røvere i Kardemomme by,"Animation, Family, Musical","The three thieves Kasper, Jesper and Jonathan lives together with their always hungry lion in the little town of Kardemomme town, the home to a fair but kind police officer, and the strict Aunt Sofie."
Promare: Puromea,"Animation, Action, Adventure",A futuristic firefighting mecha service is created to protect the world.
Suchîmubôi,"Animation, Action, Adventure","In 1860s Britain, a boy inventor finds himself caught in the middle of a deadly conflict over a revolutionary advance in steam power."
The BFG,"Animation, Adventure, Drama","A young orphan girl, Sophie, gets taken away to a faraway land populated by Giants and Dreams."
Bai She: Yuan qi,"Animation, Action, Adventure",A love story between a snake spirit and a snake hunter.
Yoru wa mijikashi aruke yo otome,"Animation, Adventure, Comedy","In this comedy about one epic night in Kyoto, a college sophomore goes on a series of surreal encounters with the local nightlife, all the while unaware of the romantic longings of her classmate Senpai."
Legends of Oz: Dorothy's Return,"Animation, Adventure, Family","Shortly after a tornado rips through her Kansas home, Dorothy returns to Oz to save her friends from a villainous jester."
Dragon Ball Z: Tobikkiri no Saikyô tai Saikyô,"Animation, Action, Sci-Fi",Frieza's older brother Cooler travels to Earth to take revenge against Goku for Frieza's defeat on planet Namek.
Xi you ji zhi da sheng gui lai,"Animation, Action, Adventure","The all-powerful Monkey King was imprisoned by the Gods for 500 years, but when a child releases him from his curse, the Monkey King must now save an innocent village from the evil Mountain Lord and his monstrous army."
Felidae,"Animation, Action, Drama",A cat must investigate brutal murders of other cats in a neighborhood he has moved into with his owner.
Si shi qing chun,"Animation, Drama, Romance",Three different stories of youth set in different cities of China.
Robot Dreams,"Animation, Drama, Music","Based on the popular graphic novel by the North American writer Sara Varon, ROBOT DREAMS tells the adventures and misfortunes of Dog and Robot in NYC during the '80s."
Gekijouban Fate/Stay Night: Heaven's Feel - II. Lost Butterfly,"Animation, Action, Adventure","The story focuses on the Holy Grail War and explores the relationship between Shirou Emiya and Sakura Matou, two teenagers participating in this conflict. The story continues immediately ...See full summary»"
Titanic - La leggenda continua,"Animation, Family, Fantasy","A Cinderella meets her Prince Charming on the ill-fated Titanic. Along for the ride are a rapping dog, other talking animals, and an assortment of wacky humans."
Hey Arnold! The Movie,"Animation, Adventure, Comedy",Arnold and company must recover a stolen document needed in order to prevent the neighborhood from being bulldozed.
Allahyar and the 100 Flowers of God,"Animation, Adventure, Sci-Fi",Pakistani upcoming animated film from Allahyar series.
Kanojo no omoide,"Animation, Drama, Horror","""Magnetic Rose"" is about what happens when a deep space corporate freighter is called upon to investigate a distress signal from what ought to be a derelict space station. The space station...See full summary»"
Scarygirl,"Animation, Adventure, Fantasy","As her world is shrouded in darkness, a young girl must overcome her fears and travel to a mysterious city of light, save her father from a dangerous scientist and prevent the destruction of her planet."
Kimetsu no Yaiba: Asakusa Hen,"Animation, Action, Fantasy","Tanjiro ventures to Asakusa, Tokyo for his second mission with the Demon Slayer Corps."
My Dream Is Yours,"Animation, Comedy, Music","An agent must search for a new personality to replace a popular singer who refuses to renew his radio contract. He finds one in the form of a single mother, but complications soon occur."
The Swan Princess: A Fairytale Is Born,"Animation, Adventure, Comedy","While Uberta is preparing to give the royal sceptre to Odette and Derek, another queen is scheming to ruin the coronation."
Koshchey. Pokhititel nevest,"Animation, Adventure, Comedy","For some reason, forever young and always immaculately dressed, Koschey has been unable to find a bride for three hundred years."
My Little Pony: The Movie,"Animation, Adventure, Family","Ponyland comes under attack from the Smooze, a massive purple ooze created by an evil witch who plans to destroy the ponies' annual spring festival."
Kuroshitsuji: Book of the Atlantic,"Animation, Fantasy","A young lord and his demon butler board a luxury cruise ship to investigate claims of the dead being returned to life, and are faced with various complications."
The House of Magic,"Animation, Adventure, Comedy","Thunder, an abandoned young cat seeking shelter from a storm, stumbles into the strangest house imaginable, owned by an old magician and inhabited by a dazzling array of automatons and gizmos."
Les maîtres du temps,"Animation, Adventure, Sci-Fi","Piel, a 7 or 8 year old boy, is alone on the desert planet Perdide, only survivor of an attack by giant hornets. Calling for help, Piel's father's friend Jaffar keeps contact with the kid and hurries across space toward Perdide."
The Reluctant Dragon,"Animation, Comedy, Family",Humorist Robert Benchley learns about the animation process at Walt Disney Studios while trying to find the great man himself to pitch him the idea of making a cartoon about a shy dragon.
Gekijô-ban Naruto: Daigekitotsu! Maboroshi no chitei iseki dattebayo!,"Animation, Action, Adventure","Naruto, Shikamaru and Sakura are on a mission to deliver a lost pet to a village when a mysterious knight appear to confront them."
The Journey,"Animation, Action, Adventure",An animated tale based on the history and culture of ancient Arabia.
Astérix: Le secret de la potion magique,"Animation, Adventure, Comedy","Asterix and Obelix help Getafix search for a young druid worthy of succeeding him, all while his old nemesis Demonix seeks to steal the recipe for his legendary magic potion."
Kimetsu no Yaiba: Hashira Gou Kaigi - Chouyashiki Hen,"Animation, Action, Fantasy","Tanjiro and his sister Nezuko have been apprehended by the Demon Slayer Hashira, a group of extremely skilled swordfighters. Tanjiro undergoes trial for violating the Demon Slayer code, ...See full summary»"
Altered Carbon: Resleeved,"Animation, Action, Crime","On the planet Latimer, reawakened Takeshi Kovacs must protect a teenage tattooist named Holly while investigating the death of a yakuza boss alongside Gina, a strangely familiar no-nonsense CTAC agent."
The Loud House,"Animation, Adventure, Comedy","With his parents and all 10 sisters in tow, Lincoln Loud heads to Scotland and learns that royalty runs in the family in this global musical journey."
Cheap,"Animation, Comedy, Fantasy",Mild-mannered insurance-adjuster Willard teams up with a foul-mouthed fowl who takes him on a surreal quest to become less uptight--and possibly get laid.
The Pilgrim's Progress,"Animation, Adventure, Family","An epic journey, faithfully adapted to modern-day. Christian faces distractions, challenges, and perils at every turn of the way. But ends victorious, with helpful guides, as he stays on the narrow path to the distant Celestial City."
Yu-Gi-Oh!: The Dark Side of Dimensions,"Animation, Adventure, Drama",Yugi and Kaiba have a special duel that transcends dimensions.
Shark Bait,"Animation, Adventure, Family",One fish must find his destiny to save his home and the love of his life from a bullying shark.
Dragon Ball Z: Fukkatsu no Fusion!! Gokuu to Vegeta,"Animation, Action, Sci-Fi",The universe is thrown into dimensional chaos as the dead come back to life. Now Goku and Vegeta must track down the cause of this uproar.
Happily N'Ever After,"Animation, Adventure, Comedy","An alliance of evil-doers, led by Frieda, looks to take over Fairy Tale Land. But when Ella realizes her stepmother is out to ruin her storybook existence, she takes a dramatic turn and blossoms into the leader of the resistance effort."
Os Demónios do Meu Avô,Animation,"Rosa is a successful designer living in a generic big city. After the unexpected death of her grandfather, she realizes she's not been in a place where she felt connected or loved since she left her homeland."
Terkel i knibe,"Animation, Comedy, Musical",Terkel is an average teenager whose life takes a turn for the worse when a girl who had a crush on him kills herself and an unknown maniac starts stalking him.
Seinto Seiya: Legend of Sanctuary,"Animation, Action, Fantasy","The warriors called ""Saints"" are champions of hope who appear whenever evil threatens the world."
Animal Farm,"Animation, Comedy, Drama",Feature film based on the novel by George Orwell.
Shingeki no Kyojin: Chronicle,"Animation, Action, Adventure",A recap of the popular anime series Shingeki no Kyojin from seasons 1-3.
Made in Abyss: Fukaki Tamashî no Reimei,"Animation, Adventure, Drama","Riko, Reg, and their new friend, Nanachi, continue their journey down the Abyss and arrive at the 5th layer. But in order for them to continue to the 6th layer, they must encounter the haunting figure of Nanachi's past: Bondrewd the Novel."
Gekijouban Sword Art Online the Movie: Progressive - Kuraki Yuuyami no Scherzo,"Animation, Action, Adventure","Two months have passed since the deadly game began, and Kirito and Asuna continue to make progress. They stop for treasure, but then they must face Asuna's least favorite monster."
Kaguya-sama wa Kokurasetai: First Kiss wa Owaranai,"Animation, Comedy, Romance","Now that Kaguya and Miyuki have shared their first kiss, the time has come for them to truly understand each other and admit their feelings."
Yu-Gi-Oh! The Movie,"Animation, Action, Adventure","Underneath the sands of Egypt, Anubis, an ancient evil spirit, has awakened. It's up to Yugi, who defeated Anubis centuries ago, to use his skill and determination to rid the world of evil once again."
Scooby-Doo Meets Batman,"Animation, Adventure, Family","Scooby-doo meets Batman is a video compilation from Warner Bros. Home Entertainment. It consists of two episodes from Hannah Barbera's The New Scooby-doo Movies, 'The Dynamic Scooby-doo ...See full summary»"
Bye Sweet Carole,"Animation, Drama, Fantasy","Set in early 1900s, young Lana Benton, pushed by the gelid Mr. Kyn, must confront bizarre creatures in a mysterious dream garden as she follows the last traces of Carole, a girl who escaped from Bunny Hall, a 19th-century girls' orphanage."
Bilal: A New Breed of Hero,"Animation, Action, Adventure","A thousand years ago, one boy with a dream of becoming a great warrior is abducted with his sister and taken to a land far away from home. Thrown into a world where greed and injustice rule all, Bilal finds the courage to raise his voice and make a change. Inspired by true events, this is a story of a real hero who earned his remembrance in time and history."
Qi che ren zong dong yuan,"Animation, Adventure, Family",The film revolves around a genius engineer who develops three cars with sentient artificial intelligence for the ultimate interaction with humans. In a world where people normally drive ...See full summary»
Scooby-Doo & Batman: The Brave and the Bold,"Animation, Action, Comedy",Batman teams up with the Scooby Doo gang when villains from both of their worlds unite to wreak havoc on the city.
Bai She 2: Qing She jie qi,"Animation, Action, Adventure",Animated adaptation of the classic Chinese folktale. Sequel to the 2019 film 'White Snake'.
Heart of Darkness,Animation,"Based on Joseph Conrad's novel, Marlow, captains a leaky steamboat up the River Congo in search of a mysterious figure named Kurtz who has carved out a brutal kingdom in which he has power of life and death over his native subjects."
"Ruben Brandt, a gyujto","Animation, Action, Crime","Four expert thieves attempt to steal every famous artwork that is haunting their mutual psychotherapist. A detective attempts to find out who the ""Collector"" is."
The Timekeepers of Eternity,"Animation, Horror, Mystery","Mr Toomey obsessively tears paper to control his childhood monsters, but when he wakes mid-flight to Boston to find most of the other passengers disappeared, he must confront the paper nightmare which threaten to rip everything apart."
Buka. Moyo lyubimoe chudishche,"Animation, Adventure, Family","Princess Barbara is secretly in love with Prince Edward. When the sneaky post clerk Weasel demands the king to marry him to Barbara, she flees. Sweet monster Boogey does everything in his might to help Barbara save the kingdom."
Meitantei Conan: Tokei-jikake no matenrou,"Animation, Adventure, Crime",The detective genius Conan must solve a series of bombings or his true love will die!
Drømmebyggerne,"Animation, Adventure, Comedy","Minna, a young girl, misuses her newfound ability to create and control other people's dreams to teach her bothersome stepsister a lesson."
A Figgly Christmas,"Animation, Comedy, Family","When Santa Claus crashes in the land of the Woodgies, Figgly has to help Santa and save Christmas."
The King and I,"Animation, Family, Fantasy","Traveling to the exotic kingdom of Siam, English schoolteacher Anna Leonowens soon discovers that her most difficult challenge is the stubborn, imperious King himself."
Animal Crossing Christmas Festival: The Movie!,"Animation, Adventure",A young boy named Evan moves in to a Village populated with anthropomorphic animals and encounters friends along the way to make his big adventure.
Melody Time,"Animation, Comedy, Family",An anthology of animated vignettes set to contemporary music.
Gekijô-ban Naruto shippûden,"Animation, Action, Adventure","A powerful spirit that once threatened to destroy the world is back! Naruto's mission is to protect a priestess named Shion, who is the only one with the power to seal away the monster."
Minions & More 2,"Animation, Adventure, Comedy","Catch animated shorts like ""Phil's Dance Party"" and ""Binky Nelson Unpacified"" in this compilation from the company behind the ""Despicable Me"" franchise."
Xiong Chu Mei Ban Wo Xiong Xin,Animation,"Briar and Bramble lose their mother at a very young age due to mysterious circumstances. Many years later, when an older female bear shows up on the scene, the Bear Brothers are determined to find out the truth once and for all."
Gekijouban Fate/Stay Night: Heaven's Feel - III. Spring Song,"Animation, Action, Adventure","The final chapter in the Heaven's Feel trilogy. Angra Mainyu has successfully possessed his vessel Sakura Matou. It's up to Rin, Shirou, and Rider to cleanse the grail or it will be the end of the world and magecraft as we all know it."
Mars Express,"Animation, Action, Mystery","Acceptance of Differences between robot and human. human Aline struggles with alcoholism,bearing-the consciousness of a dead-man partner Carlos cannot rebuild the broken family his namesake left behind."
Vaioretto evâgâden gaiden: Eien to jidou shuki ningyou,"Animation, Drama, Family","Violet Evergarden, a former soldier returned from war, comes to teach at a women's academy and changes a young girl's life."
Heruzu enjueruzu,"Animation, Adventure, Comedy","Amagane Rinne, an upbeat schoolgirl, has died. But even dead, she still has to attend school in the underworld."
Luis and His Friends from Outer Space,"Animation, Adventure, Comedy",An 11-year-old boy befriends three aliens after they crash their spaceship onto the grounds of an closed gas station by his house.
Kimi o Aishita Hitori no Boku e,"Animation, Fantasy, Romance","In a universe of parallel worlds, two lovers search for a place to belong."
