The Son of Bigfoot,"Animation, Adventure, Comedy","A young teenage boy sets out to find his missing father, only to discover that he's actually the mythical creature known as Bigfoot."
It's Such a Beautiful Day,"Animation, Comedy, Drama","Bill struggles to put together his shattered psyche, in this new feature film version of Don Hertzfeldt's animated short film trilogy."
Igor,"Animation, Comedy, Family","Animated fable about a cliché hunchbacked evil scientist's assistant who aspires to become a scientist himself, much to the displeasure of the rest of the evil science community."
Diary of a Wimpy Kid,"Animation, Comedy, Drama",Greg Heffley is an ambitious kid with an active imagination and big plans to be rich and famous. The problem is that he has to survive middle school first.
Mortal Kombat Legends: Battle of the Realms,"Animation, Action, Adventure","The Earthrealm heroes must journey to Outworld and fight for the survival of their homeland, invaded by the forces of evil warlord Shao Kahn, in the tournament to end all tournaments: the final Mortal Kombat."
Trollhunters: Rise of the Titans,"Animation, Action, Adventure",The heroes from the Trollhunters series team-up on an epic adventure to fight the Arcane Order for control over the magic that binds them all.
Ame o tsugeru hyôryû danchi,"Animation, Adventure, Drama",Follows two childhood friends who drift into a mysterious sea with an entire housing complex.
Toki o kakeru shôjo,"Animation, Adventure, Comedy","A high-school girl named Makoto acquires the power to travel back in time, and decides to use it for her own personal benefits. Little does she know that she is affecting the lives of others just as much as she is her own."
Spellbound,"Animation, Adventure, Comedy","Spellbound follows the adventures of Ellian, the tenacious princess who must go on a daring quest to save her family and kingdom after a mysterious spell transforms her parents, the King and Queen of Lumbria, into monsters."
Foodfight!,"Animation, Action, Adventure",The evil Brand X joins a supermarket that becomes a city after closing time.
Rock & Rule,"Animation, Fantasy, Music","A malevolent rock star kidnaps a singer to force her to participate in the summoning of a demon, and her band must help her stop him."
Batman: Soul of the Dragon,"Animation, Action, Adventure","In the 1970s, a missing teacher of martial arts is the subject of a quest by his devoted and brilliant but distant students, who include Batman."
Scoob!: Holiday Haunt,"Animation, Adventure, Comedy","To celebrate Scooby-Doo's first Christmas, 10-year-old Shaggy and the gang take him to a holiday-themed resort owned by Fred's Uncle Ned. The kids are forced to solve a 40-year-old mystery to save the resort from a ghostly haunting."
Evangelion Shin Gekijôban: Jo,"Animation, Action, Drama",The fate of the world is threatened by seemingly monstrous entities known as Angels. NERV is an organisation set up to counter this threat and it is up to young pilots to protect Earth but exactly what are the real motives behind NERV?
La tortue rouge,"Animation, Drama, Family","A man is shipwrecked on a deserted island and encounters a red turtle, which changes his life."
Interdit aux chiens et aux Italiens,Animation,"In the Beginning of the 20th century - Ughettera, Northern Italy, The Ughetto family's village. Living in the region had become very difficult and the Ughettos dream of a better life abroad...See full summary»"
Jin-Rô,"Animation, Action, Drama",A traumatized member of an elite para-military police force falls for the sister of a female terrorist courier who died in front of him on duty.
J'ai perdu mon corps,"Animation, Drama, Fantasy","A story of Naoufel, a young man who is in love with Gabrielle. In another part of town, a severed hand escapes from a dissection lab, determined to find its body again."
Wildwood,"Animation, Action, Adventure",The adventures of Prue McKeel as she sets off to the forests outside Portland to find her kidnapped brother.
Resident Evil: Vendetta,"Animation, Action, Adventure","Chris Redfield enlists the help of Leon S. Kennedy and Rebecca Chambers to stop a death merchant, with a vengeance, from spreading a deadly virus in New York."
Harold and the Purple Crayon,"Animation, Family, Fantasy",A young boy named Harold embarks on a magical mission with the help of his purple crayon
"Tarzoon, la honte de la jungle","Adventure, Animation, Comedy","Shame, the ape man of the jungle, sets off to rescue his woman, June, when a gang of giant penises kidnaps her."
Wonder Park,"Animation, Adventure, Comedy",The imagination of a wildly creative girl comes alive in an amusement park.
Heavy Traffic,"Animation, Comedy, Drama","An underground cartoonist contends with life in the inner city, where various unsavory characters serve as inspiration for his art."
Un monstre à Paris,"Animation, Adventure, Comedy","A 3D-animated movie set in Paris in the year 1910 and centered on a monster who lives in a garden and his love for a beautiful, young singer."
Neco z Alenky,"Animation, Adventure, Fantasy",A surrealistic revision of Alice in Wonderland.
Hopper et le hamster des ténèbres,"Animation, Adventure, Comedy","Follows a young hero born half chicken and half hare. Eager to fit in and feel loved in spite of his differences, he is obsessed by adventuring in spite of his clumsiness."
The Breadwinner,"Animation, Drama, Family","In 2001, Afghanistan is under the control of the Taliban. When her father is captured, a determined young girl disguises herself as a boy in order to provide for her family."
The Nut Job,"Animation, Adventure, Comedy","An incorrigibly self-serving exiled squirrel finds himself helping his former park brethren survive by raiding a nut store, a location that also happens to be a front for a human gang's bank robbery."
Kirikou et la sorcière,"Animation, Adventure, Family","Kirikou, an unusual little boy, must search the wisdom of the forbidden mountain in order to save his village from a spell cast by the evil sorceress Karaba"
Le sommet des dieux,"Animation, Adventure, Drama",A photojournalist's obsessive quest for the truth about the first expedition to Mt. Everest leads him to search for an esteemed climber who went missing.
Metoroporisu,"Animation, Adventure, Drama",Kenichi and his uncle Shunsaku Ban must find the mystery behind robot girl Tima.
Alpha and Omega,"Animation, Adventure, Comedy","Two young wolves at opposite ends of their pack's social order are thrown together into a foreign land and need each other to return home, but love complicates everything."
The Star,"Animation, Adventure, Comedy",A small but brave donkey and his animal friends become the unsung heroes of the first Christmas.
Surf's Up 2: WaveMania,"Animation, Adventure, Comedy","An animated comedy that features WWE Superstars, providing their own voices while matching up against talking animals."
Sennen joyû,"Animation, Drama, Fantasy",A TV interviewer and his cameraman meet a former actress and travel through her memories and career.
Open Season 2,"Animation, Adventure, Comedy","After falling head over hooves in love with Giselle, Elliot's road to the altar takes a slight detour when Mr. Weenie is kidnapped by a group of pampered pets determined to return him to his owners."
Marmaduke,"Animation, Adventure, Comedy","A legendary dog trainer believes he can transform Marmaduke from an undisciplined, but lovable dog, into the first Great Dane to win the World Dog Championship."
Helt super,"Animation, Family","You don't have to be a superhero to be super. Hedvig has shrunk daddy's superhero-costume so now he can no longer be the super-Lion. The gamer Hedvig is clumsy, but when dad chooses cousin Adrian to be the next hero, Hedvig has to react."
Gekijoban Spy x Family Code: White,"Animation, Action, Comedy",An era when countries around the world were engaged in a fierce information war under the surface. Information Bureau vs. East Division Wise Agent of Twilight Loid Forger was on a mission ...See full summary»
Playmobil: The Movie,"Animation, Adventure, Comedy","When her younger brother Charlie unexpectedly disappears into the magical, animated universe of PLAYMOBIL®, unprepared Marla must go on a quest of a lifetime to bring him home, setting off on a fantastic journey across stunning new worlds."
Starship Troopers: Traitor of Mars,"Animation, Action, Sci-Fi","Federation trooper, Johnny Rico's ordered to work with a group of new recruits on a satellite station on Mars, where giant bugs have decided to target their next attack."
Secret of the Wings,"Animation, Family, Fantasy",Tinkerbell wanders into the forbidden Winter woods and meets Periwinkle. Together they learn the secret of their wings and try to unite the warm fairies and the winter fairies to help Pixie Hollow.
Xiong chu mo: Chong fan di qiu,"Animation, Comedy, Family","When an unknown object from space lands on Earth, Bramble gains new abilities and an extraterrestrial sidekick."
Shen hai,Animation,"A girl strays into the dreamy deep sea world. In the deepest part of the sea, all secrets are hidden."
Sutorîto faitâ II gekijô-ban,"Animation, Action, Adventure","Based on the legendary video game series. This anime classic follows Ryu, a talented fighter who may be the greatest in all of the world, and Bison, the evil mastermind searching for Ryu's talents."
Middle School: The Worst Years of My Life,"Animation, Comedy, Family","After his principal (Andy Daly) destroys his sketchbook, Rafe (Griffin Gluck) and his best friend Leo (Thomas Barbusca) decide to ""destroy his book"" and break every rule in the school's Code of Conduct."
Samâ uôzu,"Animation, Action, Adventure","A student tries to fix a problem he accidentally caused in OZ, a digital world, while pretending to be the fiancé of his friend at her grandmother's 90th birthday."
Everyone's Hero,"Animation, Adventure, Comedy",A boy begins a grand journey to return Babe Ruth's baseball bat before the deciding game of the 1932 World Series comes to a close.
Zootopia 2,"Animation, Adventure, Comedy",Add a Plot
Saving Bikini Bottom: The Sandy Cheeks Movie,"Animation, Adventure, Comedy","When Bikini Bottom is suddenly scooped out of the ocean, Sandy Cheeks and SpongeBob journey to Sandy's home state of Texas, where they meet Sandy's family and must save Bikini Bottom from the hands of an evil CEO"
The Peasants,"Animation, Drama","Using a team of animators and painters who work by hand, Kobiela adapts a Nobel prize winning novel about an early 20th Polish peasant woman who creates havoc by marrying an older rich man."
Free Birds,"Animation, Adventure, Comedy","Two turkeys from opposite sides of the tracks must put aside their differences and team up to travel back in time to change the course of history, and get Turkeys off the Thanksgiving menu for good."
Cats Don't Dance,"Animation, Comedy, Family","Danny, an ambitious singing and dancing cat, goes to Hollywood and overcomes several obstacles to fulfill his dream of becoming a movie star."
Arthur 3: la guerre des deux mondes,"Animation, Adventure, Family","With Maltazard now seven feet tall and Arthur still two inches small, our hero must find a way to grow back to his normal size and stop the Evil M once and for all, with the help of Selenia and Betameche."
Ernest et Célestine,"Animation, Adventure, Comedy","The story of an unlikely friendship between a bear, Ernest, and a young mouse named Celestine."
Seal Team,"Animation, Action, Comedy",Fearless seal Quinn assembles a squad of misfit recruits to stand up to ruthless sharks with razor-sharp teeth and reclaim the open sea.
La casa lobo,"Animation, Drama, Horror","Tells the story of Maria, a young woman who takes refuge in a house in southern Chile after escaping from a German colony."
Escape from Planet Earth,"Animation, Adventure, Comedy",Astronaut Scorch Supernova finds himself caught in a trap when he responds to an SOS from a notoriously dangerous alien planet.
Eiga Doraemon: Nobita to Sora no Utopia,"Animation, Adventure, Comedy","The film will be set in a perfect world in the sky, where everyone lives happily. Doraemon and Nobita set out on an adventure to find the utopia with the help of a new gadget of Doraemon."
Berserk: Ougon jidai-hen III - Kourin,"Animation, Action, Adventure",A year has passed since Guts parted ways with Griffith. The Band of the Hawk is plotting a rescue mission to save Griffith who is confined to prison.
Dante's Inferno: An Animated Epic,"Animation, Action, Adventure","Dante journeys through the nine circles of Hell -- limbo, lust, gluttony, greed, anger, heresy, violence, fraud and treachery -- in search of his true love, Beatrice."
Inosensu: Innocence,"Animation, Drama, Mystery","In the year 2032, Batô, a cyborg detective for the anti-terrorist unit Public Security Section 9, investigates the case of a female robot--one created solely for sexual pleasure--who slaughtered her owner."
The Jungle Book 2,"Animation, Adventure, Comedy","Mowgli, missing the jungle and his old friends, runs away from the man village unaware of the danger he's in by going back to the wild."
Bakemono no ko,"Animation, Action, Adventure","When a young orphaned boy living on the streets of Shibuya stumbles upon a fantastic world of beasts, he's taken in by a gruff warrior beast looking for an apprentice."
Return to Never Land,"Animation, Adventure, Family","In London during World War II, this is the story of Wendy's daughter, Jane, who is kidnapped by Captain Hook and Peter Pan must come to the rescue."
Metalocalypse: Army of the Doomstar,Animation,"Can Nathan Explosion look beyond his brutally damaged ego to save his band, stop the Metalocalypse, and finally face the ultimate evil: Salacia?"
Toopy and Binoo the Movie,Animation,"After an escalation of blunders, Toopy and Dorothy, a comical genie, accidentally make Binoo's beloved stuffed animal, Patchy-Patch, disappear. The trio immediately set out to find the ...See full summary»"
Phineas and Ferb the Movie: Candace Against the Universe,"Animation, Adventure, Comedy",The famed stepbrother inventors know what they're gonna do today. They're gonna rescue their sister from an alien abduction.
Ma vie de Courgette,"Animation, Comedy, Drama","After losing his mother, a young boy is sent to an orphanage with other orphans his age where he begins to learn the meaning of trust and true love."
100% Wolf,"Animation, Adventure, Comedy","100% Wolf centers on Freddy Lupin, heir to a proud family line of werewolves. Positive he'll become the most fearsome werewolf ever, Freddy is in for a shock when his first ""warfing"" goes awry, turning him into a ferocious - poodle."
Mirai no Mirai,"Animation, Adventure, Drama","A young boy encounters a magical garden which enables him to travel through time and meet his relatives from different eras, with guidance by his younger sister from the future."
Where the Dead Go to Die,"Animation, Fantasy, Horror",A troubled group of children living on the same block are haunted by a talking dog named Labby who brings them on surreal hell-rides between different dimensions and time periods.
The Incredible Mr. Limpet,"Animation, Comedy, Family",Meek and mild mannered bookkeeper Henry Limpet has few passions in life. It's mid-1941 and he would love to join the Navy but has been rated 4F. His friend George Stickle is in the Navy and...See full summary»
Happy Family,"Animation, Comedy, Family","Despite the title, the Wishbone family are far from happy. In an attempt to reconnect as a family, Mum and Emma plan a fun night out. However, her plan backfires when an evil witch curses them, and they're all turned into Monsters."
Seishun Buta Yaro wa Yumemiru Shoujo no Yume wo Minai,"Animation, Drama, Fantasy",A high school student's blissful days with his girlfriend are interrupted when his first crush returns in two forms.
Reign of the Supermen,"Animation, Action, Adventure","After the death of Superman, several new people present themselves as possible successors."
Kureopatora,"Animation, Adventure, Comedy","To decipher a scheme plotted by enemy aliens, three agents from the future travel to Cleopatra's time, where they witness her romances with Caesar and Mark Antony."
Hey Good Lookin',"Animation, Comedy, Drama","An outrageous, affectionate look at coming of age in Eisenhower-era Brooklyn."
Bebe's Kids,"Animation, Comedy, Fantasy","To impress his new girlfriend, a man agrees to look after her friend's kids, only to find that they are uncontrollably rambunctious."
Rupan sansei: Kariosutoro no shiro,"Animation, Action, Adventure","A dashing thief, his gang of desperadoes and an intrepid cop struggle to free a princess from an evil count, and learn the secret of a treasure that she holds part of the key to."
My Fairy Troublemaker,"Animation, Adventure, Comedy","A cheeky fairy named Violetta gets lost into the human world. To go back to the fairy world, She meets and teams up with a 12-year-old girl named Maxie and discovers her true destiny."
The Spine of Night,"Animation, Action, Adventure","Ultra-violent, epic fantasy set in a land of magic follows heroes from different eras and cultures battling against a malevolent force."
Hoodwinked Too! Hood vs. Evil,"Animation, Adventure, Comedy","Red Riding Hood is training in the group of Sister Hoods, when she and the Wolf are called to examine the sudden mysterious disappearance of Hansel and Gretel."
Eight Crazy Nights,"Animation, Comedy, Musical","Davey Stone, an alcoholic with a criminal record, is sentenced to community service under the supervision of an elderly referee. Davey is then faced with trying to reform and abandon his bad habits."
One Piece Film: Gold,"Animation, Action, Adventure","The Straw Hat Pirates come to Gran Tesoro, the richest ship in the world."
Gnome Alone,"Animation, Adventure, Comedy","When Chloe discovers that her new home's garden gnomes are not what they seem, she must decide between the pursuit of a desired high school life and taking up the fight against the Troggs."
The Plague Dogs,"Animation, Adventure, Drama",Two dogs escape from a laboratory and are hunted as possible carriers of the bubonic plague.
Heroes of the Golden Mask,"Animation, Adventure, Comedy","Charlie, a wise-cracking, homeless, American orphan is magically transported to the ancient Chinese kingdom of Sanxingdui, where a colorful team of superheroes need his help to defend the ...See full summary»"
DuckTales the Movie: Treasure of the Lost Lamp,"Animation, Adventure, Comedy","Scrooge McDuck takes Huey, Dewey, and Louie to Egypt to find a pyramid and magic lamp."
Boruto: Naruto the Movie,"Animation, Action, Adventure","It's been some years since the end of the Shinobi War. Naruto Uzumaki is the 7th Hokage of Konohagakure, in this new era. His son, Boruto Uzumaki, will soon enter the Chûnin exams, alongside Sarada Uchiha and the mysterious Mitsuki."
Katak: The Brave Beluga,"Animation, Adventure, Comedy","While his peers have all turned white, Katak is still small and grey. To prove that he has grown up and to grant the last wish of his adored grandma, Katak departs on a perilous journey to the Great North."
Starship Troopers: Invasion,"Animation, Action, Sci-Fi","A black op has gone terribly wrong. Now, Captain Carmen Ibanez and a hardcore trooper famed as Major Henry ""Hero"" Varro must lead a team of battle-weary troopers to find the missing ship and discover what went wrong."
Rugrats in Paris: The Movie - Rugrats II,"Animation, Adventure, Comedy","While on a family vacation in Paris, the Rugrats attempt to help Chuckie find a new mom while stopping his dad from marrying a conniving businesswoman who hates kids."
A Troll in Central Park,"Animation, Adventure, Comedy","An evil Queen banishes a flower loving troll named Stanley (Dom DeLuise) to New York City, where he befriends two young children."
The Queen's Corgi,"Animation, Comedy, Family",The British monarch's (Dame Julie Walters') favorite dog gets lost from the palace and finds himself at a dog fight club. He then begins his long journey to find his way back home.
The Inventor,"Animation, Adventure, Comedy","Inventing flying contraptions, war machines and studying cadavers, Leonardo da Vinci tackles the meaning of life itself with the help of French princess Marguerite de Nevarre."
One Piece: Stampede,"Animation, Action, Adventure",Pirates from around the world gather at the Pirates Expo to join the hunt for Gol D. Roger's lost treasure.
Ozi: Voice of the Forest,Animation,"This is the story of Ozi, an orphan orangutan, who uses her influencer skills to save her forest and home from deforestation."
Hoshi o ou kodomo,"Animation, Adventure, Drama","A coming of age story involving young love and a mysterious music, coming from a crystal radio left as a memento by an absent father, that leads a young heroine deep into a hidden world."
Steven Universe: The Movie,"Animation, Action, Adventure","Steven thinks his time defending the Earth is over, but when a new threat comes to Beach City, Steven faces his biggest challenge yet."
Eflâtun,"Animation, Drama, Romance","Eflatun, a blind woman since childhood, has been able to get a hold of her life with the help of her father's various shadow and sound plays. Eflatun inherits her father's profession of ...See full summary»"
The Powerpuff Girls Movie,"Animation, Action, Adventure","After destroying the city of Townsville in a game of tag, a trio of super-powered little girls must redeem themselves by stopping a vengeful monkey's plot for world domination."
"Saules aveugles, femme endormie","Animation, Drama, Sci-Fi","A giant talkative frog, a lost cat, and a tsunami help a bank employee, his wife and a schizophrenic accountant to save Tokyo from an earthquake and find a meaning to their lives."
The Venture Bros.: Radiant Is the Blood of the Baboon Heart,Animation,Doc's latest invention will either bankrupt the Ventures or launch them to new heights.
The Wild Thornberrys Movie,"Animation, Adventure, Comedy","Eliza (Lacey Chabert) and Debbie (Danielle Harris) are two sisters who don't always get along. But their relationship is put to the test when Debbie's life is in danger, and Eliza might have to give up her power to talk to animals."
One Piece Film Z,"Animation, Action, Adventure",A former Marine stands in the way of the Straw Hat Pirates.
Kuso,"Animation, Comedy, Drama",Events unfold after a devastating earthquake in Los Angeles.
Baby Shark's Big Movie!,"Animation, Adventure, Comedy","Follow Baby Shark and his family as they leave Chomp City, the great city of sharks."
Dragon's Lair: The Movie,"Animation, Action, Adventure","Dirk the Daring, a knight who sets out to rescue Princess Daphne from the evil dragon Singe and a wizard named Mordroc."
Charming,"Animation, Adventure, Comedy","Three fairy tale princesses find themselves engaged to the same guy, Prince Charming."
Diary of a Wimpy Kid: Rodrick Rules,"Animation, Comedy, Drama","A new school year, his brother Rodrick teases him over and over and over and over again. Will Greg manage to get along with him? Or will a secret ruin everything?"
Pinokkio. Pravdivaya istoriya,"Animation, Family, Fantasy",Young Pinocchio runs away from his genius creator Jepetto accompanied by the horse Tibalt to see the world and joins the traveling circus run by hustler Modjafocco.
"Kumo no mukô, yakusoku no basho","Animation, Drama, Romance","In an alternate postwar timeline, Japan is divided into the Union-controlled North and the US-controlled South."
Arthur et la vengeance de Maltazard,"Animation, Adventure, Family","Arthur answers a distress call from Princess Selenia, who is menaced by the nefarious Maltazard."
Ronal Barbaren,"Animation, Action, Adventure","The 100 Barbarian Sons of Krull get attacked by a superior force and captured. It's up to the young, weak but smart Ronal to free them. 3 join his dangerous quest."
Gekijouban Bishoujo Senshi Sailor Moon Eternal,"Animation, Action, Adventure","When a dark power enshrouds the Earth after a total solar eclipse, the scattered Sailor Guardians must reunite to bring light back into the world."
The Soccer Football Movie,"Animation, Comedy, Family",Four young soccer superfans team up to help their idols regain their abilities after a scheming evil scientist steals their talent.
The Lego Batman Movie 2,"Animation, Action, Adventure",Add a Plot
Jungle Beat: The Movie,"Animation, Adventure, Comedy",A homesick alien crash-lands his spaceship near the colorful African Jungle. His new animal friends need to get him back to his ship and teach him about friendship and fun before his Space-Conqueror father can take over the planet.
American Pop,"Animation, Drama, History",The story of four generations of a Russian Jewish immigrant family of musicians whose careers parallel the history of American popular music in the 20th century.
Arthur Christmas,"Animation, Adventure, Comedy",Santa's clumsy son Arthur sets out on a mission with Grandsanta to give out a present they misplaced to a young girl in less than two hours.
Lupin the IIIrd: Chikemuri no Ishikawa Goemon,"Animation, Action, Adventure","Lupin's friend, the samurai Goemon Ishikawa, takes a job as bodyguard for a yakuza boss. But a brutal assassin kills the yakuza and Goemon is honor-bound to track him down."
Gekijô-ban poketto monsutâ: Maboroshi no pokemon: Rugia bakutan,"Animation, Action, Adventure","Ash Ketchum must gather the three spheres of fire, ice and lightning in order to restore balance to the Orange Islands."
Pets United,"Animation, Adventure, Comedy","A group of spoilt, selfish pets led by glamour cat Belle are stranded in their luxury hangout 'Pampered Pets,' when the machines that run Robo City, the hypermodern metropolis that they live in, go wild and take over."
