Killers of the Flower Moon (2023),"Crime, Drama, History","Members of the Osage tribe in the United States are murdered under mysterious circumstances in the 1920s, sparking a major F.B.I. investigation involving J. Edgar Hoover."
The Out-Laws (2023),"Action, Comedy, Crime","A straight-laced bank manager about to marry the love of his life. When his bank is held up by infamous Ghost Bandits during his wedding week, he believes his future in-laws who just arrived in town, are the infamous Out-Laws."
John Wick: Chapter 4 (2023),"Action, Crime, Thriller","John Wick uncovers a path to defeating The High Table. But before he can earn his freedom, Wick must face off against a new enemy with powerful alliances across the globe and forces that turn old friends into foes."
Fast X (2023),"Action, Adventure, Crime",Dom Toretto and his family are targeted by the vengeful son of drug kingpin Hernan Reyes.
Infinity Pool (2023),"Crime, Horror, Mystery","James and Em Foster are enjoying an all-inclusive beach vacation in the fictional island of La Tolqa, when a fatal accident exposes the resort's perverse subculture of hedonistic tourism, reckless violence and surreal horrors."
The Godfather (1972),"Crime, Drama","Don Vito Corleone, head of a mafia family, decides to hand over his empire to his youngest son Michael. However, his decision unintentionally puts the lives of his loved ones in grave danger."
Nobody (I) (2021),"Action, Crime, Drama","A docile family man slowly reveals his true character after his house gets burgled by two petty thieves, which, coincidentally, leads him into a bloody war with a Russian crime boss."
The Batman (2022),"Action, Crime, Drama","When a sadistic serial killer begins murdering key political figures in Gotham, Batman is forced to investigate the city's hidden corruption and question his family's involvement."
The Dark Knight (2008),"Action, Crime, Drama","When the menace known as the Joker wreaks havoc and chaos on the people of Gotham, Batman must accept one of the greatest psychological and physical tests of his ability to fight injustice."
The Wolf of Wall Street (2013),"Biography, Comedy, Crime","Based on the true story ofJordan Belfort, from his rise to a wealthy stock-broker living the high life to his fall involving crime, corruption and the federal government."
Pulp Fiction (1994),"Crime, Drama","The lives of two mob hitmen, a boxer, a gangster and his wife, and a pair of diner bandits intertwine in four tales of violence and redemption."
Shazam! Fury of the Gods (2023),"Action, Adventure, Comedy","The film continues the story of teenage Billy Batson who, upon reciting the magic word ""SHAZAM!"" is transformed into his adult Super Hero alter ego, Shazam."
Little Bone Lodge (2023),"Crime, Horror, Thriller","Set during a very vicious storm, two criminal brothers on the run seek refuge in a desolate farmhouse. Taking the resident family captive, they find the house holds dark secrets of its own."
John Wick (2014),"Action, Crime, Thriller",An ex-hitman comes out of retirement to track down the gangsters who killed his dog and stole his car.
Heat (1995),"Action, Crime, Drama",A group of high-end professional thieves start to feel the heat from the LAPD when they unknowingly leave a clue at their latest heist.
Surongo (2023),"Crime, Mystery, Romance",A simple electrician from a village turns to crime and goes to extreme lengths to satisfy his love.
Prisoners (2013),"Crime, Drama, Mystery","When Keller Dover's daughter and her friend go missing, he takes matters into his own hands as the police pursue multiple leads and the pressure mounts."
The Grand Budapest Hotel (2014),"Adventure, Comedy, Crime","A writer encounters the owner of an aging high-class hotel, who tells him of his early years serving as a lobby boy in the hotel's glorious years under an exceptional concierge."
We're the Millers (2013),"Comedy, Crime",A veteran pot dealer creates a fake family as part of his plan to move a huge shipment of weed into the U.S. from Mexico.
No Country for Old Men (2007),"Crime, Drama, Thriller",Violence and mayhem ensue after a hunter stumbles upon a drug deal gone wrong and more than two million dollars in cash near the Rio Grande.
The Departed (2006),"Crime, Drama, Thriller",An undercover cop and a mole in the police attempt to identify each other while infiltrating an Irish gang in South Boston.
Misanthrope (2023),"Action, Crime, Drama",Baltimore. New Year's Eve. A talented but troubled police officer (Shailene Woodley) is recruited by the FBI's chief investigator (Ben Mendelsohn) to help profile and track down a disturbed individual terrorizing the city.
Glass Onion (2022),"Comedy, Crime, Drama","Tech billionaire Miles Bron invites his friends for a getaway on his private Greek island. When someone turns up dead, Detective Benoit Blanc is put on the case."
Se7en (1995),"Crime, Drama, Mystery","Two detectives, a rookie and a veteran, hunt a serial killer who uses the seven deadly sins as his motives."
GoodFellas (1990),"Biography, Crime, Drama","The story ofHenry Hilland his life in the mafia, covering his relationship with his wife Karen and his mob partners Jimmy Conway and Tommy DeVito."
American Psycho (2000),"Crime, Drama, Horror","A wealthy New York City investment banking executive, Patrick Bateman, hides his alternate psychopathic ego from his co-workers and friends as he delves deeper into his violent, hedonistic fantasies."
Retribution (I) (2023),"Action, Crime, Drama",A bank executive receives a bomb threat while driving his children to school that his car will explode if they stop and get out.
The Gentlemen (2019),"Action, Comedy, Crime","An American expat tries to sell off his highly profitable marijuana empire in London, triggering plots, schemes, bribery and blackmail in an attempt to steal his domain out from under him."
The Unbearable Weight of Massive Talent (2022),"Action, Comedy, Crime",Moviestar Nick Cage is channeling his iconic characters as he's caught between a superfan and a CIA agent.
The Silence of the Lambs (1991),"Crime, Drama, Thriller","A young F.B.I. cadet must receive the help of an incarcerated and manipulative cannibal killer to help catch another serial killer, a madman who skins his victims."
The Green Mile (1999),"Crime, Drama, Fantasy","A tale set on death row in a Southern jail, where gentle giant John possesses the mysterious power to heal people's ailments. When the lead guard, Paul, recognizes John's gift, he tries to help stave off the condemned man's execution."
The Nice Guys (2016),"Action, Comedy, Crime","In 1970s Los Angeles, a mismatched pair of private eyes investigate a missing girl and the mysterious death of a porn star."
Joker (I) (2019),"Crime, Drama, Thriller","The rise of Arthur Fleck, from aspiring stand-up comedian and pariah to Gotham's clown prince and leader of the revolution."
Primal Fear (1996),"Crime, Drama, Mystery","An altar boy is accused of murdering a priest, and the truth is buried several layers deep."
Taxi Driver (1976),"Crime, Drama","A mentally unstable veteran works as a nighttime taxi driver in New York City, where the perceived decadence and sleaze fuels his urge for violent action."
Girl in the Basement (2021),"Crime, Thriller","Sarah is a teen girl who is looking forward to her 18th birthday to move away from her controlling father Don. But before she could even blow out the candles, Don imprisons her in the basement of their home."
Léon (1994),"Action, Crime, Drama","12-year-old Mathilda is reluctantly taken in by Léon, a professional assassin, after her family is murdered. An unusual relationship forms as she becomes his protégée and learns the assassin's trade."
Knock Knock (I) (2015),"Crime, Drama, Thriller","A devoted father helps two stranded young women who knock on his door, but his kind gesture turns into a dangerous seduction and a deadly game of cat and mouse."
The Drop (2014),"Crime, Drama, Thriller","Bob Saginowski finds himself at the center of a robbery gone awry and entwined in an investigation that digs deeply into the neighborhood's past where friends, families, and foes all work together to make a living--no matter the cost."
Knives Out (2019),"Comedy, Crime, Drama","A detective investigates the death of the patriarch of an eccentric, combative family."
The Mule (2018),"Crime, Drama, Thriller",A ninety-year-old horticulturist and Korean War veteran turns drug mule for a Mexican cartel.
Batman Begins (2005),"Action, Crime, Drama","After witnessing his parents' death, Bruce learns the art of fighting to confront injustice. When he returns to Gotham as Batman, he must stop a secret society that intends to destroy the city."
12 Angry Men (1957),"Crime, Drama",The jury in a New York City murder trial is frustrated by a single member whose skeptical caution forces them to more carefully consider the evidence before jumping to a hasty verdict.
Weird: The Al Yankovic Story (2022),"Comedy, Crime, Music","Explores every facet of Yankovic's life, from his meteoric rise to fame with early hits like 'Eat It' and 'Like a Surgeon' to his torrid celebrity love affairs and famously depraved lifestyle."
The Godfather Part II (1974),"Crime, Drama","The early life and career of Vito Corleone in 1920s New York City is portrayed, while his son, Michael, expands and tightens his grip on the family crime syndicate."
John Wick: Chapter 3 - Parabellum (2019),"Action, Crime, Thriller","John Wick is on the run after killing a member of the international assassins' guild, and with a $14 million price tag on his head, he is the target of hit men and women everywhere."
Scarface (1983),"Crime, Drama","In 1980 Miami, a determined Cuban immigrant takes over a drug cartel and succumbs to greed."
The Outsiders (1983),"Crime, Drama","The rivalry between two gangs, the poor Greasers and the rich Socs, only heats up when one gang member kills a member of the other."
Georgetown (2019),"Biography, Crime, Drama","Ulrich Mott, an ambitious social climber, marries a wealthy widow in Washington D.C. in order to mix with powerful political players."
Fantastic Mr. Fox (2009),"Animation, Adventure, Comedy",An urbane fox cannot resist returning to his farm raiding ways and then must help his community survive the farmers' retaliation.
Catch Me If You Can (2002),"Biography, Crime, Drama","Barely 21 yet, Frank is a skilled forger who has passed as a doctor, lawyer and pilot. FBI agent Carl becomes obsessed with tracking down the con man, who only revels in the pursuit."
Luther: The Fallen Sun (2023),"Crime, Drama, Mystery",Brilliant but disgraced detective John Luther breaks out of prison to hunt down a sadistic serial killer who is terrorising London.
Joker: Folie à Deux (2024),"Crime, Drama, Musical",Plot unknown. Sequel to the 2019 film 'Joker.'
The Pale Blue Eye (2022),"Crime, Horror, Mystery","A world-weary detective is hired to investigate the murder of a West Point cadet. Stymied by the cadets' code of silence, he enlists one of their own to help unravel the case - a young man the world would come to know as Edgar Allan Poe."
The Irishman (2019),"Biography, Crime, Drama","An illustration of Frank Sheeran's life, from W.W.II veteran to hit-man for the Bufalino crime family and his alleged assassination of his close friend Jimmy Hoffa."
F9 (2021),"Action, Crime, Thriller",Dom and the crew must take on an international terrorist who turns out to be Dom and Mia's estranged brother.
John Wick: Chapter 2 (2017),"Action, Crime, Thriller","After returning to the criminal underworld to repay a debt, John Wick discovers that a large bounty has been put on his life."
Casino (1995),"Crime, Drama","In Las Vegas, two best friends - a mafia enforcer and a casino executive - compete for a gambling empire and a fast-living, fast-loving socialite."
The Usual Suspects (1995),"Crime, Drama, Mystery",The sole survivor of a pier shoot-out tells the story of how a notorious criminal influenced the events that began with five criminals meeting in a seemingly random police lineup.
The Fast and the Furious (2001),"Action, Crime, Thriller",Los Angeles police officer Brian O'Conner must decide where his loyalty really lies when he becomes enamored with the street racing world he has been sent undercover to destroy.
Kick-Ass (2010),"Action, Comedy, Crime","Dave Lizewski is an unnoticed high school student and comic book fan who one day decides to become a superhero, even though he has no powers, training or meaningful reason to do so."
Sicario (2015),"Action, Crime, Drama",An idealistic FBI agent is enlisted by a government task force to aid in the escalating war against drugs at the border area between the U.S. and Mexico.
Clue (1985),"Comedy, Crime, Mystery","Six guests are anonymously invited to a strange mansion for dinner, but after their host is killed, they must cooperate with the staff to identify the murderer as the bodies pile up."
Death on the Nile (2022),"Crime, Drama, Mystery","While on vacation on the Nile, Hercule Poirot must investigate the murder of a young heiress."
Wrath of Man (2021),"Action, Crime, Thriller",A cold and mysterious character working at a cash truck company responsible for moving a lot of money around Los Angeles each week.
The Hateful Eight (2015),"Crime, Drama, Mystery","In the dead of a Wyoming winter, a bounty hunter and his prisoner find shelter in a cabin currently inhabited by a collection of nefarious characters."
Baby Driver (2017),"Action, Crime, Drama","After being coerced into working for a crime boss, a young getaway driver finds himself taking part in a heist doomed to fail."
The Equalizer (2014),"Action, Crime, Thriller",A man who believes he has put his mysterious past behind him cannot stand idly by when he meets a young girl under the control of ultra-violent Russian gangsters.
The Big Lebowski (1998),"Comedy, Crime","Jeff ""The Dude"" Lebowski, mistaken for a millionaire of the same name, seeks restitution for his ruined rug and enlists his bowling buddies to help get it."
Promising Young Woman (2020),"Crime, Drama, Mystery","A young woman, traumatized by a tragic event in her past, seeks out vengeance against those who crossed her path."
Four Lions (2010),"Comedy, Crime, Drama",Four incompetent British terrorists set out to train for and commit an act of terror.
Snatch (2000),"Comedy, Crime","Unscrupulous boxing promoters, violent bookmakers, a Russian gangster, incompetent amateur robbers and supposedly Jewish jewelers fight to track down a priceless stolen diamond."
A Clockwork Orange (1971),"Crime, Sci-Fi","In the future, a sadistic gang leader is imprisoned and volunteers for a conduct-aversion experiment, but it doesn't go as planned."
American Hustle (2013),"Crime, Drama","A con man, Irving Rosenfeld, along with his seductive partner Sydney Prosser, is forced to work for a wild F.B.I. Agent, Richie DiMaso, who pushes them into a world of Jersey powerbrokers and the Mafia."
American History X (1998),"Crime, Drama","Living a life marked by violence, neo-Nazi Derek finally goes to prison after killing two black youths. Upon his release, Derek vows to change; he hopes to prevent his brother, Danny, who idolizes Derek, from following in his footsteps."
Becky (II) (2020),"Action, Crime, Drama",A teenager's weekend at a lake house with her father takes a turn for the worse when a group of convicts wreaks havoc on their lives.
Murder on the Orient Express (2017),"Crime, Drama, Mystery","When a murder occurs on the train on which he's travelling, celebrated detective Hercule Poirot is recruited to solve the case."
Cidade de Deus (2002),"Crime, Drama","In the slums of Rio, two kids' paths diverge as one struggles to become a photographer and the other a kingpin."
Thelma & Louise (1991),"Adventure, Crime, Drama","Two best friends set out on an adventure, but it soon turns around to a terrifying escape from being hunted by the police, as these two girls escape for the crimes they committed."
Reservoir Dogs (1992),"Crime, Thriller","When a simple jewelry heist goes horribly wrong, the surviving criminals begin to suspect that one of them is a police informant."
The Lincoln Lawyer (2011),"Crime, Drama, Mystery",A lawyer defending a wealthy man begins to believe his client is guilty of more than just one crime.
The Getaway (1972),"Action, Crime, Thriller",A recently-released ex-con and his loyal wife go on the run after a heist goes awry.
Kill Bill: Vol. 1 (2003),"Action, Crime, Thriller","After awakening from a four-year coma, a former assassin wreaks vengeance on the team of assassins who betrayed her."
Once Upon a Time in America (1984),"Crime, Drama","A former Prohibition-era Jewish gangster returns to the Lower East Side of Manhattan 35 years later, where he must once again confront the ghosts and regrets of his old life."
Sin City: A Dame to Kill For (2014),"Action, Crime, Thriller",Some of Sin City's most hard-boiled citizens cross paths with a few of its more reviled inhabitants.
Zootopia (2016),"Animation, Adventure, Comedy","In a city of anthropomorphic animals, a rookie bunny cop and a cynical con artist fox must work together to uncover a conspiracy."
Fargo (1996),"Crime, Thriller",Minnesota car salesman Jerry Lundegaard's inept crime falls apart due to his and his henchmen's bungling and the persistent police work of the quite pregnant Marge Gunderson.
From Dusk Till Dawn (1996),"Action, Crime, Horror","Two criminals and their hostages unknowingly seek temporary refuge in a truck stop populated by vampires, with chaotic results."
The Equalizer 3 (2023),"Action, Crime, Thriller","Robert McCall finds himself at home in Southern Italy but he discovers his friends are under the control of local crime bosses. As events turn deadly, McCall knows what he has to do: become his friends' protector by taking on the mafia."
Bloody Daddy (2023),"Action, Crime, Drama","A messed up, tenacious man faces off against cops and crime lords to save the one relationship that matters to him."
A Bronx Tale (1993),"Crime, Drama",A father becomes worried when a local gangster befriends his son in the Bronx in the 1960s.
Maggie Moore(s) (2023),"Comedy, Crime, Thriller","Police Chief Sanders (Jon Hamm) investigates the bizarre murders of two women with the same name and unravels a web of small-town lies. He meets and quickly falls for Rita (Tina Fey), a nosy neighbor who is eager to help solve the mystery."
Irréversible (2002),"Crime, Drama, Mystery",Events over the course of one traumatic night in Paris unfold in reverse-chronological order as the beautiful Alex is brutally raped and beaten by a stranger in an underpass tunnel.
Zodiac (2007),"Crime, Drama, Mystery","Between 1968 and 1983, a San Francisco cartoonist becomes an amateur detective obsessed with tracking down the Zodiac Killer, an unidentified individual who terrorizes Northern California with a killing spree."
Sin City (2005),"Crime, Thriller","An exploration of the dark and miserable Basin City and three of its residents, all of whom are caught up in violent corruption."
Nightcrawler (2014),"Crime, Drama, Thriller","When Louis Bloom, a con man desperate for work, muscles into the world of L.A. crime journalism, he blurs the line between observer and participant to become the star of his own story."
A Simple Favor (2018),"Comedy, Crime, Mystery","Stephanie is a single mother with a parenting vlog who befriends Emily, a secretive upper-class woman who has a child at the same elementary school. When Emily goes missing, Stephanie takes it upon herself to investigate."
Baywatch (2017),"Action, Comedy, Crime","Devoted lifeguard Mitch Buchannon butts heads with a brash new recruit, as they uncover a criminal plot that threatens the future of the bay."
Murder Mystery 2 (2023),"Action, Comedy, Crime","Full-time detectives Nick and Audrey are struggling to get their private eye agency off the ground. They find themselves at the center of international abduction when their friend Maharaja, is kidnapped at his own lavish wedding."
A Time to Kill (1996),"Crime, Drama, Thriller","In Clanton, Mississippi, a fearless young lawyer and his assistant defend a black man accused of murdering two white men who raped his ten-year-old daughter, inciting violent retribution and revenge from the Ku Klux Klan."
A Haunting in Venice (2023),"Crime, Drama, Horror","In post-World War II Venice, Poirot, now retired and living in his own exile, reluctantly attends a seance. But when one of the guests is murdered, it is up to the former detective to once again uncover the killer."
White Chicks (2004),"Comedy, Crime",Two disgraced FBI agents go way undercover in an effort to protect hotel heiresses the Wilson sisters from a kidnapping plot.
True Romance (1993),"Crime, Drama, Romance","In Detroit, a lonely pop culture geek marries a call girl, steals cocaine from her pimp, and tries to sell it in Hollywood. Meanwhile, the owners of the cocaine, the Mob, track them down in an attempt to reclaim it."
The Place Beyond the Pines (2012),"Crime, Drama, Thriller",A motorcycle stunt-rider turns to robbing banks as a way to provide for his lover and their newborn--a decision that sets him on a collision course with an ambitious rookie cop navigating a department ruled by a corrupt detective.
L.A. Confidential (1997),"Crime, Drama, Mystery","As corruption grows in 1950s Los Angeles, three policemen - one strait-laced, one brutal, and one sleazy - investigate a series of murders with their own brand of justice."
Thunderbolts (2024),"Action, Adventure, Crime",A group of supervillains are recruited to go on missions for the government.
Emily the Criminal (2022),"Crime, Drama, Thriller","Down on her luck and saddled with debt, Emily gets involved in a credit card scam that pulls her into the criminal underworld of Los Angeles, ultimately leading to deadly consequences."
See How They Run (2022),"Comedy, Crime, Mystery","In the West End of 1950s London, plans for a movie version of a smash-hit play come to an abrupt halt after a pivotal member of the crew is murdered."
Rush Hour (1998),"Action, Comedy, Crime","A loyal and dedicated Hong Kong Inspector teams up with a reckless and loudmouthed L.A.P.D. detective to rescue the Chinese Consul's kidnapped daughter, while trying to arrest a dangerous crime lord along the way."
The Bad Guys (2022),"Animation, Adventure, Comedy","To avoid prison, a gang of notorious animal criminals pretends to seek being rehabilitated, only for their leader to realize that he genuinely wants to change his ways."
Gangs of New York (2002),"Crime, Drama","In 1862, Amsterdam Vallon returns to the Five Points area of New York City seeking revenge against Bill the Butcher, his father's killer."
The Warriors (1979),"Action, Crime, Thriller",A street gang known as The Warriors must fight their way from the Bronx to their home turf on Coney Island when they are falsely accused of assassinating a respected gang leader.
Fast & Furious (2009),"Action, Crime, Thriller","Brian O'Conner, back working for the FBI in Los Angeles, teams up with Dominic Toretto to bring down a heroin importer by infiltrating his operation."
Sharper (2023),"Crime, Drama, Thriller","Motivations are suspect, and expectations are turned chaos, as a con artist takes on Manhattan billionaires."
Run Hide Fight (2020),"Action, Crime, Drama","17-year-old Zoe Hull uses her wits, survival skills, and compassion to fight for her life, and those of her fellow classmates, against a group of live-streaming school shooters."
Ocean's Eleven (2001),"Crime, Thriller",Danny Ocean and his ten accomplices plan to rob three Las Vegas casinos simultaneously.
The Mask (1994),"Action, Comedy, Crime",Bank clerk Stanley Ipkiss is transformed into a manic superhero when he wears a mysterious mask.
The Girl with the Dragon Tattoo (2011),"Crime, Drama, Mystery",Journalist Mikael Blomkvist is aided in his search for a woman who has been missing for 40 years by young computer hacker Lisbeth Salander.
Point Break (1991),"Action, Crime, Thriller",An F.B.I. Agent goes undercover to catch a gang of surfers who may be bank robbers.
"Three Billboards Outside Ebbing, Missouri (2017)","Comedy, Crime, Drama",A mother personally challenges the local authorities to solve her daughter's murder when they fail to catch the culprit.
RoboCop (1987),"Action, Crime, Sci-Fi","In a dystopic and crime-ridden Detroit, a terminally wounded cop returns to the force as a powerful cyborg haunted by submerged memories."
3:10 to Yuma (2007),"Action, Crime, Drama",A small-time rancher agrees to hold a captured outlaw who's awaiting a train to go to court in Yuma. A battle of wills ensues as the outlaw tries to psych out the rancher.
The Devil All the Time (2020),"Crime, Drama, Thriller",Sinister characters converge around a young man devoted to protecting those he loves in a postwar backwoods town teeming with corruption and brutality.
Legend (I) (2015),"Biography, Crime, Drama",Identical twin gangsters Ronald and Reginald Kray terrorize London during the 1960s.
Traffic (2000),"Crime, Drama, Thriller","A conservative judge is appointed by the President to spearhead America's escalating war against drugs, only to discover that his teenage daughter is a crack addict. Two DEA agents protect an informant. A jailed drug baron's wife attempts to carry on the family business."
The Fugitive (1993),"Action, Crime, Drama","Dr. Richard Kimble, unjustly accused of murdering his wife, must find the real killer while being the target of a nationwide manhunt led by a seasoned U.S. Marshal."
Kingsman: The Golden Circle (2017),"Action, Adventure, Comedy","After the Kingsman's headquarters are destroyed and the world is held hostage, an allied spy organization in the United States is discovered. These two elite secret agencies must band together to defeat a common enemy."
