Manbiki kazoku (2018),"Crime, Drama, Thriller","On the margins of Tokyo, a dysfunctional band of outsiders are united by loyalty, a penchant for petty theft and playful grifting. When the young son is arrested, secrets are exposed that upend their tenuous, below-the-radar existence."
Silverado (1985),"Action, Crime, Drama",A misfit bunch of friends comes together to right the injustices which exist in a small town.
All the Money in the World (2017),"Biography, Crime, Drama",The story of the kidnapping of 16-year-oldJohn Paul Getty IIIand the desperate attempt by his devoted mother to convince his billionaire grandfatherJean Paul Gettyto pay the ransom.
The Number 23 (2007),"Crime, Mystery, Thriller","Walter Sparrow becomes obsessed with a novel that he believes was written about him, as more and more similarities between himself and his literary alter ego seem to arise."
Mr. Brooks (2007),"Crime, Drama, Mystery",A well-respected businessman is sometimes controlled by his murder and mayhem-loving alter ego.
The Bone Collector (1999),"Crime, Drama, Mystery",A quadriplegic ex-homicide detective and his partner try to track down a serial killer who is terrorizing New York City.
The Pink Panther (1963),"Comedy, Crime, Romance","The bumbling Inspector Clouseau travels to Rome to catch a notorious jewel thief known as ""The Phantom"" before he conducts his most daring heist yet: a princess' priceless diamond with one slight imperfection, known as ""The Pink Panther""."
Menace II Society (1993),"Crime, Drama, Thriller",A young street hustler attempts to escape the rigors and temptations of the ghetto in a quest for a better life.
Pete Kelly's Blues (1955),"Crime, Drama, Music","In 1927, a Kansas City, Missouri cornet player and his band perform nightly at a seedy speakeasy until a racketeer tries to extort them in exchange for protection."
Swordfish (2001),"Action, Crime, Thriller","A covert counter-terrorist unit called Black Cell led by Gabriel Shear wants the money to help finance their war against international terrorism, but it's all locked away. Gabriel brings in convicted hacker Stanley Jobson to help him."
Drishyam 2 (2022),"Crime, Drama, Mystery",A gripping tale of an investigation and a family which is threatened by it. Will Vijay Salgaonkar be able to protect his family this time?
Elle (I) (2016),"Crime, Drama, Thriller",A successful businesswoman gets caught up in a game of cat and mouse as she tracks down the unknown man who raped her.
Appaloosa (2008),"Action, Crime, Drama",Two friends hired to police a small town that is suffering under the rule of a rancher find their job complicated by the arrival of a young widow.
Tango & Cash (1989),"Action, Comedy, Crime","Framed by their ruthless arch-nemesis, a mismatched LAPD crime-fighting duo has to put its differences aside to even the score with the evil kingpin who put them behind bars once and for all."
Project Power (2020),"Action, Crime, Sci-Fi","When a pill that gives its users unpredictable superpowers for five minutes hits the streets of New Orleans, a teenage dealer and a local cop must team with an ex-soldier to take down the group responsible for its creation."
Murder on the Orient Express (1974),"Crime, Drama, Mystery","In December 1935, when his transcontinental luxury train is stranded by deep snow, detective Hercule Poirot is called on to solve a murder that occurred in his car the night before, with a multitude of suspects."
Brazen (2022),"Crime, Drama, Mystery","When her sister is killed and her double life as a webcam performer is revealed, Grace ignores the warnings of a cool-headed detective and gets involved in the case."
The Iceman (2012),"Biography, Crime, Drama","The story of Richard Kuklinski, the notorious contract killer and family man. When he was finally arrested in 1986, neither his wife nor his daughters had any clue about his real profession."
Stand Up Guys (2012),"Comedy, Crime, Thriller",A pair of aging stickup men try to get the old gang back together for one last hurrah before one of the guys takes his last assignment - to kill his comrade.
The Man from Rome (2022),"Crime, Mystery, Thriller","Vatican intelligence officer Father Quart (Richard Armitage) investigates a message sent to the pope about a crumbling Spanish church that ""kills to defend itself."" A deep conspiracy unfolds that challenges the Father's loyalty and faith."
Breakdown (I) (1997),"Crime, Drama, Mystery",A man searches for his missing wife after his car breaks down in the middle of the desert.
Skin (V) (2018),"Biography, Crime, Drama","A destitute young man, raised by racist skinheads and notorious among white supremacists, turns his back on hatred and violence to transform his life, with the help of a black activist and the woman he loves."
The Clovehitch Killer (2018),"Crime, Drama, Mystery",A picture-perfect family is shattered when the work of a serial killer hits too close to home.
Jolt (2021),"Action, Comedy, Crime",A bouncer with a slightly murderous anger-management problem that she controls with the help of an electrode-lined vest she uses to shock herself back to normalcy whenever she gets homicidal.
Walking Tall (1973),"Action, Biography, Crime","Based on the life of Tennessee sheriff Buford Pusser, who almost single-handily cleaned up his small town of crime and corruption, but at a personal cost of his family life and nearly his own life."
Inside Man (2023),"Crime, Drama, Thriller","Based on true events, a disgraced police detective seeking redemption by going undercover to expose a violent crime syndicate. But as he sinks deeper into the mob, the price for absolution may be higher than he can afford."
Once Upon a Time in Mexico (2003),"Action, Crime, Thriller","Hitman ""El Mariachi"" becomes involved in international espionage involving a psychotic CIA agent and a corrupt Mexican general."
Don't Be a Menace to South Central While Drinking Your Juice in the Hood (1996),"Comedy, Crime","A parody of several U.S. films about being in the 'Hood', for instanceBoyz n the Hood(1991),South Central(1992),Menace II Society(1993),Higher Learning(1995) andJuice(1992)."
Streets of Fire (1984),"Action, Crime, Drama","A mercenary is hired to rescue his ex-girlfriend, a singer who has been kidnapped by a motorcycle gang."
The Counselor (2013),"Crime, Drama, Thriller",A lawyer finds himself in over his head when he gets involved in drug trafficking.
Jawbreaker (1999),"Comedy, Crime, Thriller",Three of the most popular girls at Reagan High accidentally kill the prom queen with a jawbreaker when a kidnapping goes horribly wrong.
Spun (2002),"Comedy, Crime, Drama","A drug dealer introduces one of his customers, a 'speed freak', to the man who runs the meth lab. A crazy three-day adventure ensues."
The Tax Collector (2020),"Action, Crime, Drama","A ""tax collector"" working for a local crime lord finds his family's safety compromised when the rival of his boss shows up in L.A. and upends the business."
Neugdaesanyang (2022),"Action, Crime, Horror","Follows dangerous criminals on a cargo ship who are transported from the Philippines to South Korea, as they unleash a sinister force after an escape attempt leads to a riot."
"Roman J. Israel, Esq. (2017)","Crime, Drama, Thriller","Roman J. Israel, Esq., a driven, idealistic defense attorney, finds himself in a tumultuous series of events that lead to a crisis and the necessity for extreme action."
The Life of David Gale (2003),"Crime, Drama, Mystery",A man against capital punishment is accused of murdering a fellow activist and is sent to death row.
Lethal Weapon 4 (1998),"Action, Crime, Thriller","With personal crises and age weighing in on them, LAPD officers Riggs and Murtaugh must contend with deadly Chinese triads that are trying to free their former leaders out of prison and onto American soil."
The Net (I) (1995),"Action, Crime, Drama","A computer programmer stumbles upon a conspiracy, putting her life and the lives of those around her in great danger."
Kathal: A Jackfruit Mystery (2023),"Comedy, Crime, Drama",A local politician whose prized jackfruits go missing and a young police officer who is adamant to solve this bizarre case to prove herself.
The Informer (2019),"Action, Crime, Drama",An ex-convict working undercover intentionally gets himself incarcerated again in order to infiltrate the mob at a maximum security prison.
The Player (1992),"Comedy, Crime, Drama","A Hollywood studio executive is being sent death threats by a writer whose script he rejected, but which one?"
Miami Vice (2006),"Action, Adventure, Crime","Based on the 1980s TV action/drama, this update focuses on vice detectives Crockett and Tubbs as their respective personal and professional lives become dangerously intertwined."
Despicable Me 2 (2013),"Animation, Adventure, Comedy","When Gru, the world's most super-bad turned super-dad has been recruited by a team of officials to stop lethal muscle and a host of Gru's own, He has to fight back with new gadgetry, cars, and more minion madness."
Escape from Alcatraz (1979),"Action, Biography, Crime","Alcatraz is the most secure prison of its time. It is believed that no one can ever escape from it, until three daring men make a possibly successful attempt at escaping from one of the most infamous prisons in the world."
Chor Nikal Ke Bhaga (2023),"Crime, Drama, Thriller","A flight attendant and her business partner on a mission to steal diamonds and free themselves from the clutches of a loan shark.At 40,000 feet in the air, the heist goes horribly wrong and turns into a hostage situation."
The Bling Ring (2013),"Biography, Crime, Drama","Inspired by actual events, a group of fame-obsessed teenagers use the internet to track celebrities' whereabouts in order to rob their homes."
Kiss the Girls (1997),"Crime, Drama, Mystery",Police hunting for a serial kidnapper are helped when a victim manages to escape for the first time.
Chakravyuham: The Trap (2023),"Crime, Mystery, Thriller","Siri, a business partner and a housewife, was found with her throat slit. The investigation officer tries to solve the case. Can he figure out who killed her and why?"
The Infiltrator (2016),"Biography, Crime, Drama",A U.S. Customs official uncovers a money laundering scheme involving Colombian drug lord Pablo Escobar.
Kærlighed for voksne (2022),"Crime, Drama, Thriller",Follows a couple who appear to be living the perfect life after their son is declared healthy following a long-term illness.
Get Shorty (1995),"Comedy, Crime, Thriller","A mobster travels to Hollywood to collect a debt, and discovers that the movie business is much the same as his current job."
The Dinner (I) (2017),"Crime, Drama, Thriller",Two sets of wealthy parents meet for dinner to decide what to do about a crime their sons have committed.
All Good Things (2010),"Crime, Drama, Mystery","David Marks, a real estate scion, is suspected of killing his wife Katie, who disappeared in 1982."
Let's Be Cops (2014),"Action, Comedy, Crime","Two struggling pals dress as police officers for a costume party and become neighborhood sensations. But when these newly-minted ""heroes"" get tangled in a real life web of mobsters and dirty detectives, they must put their fake badges on the line."
Keanu (2016),"Action, Comedy, Crime","When the adorable kitten of an L.A. crime kingpin unexpectedly enters the life of two cousins, they will have to go through tough gangs, pitiless hit-men, and ruthless drug dealers who all claim him, to get him back. How hard can it be?"
True Story (I) (2015),"Biography, Crime, Drama",When disgraced New York Times reporter Michael Finkel meets accused killer Christian Longo - who has taken on Finkel's identity - his investigation morphs into a game of cat-and-mouse.
The Pledge (I) (2001),"Crime, Drama, Mystery",A retiring police detective pledges to catch the killer of a young child.
Lilja 4-ever (2002),"Crime, Drama","Sixteen-year-old Lilja and her only friend, the young boy Volodja, live in Russia, fantasizing about a better life. One day, Lilja falls in love with Andrej, who is going to Sweden, and invites Lilja to come along and start a new life."
Klute (1971),"Crime, Mystery, Thriller",A small-town detective searching for a missing man has only one lead: a connection with a New York prostitute.
A Most Violent Year (2014),"Action, Crime, Drama","In New York City 1981, an ambitious immigrant fights to protect his business and family during the most dangerous year in the city's history."
King of New York (1990),"Crime, Thriller",A drug kingpin is released from prison and seeks to take total control of the criminal underworld in order to give back to the community.
Blackout (VI) (2022),"Action, Crime, Thriller","A man wakes in a hospital with no memory, and quickly finds himself on the run in a locked down hospital with the Cartel on his tail. He scrambles to find his true identity in the most vicious way."
Despicable Me 3 (2017),"Animation, Adventure, Comedy","Gru meets his long-lost, charming, cheerful, and more successful twin brother Dru, who wants to team up with him for one last criminal heist."
The Poison Rose (2019),"Crime, Mystery, Thriller","Inspired by classic film noir, Carson Phillips, an ex-football star turned PI, has a soft spot for a lady in distress."
Serbuan maut 2: Berandal (2014),"Action, Crime, Thriller","Only a short time after the first raid, Rama goes undercover with the thugs of Jakarta and plans to bring down the syndicate and uncover the corruption within his police force."
Midnight Run (1988),"Action, Comedy, Crime","A bounty hunter pursues a former Mafia accountant who is also being chased by a rival bounty hunter, the F.B.I., and his old mob boss after jumping bail."
Paul Blart: Mall Cop (2009),"Action, Comedy, Crime","When a shopping mall is taken over by a gang of organized crooks, it's up to a mild-mannered security guard to save the day."
The Last House on the Left (1972),"Crime, Horror, Thriller","Two teenage girls heading to a rock concert for one's birthday try to score marijuana in the city, where they are kidnapped and brutalized by a gang of psychopathic convicts."
Peter Rabbit 2: The Runaway (2021),"Adventure, Comedy, Crime","Thomas and Bea are now married and living with Peter and his rabbit family. Bored of life in the garden, Peter goes to the big city, where he meets shady characters and ends up creating chaos for the whole family."
Kill the Irishman (2011),"Biography, Crime, Drama","The true story of Danny Greene, a tough Irish thug working for mobsters in Cleveland during the 1970's."
Fletch Lives (1989),"Comedy, Crime, Mystery","After receiving an inheritance in Louisiana, Los Angeles reporter Irvin Fletcher heads to the Belle Isle plantation where he gets himself into hilarious trouble."
The Bikeriders (),"Crime, Drama",It follows the rise of a Midwestern motorcycle club through the lives of its members.
Snakes on a Plane (2006),"Action, Adventure, Crime","An FBI agent takes on a plane full of deadly venomous snakes, deliberately released to kill a witness being flown from Honolulu to Los Angeles to testify against a mob boss."
The Laundromat (I) (2019),"Comedy, Crime, Drama","A widow investigates an insurance fraud, chasing leads to a pair of Panama City law partners exploiting the world's financial system."
Notes on a Scandal (2006),"Crime, Drama, Romance","A veteran high school teacher befriends a younger art teacher, who is having an affair with one of her fifteen-year-old students. However, her intentions with this new ""friend"" also go well beyond a platonic friendship."
The Whole Truth (2016),"Crime, Drama, Mystery",A defense attorney works to get his teenage client acquitted of murdering his wealthy father.
Les misérables (2019),"Crime, Drama, Thriller","A cop from the provinces moves to Paris to join the Anti-Crime Brigade of Montfermeil, discovering an underworld where the tensions between the different groups mark the rhythm."
The Accused (1988),"Crime, Drama","After a young woman suffers a brutal gang rape in a bar one night, a prosecutor assists in bringing the perpetrators to justice, including the ones who encouraged and cheered on the attack."
White Boy Rick (2018),"Crime, Drama","The story of teenager Richard Wershe Jr., who became an undercover informant for the FBI during the 1980s and was ultimately arrested for drug-trafficking and sentenced to life in prison."
Entrapment (1999),"Action, Crime, Romance",An insurance agent is sent by her employer to track down and help capture an art thief.
U.S. Marshals (1998),"Action, Crime, Thriller","U.S. Marshal Samuel Gerard and his team of Marshals are assigned to track down Sheridan, who has been accused of a double-murder."
Double Indemnity (1944),"Crime, Drama, Film-Noir","A Los Angeles insurance representative lets an alluring housewife seduce him into a scheme of insurance fraud and murder that arouses the suspicion of his colleague, an insurance investigator."
Home Alone 3 (1997),"Action, Comedy, Crime","Alex Pruitt, an 8-year-old boy living in Chicago, must fend off international spies who seek a top-secret computer chip in his toy car."
Rope (1948),"Crime, Drama, Mystery",Two men attempt to prove they committed the perfect crime by hosting a dinner party after strangling their former classmate to death.
Gold (I) (2016),"Crime, Drama","Kenny Wells, a prospector desperate for a lucky break, teams up with a similarly eager geologist and sets off on a journey to find gold in the uncharted jungle of Indonesia."
Kill List (2011),"Action, Crime, Horror","Nearly a year after a botched job, a hitman takes a new assignment with the promise of a big payoff for three killings. What starts off as an easy task soon unravels, sending the killer into the heart of darkness."
The Hammer (2023),"Biography, Crime, Drama","Kim Wheeler, an attorney who is appointed as a judge for Nevada's 5th district after the former judge's death. As the investigation into the death intensifies, Kim's sister, who runs the local brothel, becomes the prime suspect."
The Courier (2019),"Action, Crime, Drama",A courier in London discovers that one of the packages she's transporting is a bomb.
High Crimes (2002),"Crime, Drama, Mystery",A successful criminal defense lawyer's husband is arrested for murdering 9 villagers in El Salvador in 1988 as US Marine under a different name. She defends him in military court and investigates. Framed?
Life (I) (1999),"Comedy, Crime, Drama","In 1932, two strangers are wrongfully convicted and develop a strong friendship in prison that lasts them through the 20th century."
To Live and Die in L.A. (1985),"Action, Crime, Drama",A fearless Secret Service agent will stop at nothing to bring down the counterfeiter who killed his partner.
Enough (I) (2002),"Crime, Drama, Thriller","After running away fails, a terrified woman empowers herself in order to battle her abusive husband."
Judge Dredd (1995),"Action, Crime, Sci-Fi","In a dystopian future, Joseph Dredd, the most famous Judge (a police officer with instant field judiciary powers), is convicted for a crime he did not commit and must face his murderous counterpart."
Miller's Crossing (1990),"Crime, Drama, Thriller","Tom Reagan, an advisor to a Prohibition-era crime boss, tries to keep the peace between warring mobs but gets caught in divided loyalties."
RoboCop 3 (1993),"Action, Crime, Sci-Fi","Robocop saves the day once more. This time the half man/half robot takes on ruthless developers who want to evict some people on ""their"" land."
Torque (2004),"Action, Comedy, Crime",A biker returns from Thailand to set things straight with his girlfriend. One gang leader wants him for delivery of 2 motorbikes filled with crystal meth and another gang leader wants him for murdering his brother.
The Taking of Pelham 123 (2009),"Action, Crime, Thriller","Armed men hijack a New York City subway train, holding the passengers hostage in return for a ransom, and turning an ordinary day's work for dispatcher Walter Garber into a face-off with the mastermind behind the crime."
Hot Pursuit (2015),"Action, Comedy, Crime",An uptight and by-the-book cop (Reese Witherspoon) tries to protect the outgoing widow (Sofia Vergara) of a drug boss as they race through Texas pursued by crooked cops and murderous gunmen.
Awake (2007),"Crime, Drama, Mystery",A wealthy young man undergoing heart transplant surgery discovers that the surgical team intend to murder him.
A Perfect World (1993),"Crime, Drama, Thriller","A kidnapped boy strikes up a friendship with his captor, an escaped convict on the run from the law, while the search for him continues."
Dope (2015),"Adventure, Comedy, Crime","Life changes for Malcolm, a geek who's surviving life in a tough neighborhood, after a chance invitation to an underground party leads him and his friends into a Los Angeles adventure."
Absolute Power (1997),"Action, Crime, Drama",Career thief Luther Whitney (Clint Eastwood) witnesses a horrific crime involving U.S. President Alan Richmond (Gene Hackman).
Freebie and the Bean (1974),"Action, Comedy, Crime","San Francisco police detectives Freebie and Bean are determined to bust local crime boss Red Meyers at any cost, even if this means destroying the whole city in the process."
Freedom Writers (2007),"Biography, Crime, Drama","A young teacher inspires her class of at-risk students to learn tolerance, apply themselves and pursue education beyond high school."
Unleashed (2005),"Action, Crime, Thriller",A man enslaved by the mob since childhood and raised into behaving like a human attack dog escapes his captors and attempts to start a new life.
Animal Kingdom (2010),"Crime, Drama, Thriller",A seventeen-year-old navigates his survival amongst an explosive criminal family and the detective who thinks he can save him.
Landmine Goes Click (2015),"Action, Crime, Drama","Trapped standing on an armed landmine, an American tourist is forced to watch helplessly while his girlfriend is terrorized and brutally assaulted."
The Enforcer (1976),"Action, Crime, Thriller","Inspector ""Dirty"" Harry Callahan reluctantly teams up with rookie Inspector Kate Moore to foil a terrorist organization made up of disgruntled Vietnam veterans."
Internal Affairs (1990),"Crime, Drama, Thriller",An Internal Affairs agent becomes obsessed with bringing down a cop who has managed to maintain a spotless reputation despite being involved in a web of corruption.
Filth (I) (2013),"Action, Comedy, Crime","A corrupt, junkie cop with bipolar disorder attempts to manipulate his way through a promotion in order to win back his wife and daughter while also fighting his own inner demons."
The Doom Generation (1995),"Comedy, Crime, Drama","Jordan White and Amy Blue, two troubled teens, pick up an adolescent drifter, Xavier Red. Together, the threesome embark on a sex-and-violence-filled journey through an America of psychos and quickie marts."
Lethal Weapon 3 (1992),"Action, Crime, Thriller",Martin Riggs and Roger Murtaugh pursue a former LAPD officer who uses his knowledge of police procedure and policies to steal and sell confiscated guns and ammunition to local street gangs.
Eating Raoul (1982),"Comedy, Crime","A relatively boring Los Angeles couple discovers a bizarre, if not murderous, way to get funding for opening a restaurant."
Go (1999),"Comedy, Crime",The aftermath of a drug deal as told from three different points of view.
Blank Check (1994),"Comedy, Crime, Family","After a bike accident, a young boy inadvertently gains possession of a check for $1 million and proceeds to spend it, unaware that the gangsters it belongs to are in pursuit."
The General's Daughter (1999),"Crime, Drama, Mystery","When the daughter of a well-known and well-respected base commander is murdered, an undercover detective is summoned to look into the matter and finds a slew of cover-ups at West Point."
Hard Target (1993),"Action, Crime, Thriller","A woman hires a drifter as her guide through New Orleans in search of her missing father. In the process, they discover a deadly game of cat and mouse behind his disappearance."
Kalifornia (1993),"Crime, Drama, Thriller","A journalist duo go on a tour of serial killer murder sites with two companions, unaware that one of them is a serial killer himself."
The Captive (I) (2014),"Crime, Drama, Mystery","Eight years after the disappearance of Cassandra, some disturbing incidents seem to indicate that she's still alive. Police, parents and Cassandra herself, will try to unravel the mystery of her disappearance."
The Next Three Days (2010),"Action, Crime, Drama",A married couple's life is turned upside down when the wife is accused of a murder.
The Voices (2014),"Comedy, Crime, Horror","A likable guy pursues his office crush with help from his evil talking pets, but things turn sinister when she stands him up for a date."
I don't feel at home in this world anymore. (2017),"Comedy, Crime, Drama","When a depressed woman is burgled, she finds a new sense of purpose by tracking down the thieves alongside her obnoxious neighbour. But they soon find themselves dangerously out of their depth against a pack of degenerate criminals."
The Maltese Falcon (1941),"Crime, Film-Noir, Mystery","San Francisco private detective Sam Spade takes on a case that involves him with three eccentric criminals, a gorgeous liar and their quest for a priceless statuette, with the stakes rising after his partner is murdered."
Capote (2005),"Biography, Crime, Drama","In 1959,Truman Capotelearns of the murder of a Kansas family and decides to write a book about the case. While researching for his novel In Cold Blood, Capote forms a relationship with one of the killers, Perry Smith, who is on death row."
Chinjeolhan geumjassi (2005),"Crime, Drama, Thriller","After being wrongfully imprisoned for thirteen years and having her child taken away from her, a woman seeks revenge through increasingly brutal means."
