Sound of Freedom (2023),"Action, Biography, Drama",The incredible true story of a former government agent turned vigilante who embarks on a dangerous mission to rescue hundreds of children from sex traffickers.
Oppenheimer (2023),"Biography, Drama, History",The story of American scientist J. Robert Oppenheimer and his role in the development of the atomic bomb.
Asteroid City (2023),"Comedy, Drama, Romance","Following a writer on his world famous fictional play about a grieving father who travels with his tech-obsessed family to small rural Asteroid City to compete in a junior stargazing event, only to have his world view disrupted forever."
Nimona (2023),"Animation, Action, Adventure","When a knight in a futuristic medieval world is framed for a crime he didn't commit, the only one who can help him prove his innocence is Nimona -- a mischievous teen who happens to be a shapeshifting creature he's sworn to destroy."
Killers of the Flower Moon (2023),"Crime, Drama, History","Members of the Osage tribe in the United States are murdered under mysterious circumstances in the 1920s, sparking a major F.B.I. investigation involving J. Edgar Hoover."
Lust Stories 2 (2023),"Drama, Romance","Four eminent Indian directors explore sex, desire and love through short films in this sequel to 2018's Emmy-nominated ""Lust Stories""."
Elemental (2023),"Animation, Adventure, Comedy","Follows Ember and Wade, in a city where fire-, water-, land- and air-residents live together."
Dune: Part Two (2023),"Action, Adventure, Drama",Paul Atreides unites with Chani and the Fremen while seeking revenge against the conspirators who destroyed his family.
Titanic (1997),"Drama, Romance","A seventeen-year-old aristocrat falls in love with a kind but poor artist aboard the luxurious, ill-fated R.M.S. Titanic."
Culpa mía (2023),Drama,"Noah has to leave her town, boyfriend and friends behind and move into the mansion of her mother's new rich husband. There she meets Nick, her new stepbrother. They fall madly in love in secret."
Bone Tomahawk (2015),"Drama, Horror, Western","In the dying days of the old west, an elderly sheriff and his posse set out to rescue their town's doctor from cannibalistic cave dwellers."
Dune: Part One (2021),"Action, Adventure, Drama",A noble family becomes embroiled in a war for control over the galaxy's most valuable asset while its heir becomes troubled by visions of a dark future.
Past Lives (2023),"Drama, Romance","Nora and Hae Sung, two deeply connected childhood friends, are wrested apart after Nora's family emigrates from South Korea. Twenty years later, they are reunited for one fateful week as they confront notions of love and destiny."
Knights of the Zodiac (2023),"Action, Adventure, Drama","When a goddess of war reincarnates in the body of a young girl, street orphan Seiya discovers that he is destined to protect her and save the world. But only if he can face his own past and become a Knight of the Zodiac."
Rebel Moon (2023),"Action, Adventure, Drama",A young woman seeks out warriors from other planets to fight the tyrannical armies terrorizing her peaceful colony.
Top Gun: Maverick (2022),"Action, Drama","After thirty years, Maverick is still pushing the envelope as a top naval aviator, but must confront ghosts of his past when he leads TOP GUN's elite graduates on a mission that demands the ultimate sacrifice from those chosen to fly it."
Interstellar (2014),"Adventure, Drama, Sci-Fi","When Earth becomes uninhabitable in the future, a farmer and ex-NASA pilot, Joseph Cooper, is tasked to pilot a spacecraft, along with a team of researchers, to find a new planet for humans."
Beau Is Afraid (2023),"Comedy, Drama, Horror","Following the sudden death of his mother, a mild-mannered but anxiety-ridden man confronts his darkest fears as he embarks on an epic, Kafkaesque odyssey back home."
Haunted Mansion (2023),"Comedy, Drama, Family","A single mom named Gabbie hires a tour guide, a psychic, a priest and a historian to help exorcise her newly bought mansion after discovering it is inhabited by ghosts."
A Man Called Otto (2022),"Comedy, Drama","Otto is a grump who's given up on life following the loss of his wife and wants to end it all. When a young family moves in nearby, he meets his match in quick-witted Marisol, leading to a friendship that will turn his world around."
Don't Worry Darling (I) (2022),"Drama, Thriller","While her husband leaves home everyday to work in a top secret facility, a young 1950s housewife begins to question her life when she notices strange behavior from the other wives in the neighborhood."
Annihilation (I) (2018),"Adventure, Drama, Horror","A biologist signs up for a dangerous, secret expedition into a mysterious zone where the laws of nature don't apply."
Babylon (I) (2022),"Comedy, Drama, History","A tale of outsized ambition and outrageous excess, it traces the rise and fall of multiple characters during an era of unbridled decadence and depravity in early Hollywood."
Air (I) (2023),"Drama, Sport","Follows the history of sports marketing executive Sonny Vaccaro, and how he led Nike in its pursuit of the greatest athlete in the history of basketball, Michael Jordan."
The Shawshank Redemption (1994),Drama,"Over the course of several years, two convicts form a friendship, seeking consolation and, eventually, redemption through basic compassion."
The Godfather (1972),"Crime, Drama","Don Vito Corleone, head of a mafia family, decides to hand over his empire to his youngest son Michael. However, his decision unintentionally puts the lives of his loved ones in grave danger."
Nobody (I) (2021),"Action, Crime, Drama","A docile family man slowly reveals his true character after his house gets burgled by two petty thieves, which, coincidentally, leads him into a bloody war with a Russian crime boss."
Bob Marley: One Love (2024),"Biography, Drama, Music",A look at the life of legendary reggae musician Bob Marley.
The Iron Claw (),"Biography, Drama, Sport","Follows the story of the Von Erichs, a dynasty of wrestlers who made a great impact on the sport from the 1960s to the present day."
The Batman (2022),"Action, Crime, Drama","When a sadistic serial killer begins murdering key political figures in Gotham, Batman is forced to investigate the city's hidden corruption and question his family's involvement."
The Dark Knight (2008),"Action, Crime, Drama","When the menace known as the Joker wreaks havoc and chaos on the people of Gotham, Batman must accept one of the greatest psychological and physical tests of his ability to fight injustice."
The Wolf of Wall Street (2013),"Biography, Comedy, Crime","Based on the true story ofJordan Belfort, from his rise to a wealthy stock-broker living the high life to his fall involving crime, corruption and the federal government."
The Whale (2022),Drama,"A reclusive, morbidly obese English teacher attempts to reconnect with his estranged teenage daughter."
Midsommar (2019),"Drama, Horror, Mystery",A couple travels to Northern Europe to visit a rural hometown's fabled Swedish mid-summer festival. What begins as an idyllic retreat quickly devolves into an increasingly violent and bizarre competition at the hands of a pagan cult.
Love (II) (2015),"Drama, Romance","Murphy is an American living in Paris who enters a highly sexually and emotionally charged relationship with Electra. Unaware of the effect it will have on their relationship, they invite their pretty neighbor into their bed."
Priyotoma (2023),"Action, Drama, Romance","A tragic love story that left an indelible mark on Sumon's life, shattering his world and leaving him forever transformed."
The Patriot (2000),"Action, Drama, History",Peaceful farmer Benjamin Martin is driven to lead the Colonial Militia during the American Revolution when a sadistic British officer murders his son.
A Star Is Born (2018),"Drama, Music, Romance",A musician helps a young singer find fame as age and alcoholism send his own career into a downward spiral.
BlackBerry (2023),"Biography, Comedy, Drama",The story of the meteoric rise and catastrophic demise of the world's first smartphone.
"Are You There God? It's Me, Margaret. (2023)","Comedy, Drama, Family","When her family moves from the city to the suburbs, 11-year-old Margaret navigates new friends, feelings, and the beginning of adolescence."
Pulp Fiction (1994),"Crime, Drama","The lives of two mob hitmen, a boxer, a gangster and his wife, and a pair of diner bandits intertwine in four tales of violence and redemption."
Once Upon a Time in... Hollywood (2019),"Comedy, Drama",A faded television actor and his stunt double strive to achieve fame and success in the final years of Hollywood's Golden Age in 1969 Los Angeles.
Top Gun (1986),"Action, Drama","As students at the United States Navy's elite fighter weapons school compete to be best in the class, one daring young pilot learns a few things from a civilian instructor that are not taught in the classroom."
Blade Runner 2049 (2017),"Action, Drama, Mystery","Young Blade Runner K's discovery of a long-buried secret leads him to track down former Blade Runner Rick Deckard, who's been missing for thirty years."
10x10 (2018),"Drama, Thriller","A man abducts a flower shop owner and holds her captive in a small, soundproof room in an effort to extract a dark secret from her past."
Pearl (2022),"Drama, Horror, Thriller","In 1918, a young woman on the brink of madness pursues stardom in a desperate attempt to escape the drudgery, isolation and lovelessness of life on her parents' farm."
Triangle of Sadness (2022),"Comedy, Drama",A fashion model celebrity couple join an eventful cruise for the super-rich.
Satyaprem Ki Katha (2023),"Comedy, Drama, Musical","A middle-class boy in Ahmedabad, Satyaprem falling in one-sided love with Katha, who is coping with her breakup with Tapan. Through the journey, they discover each other's life and complement in accomplishing what was left halfway."
1776 (1972),"Drama, Family, History",A musical retelling of the American Revolution's political struggle in the Continental Congress to declare independence.
Pride & Prejudice (2005),"Drama, Romance","Sparks fly when spirited Elizabeth Bennet meets single, rich, and proud Mr. Darcy. But Mr. Darcy reluctantly finds himself falling in love with a woman beneath his class. Can each overcome their own pride and prejudice?"
Tetris (2023),"Biography, Drama, History","The story of how one of the world's most popular video games found its way to players around the globe. Businessman Henk Rogers and Tetris inventor Alexey Pajitnov join forces in the USSR, risking it all to bring Tetris to the masses."
The Fabelmans (2022),Drama,"Growing up in post-World War II era Arizona, young Sammy Fabelman aspires to become a filmmaker as he reaches adolescence, but soon discovers a shattering family secret and explores how the power of films can help him see the truth."
One Flew Over the Cuckoo's Nest (1975),Drama,"In the Fall of 1963, a Korean War veteran and criminal pleads insanity and is admitted to a mental institution, where he rallies up the scared patients against the tyrannical nurse."
Creed III (2023),"Drama, Sport","Adonis has been thriving in both his career and family life, but when a childhood friend and former boxing prodigy resurfaces, the face-off is more than just a fight."
Old (2021),"Drama, Horror, Mystery","A vacationing family discovers that the secluded beach where they're relaxing for a few hours is somehow causing them to age rapidly, reducing their entire lives into a single day."
Little Miss Sunshine (2006),"Comedy, Drama",A family determined to get their young daughter into the finals of a beauty pageant take a cross-country trip in their VW bus.
Roald Dahl's Matilda the Musical (2022),"Comedy, Drama, Family","An adaptation of the Tony and Olivier award-winning musical. Matilda tells the story of an extraordinary girl who, armed with a sharp mind and a vivid imagination, dares to take a stand to change her story with miraculous results."
Inglourious Basterds (2009),"Adventure, Drama, War","In Nazi-occupied France during World War II, a plan to assassinate Nazi leaders by a group of Jewish U.S. soldiers coincides with a theatre owner's vengeful plans for the same."
65 (2023),"Action, Adventure, Drama",An astronaut crash lands on a mysterious planet only to discover he's not alone.
Sanctuary (I) (2022),"Drama, Thriller","Follows a dominatrix and Hal, her wealthy client, and the disaster that ensues when Hal tries to end their relationship."
Saving Private Ryan (1998),"Drama, War","Following the Normandy Landings, a group of U.S. soldiers go behind enemy lines to retrieve a paratrooper whose brothers have been killed in action."
Forrest Gump (1994),"Drama, Romance","The history of the United States from the 1950s to the '70s unfolds from the perspective of an Alabama man with an IQ of 75, who yearns to be reunited with his childhood sweetheart."
Afwaah (2023),"Drama, Thriller",An advertising professional and a political heiress whose lives are upended by a viral social media rumour.
Missing (2023),"Drama, Mystery, Thriller","After her mother goes missing, a young woman tries to find her from home, using tools available to her online."
Heat (1995),"Action, Crime, Drama",A group of high-end professional thieves start to feel the heat from the LAPD when they unknowingly leave a clue at their latest heist.
White House Down (2013),"Action, Drama, Thriller","While on a tour of the White House with his young daughter, a Capitol policeman springs into action to save his child and protect the president from a heavily armed group of paramilitary invaders."
The Lord of the Rings: The Fellowship of the Ring (2001),"Action, Adventure, Drama",A meek Hobbit from the Shire and eight companions set out on a journey to destroy the powerful One Ring and save Middle-earth from the Dark Lord Sauron.
Prisoners (2013),"Crime, Drama, Mystery","When Keller Dover's daughter and her friend go missing, he takes matters into his own hands as the police pursue multiple leads and the pressure mounts."
Lust Stories (2018),"Drama, Romance","Four short films by four of India's biggest directors exploring love, sex and relationships in modern India."
Flamin' Hot (2023),"Biography, Drama, History","This is the inspiring ""true"" story of Richard Montañez who, as a Frito Lay janitor, disrupted the food industry by channeling his Mexican heritage to turn Flamin' Hot Cheetos from a snack into an iconic global pop culture phenomenon."
Aftersun (II) (2022),Drama,Sophie reflects on the shared joy and private melancholy of a holiday she took with her father twenty years earlier. Memories real and imagined fill the gaps between as she tries to reconcile the father she knew with the man she didn't...
No Country for Old Men (2007),"Crime, Drama, Thriller",Violence and mayhem ensue after a hunter stumbles upon a drug deal gone wrong and more than two million dollars in cash near the Rio Grande.
The Sandlot (1993),"Comedy, Drama, Family","In the summer of 1962, a new kid in town is taken under the wing of a young baseball prodigy and his rowdy team, resulting in many adventures."
The Perfect Find (2023),"Comedy, Drama, Romance","After a high-profile firing, Jenna's fashion career comeback hits a snag when she falls for a charming, much younger coworker - who happens to be her boss's son. As sparks fly, Jenna must decide if she'll risk it all on a secret romance."
Immortals (2011),"Action, Drama, Fantasy","Theseus is a mortal man chosen by Zeus to lead the fight against the ruthless King Hyperion, who is on a rampage across Greece to obtain a weapon that can destroy humanity."
Avengers: Endgame (2019),"Action, Adventure, Drama","After the devastating events ofAvengers: Infinity War(2018), the universe is in ruins. With the help of remaining allies, the Avengers assemble once more in order to reverse Thanos' actions and restore balance to the universe."
The Departed (2006),"Crime, Drama, Thriller",An undercover cop and a mole in the police attempt to identify each other while infiltrating an Irish gang in South Boston.
Misanthrope (2023),"Action, Crime, Drama",Baltimore. New Year's Eve. A talented but troubled police officer (Shailene Woodley) is recruited by the FBI's chief investigator (Ben Mendelsohn) to help profile and track down a disturbed individual terrorizing the city.
Prisoner's Daughter (2022),Drama,"A father fights for the love of his daughter and grandson, after serving twelve years in prison."
Gladiator (2000),"Action, Adventure, Drama",A former Roman General sets out to exact vengeance against the corrupt emperor who murdered his family and sent him into slavery.
Django Unchained (2012),"Drama, Western","With the help of a German bounty-hunter, a freed slave sets out to rescue his wife from a brutal plantation owner in Mississippi."
Glass Onion (2022),"Comedy, Crime, Drama","Tech billionaire Miles Bron invites his friends for a getaway on his private Greek island. When someone turns up dead, Detective Benoit Blanc is put on the case."
The Woman King (2022),"Action, Drama, History","A historical epic inspired by true events that took place in The Kingdom of Dahomey, one of the most powerful states of Africa in the 18th and 19th centuries."
The Shining (1980),"Drama, Horror","A family heads to an isolated hotel for the winter where a sinister presence influences the father into violence, while his psychic son sees horrific forebodings from both past and future."
The Prestige (2006),"Drama, Mystery, Sci-Fi","After a tragic accident, two stage magicians in 1890s London engage in a battle to create the ultimate illusion while sacrificing everything they have to outwit each other."
Se7en (1995),"Crime, Drama, Mystery","Two detectives, a rookie and a veteran, hunt a serial killer who uses the seven deadly sins as his motives."
Gone Girl (2014),"Drama, Mystery, Thriller","With his wife's disappearance having become the focus of an intense media circus, a man sees the spotlight turned on him when it's suspected that he may not be innocent."
There Will Be Blood (2007),Drama,"A story of family, religion, hatred, oil and madness, focusing on a turn-of-the-century prospector in the early days of the business."
GoodFellas (1990),"Biography, Crime, Drama","The story ofHenry Hilland his life in the mafia, covering his relationship with his wife Karen and his mob partners Jimmy Conway and Tommy DeVito."
Where the Crawdads Sing (2022),"Drama, Mystery, Romance",A woman who raised herself in the marshes of the Deep South becomes a suspect in the murder of a man with whom she was once involved.
Tombstone (1993),"Biography, Drama, History","A successful lawman's plans to retire anonymously in Tombstone, Arizona are disrupted by the kind of outlaws he was famous for eliminating."
American Psycho (2000),"Crime, Drama, Horror","A wealthy New York City investment banking executive, Patrick Bateman, hides his alternate psychopathic ego from his co-workers and friends as he delves deeper into his violent, hedonistic fantasies."
Fight Club (1999),Drama,An insomniac office worker and a devil-may-care soap maker form an underground fight club that evolves into much more.
Fifty Shades of Grey (2015),"Drama, Romance, Thriller","Literature student Anastasia Steele's life changes forever when she meets handsome, yet tormented, billionaire Christian Grey."
The Banshees of Inisherin (2022),"Comedy, Drama","Two lifelong friends find themselves at an impasse when one abruptly ends their relationship, with alarming consequences for both of them."
Hereditary (2018),"Drama, Horror, Mystery",A grieving family is haunted by tragic and disturbing occurrences.
Schindler's List (1993),"Biography, Drama, History","In German-occupied Poland during World War II, industrialistOskar Schindlergradually becomes concerned for his Jewish workforce after witnessing their persecution by the Nazis."
Retribution (I) (2023),"Action, Crime, Drama",A bank executive receives a bomb threat while driving his children to school that his car will explode if they stop and get out.
You Hurt My Feelings (2023),"Comedy, Drama",A novelist's longstanding marriage is suddenly upended when she overhears her husband giving his honest reaction to her latest book.
The Passion of the Christ (2004),Drama,"Depicts the final twelve hours in the life of Jesus of Nazareth, on the day of his crucifixion in Jerusalem."
Gisaengchung (2019),"Drama, Thriller",Greed and class discrimination threaten the newly formed symbiotic relationship between the wealthy Park family and the destitute Kim clan.
The Huntsman: Winter's War (2016),"Action, Adventure, Drama","Eric and fellow warrior Sara, raised as members of ice Queen Freya's army, try to conceal their forbidden love as they fight to survive the wicked intentions of both Freya and her sister Ravenna."
The French Dispatch (2021),"Comedy, Drama, Romance","A love letter to journalists set in an outpost of an American newspaper in a fictional twentieth century French city that brings to life a collection of stories published in ""The French Dispatch Magazine""."
Dunkirk (2017),"Action, Drama, History","Allied soldiers from Belgium, the British Commonwealth and Empire, and France are surrounded by the German Army and evacuated during a fierce battle in World War II."
Long ma jing shen (2023),"Action, Comedy, Drama",A washed-up stuntman and his stunt horse become an overnight social media sensation when their real-life fight with debt collectors goes viral.
Inheritance (I) (2020),"Drama, Mystery, Thriller","The patriarch of a wealthy and powerful family suddenly passes away, leaving his daughter with a shocking secret inheritance that threatens to unravel and destroy the family."
Oldeuboi (2003),"Action, Drama, Mystery","After being kidnapped and imprisoned for fifteen years, Oh Dae-Su is released, only to find that he must find his captor in five days."
The Silence of the Lambs (1991),"Crime, Drama, Thriller","A young F.B.I. cadet must receive the help of an incarcerated and manipulative cannibal killer to help catch another serial killer, a madman who skins his victims."
American Graffiti (1973),"Comedy, Drama",A group of teenagers in California's central valley spend one final night after their 1962 high school graduation cruising the strip with their buddies before they pursue their varying goals.
American Beauty (1999),Drama,A sexually frustrated suburban father has a mid-life crisis after becoming infatuated with his daughter's best friend.
Twilight (I) (2008),"Drama, Fantasy, Romance","When Bella Swan moves to a small town in the Pacific Northwest, she falls in love with Edward Cullen, a mysterious classmate who reveals himself to be a 108-year-old vampire."
The Green Mile (1999),"Crime, Drama, Fantasy","A tale set on death row in a Southern jail, where gentle giant John possesses the mysterious power to heal people's ailments. When the lead guard, Paul, recognizes John's gift, he tries to help stave off the condemned man's execution."
Reality (2023),Drama,A former American intelligence specialist was given the longest sentence for the unauthorized release of government information to the media about Russian interference in the 2016 United States elections via an email operation.
Mulan (2020),"Action, Adventure, Drama",A young Chinese maiden disguises herself as a male warrior in order to save her father.
American Sniper (2014),"Action, Biography, Drama","Navy S.E.A.L. sniper Chris Kyle's pinpoint accuracy saves countless lives on the battlefield and turns him into a legend. Back home with his family after four tours of duty, however, Chris finds that it is the war he can't leave behind."
Challengers (2023),"Drama, Romance, Sport","Follows three players who knew each other when they were teenagers as they compete in a tennis tournament to be the world-famous grand slam winner, and reignite old rivalries on and off the court."
Joker (I) (2019),"Crime, Drama, Thriller","The rise of Arthur Fleck, from aspiring stand-up comedian and pariah to Gotham's clown prince and leader of the revolution."
Blade Runner (1982),"Action, Drama, Sci-Fi",A blade runner must pursue and terminate four replicants who stole a ship in space and have returned to Earth to find their creator.
Requiem for a Dream (2000),Drama,The drug-induced utopias of four Coney Island people are shattered when their addictions run deep.
The Breakfast Club (1985),"Comedy, Drama",Five high school students meet in Saturday detention and discover how they have a great deal more in common than they thought.
Whiplash (2014),"Drama, Music",A promising young drummer enrolls at a cut-throat music conservatory where his dreams of greatness are mentored by an instructor who will stop at nothing to realize a student's potential.
Primal Fear (1996),"Crime, Drama, Mystery","An altar boy is accused of murdering a priest, and the truth is buried several layers deep."
Crater (2023),"Adventure, Drama, Family","After the death of his father, a boy growing up on a lunar mining colony takes a trip to explore a legendary crater, along with his four best friends, prior to permanently leaving the Moon and relocated to another planet."
365 dni (2020),"Drama, Romance","Massimo is a member of the Sicilian Mafia family and Laura is a sales director. She does not expect that on a trip to Sicily trying to save her relationship, Massimo will kidnap her and give her 365 days to fall in love with him."
After (I) (2019),"Drama, Romance",A young woman falls for a guy with a dark secret and the two embark on a rocky relationship. Based on the novel byAnna Todd.
Taxi Driver (1976),"Crime, Drama","A mentally unstable veteran works as a nighttime taxi driver in New York City, where the perceived decadence and sleaze fuels his urge for violent action."
