In Bruges (2008),"Comedy, Crime, Drama","Guilt-stricken after a job gone wrong, hitman Ray and his partner await orders from their ruthless boss in Bruges, Belgium, the last place in the world Ray wants to be."
Notting Hill (1999),"Comedy, Drama, Romance",The life of a simple bookshop owner changes when he meets the most famous film star in the world.
West Side Story (2021),"Crime, Drama, Musical","An adaptation of the 1957 musical, West Side Story explores forbidden love and the rivalry between the Jets and the Sharks, two teenage street gangs of different ethnic backgrounds."
Jackie Brown (1997),"Crime, Drama, Thriller","A flight attendant with a criminal past gets nabbed by the ATF for smuggling. Under pressure to become an informant against the drug dealer she works for, she must find a way to secure her future without getting killed."
Mystic River (2003),"Crime, Drama, Mystery",The lives of three men who were childhood friends are shattered when one of them has a family tragedy.
Revolutionary Road (2008),"Drama, Romance",A young couple living in a Connecticut suburb during the mid-1950s struggle to come to terms with their personal problems while trying to raise their two children.
The Lives of Others (2006),"Drama, Mystery, Thriller","In 1984 East Berlin, an agent of the secret police, conducting surveillance on a writer and his lover, finds himself becoming increasingly absorbed by their lives."
The Perfect Storm (2000),"Action, Adventure, Drama",An unusually intense storm pattern catches some commercial fishermen unaware and puts them in mortal danger.
Bottle Rocket (1996),"Comedy, Crime, Drama",Three friends plan to pull off a simple robbery and go on the run.
Swimming Pool (2003),"Crime, Drama, Mystery","A British mystery author visits her publisher's home in the South of France, where her interaction with his unusual daughter sets off some touchy dynamics."
The Killer (II) (2023),"Action, Adventure, Crime","After a fateful near-miss an assassin battles his employers, and himself, on an international manhunt he insists isn't personal."
Closer (I) (2004),"Drama, Romance",The relationships of two couples become complicated and deceitful when the man from one couple meets the woman of the other.
American Made (2017),"Action, Comedy, Crime","The story of Barry Seal, an American pilot who became a drug-runner for the CIA in the 1980s in a clandestine operation that would be exposed as the Iran-Contra Affair."
Collateral (2004),"Action, Crime, Drama",A cab driver finds himself the hostage of an engaging contract killer as he makes his rounds from hit to hit during one night in Los Angeles.
The Man in the Iron Mask (I) (1998),"Action, Adventure, Drama",The cruel King Louis XIV of France has a secret twin brother whom he keeps imprisoned. Can the twin be substituted for the real king?
The Reader (2008),"Drama, Romance","Post-WWII Germany: Nearly a decade after his affair with an older woman came to a mysterious end, law student Michael Berg re-encounters his former lover as she defends herself in a war-crime trial."
The Guilty (2021),"Crime, Drama, Thriller",A demoted police officer assigned to a call dispatch desk is conflicted when he receives an emergency phone call from a kidnapped woman.
Inside Man (2006),"Crime, Drama, Mystery","A police detective, a bank robber, and a high-power broker enter high-stakes negotiations after the criminal's brilliant heist spirals into a hostage situation."
Linoleum (2022),"Comedy, Drama, Sci-Fi","When the host of a failing children's science show tries to fulfill his childhood dream of becoming an astronaut by building a rocket ship in his garage, a series of bizarre events occur that cause him to question his own reality."
The Karate Kid (2010),"Action, Drama, Family","Work causes a single mother to move to China with her young son; in his new home, the boy embraces kung fu, taught to him by a master."
Searching (III) (2018),"Drama, Mystery, Thriller","After his teenage daughter goes missing, a desperate father tries to find clues on her laptop."
2018 (2023),"Action, Drama, Thriller",A disaster film set during the 2018 Kerala Floods where people from all walks of life faced catastrophic consequences and put in collective efforts to survive the calamity.
Seven Brides for Seven Brothers (1954),"Comedy, Drama, Musical","In 1850 Oregon, when a backwoodsman brings a wife home to his farm, his six brothers decide that they want to get married too."
Lo imposible (2012),"Adventure, Drama, History",The story of a tourist family in Thailand caught in the destruction and chaotic aftermath of the 2004 Indian Ocean tsunami.
Nightmare Alley (2021),"Crime, Drama, Thriller",A grifter working his way up from low-ranking carnival worker to lauded psychic medium matches wits with a psychologist bent on exposing him.
Master and Commander: The Far Side of the World (2003),"Action, Adventure, Drama","During the Napoleonic Wars, a brash British captain pushes his ship and crew to their limits in pursuit of a formidable French war vessel around South America."
Magic Mike (2012),"Comedy, Drama","A male stripper teaches a younger performer how to party, pick up women, and make easy money."
The Green Knight (2021),"Adventure, Drama, Fantasy",A fantasy retelling of the medieval story of Sir Gawain and the Green Knight.
Easy Rider (1969),"Adventure, Drama","Two bikers head from L.A. to New Orleans through the open country and desert lands, and along the way they meet a man who bridges a counter-culture gap of which they had been unaware."
Big Fish (2003),"Adventure, Drama, Fantasy",A frustrated son tries to determine the fact from fiction in his dying father's life.
Boxing Helena (1993),"Drama, Mystery, Romance","A surgeon becomes obsessed with the seductive woman he once was in an affair with. Refusing to accept that she has moved on, he amputates her limbs and holds her captive in his mansion."
Monster (2003),"Biography, Crime, Drama","Based on the life ofAileen Wuornos, a Daytona Beach prostitute who became a serial killer."
The Unseen (2023),"Drama, Horror, Thriller",A law student finds himself in a twisted web of murder and deceit brought on by a dark force from his past.
The Old Way (2023),"Action, Drama, Western","An old gunslinger and his daughter must face the consequences of his past, when the son of a man he murdered years ago arrives to take his revenge."
The NeverEnding Story (1984),"Adventure, Drama, Family",A troubled boy dives into a wondrous fantasy world through the pages of a mysterious book.
Megan Is Missing (2011),"Drama, Horror, Thriller",Two teenage girls encounter an Internet child predator.
Blue Valentine (2010),"Drama, Romance","The relationship of a contemporary married couple, charting their evolution over a span of years by cross-cutting between time periods."
Enola Holmes 2 (2022),"Action, Adventure, Crime","Now a detective-for-hire, Enola Holmes takes on her first official case to find a missing girl as the sparks of a dangerous conspiracy ignite a mystery that requires the help of friends - and Sherlock himself - to unravel."
Unbreakable (2000),"Drama, Mystery, Sci-Fi",A man learns something extraordinary about himself after a devastating accident.
The Crow (1994),"Action, Crime, Drama",A man brutally murdered comes back to life as an undead avenger of his and his fiancée's murder.
Orphan: First Kill (2022),"Crime, Drama, Horror","After orchestrating a brilliant escape from an Estonian psychiatric facility, Esther travels to America by impersonating the missing daughter of a wealthy family."
Friday (1995),"Comedy, Drama","It's Friday, and Craig and Smokey must come up with $200 they owe a local bully or there won't be a Saturday."
Hard Candy (2005),"Drama, Thriller","Hayley's a smart, charming teenage girl. Jeff's a handsome, smooth fashion photographer. An Internet chat, a coffee shop meet-up, an impromptu fashion shoot back at Jeff's place. Jeff thinks it's his lucky night. He's in for a surprise."
Synchronic (2019),"Drama, Horror, Mystery","Two New Orleans paramedics' lives are ripped apart after they encounter a series of horrific deaths linked to a designer drug with bizarre, otherworldly effects."
The Talented Mr. Ripley (1999),"Crime, Drama, Thriller","In late 1950s New York, a young underachiever named Tom Ripley is sent to Italy to retrieve Dickie Greenleaf, a rich and spoiled millionaire playboy. But when the errand fails, Ripley takes extreme measures."
Hannibal (2001),"Crime, Drama, Thriller","Living in exile, Dr. Hannibal Lecter tries to reconnect with now disgraced F.B.I. Agent Clarice Starling, and finds himself a target for revenge from a powerful victim."
Red Rocket (2021),"Comedy, Drama","Mikey Saber is a washed-up porn star who returns to his small Texas hometown, not that anyone really wants him back."
Wo hu cang long (2000),"Action, Adventure, Drama",A young Chinese warrior steals a sword from a famed swordsman and then escapes into a world of romantic adventure with a mysterious man in the frontier of the nation.
Hotaru no haka (1988),"Animation, Drama, War",A young boy and his little sister struggle to survive in Japan during World War II.
The Village (2004),"Drama, Mystery, Thriller",A series of events tests the beliefs of a small isolated countryside village.
The Secret Life of Walter Mitty (2013),"Adventure, Comedy, Drama","When both he and a colleague are about to lose their job, Walter takes action by embarking on an adventure more extraordinary than anything he ever imagined."
Pain & Gain (2013),"Action, Comedy, Crime",A trio of bodybuilders in Florida get caught up in an extortion ring and a kidnapping scheme that goes terribly wrong.
Jerry Maguire (1996),"Comedy, Drama, Romance","When a sports agent has a moral epiphany and is fired for expressing it, he decides to put his new philosophy to the test as an independent agent with the only athlete who stays with him and his former colleague."
Cloud Atlas (2012),"Drama, Mystery, Sci-Fi","An exploration of how the actions of individual lives impact one another in the past, present and future, as one soul is shaped from a killer into a hero, and an act of kindness ripples across centuries to inspire a revolution."
The Phantom of the Opera (2004),"Drama, Musical, Romance",A young soprano becomes the obsession of a disfigured and murderous musical genius who lives beneath the Paris Opéra House.
Empire of Light (2022),"Drama, Romance","A drama about the power of human connection during turbulent times, set in an English coastal town in the early 1980s."
Moulin Rouge! (2001),"Drama, Musical, Romance",A poor Bohemian poet in 1890s Paris falls for a beautiful courtesan and nightclub star coveted by a jealous duke.
The Beach (I) (2000),"Adventure, Drama, Romance","On vacation in Thailand, Richard sets out for an island rumored to be a solitary beach paradise."
Misery (1990),"Drama, Thriller","After a famous author is rescued from a car crash by a fan of his novels, he comes to realize that the care he is receiving is only the beginning of a nightmare of captivity and abuse."
Curiosa (2019),"Biography, Drama, History","A passionate love story set against a backdrop of sexual freedom, loosely based on the relationship between 19th-century authors Pierre Louÿs and Marie de Régnier."
Devotion (II) (2022),"Action, Drama, War",A pair of U.S. Navy fighter pilots risk their lives during the Korean War and become some of the Navy's most celebrated wingmen.
House of Gucci (2021),"Biography, Crime, Drama","When Patrizia Reggiani, an outsider from humble beginnings, marries into the Gucci family, her unbridled ambition begins to unravel their legacy and triggers a reckless spiral of betrayal, decadence, revenge, and ultimately...murder."
After We Fell (2021),"Drama, Romance","Just as Tessa makes the biggest decision of her life, everything changes. Revelations about her family, and then Hardin's, throw everything they knew before in doubt and makes their hard-won future together more difficult to claim."
Insomnia (2002),"Drama, Mystery, Thriller",Two Los Angeles homicide detectives are dispatched to a northern town where the sun doesn't set to investigate the methodical murder of a local teen.
Possession (1981),"Drama, Horror",A woman starts exhibiting increasingly disturbing behavior after asking her husband for a divorce. Suspicions of infidelity soon give way to something much more sinister.
Man on Fire (2004),"Action, Crime, Drama","In Mexico City, a former CIA operative swears vengeance on those who committed an unspeakable act against the family he was hired to protect."
Serenity (I) (2019),"Drama, Mystery, Thriller",A fishing boat captain juggles facing his mysterious past and finding himself ensnared in a reality where nothing is what it seems.
The Legend of Tarzan (2016),"Action, Adventure, Drama","Tarzan, having acclimated to life in London, is called back to his former home in the jungle to investigate the activities at a mining encampment."
American Gangster (2007),"Biography, Crime, Drama","An outcast New York City cop is charged with bringing down Harlem drug lord Frank Lucas, whose real life inspired this partly biographical film."
It's a Wonderful Life (1946),"Drama, Family, Fantasy",An angel is sent from Heaven to help a desperately frustrated businessman by showing him what life would have been like if he had never existed.
Dog (I) (2022),"Comedy, Drama",Two former Army Rangers are paired against their will on the road trip of a lifetime. Briggs (Channing Tatum) and Lulu (a Belgian Malinois) race down the Pacific Coast to get to a fellow soldier's funeral on time.
8 Mile (2002),"Drama, Music","Follows a young rapper in the Detroit area, struggling with every aspect of his life, wants to make it big but his friends and foes make this odyssey of rap harder than it may seem."
The Color Purple (2023),"Drama, Musical",Musical adaptation of Alice Walker's novel about the life-long struggles of an African American woman living in the south during the early 1900s.
The Glass Castle (2017),"Biography, Drama",A young girl comes of age in a dysfunctional family of nonconformist nomads with a mother who's an eccentric artist and an alcoholic father who would stir the children's imagination with hope as a distraction to their poverty.
This Is Where I Leave You (2014),"Comedy, Drama","After their father passes away, four grown siblings are forced to return to their childhood home and live under the same roof for a week, along with their over-sharing mother and an assortment of spouses, exes, and might-have-beens."
Jarhead (2005),"Biography, Drama, War","A psychological study of Marine's state of mind during the Gulf War. Told through the eyes of a U.S. Marine sniper who struggles to cope with boredom, a sense of isolation, and other issues back home."
Nineteen Eighty-Four (1984),"Drama, Sci-Fi","In a totalitarian future society, a man, whose daily work is re-writing history, tries to rebel by falling in love."
Moonlight (I) (2016),Drama,"A young African-American man grapples with his identity and sexuality while experiencing the everyday struggles of childhood, adolescence, and burgeoning adulthood."
The Virgin Suicides (1999),"Drama, Romance","A group of male friends become obsessed with five mysterious sisters who are sheltered by their strict, religious parents in suburban Detroit in the mid 1970s."
Shame (2011),Drama,A sex addict's carefully cultivated private life falls apart after his sister arrives for an indefinite stay.
Sleepless in Seattle (1993),"Comedy, Drama, Romance",A recently widowed man's son calls a radio talk-show in an attempt to find his father a partner.
Below Her Mouth (2016),"Drama, Romance",An unexpected affair quickly escalates into a heart-stopping reality for two women whose passionate connection changes their lives forever.
The Blind Side (2009),"Biography, Drama, Sport","The story of Michael Oher, a homeless and traumatized boy who became an All-American football player and first-round NFL draft pick with the help of a caring woman and her family."
Coherence (2013),"Drama, Mystery, Sci-Fi",Strange things begin to happen when a group of friends gather for a dinner party on an evening when a comet is passing overhead.
Capharnaüm (2018),Drama,"While serving a five-year sentence for a violent crime, a 12-year-old boy sues his parents for neglect."
The Machinist (2004),"Drama, Thriller",An industrial worker who hasn't slept in a year begins to doubt his own sanity.
The Invisible Man (I) (2020),"Drama, Horror, Mystery","When Cecilia's abusive ex takes his own life and leaves her his fortune, she suspects his death was a hoax. As a series of coincidences turn lethal, Cecilia works to prove that she is being hunted by someone nobody can see."
Raya and the Last Dragon (2021),"Animation, Action, Adventure","In a realm known as Kumandra, a re-imagined Earth inhabited by an ancient civilization, a warrior named Raya is determined to find the last dragon."
Marrowbone (2017),"Adventure, Drama, Horror","A young man and his three younger siblings, who have kept secret the death of their beloved mother in order to remain together, are plagued by a sinister presence in the sprawling manor in which they live."
50 First Dates (2004),"Comedy, Drama, Romance",Henry Roth is a man afraid of commitment until he meets the beautiful Lucy. They hit it off and Henry think he's finally found the girl of his dreams until discovering she has short-term memory loss and forgets him the next day.
Hunger (II) (2023),"Drama, Thriller",A woman running her family's noodle restaurant receives an invitation to join the fine-dining industry under the tutelage of an infamous chef.
Le otto montagne (2022),Drama,"An epic journey of friendship and self-discovery set in the breathtaking Italian Alps, The Eight Mountains follows over four decades the profound, complex relationship between Pietro and Bruno."
Steel Magnolias (1989),"Comedy, Drama, Romance","A young beautician, newly arrived in a small Louisiana town, finds work at the local salon, where a small group of women share a close bond of friendship, and welcome her into the fold."
Don Jon (2013),"Comedy, Drama, Romance","A New Jersey guy dedicated to his family, friends, and church, develops unrealistic expectations from watching porn and works to find happiness and intimacy with his potential true love."
Phantom Thread (2017),"Drama, History, Romance","Set in 1950s London, Reynolds Woodcock is a renowned dressmaker whose fastidious life is disrupted by a young, strong-willed woman, Alma, who becomes his muse and lover."
King Richard (2021),"Biography, Drama, Sport",A look at how tennis superstars Venus and Serena Williams became who they are after the coaching from their father Richard Williams.
Spiderhead (2022),"Action, Crime, Drama","In the near future, convicts are offered the chance to volunteer as medical subjects to shorten their sentence. One such subject for a new drug capable of generating feelings of love begins questioning the reality of his emotions."
Året jag slutade prestera och började onanera (2022),"Comedy, Drama","Goal-oriented Hanna wants another child before it is too late, but unexpectedly her boyfriend breaks up with her, and Hanna's world collapses. Hanna begins to realize that she may be chasing the wrong things in life."
Sex and the City 2 (2010),"Comedy, Drama, Romance","While wrestling with the pressures of life, love, and work in Manhattan, Carrie, Miranda, and Charlotte join Samantha for a trip to Abu Dhabi (United Arab Emirates), where Samantha's ex is filming a new movie."
Let Him Go (2020),"Crime, Drama, Thriller","A retired sheriff and his wife, grieving over the death of their son, set out to find their only grandson."
Hustle (2022),"Comedy, Drama, Sport",A basketball scout discovers a phenomenal street ball player while in Spain and sees the prospect as his opportunity to get back into the NBA.
Fallen (1998),"Action, Crime, Drama","Homicide detective John Hobbes witnesses the execution of serial killer Edgar Reese. Soon after the execution, the killings start again, and they are very similar to Reese's style."
Black Mirror: Bandersnatch (2018),"Drama, Fantasy, Mystery",A young programmer starts to question reality when he adapts a mad writer's fantasy novel into a video game.
The Shallows (2016),"Action, Drama, Horror","A mere 200 yards from shore, surfer Nancy is attacked by a great white shark, with her short journey to safety becoming the ultimate contest of wills."
Rocketman (I) (2019),"Biography, Drama, Music",A musical fantasy about the fantastical human story ofElton John's breakthrough years.
Valkyrie (2008),"Drama, History, Thriller","A dramatization of the July 20, 1944 assassination and political coup plot by desperate renegade German Army officers againstAdolf Hitlerduring World War II."
Glory (1989),"Biography, Drama, History","Robert Gould Shawleads the U.S. Civil War's first all-black volunteer company, fighting prejudices from both his own Union Army, and the Confederates."
The Twilight Saga: Eclipse (2010),"Action, Adventure, Drama","As a string of mysterious killings grips Seattle, Bella, whose high school graduation is fast approaching, is forced to choose between her love for vampire Edward and her friendship with werewolf Jacob."
A Cure for Wellness (2016),"Drama, Fantasy, Horror","An ambitious young executive is sent to retrieve his company's CEO from an idyllic but mysterious ""wellness center"" at a remote location in the Swiss Alps, but soon suspects that the spa's treatments are not what they seem."
The Favourite (2018),"Biography, Comedy, Drama","In early 18th-century England, the status quo at the court is upset when a new servant arrives and endears herself to a frail Queen Anne."
The Founder (2016),"Biography, Drama","The story ofRay Kroc, a salesman who turned two brothers' innovative fast food eatery, McDonald's, into the biggest restaurant business in the world, with a combination of ambition, persistence, and ruthlessness."
Five Easy Pieces (1970),Drama,"A dropout from upper-class America picks up work along the way on oil rigs when his life isn't spent in a squalid succession of bars, motels, and other points of interest."
Winchester '73 (1950),"Action, Drama, Western",A cowboy's obsession with a stolen rifle leads to a bullet-ridden odyssey through the American West.
Under the Tuscan Sun (2003),"Comedy, Drama, Romance",A writer impulsively buys a villa in Tuscany in order to change her life.
Inside (I) (2023),"Drama, Thriller","Nemo, a high-end art thief, is trapped in a New York penthouse after his heist doesn't go as planned. Locked inside with nothing but priceless works of art, he must use all his cunning and ingenuity to survive."
Boyz n the Hood (1991),"Crime, Drama","Follows the lives of three young males living in the Crenshaw ghetto of Los Angeles, dissecting questions of race, relationships, violence, and future prospects."
Can't Buy Me Love (1987),"Comedy, Drama, Romance",An outcast secretly pays the most popular girl in school one thousand dollars to pretend to be his girlfriend for a month.
Pâfekuto burû (1997),"Animation, Crime, Drama","A pop singer gives up her career to become an actress, but she slowly goes insane when she starts being stalked by an obsessed fan and what seems to be a ghost of her past."
Disturbia (2007),"Crime, Drama, Mystery",A teen living under house arrest becomes convinced his neighbor is a serial killer.
Training Day (2001),"Action, Crime, Drama",A rookie cop spends his first day as a Los Angeles narcotics officer with a rogue detective who isn't what he appears to be.
Eastern Promises (2007),"Crime, Drama, Thriller",A teenager who dies during childbirth leaves clues in her journal that could tie her child to a rape involving a violent Russian mob family.
Zara Hatke Zara Bachke (2023),"Comedy, Drama, Family","Kapil and Somya are a happily married couple from Indore who live in a joint family and decide to get a divorce one fine day. Things don't go as planned as their family gets to know of it, and thus begins a comedy of errors."
Magnificent Obsession (1954),"Drama, Romance","A rich playboy whose recklessness inadvertently causes the death of a prominent doctor tries to make amends to his widow, and falls for her in the process."
Anastasia (1997),"Animation, Adventure, Drama","The last surviving child of the Russian Royal Family joins two con men to reunite with her grandmother, the Dowager Empress, while the undead Rasputin seeks her death."
A Beautiful Day in the Neighborhood (2019),"Biography, Drama",Based on the true story of a real-life friendship betweenFred Rogersand journalist Lloyd Vogel.
Blood Diamond (2006),"Adventure, Drama, Thriller","A fisherman, a smuggler, and a syndicate of businessmen match wits over the possession of a priceless diamond."
Brightburn (2019),"Drama, Horror, Mystery","What if a child from another world crash-landed on Earth, but instead of becoming a hero to mankind, he proved to be something far more sinister?"
The Harder They Fall (2021),"Action, Drama, Western","When an outlaw discovers his enemy is being released from prison, he reunites his gang to seek revenge."
Ghost (1990),"Drama, Fantasy, Romance","After a young man is murdered, his spirit stays behind to warn his lover of impending danger, with the help of a reluctant psychic."
Lightyear (2022),"Animation, Action, Adventure","While spending years attempting to return home, marooned Space Ranger Buzz Lightyear encounters an army of ruthless robots commanded by Zurg who are attempting to steal his fuel source."
Erin Brockovich (2000),"Biography, Drama",An unemployed single mother becomes a legal assistant and almost single-handedly brings down a California power company accused of polluting a city's water supply.
