A Biltmore Christmas (),"Romance, Fantasy","It follows Lucy as she's hired to write the script for a remake of a holiday movie. She joins a tour of the grounds and when she knocks an hourglass over, she finds herself transported back in time to 1946."
Chip 'n Dale: Rescue Rangers (2022),"Animation, Action, Adventure","Thirty years after their popular television show ended, chipmunks Chip and Dale live very different lives. When a cast member from the original series mysteriously disappears, the pair must reunite to save their friend."
Pompeii (I) (2014),"Action, Adventure, Drama","A slave-turned-gladiator finds himself in a race against time to save his true love, who has been betrothed to a corrupt Roman Senator. As Mount Vesuvius erupts, he must fight to save his beloved as Pompeii crumbles around him."
Pan (2015),"Action, Adventure, Comedy","Twelve-year-old orphan Peter is spirited away to the magical world of Neverland, where he finds both fun and danger, and ultimately discovers his destiny: to become the hero who will be forever known as Peter Pan."
Elf (2003),"Adventure, Comedy, Family","Raised as an oversized elf, Buddy travels from the North Pole to New York City to meet his biological father, Walter Hobbs, who doesn't know he exists and is in desperate need of some Christmas spirit."
Angels in the Outfield (1994),"Comedy, Family, Fantasy","When a boy prays for a chance to have a family if the California Angels win the pennant, angels are assigned to make that possible."
Evan Almighty (2007),"Comedy, Family, Fantasy",God contacts Congressman Evan Baxter and tells him to build an ark in preparation for a great flood.
The Old Guard 2 (2024),"Action, Adventure, Fantasy",Plot Unknown. Sequel toThe Old Guard(2020).
The Emoji Movie (2017),"Animation, Adventure, Comedy","Gene, a multi-expressional emoji, sets out on a journey to become a normal emoji."
The Croods: A New Age (2020),"Animation, Adventure, Comedy","The prehistoric family the Croods are challenged by a rival family the Bettermans, who claim to be better and more evolved."
Tenkû no shiro Rapyuta (1986),"Animation, Adventure, Family",A young boy and a girl with a magic crystal must race against pirates and foreign agents in a search for a legendary floating castle.
The Boss Baby: Family Business (2021),"Animation, Adventure, Comedy","The Templeton brothers have become adults and drifted away from each other, but a new boss baby with a cutting-edge approach is about to bring them together again - and inspire a new family business."
The Endless (I) (2017),"Drama, Fantasy, Horror","As kids, they escaped a UFO death cult. Now, two adult brothers seek answers after an old videotape surfaces and brings them back to where they began."
Creepshow (1982),"Comedy, Fantasy, Horror","Five grisly tales from a kid's comic book about a murdered father rising from his grave, a bizarre meteor, a vengeful husband, a mysterious crate's occupant, and a plague of cockroaches."
A Little Princess (1995),"Drama, Family, Fantasy","Sara is sent to a strict boarding school after her father enlists in WWI. When he is presumed dead, the headmistress, knowing she will not receive any more money, forces the girl to become a servant."
Queen of the Damned (2002),"Drama, Fantasy, Horror","In this loose sequel toInterview with the Vampire: The Vampire Chronicles(1994), the vampire Lestat becomes a rock star whose music wakes up the equally beautiful and monstrous queen of all vampires."
Deliver Us from Evil (I) (2014),"Action, Adventure, Crime","New York police officer Ralph Sarchie investigates a series of crimes. He joins forces with an unconventional priest, schooled in the rites of exorcism, to combat the possessions that are terrorizing their city."
Bright (I) (2017),"Action, Fantasy, Thriller",A detective must work with an Orc to find a powerful wand before evil creatures do.
Swiss Army Man (2016),"Comedy, Drama, Fantasy","A hopeless man stranded on a deserted island befriends a dead body, and together they go on a surreal journey to get home."
Nosferatu (1922),"Fantasy, Horror",Vampire Count Orlok expresses interest in a new residence and real estate agent Hutter's wife.
What Women Want (2000),"Comedy, Fantasy, Romance","A cocky, chauvinistic advertising executive magically acquires the ability to hear what women are thinking."
Garfield (2024),"Animation, Adventure, Comedy","Animated feature film based on the popular comic strip about a sarcastic, lasagna-loving cat."
Pleasantville (1998),"Comedy, Drama, Fantasy","Two 1990s teenage siblings find themselves transported to a 1950s sitcom where their influence begins to profoundly change that colorless, complacent world."
The Croods (2013),"Animation, Action, Adventure","After their cave is destroyed, a caveman family must trek through an unfamiliar fantastical world with the help of an inventive boy."
Death Note (I) (2017),"Crime, Drama, Fantasy","A high school student named Light Turner discovers a mysterious notebook that has the power to kill anyone whose name is written within its pages, and launches a secret crusade to rid the world of criminals."
Highlander (I),"Action, Fantasy, Sci-Fi",An immortal Scottish swordsman faces off with other immortal warriors in order to obtain a coveted ability.
Garfield (2004),"Animation, Adventure, Comedy","Jon Arbuckle buys a second pet, a dog named Odie. However, Odie is then abducted and it is up to Jon's cat, Garfield, to find and rescue the canine."
The House (III) (2022),"Animation, Comedy, Drama","Across different eras, a poor family, an anxious developer and a fed-up landlady become tied to the same mysterious house in this animated dark comedy."
Mortal Kombat: Annihilation (1997),"Action, Adventure, Fantasy",A group of martial-arts warriors has only six days to save the Earth from an extra-dimensional invasion.
The Road to El Dorado (2000),"Animation, Adventure, Comedy","Two swindlers get their hands on a map to the fabled city of gold, El Dorado."
Kung Fu Panda 2 (2011),"Animation, Action, Adventure","Po and his friends fight to stop a peacock villain from conquering China with a deadly new weapon, but first the Dragon Warrior must come to terms with his past."
Ghoulies (1984),"Comedy, Fantasy, Horror","A young man and his girlfriend move into an old mansion home, where he becomes possessed by a desire to control ancient demons."
Dark Shadows (2012),"Comedy, Fantasy, Horror","An imprisoned vampire, Barnabas Collins, is set free and returns to his ancestral home, where his dysfunctional descendants are in need of his protection."
"South Park: Bigger, Longer & Uncut (1999)","Animation, Comedy, Fantasy","When Stan Marsh and his friends go see an R-rated movie, they start cursing and their parents think that Canada is to blame."
Slayers (2022),"Comedy, Fantasy, Horror",A group of superstar influencers are drawn to a reclusive billionaire's mansion only to find themselves trapped in the lair of an evil vampire. The only way out is to be saved by a famous online gamer and an old school vampire hunter.
Hocus Pocus 2 (2022),"Comedy, Family, Fantasy",Two young women accidentally bring back the Sanderson Sisters to modern day Salem and must figure out how to stop the child-hungry witches from wreaking havoc on the world.
Paddington (2014),"Adventure, Comedy, Family","A young Peruvian bear travels to London in search of a home. Finding himself lost and alone at Paddington Station, he meets the kindly Brown family, who offer him a temporary haven."
The Flintstones (1994),"Comedy, Family, Fantasy","In a parallel modern-day Stone Age world, a working-class family, the Flintstones, are set up for an executive job. But they learn that money can't buy happiness."
Jack the Giant Slayer (2013),"Action, Adventure, Fantasy","The ancient war between humans and a race of giants is reignited when Jack, a young farmhand fighting for a kingdom and the love of a princess, opens a gateway between the two worlds."
City of Ember (2008),"Adventure, Drama, Family","For generations, the people of the City of Ember have flourished in an amazing world of glittering lights. But Ember's once powerful generator is failing and the great lamps that illuminate the city are starting to flicker."
Teen Witch (1989),"Comedy, Fantasy, Romance","High school misfit Louise, at a loss for romance, discovers magical abilities, but the teenage witch finds that she cannot conjure herself true love, so what?"
Braindead (1992),"Comedy, Fantasy, Horror","A young man's mother is bitten by a Sumatran rat-monkey. She gets sick and dies, at which time she comes back to life, killing and eating dogs, nurses, friends, and neighbors."
Doctor Dolittle (1998),"Comedy, Family, Fantasy",A doctor discovers that he can communicate with animals.
Paprika (2006),"Animation, Drama, Fantasy","When a machine that allows therapists to enter their patients' dreams is stolen, all hell breaks loose. Only a young female therapist, Paprika, can stop it."
The Borrowers (1997),"Adventure, Comedy, Family",A secret family of four-inch people living inside the walls of a house must save their home from an evil real estate developer.
9 (I) (2009),"Animation, Action, Adventure",A rag doll that awakens in a postapocalyptic future holds the key to humanity's salvation.
The King's Daughter (2022),"Action, Adventure, Family","King Louis XIV's quest for immortality leads him to capture and steal a mermaid's life force, a move that is further complicated by his illegitimate daughter's discovery of the creature."
The SpongeBob SquarePants Movie (2004),"Animation, Adventure, Comedy",SpongeBob SquarePants takes leave from the town of Bikini Bottom in order to track down King Neptune's stolen crown.
Spawn (1997),"Action, Crime, Drama","An elite mercenary is killed, but comes back from Hell as a reluctant soldier of the Devil."
Eragon (2006),"Action, Adventure, Family","In his homeland of Alagaesia, a farm boy happens upon a dragon's egg -- a discovery that leads him on a predestined journey where he realizes he's the one person who can defend his home against an evil king."
The Haunting (1999),"Fantasy, Horror, Mystery",A study in fear escalates into a heart-stopping nightmare for a professor and three subjects trapped in a mysterious mansion.
Monsters vs. Aliens (2009),"Animation, Action, Adventure",A woman transformed into a giant after she is struck by a meteorite on her wedding day becomes part of a team of monsters sent in by the U.S. government to defeat an alien mastermind trying to take over Earth.
Krull (1983),"Action, Adventure, Fantasy",A prince and a fellowship of companions set out to rescue his bride from a fortress of alien invaders who have arrived on their home planet.
Zathura: A Space Adventure (2005),"Action, Adventure, Comedy",Two young brothers are drawn into an intergalactic adventure when their house is hurled through the depths of space by the magical board game they are playing.
Dinosaur (2000),"Animation, Adventure, Drama",An orphaned dinosaur raised by lemurs joins an arduous trek to a sanctuary after a meteorite shower destroys his family home.
Alice Through the Looking Glass (2016),"Adventure, Family, Fantasy","Alice is appointed to save her beloved Mad Hatter from deadly grief by travelling back to the past, but this means fatally harming Time himself, the noble clockwork man with the device needed to save the Hatter's family from the Red Queen."
The Fisher King (1991),"Comedy, Drama, Fantasy","A former radio DJ, suicidally despondent because of a terrible mistake he made, finds redemption in helping a deranged homeless man who was an unwitting victim of that mistake."
Oz the Great and Powerful (2013),"Adventure, Family, Fantasy",A small-time magician is swept away to an enchanted land and is forced into a power struggle between three witches.
Horton Hears a Who! (2008),"Animation, Adventure, Comedy",Horton the Elephant struggles to protect a microscopic community from his neighbors who refuse to believe it exists.
Abraham Lincoln: Vampire Hunter (2012),"Action, Fantasy, Horror","Abraham Lincoln, the 16th President of the United States, discovers vampires are planning to take over the United States. He makes it his mission to eliminate them."
The Sorcerer's Apprentice (2010),"Action, Adventure, Family",A protege of the magician Merlin must train his teacher's successor - an introverted but resourceful physics prodigy - in the art of sorcery to prevent the return of Morgana le Fay.
Lakadbaggha (2023),"Action, Comedy, Crime","An animal loving vigilante Arjun Bakshi, unearths the fact that an underground illegal animal trade cell functions from Kolkata port. On investigating he chances upon a rare species of the Indian Striped Hyena (Lakadbaggha)."
The Time Traveler's Wife (2009),"Comedy, Drama, Fantasy","A Chicago librarian has a gene that causes him to involuntarily time travel, creating complications in his marriage."
Blood Red Sky (2021),"Action, Adventure, Drama",A woman with a mysterious illness is forced into action when a group of terrorists attempt to hijack a transatlantic overnight flight.
Fright Night (1985),"Fantasy, Horror",A teenager believes that the newcomer in his neighborhood is a vampire. He turns to an actor in a television horror show for help to deal with the undead.
Ghostbusters II (1989),"Action, Comedy, Fantasy",The discovery of a massive river of ectoplasm and a resurgence of spectral activity allows the staff of Ghostbusters to revive the business.
Brother Bear (2003),"Animation, Adventure, Comedy","When a young Inuit hunter needlessly kills a bear, he is magically changed into a bear himself as punishment with a talkative cub being his only guide to changing back."
The Spirit (2008),"Action, Crime, Fantasy","Rookie cop Denny Colt returns from the beyond as The Spirit, a hero whose mission is to fight against the bad forces in Central City."
Percy Jackson: Sea of Monsters (2013),"Adventure, Family, Fantasy","In order to restore their dying safe haven, the son of Poseidon and his friends embark on a quest to the Sea of Monsters, to find the mythical Golden Fleece, all the while trying to stop an ancient evil from rising."
Rise of the Guardians (2012),"Animation, Action, Adventure","When the evil spirit Pitch launches an assault on Earth, the Immortal Guardians team up to protect the innocence of children all around the world."
The Lego Movie 2: The Second Part (2019),"Animation, Action, Adventure","It's been five years since everything was awesome and the citizens are facing a huge new threat: Lego Duplo invaders from outer space, wrecking everything faster than they can rebuild."
Red Lights (2012),"Drama, Fantasy, Mystery","Psychologist Margaret Matheson and her assistant study paranormal activity, which leads them to investigate a world-renowned psychic who has resurfaced years after his toughest critic mysteriously passed away."
Underworld: Blood Wars (2016),"Action, Adventure, Fantasy",Vampire death dealer Selene (Kate Beckinsale) fights to end the eternal war between the Lycan clan and the Vampire faction that betrayed her.
Last Christmas (2019),"Comedy, Drama, Fantasy","Kate is a young woman subscribed to bad decisions. Working as an elf in a year-round Christmas store is not good for the wannabe singer. However, she meets Tom there. Her life takes a new turn--that seems too good to be true."
R.I.P.D. (2013),"Action, Adventure, Comedy","A cop killed by his own partner joins RIPD, an afterlife law enforcement department working to apprehend various monsters disguised as humans living on earth, and gets paired up with a smart-mouthed veteran."
The Garbage Pail Kids Movie (1987),"Adventure, Comedy, Family",Dodger must confront the struggles of life as he is visited by the Garbage Pail Kids and intimidated by some older bullies.
Dracula 2000 (2000),"Action, Fantasy, Horror","A group of thieves breaks into a chamber expecting to find paintings, but instead they release the count himself, who travels to New Orleans to find his nemesis' daughter, Mary Van Helsing."
A Ghost Story (2017),"Drama, Fantasy, Romance","In this singular exploration of legacy, love, loss, and the enormity of existence, a recently deceased, white-sheeted ghost returns to his suburban home to try to reconnect with his bereft wife."
The Munsters (2022),"Comedy, Family, Fantasy","Reboot of ""The Munsters,"" that followed a family of monsters who moves from Transylvania to an American suburb."
The Spiderwick Chronicles (2008),"Action, Adventure, Drama","Upon moving into the run-down Spiderwick Estate with their mother, twin brothers Jared and Simon Grace, along with their sister Mallory, find themselves pulled into an alternate world full of faeries and other creatures."
The Beastmaster (1982),"Action, Adventure, Fantasy","A sword-and-sorcery fantasy about a young man's search for revenge. Armed with supernatural powers, the handsome hero and his animal allies wage war against marauding forces."
Inland Empire (2006),"Drama, Fantasy, Mystery","As an actress begins to adopt the persona of her character in a film, her world becomes nightmarish and surreal."
Beowulf (2007),"Animation, Action, Adventure","The warrior Beowulf must fight and defeat the monster Grendel, who is terrorizing Denmark, then Grendel's Mother, who begins killing out of revenge."
Kung Fu Panda 4 (2024),"Animation, Action, Adventure","Follow Po on his wide-eyed adventures in ancient China, whose love of kung fu is matched only by an insatiable appetite."
The Adventures of Baron Munchausen (1988),"Adventure, Comedy, Fantasy",An account of Baron Munchausen's supposed travels and fantastical experiences across late 18th-century Europe with his band of misfits.
Goosebumps (2015),"Adventure, Comedy, Fantasy","A teenager teams up with the daughter of young-adult horror author R.L. Stine after the writer's imaginary demons are set free on the town of Madison, Delaware."
The Final Girls (2015),"Comedy, Fantasy, Horror","A young woman grieving the loss of her mother, a famous scream queen from the 1980s, finds herself pulled into the world of her mom's most famous movie. Reunited, the women must fight off the film's maniacal killer."
Only Lovers Left Alive (2013),"Comedy, Drama, Fantasy","A depressed musician reunites with his lover. Though their romance, which has already endured several centuries, is disrupted by the arrival of her uncontrollable younger sister."
Wish Dragon (2021),"Animation, Adventure, Comedy",Determined teen Din is longing to reconnect with his childhood best friend when he meets a wish-granting dragon who shows him the magic of possibilities.
Hotel Transylvania 2 (2015),"Animation, Adventure, Comedy","Dracula and his friends try to bring out the monster in his half human, half vampire grandson in order to keep Mavis from leaving the hotel."
City of Angels (1998),"Drama, Fantasy, Romance","An angel on Earth, a doctor unable to believe, a patient with a secret, a love story made in Heaven."
Hotel Transylvania 3: Summer Vacation (2018),"Animation, Adventure, Comedy","Count Dracula and company participate in a cruise for sea-loving monsters, unaware that their boat is being commandeered by the monster-hating Van Helsing family."
Alice in Wonderland (1951),"Animation, Adventure, Comedy",Alice stumbles into the world of Wonderland. Will she get home? Not if the Queen of Hearts has her way.
Clifford the Big Red Dog (2021),"Animation, Adventure, Comedy",A young girl's love for a tiny puppy named Clifford makes the dog grow to an enormous size.
Your Highness (2011),"Action, Adventure, Comedy","When Prince Fabious's bride is kidnapped, he goes on a quest to rescue her... accompanied by his lazy useless brother Thadeous."
The Woman in Black (2012),"Drama, Fantasy, Horror",A young solicitor travels to a remote village where he discovers that the vengeful ghost of a scorned woman is terrorizing the locals.
Heavy Metal (1981),"Animation, Adventure, Fantasy","A glowing green orb - which embodies ultimate evil - terrorizes a young girl with an anthology of bizarre and fantastic stories of dark fantasy, eroticism and horror."
The SpongeBob Movie: Sponge Out of Water (2015),"Animation, Adventure, Comedy","When a diabolical pirate above the sea steals the secret Krabby Patty formula, SpongeBob and his nemesis Plankton must team up in order to get it back."
Stranger Than Fiction (2006),"Comedy, Drama, Fantasy","I.R.S. auditor Harold Crick suddenly finds his mundane Chicago life to be the subject of narration only he can hear: narration that begins to affect his entire existence, from his work to his love life to his death."
Mad Heidi (2022),"Action, Adventure, Comedy",Swiss mountain girl Heidi is abducted by brutal government troops and must defend herself and fight a war against a cheese-fueled machinery of hate.
Nanny McPhee and the Big Bang (2010),"Comedy, Family, Fantasy","Nanny McPhee arrives to help a harried young mother who is trying to run the family farm while her husband is away at war, though she uses her magic to teach the woman's children and their two spoiled cousins five new lessons."
Dora and the Lost City of Gold (2019),"Action, Adventure, Comedy",Teenage explorer Dora leads her friends on an adventure to save her parents and solve the mystery behind a lost city of gold.
Shrek Forever After (2010),"Animation, Adventure, Comedy",Rumpelstiltskin tricks a mid-life crisis burdened Shrek into allowing himself to be erased from existence and cast in a dark alternate timeline where Rumpelstiltskin rules supreme.
Inside Out 2 (2024),"Animation, Adventure, Comedy","Follow Riley, in her teenage years encountering new emotions."
The Imaginarium of Doctor Parnassus (2009),"Adventure, Comedy, Fantasy",A traveling theater company gives its audience much more than they were expecting.
Bedtime Stories (2008),"Adventure, Comedy, Family",A hotel handyman's life changes when the lavish bedtime stories he tells his niece and nephew start to magically come true.
Peter Pan (1953),"Animation, Adventure, Family","Wendy and her brothers are whisked away to the magical world of Neverland with the hero of their stories, Peter Pan."
Kozí príbeh (2008),"Animation, Comedy, Fantasy","Story about the friendship between a young villager Jemmy who arrives in medieval Prague, and his Goat. Jemmy falls in love with Katy - a street-wise girl from Prague. Goat is jealous, and starts to hate Katy."
The VelociPastor (2018),"Action, Adventure, Comedy","After losing his parents, a priest travels to China, where he inherits a mysterious ability that allows him to turn into a dinosaur. At first horrified by this new power, a hooker convinces him to use it to fight crime. And ninjas."
Chicken Little (2005),"Animation, Adventure, Comedy","After ruining his reputation with the town, a courageous chicken must come to the rescue of his fellow citizens when aliens start an invasion."
The Witches (1990),"Adventure, Comedy, Family","A young boy stumbles onto a witch convention and must stop them, even after he has been turned into a mouse."
Corpse Bride (2005),"Animation, Drama, Family","When a shy groom practices his wedding vows in the inadvertent presence of a deceased young woman, she rises from the grave assuming he has married her."
The Golden Compass (2007),"Adventure, Family, Fantasy","In a parallel universe, young Lyra Belacqua journeys to the far North to save her best friend and other kidnapped children from terrible experiments by a mysterious organization."
Justice League: Warworld (2023),"Animation, Action, Adventure","Warworld, a place of unending brutal gladiatorial combat, Batman, Superman, Wonder Woman and others must unite to form an unbeatable resistance to lead entire planet to freedom."
How High (2001),"Comedy, Fantasy","Two guys by the name of Silas and Jamal decided to one day smoke something magical, which eventually helps them to ace their college entrance exam."
"10,000 BC (2008)","Action, Adventure, Drama","In the prehistoric past, D'Leh is a mammoth hunter who bonds with the beautiful Evolet. When warriors on horseback capture Evolet and the tribesmen, D'Leh must embark on an odyssey to save his true love."
Masters of the Universe (),"Animation, Action, Adventure","He-Man, the most powerful man in the universe, goes against the evil Skeletor to save the planet Eternia and protect the secrets of Castle Grayskull."
Eight for Silver (2021),"Fantasy, Horror, Mystery","In rural 19th-century France, a mysterious, possibly supernatural menace threatens a small village. John McBride, a pathologist, comes to town to investigate the danger - and exorcise some of his own demons in the process."
Damsel (2023),"Action, Adventure, Fantasy","In this new fantasy film, a young woman who thinks she is being married to a perfect prince is thrown into a pit where she discovers she's not going to be a princess after all, but a ...See full summary»"
Season of the Witch (2011),"Action, Adventure, Fantasy","14th-century knights transport a suspected witch to a monastery, where monks deduce that her powers could be the source of the Black Plague."
Klaus (2019),"Animation, Adventure, Comedy","A simple act of kindness always sparks another, even in a frozen, faraway place. When Smeerensburg's new postman, Jesper, befriends toymaker Klaus, their gifts melt an age-old feud and deliver a sleigh full of holiday traditions."
Les cinq diables (2022),"Drama, Fantasy, Romance","Vicky lives with her mother Joanne and father Jimmie, a man struggling to find his place. When Vicky's aunt Julia arrives after being released from prison, her presence brings back the past in a violent, magical way."
Mystery Men (1999),"Action, Comedy, Fantasy",A group of inept amateur superheroes must try to save the day when a supervillain threatens to destroy a major superhero and the city.
