Barbie (I) (2023),"Adventure, Comedy, Fantasy",Barbie suffers a crisis that leads her to question her world and her existence.
Spider-Man: Across the Spider-Verse (2023),"Animation, Action, Adventure","Miles Morales catapults across the Multiverse, where he encounters a team of Spider-People charged with protecting its very existence. When the heroes clash on how to handle a new threat, Miles must redefine what it means to be a hero."
The Flash (2023),"Action, Adventure, Fantasy","Barry Allen uses his super speed to change the past, but his attempt to save his family creates a world without super heroes, forcing him to race for his life in order to save the future."
Nimona (2023),"Animation, Action, Adventure","When a knight in a futuristic medieval world is framed for a crime he didn't commit, the only one who can help him prove his innocence is Nimona -- a mischievous teen who happens to be a shapeshifting creature he's sworn to destroy."
Elemental (2023),"Animation, Adventure, Comedy","Follows Ember and Wade, in a city where fire-, water-, land- and air-residents live together."
Avatar: The Way of Water (2022),"Action, Adventure, Fantasy","Jake Sully lives with his newfound family formed on the extrasolar moon Pandora. Once a familiar threat returns to finish what was previously started, Jake must work with Neytiri and the army of the Na'vi race to protect their home."
Dungeons & Dragons: Honor Among Thieves (2023),"Action, Adventure, Comedy","A charming thief and a band of unlikely adventurers embark on an epic quest to retrieve a lost relic, but things go dangerously awry when they run afoul of the wrong people."
The Little Mermaid (I) (2023),"Adventure, Family, Fantasy",A young mermaid makes a deal with a sea witch to trade her beautiful voice for human legs so she can discover the world above water and impress a prince.
The Super Mario Bros. Movie (2023),"Animation, Adventure, Comedy","A plumber named Mario travels through an underground labyrinth with his brother, Luigi, trying to save a captured princess."
"Ruby Gillman, Teenage Kraken (2023)","Animation, Action, Adventure","A shy adolescent learns that she comes from a fabled royal family of legendary sea krakens and that her destiny lies in the depths of the waters, which is bigger than she could have ever imagined."
Knights of the Zodiac (2023),"Action, Adventure, Drama","When a goddess of war reincarnates in the body of a young girl, street orphan Seiya discovers that he is destined to protect her and save the world. But only if he can face his own past and become a Knight of the Zodiac."
Rebel Moon (2023),"Action, Adventure, Drama",A young woman seeks out warriors from other planets to fight the tyrannical armies terrorizing her peaceful colony.
Spider-Man: Into the Spider-Verse (2018),"Animation, Action, Adventure",Teen Miles Morales becomes the Spider-Man of his universe and must join with five spider-powered individuals from other dimensions to stop a threat for all realities.
Haunted Mansion (2023),"Comedy, Drama, Family","A single mom named Gabbie hires a tour guide, a psychic, a priest and a historian to help exorcise her newly bought mansion after discovering it is inhabited by ghosts."
Everything Everywhere All at Once (2022),"Action, Adventure, Comedy",A middle-aged Chinese immigrant is swept up into an insane adventure in which she alone can save existence by exploring other universes and connecting with the lives she could have led.
Renfield (2023),"Comedy, Fantasy, Horror","Renfield, Dracula's henchman and inmate at the lunatic asylum for decades, longs for a life away from the Count, his various demands, and all of the bloodshed that comes with them."
Teenage Mutant Ninja Turtles: Mutant Mayhem (2023),"Animation, Action, Adventure",The Turtle brothers as they work to earn the love of New York City while facing down an army of mutants.
Shazam! Fury of the Gods (2023),"Action, Adventure, Comedy","The film continues the story of teenage Billy Batson who, upon reciting the magic word ""SHAZAM!"" is transformed into his adult Super Hero alter ego, Shazam."
Harry Potter and the Sorcerer's Stone (2001),"Adventure, Family, Fantasy","An orphaned boy enrolls in a school of wizardry, where he learns the truth about himself, his family and the terrible evil that haunts the magical world."
Spider-Man: No Way Home (2021),"Action, Adventure, Fantasy","With Spider-Man's identity now revealed, Peter asks Doctor Strange for help. When a spell goes wrong, dangerous foes from other worlds start to appear, forcing Peter to discover what it truly means to be Spider-Man."
Beetlejuice 2 (2024),"Comedy, Fantasy, Horror","This is a follow-up to the comedyBeetle Juice(1988), about a ghost who's recruited to help haunt a house."
Superman: Legacy (2025),"Action, Adventure, Fantasy","It follows Superman as he reconciles his heritage with his human upbringing. He is the embodiment of truth, justice and the American way in a world that views kindness as old-fashioned."
Roald Dahl's Matilda the Musical (2022),"Comedy, Drama, Family","An adaptation of the Tony and Olivier award-winning musical. Matilda tells the story of an extraordinary girl who, armed with a sharp mind and a vivid imagination, dares to take a stand to change her story with miraculous results."
Avatar (2009),"Action, Adventure, Fantasy",A paraplegic Marine dispatched to the moon Pandora on a unique mission becomes torn between following his orders and protecting the world he feels is his home.
The Lord of the Rings: The Fellowship of the Ring (2001),"Action, Adventure, Drama",A meek Hobbit from the Shire and eight companions set out on a journey to destroy the powerful One Ring and save Middle-earth from the Dark Lord Sauron.
Pirates of the Caribbean: The Curse of the Black Pearl (2003),"Action, Adventure, Fantasy","Blacksmith Will Turner teams up with eccentric pirate ""Captain"" Jack Sparrow to save his love, the governor's daughter, from Jack's former pirate allies, who are now undead."
Immortals (2011),"Action, Drama, Fantasy","Theseus is a mortal man chosen by Zeus to lead the fight against the ruthless King Hyperion, who is on a rampage across Greece to obtain a weapon that can destroy humanity."
Black Adam (2022),"Action, Adventure, Fantasy","Nearly 5,000 years after he was bestowed with the almighty powers of the Egyptian gods--and imprisoned just as quickly--Black Adam is freed from his earthly tomb, ready to unleash his unique form of justice on the modern world."
The Huntsman: Winter's War (2016),"Action, Adventure, Drama","Eric and fellow warrior Sara, raised as members of ice Queen Freya's army, try to conceal their forbidden love as they fight to survive the wicked intentions of both Freya and her sister Ravenna."
Wonka (2023),"Adventure, Comedy, Family",The story will focus specifically on a young Willy Wonka and how he met the Oompa-Loompas on one of his earliest adventures.
Twilight (I) (2008),"Drama, Fantasy, Romance","When Bella Swan moves to a small town in the Pacific Northwest, she falls in love with Edward Cullen, a mysterious classmate who reveals himself to be a 108-year-old vampire."
The Green Mile (1999),"Crime, Drama, Fantasy","A tale set on death row in a Southern jail, where gentle giant John possesses the mysterious power to heal people's ailments. When the lead guard, Paul, recognizes John's gift, he tries to help stave off the condemned man's execution."
Mulan (2020),"Action, Adventure, Drama",A young Chinese maiden disguises herself as a male warrior in order to save her father.
Zack Snyder's Justice League (2021),"Action, Adventure, Fantasy","Determined to ensure that Superman's ultimate sacrifice wasn't in vain, Bruce Wayne recruits a team of metahumans to protect the world from an approaching threat of catastrophic proportions."
Star Wars (1977),"Action, Adventure, Fantasy","Luke Skywalker joins forces with a Jedi Knight, a cocky pilot, a Wookiee and two droids to save the galaxy from the Empire's world-destroying battle station, while also attempting to rescue Princess Leia from the mysterious Darth Vader."
Thor: Love and Thunder (2022),"Action, Adventure, Comedy","Thor enlists the help of Valkyrie, Korg and ex-girlfriend Jane Foster to fight Gorr the God Butcher, who intends to make the gods extinct."
Mulan (1998),"Animation, Adventure, Comedy","To save her father from death in the army, a young maiden secretly goes in his place and becomes one of China's greatest heroines in the process."
Pirates of the Caribbean: Dead Men Tell No Tales (2017),"Action, Adventure, Fantasy",Captain Jack Sparrow is pursued by old rival Captain Salazar and a crew of deadly ghosts who have escaped from the Devil's Triangle. They're determined to kill every pirate at sea...notably Jack.
Star Wars: Episode IX - The Rise of Skywalker (2019),"Action, Adventure, Fantasy","In the riveting conclusion of the landmark Skywalker saga, new legends will be born-and the final battle for freedom is yet to come."
The Mummy (1999),"Action, Adventure, Fantasy","At an archaeological dig in the ancient city of Hamunaptra, an American serving in the French Foreign Legion accidentally awakens a mummy who begins to wreak havoc as he searches for the reincarnation of his long-lost love."
Spider-Man: Beyond the Spider-Verse (2024),"Animation, Action, Adventure","After leaving off from Spider-Man: Across the Spider-Verse, the story continues."
Beetle Juice (1988),"Comedy, Fantasy","The spirits of a deceased couple are harassed by an unbearable family that has moved into their home, and hire a malicious spirit to drive them out."
Doctor Sleep (2019),"Drama, Fantasy, Horror","Years following the events ofThe Shining(1980), a now-adult Dan Torrance must protect a young girl with similar powers from a cult known as The True Knot, who prey on children with powers to remain immortal."
The Northman (2022),"Action, Adventure, Drama",A young Viking prince is on a quest to avenge his father's murder.
The Princess Bride (1987),"Adventure, Comedy, Family","A bedridden boy's grandfather reads him the story of a farmboy-turned-pirate who encounters numerous obstacles, enemies and allies in his quest to be reunited with his true love."
The Lord of the Rings: The Return of the King (2003),"Action, Adventure, Drama",Gandalf and Aragorn lead the World of Men against Sauron's army to draw his gaze from Frodo and Sam as they approach Mount Doom with the One Ring.
Mortal Engines (2018),"Action, Adventure, Fantasy","In a post-apocalyptic world where cities ride on wheels and consume each other to survive, two people meet in London and try to stop a conspiracy."
Maleficent: Mistress of Evil (2019),"Adventure, Family, Fantasy","Maleficent and her goddaughter Aurora begin to question the complex family ties that bind them as they are pulled in different directions by impending nuptials, unexpected allies, and dark new forces at play."
Jumanji: Welcome to the Jungle (2017),"Action, Adventure, Comedy","Four teenagers are sucked into a magical video game, and the only way they can escape is to work together to finish the game."
The Marvels (2023),"Action, Adventure, Fantasy","Carol Danvers gets her powers entangled with those of Kamala Khan and Monica Rambeau, forcing them to work together to save the universe."
Suicide Squad (2016),"Action, Adventure, Fantasy",A secret government agency recruits some of the most dangerous incarcerated super-villains to form a defensive task force. Their first mission: save the world from the apocalypse.
Encanto (2021),"Animation, Comedy, Family",A Colombian teenage girl has to face the frustration of being the only member of her family without magical powers.
Doctor Strange in the Multiverse of Madness (2022),"Action, Adventure, Fantasy","Doctor Strange teams up with a mysterious teenage girl from his dreams who can travel across multiverses, to battle multiple threats, including other-universe versions of himself, which threaten to wipe out millions across the multiverse. They seek help from Wanda the Scarlet Witch, Wong and others."
"The Chronicles of Narnia: The Lion, the Witch and the Wardrobe (2005)","Adventure, Family, Fantasy",Four kids travel through a wardrobe to the land of Narnia and learn of their destiny to free it with the guidance of a mystical lion.
Resident Evil: Death Island (2023),"Animation, Action, Adventure","D.S.O. agent Leon S. Kennedy is on a mission to rescue Dr. Antonio Taylor from kidnappers, when a mysterious woman thwarts his pursuit. Meanwhile, B.S.A.A. agent Chris Redfield is ...See full summary»"
Harry Potter and the Goblet of Fire (2005),"Adventure, Family, Fantasy","Harry Potter finds himself competing in a hazardous tournament between rival schools of magic, but he is distracted by recurring nightmares."
Mavka. Lisova pisnya (2023),"Animation, Adventure, Comedy",Mavka must choose between love and duty to protect the Heart of the Forest.
Eternals (2021),"Action, Adventure, Fantasy","The saga of the Eternals, a race of immortal beings who lived on Earth and shaped its history and civilizations."
Sen to Chihiro no kamikakushi (2001),"Animation, Adventure, Family","During her family's move to the suburbs, a sullen 10-year-old girl wanders into a world ruled by gods, witches and spirits, a world where humans are changed into beasts."
Ratatouille (2007),"Animation, Adventure, Comedy",A rat who can cook makes an unusual alliance with a young kitchen worker at a famous Paris restaurant.
Aquaman and the Lost Kingdom (2023),"Action, Adventure, Fantasy",Plot unknown. Sequel to the 2018 film 'Aquaman.'
Free Guy (2021),"Action, Adventure, Comedy","When Guy, a bank teller, learns that he is a non-player character in a bloodthirsty, open-world video game, he goes on to become the hero of the story and takes the responsibility of saving the world."
Star Wars: Episode I - The Phantom Menace (1999),"Action, Adventure, Fantasy","Two Jedi escape a hostile blockade to find allies and come across a young boy who may bring balance to the Force, but the long dormant Sith resurface to claim their original glory."
The VVitch: A New-England Folktale (2015),"Drama, Fantasy, Horror","A family in 1630s New England is torn apart by the forces of witchcraft, black magic and possession."
Pirates of the Caribbean: On Stranger Tides (2011),"Action, Adventure, Fantasy","Jack Sparrow and Barbossa embark on a quest to find the elusive fountain of youth, only to discover that Blackbeard and his daughter are after it too."
Moana (I) (2016),"Animation, Adventure, Comedy","In Ancient Polynesia, when a terrible curse incurred by the Demigod Maui reaches Moana's island, she answers the Ocean's call to seek out the Demigod to set things right."
About Time (I) (2013),"Comedy, Drama, Fantasy","At the age of 21, Tim discovers he can travel in time and change what happens and has happened in his own life. His decision to make his world a better place by getting a girlfriend turns out not to be as easy as you might think."
Mortal Kombat 2 (),"Action, Adventure, Fantasy",Plot under wraps
Matilda (1996),"Comedy, Family, Fantasy","A girl gifted with a keen intellect and psychic powers uses both to deal with her crude, distant family and free her kind teacher from their sadistic headmistress."
Star Wars: Episode VIII - The Last Jedi (2017),"Action, Adventure, Fantasy","The Star Wars saga continues as new heroes and galactic legends go on an epic adventure, unlocking mysteries of the Force and shocking revelations of the past."
Harry Potter and the Deathly Hallows: Part 2 (2011),"Adventure, Family, Fantasy","Harry, Ron, and Hermione search for Voldemort's remaining Horcruxes in their effort to destroy the Dark Lord as the final battle rages on at Hogwarts."
Toy Story (1995),"Animation, Adventure, Comedy",A cowboy doll is profoundly threatened and jealous when a new spaceman action figure supplants him as top toy in a boy's bedroom.
Hook (1991),"Adventure, Comedy, Family","When Captain James Hook kidnaps his children, an adult Peter Pan must return to Neverland and reclaim his youthful spirit in order to challenge his old enemy."
Ghostbusters: Afterlife (2021),"Adventure, Comedy, Fantasy","When a single mom and her two kids arrive in a small town, they begin to discover their connection to the original Ghostbusters and the secret legacy their grandfather left behind."
Inside Out (I) (2015),"Animation, Adventure, Comedy","After young Riley is uprooted from her Midwest life and moved to San Francisco, her emotions - Joy, Fear, Anger, Disgust and Sadness - conflict on how best to navigate a new city, house, and school."
Pirates of the Caribbean: Dead Man's Chest (2006),"Action, Adventure, Fantasy","Jack Sparrow races to recover the heart of Davy Jones to avoid enslaving his soul to Jones' service, as other friends and foes seek the heart for their own agenda as well."
Justice League (2017),"Action, Adventure, Fantasy","Fueled by his restored faith in humanity and inspired by Superman's selfless act, Bruce Wayne enlists the help of his new-found ally, Diana Prince, to face an even greater enemy."
Peter Pan & Wendy (2023),"Action, Adventure, Comedy","Follow the adventures of Peter Pan, a boy who does not want to grow up, and how he recruits three siblings in London, and together they embark on a magical adventure on the enchanted island of Neverland."
Luck (I) (2022),"Animation, Adventure, Comedy",The curtain is pulled back on the millennia-old battle between the organizations of good luck and bad luck that secretly affects everyday lives.
Harry Potter and the Prisoner of Azkaban (2004),"Adventure, Family, Fantasy","Harry Potter, Ron and Hermione return to Hogwarts School of Witchcraft and Wizardry for their third year of study, where they delve into the mystery surrounding an escaped prisoner who poses a dangerous threat to the young wizard."
Snow White and the Huntsman (2012),"Action, Adventure, Drama","In a twist to the fairy tale, the Huntsman ordered to take Snow White into the woods to be killed winds up becoming her protector and mentor in a quest to vanquish the Evil Queen."
Harry Potter and the Chamber of Secrets (2002),"Adventure, Family, Fantasy",An ancient prophecy seems to be coming true when a mysterious presence begins stalking the corridors of a school of magic and leaving its victims paralyzed.
Hauru no ugoku shiro (2004),"Animation, Adventure, Family","When an unconfident young woman is cursed with an old body by a spiteful witch, her only chance of breaking the spell lies with a self-indulgent yet insecure young wizard and his companions in his legged, walking castle."
Star Wars: Episode VI - Return of the Jedi (1983),"Action, Adventure, Fantasy","After rescuing Han Solo from Jabba the Hutt, the Rebels attempt to destroy the second Death Star, while Luke struggles to help Darth Vader back from the dark side."
Wonder Woman (2017),"Action, Adventure, Fantasy","When a pilot crashes and tells of conflict in the outside world, Diana, an Amazonian warrior in training, leaves home to fight a war, discovering her full powers and true destiny."
Beauty and the Beast (I) (2017),"Adventure, Family, Fantasy","A selfish Prince is cursed to become a monster for the rest of his life, unless he learns to fall in love with a beautiful young woman he keeps prisoner."
Suzume no Tojimari (2022),"Animation, Action, Adventure",A modern action adventure road story where a 17-year-old girl named Suzume helps a mysterious young man close doors from the other side that are releasing disasters all over in Japan.
Conan the Barbarian (1982),"Action, Adventure, Fantasy","A young boy, Conan, becomes a slave after his parents are killed and tribe destroyed by a savage warlord and sorcerer, Thulsa Doom. When he grows up he becomes a fearless, invincible fighter. Set free, he plots revenge against Thulsa Doom."
The Hobbit: An Unexpected Journey (2012),"Adventure, Fantasy","A reluctant Hobbit, Bilbo Baggins, sets out to the Lonely Mountain with a spirited group of dwarves to reclaim their mountain home, and the gold within it from the dragon Smaug."
Star Wars: Episode V - The Empire Strikes Back (1980),"Action, Adventure, Fantasy","After the Rebels are overpowered by the Empire, Luke Skywalker begins his Jedi training with Yoda, while his friends are pursued across the galaxy by Darth Vader and bounty hunter Boba Fett."
Liar Liar (1997),"Comedy, Fantasy",A pathological liar-lawyer finds his career turned upside down when he inexplicably cannot physically lie for 24 whole hours.
The Lord of the Rings: The Two Towers (2002),"Action, Adventure, Drama","While Frodo and Sam edge closer to Mordor with the help of the shifty Gollum, the divided fellowship makes a stand against Sauron's new ally, Saruman, and his hordes of Isengard."
The Age of Adaline (2015),"Drama, Fantasy, Romance","A young woman, born at the turn of the 20th century, is rendered ageless after an accident. After many solitary years, she meets a man who complicates the eternal life she has settled into."
Ghostbusters (1984),"Action, Comedy, Fantasy","Three parapsychologists forced out of their university funding set up shop as a unique ghost removal service in New York City, attracting frightened yet skeptical customers."
Thor (2011),"Action, Fantasy","The powerful but arrogant god Thor is cast out of Asgard to live amongst humans in Midgard (Earth), where he soon becomes one of their finest defenders."
Big Trouble in Little China (1986),"Action, Adventure, Comedy",A rough-and-tumble trucker and his side kick face off with an ancient sorcerer in a supernatural battle beneath Chinatown.
Coco (I) (2017),"Animation, Adventure, Drama","Aspiring musician Miguel, confronted with his family's ancestral ban on music, enters the Land of the Dead to find his great-great-grandfather, a legendary singer."
Jumanji (1995),"Adventure, Comedy, Family","When two kids find and play a magical board game, they release a man trapped in it for decades - and a host of dangers that can only be stopped by finishing the game."
Aquaman (2018),"Action, Adventure, Fantasy","Arthur Curry, the human-born heir to the underwater kingdom of Atlantis, goes on a quest to prevent a war between the worlds of ocean and land."
Pirates of the Caribbean: At World's End (2007),"Action, Adventure, Fantasy","Captain Barbossa, Will Turner and Elizabeth Swann must sail off the edge of the map, navigate treachery and betrayal, find Jack Sparrow, and make their final alliances for one last decisive battle."
Miraculous - Le film (2023),"Animation, Action, Adventure","Ordinary teenager Marinette's life in Paris goes superhuman when she becomes Ladybug. Bestowed with magical powers of creation, Ladybug must unite with her opposite, Cat Noir, to save Paris as a new villain unleashes chaos unto the city."
Fantastic Beasts: The Secrets of Dumbledore (2022),"Adventure, Family, Fantasy",Professor Albus Dumbledore must assist Newt Scamander and his partners as Grindelwald begins to lead an army to eliminate all Muggles.
Scott Pilgrim vs. the World (2010),"Action, Comedy, Fantasy","In a magically realistic version of Toronto, a young man must defeat his new girlfriend's seven evil exes one by one in order to win her heart."
Charlie and the Chocolate Factory (2005),"Adventure, Comedy, Family","A young boy wins a tour through the most magnificent chocolate factory in the world, led by the world's most unusual candy maker."
Stardust (2007),"Adventure, Family, Fantasy","In a countryside town bordering on a magical land, a young man makes a promise to his beloved that he'll retrieve a fallen star by venturing into the magical realm."
The Little Mermaid (1989),"Animation, Adventure, Family",A mermaid princess makes a Faustian bargain in an attempt to become human and win a prince's love.
Three Thousand Years of Longing (2022),"Drama, Fantasy, Romance","A lonely scholar, on a trip to Istanbul, discovers a Djinn who offers her three wishes in exchange for his freedom."
Thunderbolts (2024),"Action, Adventure, Crime",A group of supervillains are recruited to go on missions for the government.
This Is the End (2013),"Comedy, Fantasy","Six Los Angeles celebrities are stuck inJames Franco's house after a series of devastating events just destroyed the city. Inside, the group not only have to face the apocalypse, but themselves."
Shazam! (2019),"Action, Adventure, Comedy",A newly fostered young boy in search of his mother instead finds unexpected super powers and soon gains a powerful enemy.
Men (2022),"Drama, Fantasy, Horror",A young woman goes on a solo vacation to the English countryside following the death of her ex-husband.
Cinderella (I) (2015),"Adventure, Drama, Family","When her father unexpectedly dies, young Ella finds herself at the mercy of her cruel stepmother and her scheming stepsisters. Never one to give up hope, Ella's fortunes begin to change after meeting a dashing stranger."
The Wizard of Oz (1939),"Adventure, Family, Fantasy","Young Dorothy Gale and her dog Toto are swept away by a tornado from their Kansas farm to the magical Land of Oz, and embark on a quest with three new friends to see the Wizard, who can return her to her home and fulfill the others' wishes."
Triangle (2009),"Fantasy, Mystery, Sci-Fi","Five friends set sail and their yacht is overturned by a strange and sudden storm. A mysterious ship arrives to rescue them, and what happens next cannot be explained."
The Curious Case of Benjamin Button (2008),"Drama, Fantasy, Romance","Tells the story of Benjamin Button, a man who starts aging backwards with consequences."
Shang-Chi and the Legend of the Ten Rings (2021),"Action, Adventure, Fantasy","Shang-Chi, the master of weaponry-based Kung Fu, is forced to confront his past after being drawn into the Ten Rings organization."
