Kubo and the Two Strings (2016),"Animation, Action, Adventure",A young boy named Kubo must locate a magical suit of armour worn by his late father in order to defeat a vengeful spirit from the past.
Il fiore delle mille e una notte (1974),"Comedy, Drama, Fantasy","In ancient Arabia, a beautiful slave girl chooses a youth to be her new master, then she is kidnapped and they must search for each other. Stories are told within stories: love, travel and the whims of destiny."
The Forbidden Kingdom (2008),"Action, Adventure, Fantasy","A discovery made by a kung fu obsessed American teen sends him on an adventure to ancient China, where he joins up with a band of martial arts warriors in order to free the imprisoned Monkey King."
Ghosts of Girlfriends Past (2009),"Comedy, Fantasy, Romance","While attending his brother's wedding, a serial womanizer is haunted by the ghosts of his past girlfriends."
The Craft: Legacy (2020),"Drama, Fantasy, Horror",A group of high school students form a coven of witches.
Siu Lam juk kau (2001),"Action, Comedy, Fantasy",A young Shaolin follower reunites with his discouraged brothers to form a soccer team using their martial art skills to their advantage.
Race to Witch Mountain (2009),"Action, Adventure, Family",A Las Vegas cabbie enlists the help of a U.F.O. expert to protect two siblings with paranormal powers from the clutches of an organization that wants to use the kids for their nefarious plans.
Nine Days (2020),"Drama, Fantasy",A reclusive man conducts a series of interviews with human souls for a chance to be born.
The Dark Crystal (1982),"Adventure, Family, Fantasy","On another planet in the distant past, a Gelfling embarks on a quest to find the missing shard of a magical crystal, and to restore order to his world."
The Rescuers Down Under (1990),"Animation, Adventure, Comedy",R.A.S. agents Miss Bianca and Bernard race to Australia to save a little boy and a rare golden eagle from a murderous poacher.
My Little Pony: The Movie (2017),"Animation, Adventure, Comedy","After a dark force conquers Canterlot, the Mane 6 embark on an unforgettable journey beyond Equestria where they meet new friends and exciting challenges on a quest to use the magic of friendship to save their homeland."
Are We There Yet? (2005),"Adventure, Comedy, Family","To impress a foxy divorcee, ladies' man Nick offers to take her kids on an extended road trip, unaware of the torture he's in for."
Gnomeo & Juliet (2011),"Animation, Adventure, Comedy","Separated by a garden fence and a feud, are blue gnomes on one side and red gnomes on the other. This doesn't stop blue Gnomeo and red Juliet from falling in love with each other. Do they have a future together?"
Dead Man (1995),"Adventure, Drama, Fantasy","On the run after murdering a man, accountant William Blake encounters a strange aboriginal American man named Nobody who prepares him for his journey into the spiritual world."
The Lego Ninjago Movie (2017),"Animation, Action, Adventure","Shunned by everyone for being the son of an evil warlord, a teenager seeks to defeat him with the help of his fellow ninjas."
The Phantom (1996),"Action, Adventure, Comedy","The Phantom, descendent of a line of African superheroes, travels to New York City to thwart a wealthy criminal genius from obtaining three magic skulls which would give him the secret to ultimate power."
Secret Society of Second-Born Royals (2020),"Action, Adventure, Comedy",Follows Sam's adventures at a top-secret training program for a new class of second-born royals tasked with saving the world.
Wendell & Wild (2022),"Animation, Adventure, Comedy","Two scheming demon brothers, Wendell and Wild, enlist the aid of 13-year-old Kat Elliot to summon them to the Land of the Living."
Gretel & Hansel (2020),"Fantasy, Horror, Mystery","A long time ago in a distant fairy tale countryside, a young girl leads her little brother into a dark wood in desperate search of food and work, only to stumble upon a nexus of terrifying evil."
Kurenai no buta (1992),"Animation, Adventure, Comedy","In 1930s Italy, a veteran World War I pilot is cursed to look like an anthropomorphic pig."
The Black Cauldron (1985),"Animation, Action, Adventure",A young boy and a group of misfit friends embark on a quest to find a dark magic item of ultimate power before a diabolical tyrant can.
The Rescuers (1977),"Animation, Adventure, Comedy",Two mice of the Rescue Aid Society search for a little girl kidnapped by unscrupulous treasure hunters.
The Secret Garden (2020),"Drama, Family, Fantasy",An orphaned girl discovers a magical garden hidden at her strict uncle's estate.
If Only (2004),"Comedy, Drama, Fantasy",It takes a tragedy to teach the young businessman Ian to put love ahead of work and open up to his musician girlfriend Samantha.
Saturday the 14th (1981),"Comedy, Fantasy, Horror",A family inherits an old mansion which houses the dangerous 'Book of Evil' that has all the monsters of the world trapped inside it.
Ruby Sparks (2012),"Comedy, Drama, Fantasy","A novelist struggling with writer's block finds romance in a most unusual way: by creating a female character he thinks will love him, then willing her into existence."
Birth (2004),"Drama, Fantasy, Mystery",A young boy attempts to convince a woman that he is her dead husband reborn.
The Lost World (1960),"Adventure, Fantasy, Sci-Fi",Professor Challenger leads an expedition of scientists and adventurers to a remote plateau deep in the Amazonian jungle to verify his claim that dinosaurs still live there.
Herbie Fully Loaded (2005),"Adventure, Comedy, Family","Maggie Peyton, the new owner of Herbie, Number 53, the free-wheelin' Volkswagen bug with a mind of its own, puts the car through its paces on the road to becoming a NASCAR competitor."
The Grinch (2018),"Animation, Comedy, Family",A grumpy Grinch plots to ruin Christmas for the village of Whoville.
Migration (I) (2023),"Animation, Adventure, Comedy",A family of ducks try to convince their overprotective father to go on the vacation of a lifetime.
The Map of Tiny Perfect Things (2021),"Comedy, Fantasy, Romance","Two teens live the same day repeatedly, enabling them to create a map of things to remember."
Ryû to sobakasu no hime (2021),"Animation, Adventure, Drama","Suzu is a shy high school student living in a rural village. For years, she has only been a shadow of herself. But when she enters ""U"", a massive virtual world, she escapes into her online persona as Belle, a globally-beloved singer."
Underworld: Evolution (2006),"Action, Fantasy, Thriller","Picking up directly from the previous movie, vampire warrior Selene and the half werewolf Michael hunt for clues to reveal the history of their races and the war between them."
The Man Who Killed Don Quixote (2018),"Adventure, Comedy, Drama","Toby, a disillusioned film director, is pulled into a world of time-jumping fantasy when a Spanish cobbler believes himself to be Sancho Panza. He gradually becomes unable to tell dreams from reality."
Alvin and the Chipmunks: Chipwrecked (2011),"Animation, Adventure, Comedy","Playing around while aboard a cruise ship, the Chipmunks and Chipettes accidentally go overboard and end up marooned in a tropical paradise. They discover their new turf is not as deserted as it seems."
The Grudge (I) (2020),"Fantasy, Horror",A house is cursed by a vengeful ghost that dooms those who enter it with a violent death.
Arthur et les Minimoys (2006),"Animation, Adventure, Comedy","Ten-year-old Arthur, in a bid to save his grandfather's house from being demolished, goes looking for some much-fabled hidden treasure in the land of the Minimoys, tiny people living in harmony with nature."
Oegye+in 1bu (2022),"Action, Adventure, Fantasy",The door of time opens between the swordsman who wants to seize the legendary divine sword at the end of the Goryeo Dynasty and those who chase after an alien prisoner imprisoned in a human body in 2022.
The Little Mermaid (2018),"Adventure, Drama, Fantasy",A young reporter and his niece discover a beautiful and enchanting creature they believe to be the real little mermaid.
Star Trek V: The Final Frontier (1989),"Action, Adventure, Fantasy",Captain Kirk and his crew must deal with Mr. Spock's long-lost half-brother who hijacks the Enterprise for an obsessive search for God at the center of the galaxy.
Harry and the Hendersons (1987),"Comedy, Family, Fantasy",The Henderson family adopt a friendly Sasquatch but have a hard time trying to keep the legend of 'Bigfoot' a secret.
The Prophecy (1995),"Action, Crime, Drama","At the scene of a bizarre murder, L.A. homicide detective Thomas Dagget discovers a lethal heavenly prophecy now being fulfilled on earth. In his fight to stop the forces of evil, he finds an unlikely ally in an elementary school teacher."
Pumpkinhead (1988),"Fantasy, Horror","After a tragic accident, a man conjures up a towering, vengeful demon called Pumpkinhead to destroy a group of unsuspecting teenagers."
Freaks Out (2021),"Adventure, Drama, Fantasy","Rome, 1943: Matilde, Cencio, Fulvio and Mario are the main attractions of the ""Mezza Piotta Circus"" run by Israel, meanwhile someone starts looking for the four freaks with a plan that could change the fate of the whole world."
Isn't It Romantic (2019),"Comedy, Fantasy, Musical",A young woman disenchanted with love mysteriously finds herself trapped inside a romantic comedy.
Dracula (1931),"Drama, Fantasy, Horror","Transylvanian vampire Count Dracula bends a naive real estate agent to his will, then takes up residence at a London estate where he sleeps in his coffin by day and searches for potential victims by night."
Lara Croft: Tomb Raider - The Cradle of Life (2003),"Action, Adventure, Fantasy","Adventurer Lara Croft goes on a quest to save the mythical Pandora's Box, before an evil scientist finds it, and recruits a former Marine turned mercenary to assist her."
Just Like Heaven (2005),"Comedy, Drama, Fantasy",A lonely landscape architect falls for the spirit of the beautiful woman who used to live in his new apartment.
The Little Mermaid (II) (2023),"Animation, Comedy, Drama","In this ""half-fish"" out-of-water animated adventure, a mermaid princess makes a bargain with a sea witch to become human."
Bubba Ho-Tep (2002),"Comedy, Fantasy, Horror","Elvis Presley and a black ""JFK"" stay in a nursing home where nothing happens - until a wayward Egyptian mummy comes and sucks out the old people's souls thru their anuses. The two decide to fight back."
Vampire Academy (2014),"Action, Comedy, Drama","Rose Hathaway is a Dhampir, half human-half vampire, a guardian of the Moroi, peaceful, mortal vampires living discreetly within our world. Her calling is to protect the Moroi from bloodthirsty, immortal Vampires, the Strigoi."
Kate & Leopold (2001),"Comedy, Fantasy, Romance",An English Duke from 1876 is inadvertedly dragged to modern day New York where he falls for a plucky advertising executive.
Sinbad: Legend of the Seven Seas (2003),"Animation, Adventure, Comedy",The sailor of legend is framed by the goddess Eris for the theft of the Book of Peace and must travel to her realm at the end of the world to retrieve it and save the life of his childhood friend Prince Proteus.
Pete's Dragon (2016),"Action, Adventure, Comedy","The adventures of an orphaned boy named Pete and his best friend Elliott, who happens to be a dragon."
Like Mike (2002),"Comedy, Family, Fantasy","A 13-year-old orphan becomes an NBA superstar after trying on a pair of sneakers with the faded initials ""MJ"" inside them."
Pete's Dragon (1977),"Animation, Adventure, Comedy",An orphan boy and his magical dragon come to town with his abusive adoptive parents in pursuit.
The Family Man (2000),"Comedy, Drama, Fantasy","A fast-lane investment broker, offered the opportunity to see how the other half lives, wakes up to find that his sports car and girlfriend have become a mini-van and wife."
The Sword and the Sorcerer (1982),"Action, Adventure, Fantasy",A mercenary with a three-bladed sword rediscovers his royal heritage's dangerous future when he is recruited to help a princess foil the designs of a brutal tyrant and a powerful sorcerer in conquering a land.
Leprechaun Returns (2018),"Comedy, Fantasy, Horror","The Leprechaun returns once again, when a group of girls unwillingly awaken him after they tear down a cabin so that they can build a new sorority house."
Status Update (II) (2018),"Comedy, Fantasy, Romance","Uprooted by his parents' separation, teenager Kyle Moore is unable to fit into his new hometown until he stumbles upon a magical app that makes his social-media updates come true, changing his entire life."
Before I Wake (2016),"Drama, Fantasy, Horror",A couple adopt an orphaned child whose dreams - and nightmares - manifest physically as he sleeps.
Xanadu (1980),"Fantasy, Musical, Romance",A struggling artist living in Los Angeles meets a girl who may hold the key to his happiness.
Scrooged (1988),"Comedy, Drama, Fantasy","A selfish, cynical television executive is haunted by three spirits bearing lessons on Christmas Eve."
America: The Motion Picture (2021),"Animation, Action, Adventure",A chainsaw-wielding George Washington teams with beer-loving bro Sam Adams to take down the Brits in a tongue-in-cheek riff on the American Revolution.
Idle Hands (1999),"Comedy, Fantasy, Horror",A teenage slacker's right hand becomes possessed with murderous intent.
Beyond the Door III (1989),"Drama, Fantasy, Horror","An introverted American student of Balkan descent travels to Yugoslavia as part of a school trip to witness an ancient pagan ritual, but the pagans hide a deadly secret."
Zapped! (1982),"Comedy, Fantasy, Sci-Fi",A high school science nerd gains telekinetic powers after a laboratory accident and uses them for revenge upon bullies.
Untitled Spider-Man Sequel (2024),"Action, Adventure, Fantasy",Plot under wraps
Kimetsu no Yaiba: Tsuzumi Yashiki Hen (2021),"Animation, Action, Fantasy",Tanjiro ventures to the south-southeast where he encounters a cowardly young man named Zenitsu Agatsuma. He is a fellow survivor from Final Selection and his sparrow asks Tanjiro to help keep him in line.
Ci sha xiao shuo jia (2021),"Action, Adventure, Fantasy","Six years after the abduction of his daughter, a man is hired to kill the author of a fantasy novel, but the world of the novel seems to intersect with reality."
Boys of Summer (),"Adventure, Fantasy, Mystery","In the summer of 1997, a local boy and his friends team up with a retired detective to confront a witch that has secretly moved to Martha's Vineyard. Together, they must work to overcome their fears and save the island."
Lilo & Stitch (),"Action, Adventure, Comedy",Live-action remake of Disney's animated classic 'Lilo and Stitch'.
The Sword in the Stone (1963),"Animation, Adventure, Comedy","A poor boy named Arthur learns the power of love, kindness, knowledge and bravery with the help of a wizard called Merlin in the path to become one of the most beloved kings in English history."
Winnie the Pooh (2011),"Animation, Adventure, Comedy","While searching for honey, Pooh and his friends embark on an adventure to find Eeyore's missing tail and rescue Christopher Robin from an unknown monster called The Backson."
Wizards (1977),"Animation, Adventure, Fantasy","On a post-apocalyptic Earth, a wizard and his faire folk comrades fight an evil wizard who's using technology in his bid for conquest."
Osmosis Jones (2001),"Animation, Action, Adventure","A policeman white blood cell, with the help of a cold pill, must stop a deadly virus from destroying the human they live in, Frank."
Slaughterhouse Rulez (2018),"Action, Comedy, Fantasy",An illustrious British boarding school becomes a bloody battleground when a mysterious sinkhole appears at a nearby fracking site unleashing unspeakable horror.
Peggy Sue Got Married (1986),"Comedy, Drama, Fantasy","Peggy Sue faints at a high school reunion. When she wakes up, she finds herself in her own past, just before she finished school."
Bakjwi (2009),"Drama, Fantasy, Horror","Through a failed medical experiment, a priest is stricken with vampirism and is forced to abandon his ascetic ways."
Moana (2025),"Adventure, Comedy, Family",Live action ofMoana(2016)
Phenomenon (1996),"Drama, Fantasy, Romance","An ordinary man sees a bright light descend from the sky, and discovers he now has super-intelligence and telekinesis."
Teenage Mutant Ninja Turtles III (1993),"Action, Adventure, Comedy","When their closest friend April O'Neil discovers an ancient scepter with magical powers, the turtles must cow-a-bunga their way back to 17th century Japan to rescue her from the evil clutches of Lord Norinaga."
Neko no ongaeshi (2002),"Animation, Adventure, Comedy","After helping a cat, a seventeen-year-old girl finds herself involuntarily engaged to a cat Prince in a magical world where her only hope of freedom lies with a dapper cat statuette come to life."
Choses secrètes (2002),"Comedy, Drama, Fantasy","Two young women find themselves struggling to survive in Paris, street-wise Nathalie, a stripper, and naïve Sandrine, a barmaid. Together, they discover that sex can be used to their ...See full summary»"
Gulliver's Travels (2010),"Adventure, Comedy, Family","Travel writer Lemuel Gulliver takes an assignment in Bermuda but ends up on the island of Lilliput, where he towers over its tiny citizens."
Legend of the Guardians: The Owls of Ga'Hoole (2010),"Animation, Action, Adventure","When a young owl is abducted by an evil Owl army, he must escape with new-found friends and seek the legendary Guardians to stop the menace."
Tales from the Darkside: The Movie (1990),"Comedy, Fantasy, Horror","To stall a witch plotting to eat him, a boy reads her horror tales dealing with a collegian's resurrection of a mummy, a murderous cat, and an artist's pact with a gargoyle."
Zoom (2006),"Action, Adventure, Comedy",Former superhero Jack is called back to work to transform an unlikely group of ragtag kids into superheroes at a private academy.
The Return of Captain Invincible (1983),"Comedy, Fantasy, Musical","In World War II, Captain Invincible used his superpowers against the Nazis, and he was a hero. But when they accused him of supporting the Communists, he retired to Australia. Now, after a ...See full summary»"
Ramayana: The Legend of Prince Rama (1993),"Animation, Action, Adventure","An anime adaptation of the Hindu epic the Ramayana, where Lord Ram combats the wicked king Ravana."
The Jacket (2005),"Drama, Fantasy, Mystery","A Gulf war veteran is wrongly sent to a mental institution for insane criminals, where he becomes the object of a doctor's experiments, and his life is completely affected by them."
Underworld: Rise of the Lycans (2009),"Action, Fantasy, Thriller","An origins story centered on the centuries-old feud between the race of aristocratic vampires and their onetime slaves, the Lycans."
Phantom of the Paradise (1974),"Comedy, Drama, Fantasy","A disfigured composer sells his soul for the woman he loves so that she will perform his music. However, an evil record tycoon betrays him and steals his music to open his rock palace, The Paradise."
Smosh: The Movie (2015),"Adventure, Comedy, Fantasy",An embarrassing video of Anthony surfaces online right before his fifth high school reunion. The Smosh dudes then take a portal into YouTube and race to change the video and re-write history before it blows Anthony's chances of reconnecting with his teen crush Anna.
Dragonslayer (1981),"Action, Adventure, Fantasy",A young wizarding apprentice is sent to kill a dragon which has been devouring girls from a nearby kingdom.
One Piece Film Red (2022),"Animation, Action, Adventure","For the first time ever, Uta - the most beloved singer in the world - will reveal herself to the world at a live concert. The voice that the whole world has been waiting for is about to resound."
The Kiss (1988),"Drama, Fantasy, Horror","After the death of her mother, a teenage girl is faced with bizarre supernatural occurrences when her mother's estranged sister arrives and begins to infiltrate her and her father's lives."
The Gate (1987),"Fantasy, Horror",Kids left home alone accidentally unleash a horde of malevolent demons from a mysterious hole in their suburban backyard.
Little Monsters (1989),"Adventure, Comedy, Family",A boy discovers an incredible and gruesome world of monsters under his bed.
The Barbarians (1987),"Action, Adventure, Fantasy",Two twin barbarians seek revenge from the warlord who massacred their tribe and captured them when they were small children.
The Omen (2006),"Drama, Fantasy, Horror",An American official realizes that his young son may literally be the Devil incarnate.
A Midsummer Night's Dream (1999),"Comedy, Fantasy, Romance","Lovers' lives are complicated by city law, feuding faerie royalty, and... love."
Hercules in New York (1970),"Adventure, Comedy, Fantasy",Hercules is sent to Earth where he finds true love and starts a promising career in the bodybuilder business.
Night of the Demons (1988),"Comedy, Fantasy, Horror","Ten teenagers party at an abandoned funeral parlor on Halloween night. When an evil force awakens, demonic spirits keep them from leaving and turn their gathering into a living Hell."
The Happytime Murders (2018),"Action, Comedy, Crime","When the puppet cast of a '90s children's TV show begin to get murdered one by one, a disgraced LAPD detective-turned-private eye puppet takes on the case."
Shingeki no kyojin (2015),"Action, Adventure, Drama","In a world where giant humanoid Titans prey on humans, Eren joins the scouting legion to get revenge on the monsters who killed everyone in his town."
Star Wars: New Jedi Order (2027),"Action, Adventure, Fantasy",The plot is unknown.
One Million Years B.C. (1966),"Adventure, Comedy, Fantasy","Prehistoric man Tumak is banished from his savage tribe and meets pretty Loana, who belongs to a gentler coastal tribe, but he must fight caveman Payto to win her favors."
Warlock: The Armageddon (1993),"Action, Fantasy, Horror",An order of Druids train their children to battle an evil Warlock determined to unleash Satan upon the world by bringing a collection of five mystic rune stones together.
Cats & Dogs (2001),"Action, Adventure, Comedy","A look at the top-secret, high-tech espionage war going on between cats and dogs, of which their human owners are blissfully unaware."
Dracula: Dead and Loving It (1995),"Comedy, Fantasy, Horror",Mel Brooks' parody of the classic vampire story and its famous film adaptations.
Evil Toons (1992),"Animation, Comedy, Horror","Burt has a cleaning company and hires four women to clean an isolated house. They find an old book, a dagger and a soul shred and when one of them, Megan, reads an incantation, she unleashes an evil beast in our world."
Outside the Wire (2021),"Action, Adventure, Fantasy","In the near future, a drone pilot sent into a war zone finds himself paired with a top-secret android officer on a mission to stop a nuclear attack."
Interstate 60: Episodes of the Road (2002),"Adventure, Comedy, Drama","Neal Oliver, a very confused young man and an artist, takes a journey of a lifetime on a highway I60 that doesn't exist on any of the maps, going to the places he never even heard of, searching for an answer and his dreamgirl."
Thinner (1996),"Fantasy, Horror",An obese attorney is cursed by a gypsy to rapidly and uncontrollably lose weight.
Young Sherlock Holmes (1985),"Adventure, Fantasy, Mystery","When assorted people start having inexplicable delusions that lead to their deaths, a teenage Sherlock Holmes decides to investigate."
Toys (1992),"Adventure, Comedy, Drama","When Lieutenant General Leland Zevo (Sir Michael Gambon) inherits a toymaking company and begins making war toys, his employees band together to stop him before he ruins the name of Zevo Toys forever."
The Indian in the Cupboard (1995),"Drama, Family, Fantasy","Omri, a young boy growing up in Brooklyn, receives an odd variety of presents for his birthday: a wooden cupboard from his older brother, a set of antique keys from his mother, and a plastic Indian from his best friend, Patrick."
Waking Life (2001),"Animation, Drama, Fantasy",A man shuffles through a dream meeting various people and discussing the meanings and purposes of the universe.
Dr. Dolittle 2 (2001),"Comedy, Family, Fantasy",Dolittle must save a forest and a bear's life.
Petite maman (2021),"Drama, Fantasy",Nelly has just lost her grandmother and is helping her parents clean out her mother's childhood home. She explores the house and the surrounding woods. One day she meets a girl her age building a tree-house.
The House with a Clock in Its Walls (2018),"Comedy, Family, Fantasy",A young orphan named Lewis Barnavelt aids his magical uncle in locating a clock with the power to bring about the end of the world.
Road to Bali (1952),"Adventure, Comedy, Fantasy","Two unemployed show-biz pals accept treasure-diving work in Bali for a local princess and they find treasure, love and trouble."
"I, Frankenstein (2014)","Action, Fantasy, Sci-Fi","Frankenstein's creature finds himself caught in an all-out, centuries-old war between two immortal clans."
Premonition (I) (2007),"Drama, Fantasy, Mystery","A depressed woman learns that her husband was killed in a car accident the previous day, then awakens the next morning to find him alive and well at home; then awakens the day after that to find that he's dead."
Valhalla Rising (2009),"Action, Adventure, Drama","Forced for some time to be a fighting slave, a pagan warrior escapes his captors with a boy and joins a group of Crusaders on their quest to the Holy Land."
Inkheart (2008),"Adventure, Family, Fantasy","A teenage girl discovers her father has an amazing talent to bring characters out of their books and must try to stop a freed villain from destroying them all, with the help of her father, her aunt, and a storybook's hero."
