Bob Marley: One Love (2024),"Biography, Drama, Music",A look at the life of legendary reggae musician Bob Marley.
A Star Is Born (2018),"Drama, Music, Romance",A musician helps a young singer find fame as age and alcoholism send his own career into a downward spiral.
Whiplash (2014),"Drama, Music",A promising young drummer enrolls at a cut-throat music conservatory where his dreams of greatness are mentored by an instructor who will stop at nothing to realize a student's potential.
Tár (2022),"Drama, Music","Set in the international world of Western classical music, the film centers on Lydia Tár, widely considered one of the greatest living composer-conductors and the very first female director of a major German orchestra."
Yankee Doodle Dandy (1942),"Biography, Drama, Family","The life of the renowned musical composer, playwright, actor, dancer, and singerGeorge M. Cohan."
Amadeus (1984),"Biography, Drama, Music","The life, success and troubles ofWolfgang Amadeus Mozart, as told byAntonio Salieri, the contemporaneous composer who was deeply jealous of Mozart's talent and claimed to have murdered him."
Dirty Dancing (I) (1987),"Drama, Music, Romance","Spending the summer at a Catskills resort with her family, Frances ""Baby"" Houseman falls in love with the camp's dance instructor, Johnny Castle."
Weird: The Al Yankovic Story (2022),"Comedy, Crime, Music","Explores every facet of Yankovic's life, from his meteoric rise to fame with early hits like 'Eat It' and 'Like a Surgeon' to his torrid celebrity love affairs and famously depraved lifestyle."
La La Land (2016),"Comedy, Drama, Music","While navigating their careers in Los Angeles, a pianist and an actress fall in love while attempting to reconcile their aspirations for the future."
Chevalier (2022),"Biography, Drama, History","Based on factual story of composer Joseph Bologne, Chevalier de Saint-Georges, the illegitimate son of an African enslaved and a French plantation owner, who rises to heights in French society as a composer before an ill-fated love affair."
Baby Driver (2017),"Action, Crime, Drama","After being coerced into working for a crime boss, a young getaway driver finds himself taking part in a heist doomed to fail."
Elvis (2022),"Biography, Drama, Music","The life of American music iconElvis Presley, from his childhood to becoming a rock and movie star in the 1950s while maintaining a complex relationship with his manager, ColonelTom Parker."
School of Rock (2003),"Comedy, Music","After being kicked out of his rock band, Dewey Finn becomes a substitute teacher of an uptight elementary private school, only to try and turn his class into a rock band."
A Beautiful Life (I) (2023),"Drama, Music, Romance","Elliott, a young fisherman with an extraordinary voice, gets the chance of a lifetime when high-profile music manager Suzanne discovers him at a party."
Pitch Perfect (2012),"Comedy, Music, Romance","Beca, a freshman at Barden University, is cajoled into joining The Bellas, her school's all-girls singing group. Injecting some much needed energy into their repertoire, The Bellas take on their male rivals in a campus competition."
Green Book (2018),"Biography, Comedy, Drama",A working-class Italian-American bouncer becomes the driver for an African-American classical pianist on a tour of venues through the 1960s American South.
The Pianist (2002),"Biography, Drama, Music",A Polish Jewish musician struggles to survive the destruction of the Warsaw ghetto of World War II.
Bohemian Rhapsody (2018),"Biography, Drama, Music","The story of the legendary British rock bandQueenand lead singerFreddie Mercury, leading up to their famous performance atLive Aid(1985)."
Coco (I) (2017),"Animation, Adventure, Drama","Aspiring musician Miguel, confronted with his family's ancestral ban on music, enters the Land of the Dead to find his great-great-grandfather, a legendary singer."
Purple Hearts (2022),"Drama, Music, Romance","In spite of their many differences, Cassie, a struggling singer-songwriter, and Luke, a troubled Marine, agree to marry solely for military benefits. But when tragedy strikes, the line between real and pretend begins to blur."
The Phynx (1970),"Comedy, Music",A rock band becomes embroiled in foreign affairs when they're sent to go on tour in Albania as a cover to find hostages in a remote castle held by Communist enemies of the U.S.
Vengeance (II) (2022),"Comedy, Music, Mystery",A writer from New York City attempts to solve the murder of a girl he hooked up with and travels down south to investigate the circumstances of her death and discover what happened to her.
Almost Famous (2000),"Adventure, Comedy, Drama",A high-school boy in the early 1970s is given the chance to write a story for Rolling Stone magazine about an up-and-coming rock band as he accompanies them on their concert tour.
CODA (2021),"Comedy, Drama, Music","As a CODA (Child of Deaf Adults) Ruby is the only hearing person in her deaf family. When the family's fishing business is threatened, Ruby finds herself torn between pursuing her passion at Berklee College of Music and her fear of abandoning her parents."
Whitney Houston: I Wanna Dance with Somebody (2022),"Biography, Drama, Music","A joyous, emotional, heartbreaking celebration of the life and music ofWhitney Houston, one of the greatest female R&B pop vocalists of all time, tracking her journey from obscurity to musical super stardom."
Coyote Ugly (2000),"Comedy, Drama, Music","Aspiring songwriter Violet Sanford, after getting a job at a women-run NYC bar that teases its male patrons, comes out of her shell."
The Wedding Singer (1998),"Comedy, Music, Romance","Robbie, a singer, and Julia, a waitress, are both engaged, but to the wrong people. Fortune intervenes to help them discover each other."
Bill & Ted's Excellent Adventure (1989),"Adventure, Comedy, Music","Two rock-'n-rolling teens, on the verge of failing their class, set out on a quest to make the ultimate school history report after being presented with a time machine."
World's Best (2023),"Comedy, Family, Music","Follows Raj Patel, who is an expert at math but is also secretly obsessed with his late father's dream of becoming a rap musician, and he almost loses everything in his attempt to achieve multiple goals in life."
Soul (2020),"Animation, Adventure, Comedy","After landing the gig of a lifetime, a New York jazz pianist suddenly finds himself trapped in a strange land between Earth and the afterlife."
Forever My Girl (2018),"Comedy, Drama, Music",After being gone for a decade a country star returns home to the love he left behind.
Footloose (1984),"Drama, Music, Romance","A city teenager moves to a small town where rock music and dancing have been banned, and his rebellious spirit shakes up the populace."
The Blues Brothers (1980),"Action, Adventure, Comedy","Jake Blues rejoins with his brother Elwood after being released from prison, but the duo has just days to reunite their old R&B band and save the Catholic home where the two were raised, outrunning the police as they tear through Chicago."
"O Brother, Where Art Thou? (2000)","Adventure, Comedy, Crime","In the deep south during the 1930s, three escaped convicts search for hidden treasure while a relentless lawman pursues them."
Wayne's World (1992),"Comedy, Music",Two slacker friends try to promote their public-access cable show.
8 Mile (2002),"Drama, Music","Follows a young rapper in the Detroit area, struggling with every aspect of his life, wants to make it big but his friends and foes make this odyssey of rap harder than it may seem."
Tenacious D in The Pick of Destiny (2006),"Adventure, Comedy, Music","To become the greatest band of all time, two slacker, wannabe-rockers set out on a quest to steal a legendary guitar pick that gives its holders incredible guitar skills, from a maximum security Rock and Roll museum."
Rocketman (I) (2019),"Biography, Drama, Music",A musical fantasy about the fantastical human story ofElton John's breakthrough years.
Some Like It Hot (1959),"Comedy, Music, Romance","After two male musicians witness a mob hit, they flee the state in an all-female band disguised as women, but further complications set in."
Straight Outta Compton (2015),"Biography, Drama, History","The rap groupNWAemerges from the mean streets of Compton in Los Angeles, California, in the mid-1980s and revolutionizes Hip Hop culture with their music and tales about life in the hood."
Sound of Metal (2019),"Drama, Music",A heavy metal drummer's life is turned upside down when he begins to lose his hearing and he must confront a future filled with silence.
Walk the Line (2005),"Biography, Drama, Music","A chronicle of country music legendJohnny Cash's life, from his early days on an Arkansas cotton farm to his rise to fame with Sun Records in Memphis, where he recorded alongsideElvis Presley,Jerry Lee Lewis, andCarl Perkins."
Dirty Dancing: Havana Nights (2004),"Drama, Music, Romance","High school senior Katey moves to Havana in November 1958, when her dad gets a promotion at Ford. She meets a local waiter, who introduces her to sensual Cuban music/dance. They enter a big dance contest for the prize when he gets fired."
Climax (I) (2018),"Drama, Horror, Music","French dancers gather in a remote, empty school building to rehearse on a wintry night. The all-night celebration morphs into a hallucinatory nightmare when they learn their sangria is laced with LSD."
9 Songs (2004),"Drama, Music, Romance","In London, intense sexual encounters take place between an American college student, named Lisa, and an English scientist, named Matt, between attending rock concerts."
Trolls (2016),"Animation, Adventure, Comedy","After the Bergens invade Troll Village, Poppy, the happiest Troll ever born, and the curmudgeonly Branch set off on a journey to rescue her friends."
La pianiste (2001),"Drama, Music",A young man romantically pursues his masochistic piano teacher.
Maestro (2023),"Biography, Drama, Music","The complex love of Leonard and Felicia, from the time they met in 1946 at a party and continuing through two engagements, a 25 year marriage, and three children."
Rio (2011),"Animation, Adventure, Comedy","When Blu, a domesticated macaw from small-town Minnesota, meets the fiercely independent Jewel, he takes off on an adventure to Rio de Janeiro with the bird of his dreams."
Tarzan (1999),"Animation, Adventure, Comedy",A man raised by gorillas must decide where he really belongs when he discovers he is a human.
Saturday Night Fever (1977),"Drama, Music","Anxious about his future after high school, a 19-year-old Italian-American from Brooklyn tries to escape the harsh reality of his bleak family life by dominating the dance floor at the local disco."
Freaky Friday (2003),"Comedy, Family, Fantasy","An overworked mother and her daughter do not get along. When they switch bodies, each is forced to adapt to the other's life for one freaky Friday."
Yesterday (III) (2019),"Comedy, Fantasy, Music",A struggling musician realizes he's the only person on Earth who can rememberThe Beatlesafter waking up in an alternate reality where they never existed.
Dick Tracy (1990),"Action, Comedy, Crime",The comic strip detective finds his life vastly complicated when Breathless Mahoney makes advances towards him while he is trying to battle Big Boy Caprice's united mob.
Green Room (2015),"Crime, Drama, Horror",A punk rock band is forced to fight for survival after witnessing a murder at a neo-Nazi skinhead bar.
The Dirt (2019),"Biography, Comedy, Drama","Based on the bestselling autobiography from Mötley Crüe, the film is an unflinching tale of success and excess as four misfits rise from the streets of Hollywood to the heights of international fame."
Top Secret! (1984),"Comedy, Crime, Music",An American rock and roll singer (Val Kilmer) becomes involved in a Resistance plot to rescue a scientist (Michael Gough) imprisoned in East Germany.
The Piano (1993),"Drama, Music, Romance","In the mid-19th century a mute woman is sent to New Zealand along with her young daughter and prized piano for an arranged marriage to a farmer, but is soon lusted after by a farm worker."
Singles (1992),"Comedy, Drama, Music",A group of twenty-something friends search for love and success in grunge-era Seattle.
Grease 2 (1982),"Comedy, Music, Musical",A British student at a 1960s American high school must prove himself to the leader of a girls' gang whose members can only date greasers.
This Is Spinal Tap (1984),"Comedy, Music","Spinal Tap, one of England's loudest bands, is chronicled by film director Marty DiBergi on what proves to be a fateful tour."
Trolls Band Together (2023),"Animation, Adventure, Comedy","Poppy discovers that Branch was once part of a boy band, BroZone, with his brothers: Floyd, John Dory, Spruce, and Clay. But when Floyd is kidnapped, Branch and Poppy embark on a journey to reunite the other brothers and rescue Floyd."
Pitch Perfect 2 (2015),"Comedy, Music","After a humiliating command performance at The Kennedy Center, the Barden Bellas enter an international competition that no American group has ever won in order to regain their status and right to perform."
Eurovision Song Contest: The Story of Fire Saga (2020),"Comedy, Music","When aspiring musicians Lars and Sigrit are given the opportunity to represent their country at the world's biggest song competition, they finally have a chance to prove that any dream worth having is a dream worth fighting for."
Burlesque (I) (2010),"Drama, Music, Musical",A small-town girl ventures to Los Angeles and finds her place in a neo-burlesque club run by a former dancer.
Black Snake Moan (2006),"Drama, Music","A God-fearing bluesman takes to a wild young woman who, as a victim of childhood sexual abuse, looks everywhere for love, never quite finding it."
Flashdance (1983),"Drama, Music, Romance",A Pittsburgh woman with two jobs as a welder and an exotic dancer wants to get into ballet school.
Priscilla (II),"Biography, Drama, Music",Sofia Coppola's take on the relationship between Priscilla and Elvis Presley.
Entergalactic (2022),"Animation, Comedy, Music","Jabari, a charming, streetwear-clad artist on the cusp of real success. After a chance run-in with his cool new photographer neighbor, Meadow, Jabari has to figure out whether he can make space for love in his life."
The Bodyguard (1992),"Action, Drama, Music","A former Secret Service agent takes on the job of bodyguard to an R&B singer, whose lifestyle is most unlike a President's."
Alvin and the Chipmunks (2007),"Animation, Adventure, Comedy",Three musical chipmunks are discovered by an aspiring songwriter who wants to use their amazing singing abilities to become famous.
Sister Act (1992),"Comedy, Family, Music","When a nightclub singer is forced to take refuge from the mob in a convent, she ends up turning the convent choir into a soulful chorus complete with a Motown repertoire, until the sudden celebrity of the choir jeopardizes her identity."
Step Up (2006),"Crime, Drama, Music","Tyler Gage receives the opportunity of a lifetime after vandalizing a performing arts school, gaining him the chance to earn a scholarship and dance with an up and coming dancer, Nora."
Empire Records (1995),"Comedy, Drama, Music",Twenty-four hours in the lives of the young employees at Empire Records when they all grow up and become young adults thanks to each other and the manager. They all face the store joining a chain store with strict rules.
Begin Again (II) (2013),"Comedy, Drama, Music","A chance encounter between a down-and-out music-business executive and a young singer-songwriter, new to Manhattan, turns into a promising collaboration between the two talents."
The Doors (1991),"Biography, Drama, Music","The story of the famous and influential 1960s rock bandThe Doorsand its lead singer and composer,Jim Morrison, from his days as a UCLA film student in Los Angeles, to his untimely death in Paris, France at age 27 in 1971."
That Thing You Do! (1996),"Comedy, Drama, Music","A local Pennsylvania band scores a one-hit wonder in 1964 and rides the star-making machinery as long as they can, with lots of help from their manager."
Magic Mike XXL (2015),"Comedy, Drama, Music","Three years after Mike bowed out of the stripper life at the top of his game, he and the remaining Kings of Tampa hit the road to Myrtle Beach to put on one last blow-out performance."
Walk Hard: The Dewey Cox Story (2007),"Comedy, Music",Singer Dewey Cox overcomes adversity to become a musical legend.
"The Adventures of Priscilla, Queen of the Desert (1994)","Comedy, Music",Two drag performers and a transgender woman travel across the desert to perform their unique style of cabaret.
High Fidelity (2000),"Comedy, Drama, Music","Rob, a record store owner and compulsive list maker, recounts his top five breakups, including the one in progress."
If I Stay (2014),"Drama, Fantasy, Music","Life changes in an instant for young Mia Hall after a car accident puts her in a coma. During an out-of-body experience, she must decide whether to wake up and live a life far different than she had imagined. The choice is hers if she can go on."
Victor/Victoria (1982),"Comedy, Music, Romance","A struggling female soprano finds work playing a male female impersonator, but it complicates her personal life."
Center Stage (2000),"Drama, Music, Romance",A group of 12 teenagers from various backgrounds enroll at the American Ballet Academy in New York to make it as ballet dancers and each one deals with the problems and stress of training and getting ahead in the world of dance.
Up in Smoke (1978),"Comedy, Music","Two stoners unknowingly smuggle a van - made entirely of marijuana - from Mexico to L.A., with incompetent Sgt. Stedenko on their trail."
What's Love Got to Do with It (1993),"Biography, Drama, Music","The story of singerTina Turner's rise to stardom and how she gained the courage to break free from her abusive husband,Ike Turner."
Pitch Perfect 3 (2017),"Comedy, Music","Following their win at the world championship, the now separated Bellas reunite for one last singing competition at an overseas USO tour, but face a group who uses both instruments and voices."
Marry Me (2022),"Comedy, Music, Romance","Music superstars Kat Valdez and Bastian are getting married before a global audience of fans. But when Kat learns, seconds before her vows, that Bastian has been unfaithful, she instead decides to marry Charlie, a stranger in the crowd."
Ray (I) (2004),"Biography, Drama, Music","The story of the life and career of the legendary rhythm and blues musicianRay Charles, from his humble beginnings in the South, where he went blind at age seven, to his meteoric rise to stardom during the 1950s and 1960s."
A Night at the Roxbury (1998),"Comedy, Music, Romance","Two dim-witted brothers dream of owning their own dance club or at least getting into the coolest and most exclusive club in town, The Roxbury."
Metal Lords (2022),"Comedy, Music",Two friends try to form a heavy metal band with a cellist for a Battle of the Bands.
Dreamin' Wild (2022),"Biography, Drama, Music",Musical duo Donnie and Joe Emerson spend everything they have to produce a record in the 1970s.
Get Him to the Greek (2010),"Comedy, Music",A record company intern is hired to accompany out-of-control British rock star Aldous Snow to a concert at L.A.'s Greek Theater.
Inside Llewyn Davis (2013),"Drama, Music",A week in the life of a young singer as he navigates the Greenwich Village folk scene of 1961.
Lisztomania (1975),"Biography, Comedy, Music",Composer and pianist Franz Liszt (Roger Daltrey) attempts to overcome his hedonistic life-style while repeatedly being drawn back into it by the many women in his life and fellow composer Richard Wagner (Paul Nicholas).
A Complete Unknown (),"Biography, Drama, Music",A young Bob Dylan shakes up the folk music scene when he plugs in his electric guitar at the Newport Folk Festival in 1965.
Bill & Ted Face the Music (2020),"Adventure, Comedy, Music","Once told they'd save the universe during a time-traveling adventure, two would-be rockers from San Dimas, California find themselves as middle-aged dads still trying to crank out a hit song and fulfill their destiny."
Good Vibrations (2012),"Biography, Drama, Music","A chronicle of Terri Hooley's life, a record-store owner instrumental in developing Belfast's punk-rock scene."
Dreamgirls (2006),"Drama, Music, Musical","A trio of black female soul singers cross over to the pop charts in the early 1960s, facing their own personal struggles along the way."
Meet the Robinsons (2007),"Animation, Adventure, Comedy","Lewis is a brilliant inventor who meets mysterious stranger named Wilbur Robinson, whisking Lewis away in a time machine and together they team up to track down Bowler Hat Guy in a showdown that ends with an unexpected twist of fate."
Billy Elliot (2000),"Drama, Music",A talented young boy becomes torn between his unexpected love of dance and the disintegration of his family.
Greatest Days (2023),"Comedy, Drama, Music","A feature adaptation of the 'The Band' musical, featuring the songs of Take That."
Horton Hears a Who! (2008),"Animation, Adventure, Comedy",Horton the Elephant struggles to protect a microscopic community from his neighbors who refuse to believe it exists.
Footloose (2011),"Comedy, Drama, Music","City teenager Ren MacCormack moves to a small town where rock music and dancing have been banned, and his rebellious spirit shakes up the populace."
Sister Act 2: Back in the Habit (1993),"Comedy, Family, Music",Showgirl Deloris Van Cartier returns as Sister Mary Clarence to teach music to a group of Catholic students whose run-down school is slated for closure.
The Casino Murder Case (1935),"Crime, Music, Mystery","After socialite Lynn Llewellyn receives an anonymous threat, he is poisoned at his uncle's casino, and although he recovers, his wife is murdered by the same killer."
Pete Kelly's Blues (1955),"Crime, Drama, Music","In 1927, a Kansas City, Missouri cornet player and his band perform nightly at a seedy speakeasy until a racketeer tries to extort them in exchange for protection."
Studio 666 (2022),"Comedy, Horror, Music",Legendary rock band Foo Fighters move into an Encino mansion steeped in grisly rock and roll history to record their much anticipated 10th album.
Popstar: Never Stop Never Stopping (2016),"Comedy, Drama, Music","When it becomes clear that his solo album is a failure, a former boy band member does everything in his power to maintain his celebrity status."
Youth (I) (2015),"Comedy, Drama, Music",A retired orchestra conductor is on vacation with his daughter and his film director best friend in the Alps when he receives an invitation from Queen Elizabeth II to perform for Prince Philip's birthday.
Streets of Fire (1984),"Action, Crime, Drama","A mercenary is hired to rescue his ex-girlfriend, a singer who has been kidnapped by a motorcycle gang."
Happy Feet (2006),"Animation, Adventure, Comedy","Into the world of the Emperor Penguins, who find their soul mates through song, a penguin is born who cannot sing. But he can tap dance something fierce!"
I Used to Be Famous (2022),"Comedy, Drama, Music","Follows Vince, a desperate former popstar who dreams of making a comeback. An impromptu jam session with autistic young drummer Stevie sparks an unexpected friendship between the two misunderstood musicians."
Yoga Hosers (2016),"Action, Comedy, Horror",Two teenage yoga enthusiasts must do battle with an evil presence that is threatening to rise from its underground lair and endanger their major party plans.
Strictly Ballroom (1992),"Comedy, Drama, Music",A maverick dancer risks his career by performing an unusual routine and sets out to succeed with a new partner.
Beaches (1988),"Comedy, Drama, Music","A privileged rich debutante and a cynical struggling entertainer share a turbulent, but strong childhood friendship over the years."
Spinning Gold (2023),"Biography, Drama, Music","A biopic of 1970s record producer Neil Bogart, co-founder of Casablanca Records."
I Saw the Light (2015),"Biography, Drama, Music","The story of the country-western singerHank Williams, who in his brief life created one of the greatest bodies of work in American music. The film chronicles his rise to fame and its tragic effect on his health and personal life."
La Bamba (1987),"Biography, Drama, Music",Biographical story of the rise from nowhere of early rock and roll singerRitchie Valenswho died at age 17 in a plane crash withBuddy HollyandThe Big Bopper.
Fame (1980),"Drama, Music, Musical",A chronicle of the lives of several teenagers who attend a New York high school for students gifted in the performing arts.
Selena (1997),"Biography, Drama, Music","The true story ofSelena, a Texas-born Tejano singer who rose from cult status to performing at the Astrodome, as well as having chart-topping albums on the Latin music charts."
Nashville (1975),"Comedy, Drama, Music","Over the course of a few hectic days, numerous interrelated people prepare for a political convention."
Road to Morocco (1942),"Adventure, Comedy, Family","Two carefree castaways on a desert shore find an Arabian Nights city, where they compete for the luscious Princess Shalmar."
Across the Universe (2007),"Drama, Fantasy, History",The music ofThe Beatlesand the Vietnam War form the backdrop for the romance between an upper-class American girl and a poor Liverpudlian artist.
A Bigger Splash (2015),"Drama, Music, Thriller",A famous rock star's vacation in Italy with her boyfriend is disrupted by the unexpected visit of an old friend and his daughter.
Lords of Chaos (2018),"Biography, Drama, Horror",A teenager's quest to launch Norwegian Black Metal in Oslo in the early 1990s results in a very violent outcome.
