Love Without Walls (2023),"Drama, Music, Romance","A young married couple struggle when made suddenly homeless in this emotionally charged British drama, set in a recognisable social setting, which tells a story of love attempting to survive in the face of adversity."
Ex Drummer (2007),"Comedy, Crime, Drama",Three handicapped losers who form a band ask famous writer Dries to be their drummer. He joins the band and starts manipulating them.
Houdini (1953),"Biography, Drama, Music","From his beginnings as a ""wildman"" carnival act to the internationally famous feat of escaping from a locked trunk in an ice-jammed river, the greatHarry Houdiniemerged as the world's most captivating magician and escape artist."
The Maltese Falcon (1931),"Crime, Drama, Film-Noir","A lovely dame with dangerous lies employs the services of a private detective, who is quickly caught up in the mystery and intrigue of a statuette known as the Maltese Falcon."
Forty Shades of Blue (2005),"Drama, Music, Romance",A Russian woman living in Memphis with a much older rock-'n'-roll legend experiences a personal awakening when her husband's estranged son comes to visit.
Untitled George Gershwin Project (),"Biography, Drama, Music",A chronicle of the life of the famed Broadway composer and pianist.
Confetti (2006),"Comedy, Music, Romance",A mockumentary that follows three couples as they battle it out to win the coveted title of 'Most Original Wedding of the Year'.
Sho o suteyo machi e deyô (1971),"Drama, Music","An angst-ridden teen dealing with his dysfunctional family hits the streets. The story is inter-cut with various psychedelic, energetic vignettes."
A Song Is Born (1948),"Comedy, Music, Musical","With her gangster boyfriend under investigation by the police, a nightclub singer hides out in a musical research institution staffed by bachelor professors - one of whom begins to fall for her."
Creation Stories (2021),"Biography, Drama, Music",Creation Stories tells the unforgettable tale of infamous Creation Records label head Alan McGee; and of how one written-off young Glaswegian upstart rose to irrevocably change the face of British culture.
Boys Town (1938),"Biography, Drama, Family","When a death row prisoner tells him he wouldn't have led a life of crime if only he had had one friend as a child, Father Edward Flanagan decides to start a home for young boys."
Carmen (I) (1983),"Drama, Music, Romance","A group of flamenco dancers are rehearsing a very Spanish version of Bizet's dramatization of Prosper Merimee's novella Carmen. The choreographer Antonio falls in love with Carmen, the main...See full summary»"
Leningrad Cowboys Go America (1989),"Comedy, Music",Siberian rock band Leningrad Cowboys go to the USA in pursuit of fame.
My Man Godfrey (1957),"Comedy, Music, Mystery","The spoiled daughter of a rich American family hires as butler an Austrian vagrant she finds on a pier, without knowing that he illegally jumped ship."
Permanent Record (1988),"Drama, Music, Romance","A man who seemingly has it all together, being smart, talented, funny, and popular, is secretly overwhelmed by expectations of himself and those of his parents, and suffers what is assumed to be a horrible accident."
Masked and Anonymous (2003),"Comedy, Drama, Music","A singer, whose career has gone on a downward spiral, is forced to make a comeback to the performance stage for a benefit concert."
The Competition (1980),"Drama, Romance, Music","Paul Dietrich, at almost 30 years old, is a fading piano prodigy. Heidi Schoonover is a talented young pianist with a promising future. When Paul hears of an upcoming competition that could make his career, he dedicates himself to winning."
Hello Again (I) (2017),"Drama, Music, Musical",Ten lost souls slip in and out of one another's arms in a daisy-chained exploration of love's bittersweet embrace.
The Prisoner of Zenda (1952),"Adventure, Music, Mystery","An Englishman vacationing in a Ruritarian kingdom is recruited to impersonate his cousin, the soon-to-be-crowned king, after the monarch is drugged and kidnapped."
Nina (I) (2016),"Biography, Drama, Music","The story of the late jazz musician and classical pianistNina Simone, including her rise to fame and relationship with her manager Clifton Henderson."
Kansas City (1996),"Crime, Drama, Music",A pair of kidnappings expose the complex power dynamics within the corrupt and unpredictable workings of 1930s Kansas City.
The Song of Sway Lake (2018),"Drama, Music, Romance","Music collector Ollie Sway recruits his only friend, a rowdy Russian drifter, to help him steal a 78 record from his own family's estate."
I Never Sang for My Father (1970),"Drama, Music",A man living in the towering shadow of his aging father finds it difficult to start a new chapter in his life by marrying his girlfriend and moving to California.
Unfaithfully Yours (1984),"Comedy, Music, Romance",A composer suspects his wife of cheating. He plots to kill her and frame it on her lover.
Ils se marièrent et eurent beaucoup d'enfants (2004),"Comedy, Drama, Music",Is the love compatible with coupledom? And what of freedom and fidelity? These are some of the questions facing two married men.
The Good Night (2007),"Comedy, Drama, Fantasy","A former pop star who now writes commercial jingles for a living, experiences a mid-life crisis."
That'll Be the Day (1973),"Drama, Music","Musical drama set in the 1950s ,starring David Essex and Ringo Starr, loosely-based on John Lennon's early years. A gifted but wayward young man finally discovers a sense of purpose when he decides to turn his love of music into a career."
200 Motels (1971),"Comedy, Fantasy, Music","The great Frank Zappa's outrageous psychedelic precursor to today's music videos features ""The Mothers of Invention"" wreaking havoc in a typical American town. Ringo Starr narrates."
Roxanne Roxanne (2017),"Biography, Drama, Music","In the late 80s/ early 1990s, the most feared battle MC in Queens, New York, was a fierce teenage girl with the weight of the world on her shoulders. At the age of 14, Lolita ""Roxanne ...See full summary»"
Tango Shalom (2021),"Comedy, Family, Music","A Tango dancer and a rabbi develop a plan to enter a dance competition without sacrificing his orthodox beliefs. Family, tolerance, and community are tested one dazzling dance step at a time."
The Trial of Billy Jack (1974),"Action, Drama, Music","After Billy Jack in sentenced to four years in prison for the ""involuntary manslaughter"" of the first film, the Freedom School expands and flourishes under the guidance of Jean Roberts. The...See full summary»"
Livet är en schlager (2000),"Comedy, Drama, Music","Mona Bergström is a sweet Melodifestivalen-obsessed woman in her 30's. She is married to an unemployed man and they have 4 daughters, all named after her favorite Swedish Melodifestivalen ...See full summary»"
Eegah (1962),"Adventure, Comedy, Fantasy","Teenagers stumble across a prehistoric caveman, who goes on a rampage."
Gidget Goes Hawaiian (1961),"Comedy, Music, Romance","Southern Californian surf bums Francie Lawrence and Jeff Matthews - Gidget and Moondoggie to their friends - have just gotten pinned. Jeff is home from college for the summer, so he and ...See full summary»"
Get Crazy (1983),"Comedy, Music",Mega-promoter Colin Beverly plans to sabotage the New Year's 1983 concert of small-time operator Max Wolfe. Wolfe's assistants Neil Allen and Willie Loman find romance while trying to save ...See full summary»
Hellzapoppin' (1941),"Action, Comedy, Music","Olsen and Johnson, a pair of stage comedians, try to turn their play into a movie and bring together a young couple in love, while breaking the fourth wall every step of the way."
Alice's Restaurant (1969),"Comedy, Drama, Music",A cinematic adaption of Arlo Guthrie's classic song story.
Stoned (2005),"Biography, Drama, Music","A chronicle of the sordid life and suspicious death of Rolling Stones co-founder Brian Jones, who was found in the bottom of his swimming pool weeks after being let go from the band."
En dag kommer allt det här bli ditt (2023),"Comedy, Drama, Music","Successful cartoonist Lisa and her siblings gather at their parents' farm for the first time in over ten years. The parents want only one of them to inherit the forest, which has been in the family's possessions for generations."
Lara (2019),"Drama, Music","It's Lara's 60th birthday, and this very evening, her son will be giving his debut piano concert. Lara mapped out his musical career. But Lara is not welcome at his debut performance. Even if Lara engages, everything gets out of control."
Leviatán (1984),"Horror, Music",A rock star returns to his childhood home to shoot a music video while a pack of wild dogs are on the loose killing off the local residents.
Strings (I) (2015),"Drama, Music","Josh, a talented DJ, comes to a small town, where he finds love, and a friend. A place he never would have thought he'd belong."
Secret Superstar (2017),"Drama, Music",A talented teenage singer-songwriter living amid domestic abuse becomes a YouTube sensation after a video in which she hides her identity goes viral.
The Phantom of the Opera (1962),"Drama, Horror, Music",An acid-scarred composer has his dwarf helper bring an opera singer to his London sewer hide-out.
Cosi (1996),"Comedy, Drama, Music",Lewis is a young Sydney amateur theater director at his first experience: he is offered a job with a Governmental program for the rehabilitation of mentally ill patients in a Sydney ...See full summary»
Black Is King (2020),"Adventure, Drama, Fantasy",Visual album from Beyoncé inspired by 'The Lion King'.
Sparkle (1976),"Drama, Music","Three sisters form a singing group in 1950s Harlem, but success threatens to ruin their relationship forever."
Vi är bäst! (2013),"Drama, Music",Three girls in 1980s Stockholm decide to form a punk band -- despite not having any instruments and being told by everyone that punk is dead.
Death of a Ladies' Man (2020),"Comedy, Drama, Music","A carousing college professor's life takes a series of unimaginable turns, and all the old stories are given a new twist, when he begins to have surreal hallucinations and learns he may not be long for this world."
Anita (2021),"Biography, Drama, History","Traces the life of Anita Mui, Hong Kong's legendary Cantopop star."
Dead Ant (2017),"Comedy, Horror, Music","When the 1989 ""one-hit-wonder"" glam-metal band ""Sonic Grave"" embark on a trip to Coachella in hopes of a comeback, their peyote trip pit stop in Joshua Tree incites an ""unworldly"" viscous attack, and they must ""rock"" themselves out of harms way."
Nadie sabe que estoy aquí (2020),"Drama, Music","Memo lives on a remote Chilean sheep farm, hiding a beautiful singing voice from the outside world. A recluse with a glittery flair, he can't stop dwelling on the past, but what will happen once someone finally listens?"
Why Do Fools Fall in Love (1998),"Biography, Drama, Music","Three women each claim to be the widow of 1950s doo-wop singer Frankie Lymon, claiming legal rights to his estate."
Le concert (2009),"Comedy, Drama, Music","Thirty years ago Bolshoi Orchestra conductor Andreï Filipov was fired for hiring Jewish musicians. Now a lowly janitor, an opportunity arises to gather his old musicians to go and pose as the official Buolshoi orchestra in Paris."
The Man I Love (1946),"Drama, Film-Noir, Music","A homesick, no-nonsense, lounge singer decides to leave New York City to spend some time visiting her two sisters and brother on the West Coast, and eventually falling in love with down-and-out ex-jazz pianist."
De battre mon coeur s'est arrêté (2005),"Crime, Drama, Music","Will Thomas still lead a life of crime and cruelty, just like his thuggish father, or will he pursue his dream of becoming a pianist?"
Chôjikû Yôsai Macross: Ai Oboeteimasuka (1984),"Animation, Action, Adventure","Earth braces for an invasion of giant male bionoids and their enemy, giant female bionoids."
Another Thin Man (1939),"Comedy, Crime, Music",An explosives manufacturer suspects a young man is out to kill him. He calls in new parents Nick and Nora to sort things out.
One Way Passage (1932),"Comedy, Drama, Music","A terminally ill woman and a debonair murderer facing execution meet and fall in love on a trans-Pacific crossing, each without knowing the other's secret."
Stormy Weather (1943),"Comedy, Drama, Music",The relationship between an aspiring dancer and a popular songstress provides a retrospective of the great African-American entertainers of the early 1900s.
Gumby 1 (1995),"Animation, Adventure, Comedy","In this offshoot of the 1950s ""claymation"" cartoon series, the crazy Blockheads threaten to ruin Gumby's benefit concert by replacing the entire city of Clokeytown with robots."
Rock Around the Clock (1956),"Comedy, Music, Romance","Orchestra manager Steve Hollis realizes that big-band music is dead. People want something new, but what? On their way to New York, Steve and his companion Corny, stop at a motel in a small...See full summary»"
Hard to Hold (1984),"Drama, Music","A famous rock star falls in love with a child psychologist who has ears only for the classics, and has never heard of him."
Tapeheads (1988),"Comedy, Music",A couple of creative losers accidently become big shots in the video music industry.
Don't Come Knocking (2005),"Drama, Music","An aging cowboy movie star deserts a film set and tries to reconnect with his mother, whom he hasn't seen in thirty years, only to learn that he has a child he never knew about."
Rebecca of Sunnybrook Farm (1938),"Comedy, Drama, Family",Rebecca's Uncle Harry leaves her with Aunt Miranda who forbids her to associate with show people. But neighbor Anthony Kent is a talent scout who secretly set it up for her to broadcast.
Hollywood Story (1951),"Crime, Drama, Film-Noir",An independent producer unwisely opens a can of worms after he decides to make a movie about the unsolved murder of a famous silent film director in 1929.
Amar Akbar Anthony (1977),"Action, Comedy, Drama","Three brothers are separated and united after many years - one is brought up a Hindu, another a Muslim and the last (and most memorable) a Christian. Hilarity and adventure ensues."
Caught (1949),"Crime, Drama, Film-Noir",An ambitious young LA department store model gets her wish of marrying a millionaire but she eventually discovers that rich life isn't always a happy one.
"Like Sunday, Like Rain (2014)","Drama, Music","Surrounded by wealth and living with abundant resources in Manhattan, 12-year-old cello prodigy Reggie, lives a solitary life lacking only frequently absent parents and friends. Estranged from family, having slacker boyfriend troubles, and fired from her waitressing job, sometimes musician 23-year-old Eleanor needs a new place to live and a new job."
The Adventures of Tom Sawyer (1938),"Adventure, Drama, Family","Tom Sawyer and his pal Huckleberry Finn have great adventures on the Mississippi River, pretending to be pirates, attending their own funeral and witnessing a murder."
Awaken (I) (2018),"Drama, Music","Executive produced by cinema pioneers Terrence Malick and Godfrey Reggio, AWAKEN is a celebration of the spirit of life, an exploration of the Earth, and an ode to the Cosmos."
Broken Bridges (2006),"Drama, Music","A fading country music star (Keith) returns to his hometown, where he reunites with his childhood sweetheart and also meets his 16-year-old daughter for the first time."
There's Always Woodstock (2014),"Comedy, Music, Romance","Aspiring singer, Catherine Brown finds herself living a life she never imagined"
La captive (2000),"Drama, Music, Romance","An adaptation of Proust's ""La Prisoniere"" (book five of ""Remembrance of Things Past""). Set in Paris, France, it is a serious tale of a tragic and dysfunctional love."
San Francisco (1936),"Drama, Music, Romance","A Barbary Coast saloonkeeper and a Nob Hill impresario are rivals for the affections of a beautiful singer, both personally and professionally, in 1906 San Francisco."
Street Dancer 3D (2020),"Drama, Music","Two rival dance groups from India and Pakistan who are always competing against each other, join forces when it comes to competing at an international dance competition."
Yim ji kau (1987),"Drama, Fantasy, Music","Fleur is the blue angel in one of Hong Kong's ""flower houses"" - bordellos and night clubs of the 1930s. A detached and beautiful performer, she falls in love with Twelfth Master Chan, heir ...See full summary»"
Der Fan (1982),"Drama, Horror, Music",The hero-worship that Simone has for a pop singer is built to a crescendo until she passes out when she finally sees him up-close in a crowd of fans. She is later shocked when he lets her know that he does not love her.
Suck (2009),"Comedy, Horror, Music",A comedy centered on a rock 'n' roll band that will do anything to become famous.
Shock 'Em Dead (1991),"Horror, Thriller, Music",Martin is a total loser who makes a deal with the devil to become the greatest rock star in the world.
Rock Dog 2 (2021),"Animation, Adventure, Comedy","When Bodi and his band 'True Blue' leave Snow Mountain, to tour with pop sensation, Lil' Foxy, they learn that fame comes at a price."
5 Fingers (1952),"Crime, Drama, Music",During WWII the valet to the British Ambassador to Ankara sells British secrets to the Germans while trying to romance a refugee Polish countess.
Shall we dansu? (1996),"Comedy, Drama, Music",A successful but unhappy Japanese accountant finds the missing passion in his life when he begins to secretly take ballroom dance lessons.
American Dreamz (2006),"Comedy, Music",A popular television music talent competition hosted by a pompous egomaniac becomes the setting for an assassination attempt when the President of the United States becomes a celebrity judge in an attempt to rehabilitate his image.
It Happened on Fifth Avenue (1947),"Comedy, Music, Romance",Two homeless men move into a mansion while its owners are wintering in the South.
The Disciple (2020),"Drama, Music","Self-doubt, sacrifice and struggle converge into an existential crisis for a devoted classical vocalist as the mastery he strives for remains elusive."
Du levande (2007),"Comedy, Drama, Music","You, the Living is a film about humankind, its greatness and its baseness, joy and sorrow, its self-confidence and anxiety, its desire to love and be loved."
Shout (1991),"Drama, Music, Romance",A new music teacher in a 1955 West Texas home for wayward boys brings new vision and hope for many of the interned boys.
Our Wife (1941),"Comedy, Music, Romance","Jerry Marvin, a talented musician and composer, wallows in drunken self-pity after he is divorced by his wife Babe. Along comes new love Susan, who rescues Jerry and provides him with fresh...See full summary»"
Sex & Drugs & Rock & Roll (2010),"Biography, Drama, Music","A biography of Ian Dury, who was stricken with polio at a young age and defied expectations by becoming one of the founders of the punk-rock scene in Britain in the 1970s."
Grace of My Heart (1996),"Comedy, Drama, Music","Edna wins a recording contract singing her own song at a competition in 1958. After trying to make it as a singer/songwriter for 11 months in NYC, she has success writing songs for others at the Brill Building."
Rock On!! (2008),"Drama, Music",Four friends reunite to relive their moments of glory as a rock band.
StreetDance 2 (2012),"Drama, Music, Romance","After suffering humiliation by the crew Invincible, street dancer Ash (Hentschel) looks to gather the best dancers from around the world for a rematch."
StreetDance 3D (2010),"Drama, Music, Romance","In order to win the Street Dance Championships, a dance crew is forced to work with ballet dancers from the Royal Dance School in exchange for rehearsal space."
Lady of Burlesque (1943),"Comedy, Music, Mystery","After one member of their group is murdered, the performers at a burlesque house must work together to find out who the killer is before he strikes again."
I Could Go on Singing (1963),"Drama, Music","Jenny Bowman is a successful singer who visits David Donne to see her son Matt again, spending a few glorious days with him while his father is away in Rome in an attempt to attain the family that she never had."
The Prisoner of Zenda (1937),"Adventure, Drama, Music","An Englishman on a Ruritarian holiday must impersonate the king when the rightful monarch, a distant cousin, is drugged and kidnapped."
Design for Living (1933),"Comedy, Music, Mystery","A woman cannot decide between two men who love her, and the trio agree to try living together in a platonic friendly relationship."
Parting Glances (1986),"Drama, Music, Romance","As Michael and Robert, a gay couple in New York, prepare for Robert's departure for a two-year work assignment in Africa, Michael must face Robert's true motives for leaving while dealing ...See full summary»"
Sora no aosa o shiru hito yo (2019),"Animation, Drama, Family",Second-year high school student Aoi Aioi is an aspiring musician. Her older sister Akane's ex-boyfriend Shinnosuke Kanomura is a struggling guitarist. Aoi and Akane's parents passed away in...See full summary»
The Thin Man Goes Home (1944),"Comedy, Crime, Film-Noir","Nick and Nora head to Nick's hometown of Sycamore Springs to spend some time with his parents. His father, a prominent local physician, was always a bit disappointed with Nick's choice of ...See full summary»"
Mother's Little Helpers (2019),"Comedy, Drama, Family","The millennial children of a groovy 70s burnout come home to do right by a mom who always did them wrong. Based on true lies, it explores the ""OK, Boomer"" relationship between the free love generation and those left to clean up the mess."
Cinderela Pop (2019),"Family, Music, Romance","After her parents divorce, Cintia moves to her aunt Helena and begins to dream of becoming a DJ. When matters of the heart will stand between her and her objectives, Cintia's career will take an unexpected turn."
Radioactive Dreams (1984),"Action, Adventure, Comedy","After a nuclear war, Phillip Hammer and Marlowe Chandler have spent fifteen years on their own in a bunker, stuffed with junk from the 40s and old detective novels. Now, nineteen-years-old,...See full summary»"
Rock 'n' Roll Nightmare (1987),"Comedy, Horror, Music","At a farmhouse in the middle of nowhere, a hopeful hair-metal band seeking inspiration to record their upcoming new LP will soon find themselves in a furious confrontation against the Prince of Darkness himself."
Love Me or Leave Me (1955),"Biography, Drama, Music","A fictionalized account of the career of jazz singerRuth Ettingand her tempestuous marriage to gangster Marty Snyder, who helped propel her to stardom."
Just the Way You Are (1984),"Comedy, Music, Romance","A disabled musician thinks people treat her differently because of her disability, so she goes to a ski resort with her leg in a cast to test this theory."
One More Time (2015),"Comedy, Drama, Music",A New York City crooner plots his comeback.
Vicious Lips (1986),"Horror, Music, Sci-Fi","Sometime in the distant future, a fledgling band gets an opportunity for a breakthrough, if they can make it in time to a faraway planet to perform in a very popular club."
Downtown 81 (2000),"Comedy, Drama, Music","After being released from the hospital, the artistJean Michel Basquiatwanders around Manhattan trying to sell art to make money and find a place to stay."
Duran Duran: A Hollywood High (2022),Music,"Duran Duran's live show becomes immortalized on the big screen. Featuring exclusive new interviews, behind-the-scenes video and unseen archival footage, the film celebrates the band's four-decade-long career."
Fingers (1978),"Crime, Drama, Music",A dysfunctional young man is pulled between loyalties to his Italian mob-connected loan-shark father and his mentally-disturbed Jewish concert-pianist mother.
Nerosubianco (1969),"Comedy, Fantasy, Music","A taboo-smasher of the late '60s, featuring interracial affairs, anti-Vietnam statements, violence versus sex. Take a whirlwind trip with a married woman whose journey through the ...See full summary»"
Teacher's Pet (2004),"Animation, Adventure, Comedy","Spot (Lane) is a dog who can talk and read. Posing as a human, he sneaks into school with his master Leonard (Flemming). Educational adventures ensue."
Salsa (1988),"Music, Romance","As a young East Los Angeles Latino pursues his dream of becoming a great Salsa dancer, he is enraged to learn that his little sister is romantically involved with his best friend."
Punk's Dead: SLC Punk 2 (2016),"Adventure, Comedy, Music",A young punk's odyssey.
Jekyll and Hyde... Together Again (1982),"Comedy, Music, Sci-Fi","Dr Daniel Jekyll researching into drugs that would help mankind avoid surgery discovers a white powder that unleashes the animal in every man, and in his case turning him from a shy and ...See full summary»"
Rock 'n' Roll High School Forever (1991),"Comedy, Music","Those rambunctious kids are back in school and back in trouble in a smash sequel to the 1978 worldwide hit. Corey Feldman leads a rock and roll rally at Ronald Reagon High, but must triumph...See full summary»"
Shakedown (1950),"Crime, Drama, Film-Noir","Unscrupulous and opportunistic San Francisco news media photographer Jack Early steps on and uses folks to get ahead, but in the end he tangles with the wrong people."
Girl in Gold Boots (1968),"Crime, Drama, Music","A young woman leaves her job as a waitress and travels to Los Angeles, where she strives to become the top star in the glamorous world of go-go dancing."
Shigatsu wa kimi no uso (2016),"Drama, Music, Romance",A piano prodigy who lost his ability to play after suffering a traumatic event in his childhood is forced back into the spotlight by an eccentric girl with a secret of her own.
