Sleeping Beauty,"Family, Fantasy, Musical","Feature-length, live-action musical version of the classic fairy tale by Charles Perrault."
Neptune's Daughter,"Comedy, Musical, Romance","A swimsuit fashion designer is determined to protect her scatterbrained sister from a South American heartbreaker, but a case of mistaken identity complicates matters."
Bathing Beauty,"Comedy, Musical","A contrived misunderstanding leads to the breakup of a songwriter and his fiancée. She returns to work as a gym teacher at an all-girls school, but a legal loophole allows the man to enroll as one of her students."
Looking for Love,Musical,"After being in Hollywood for a month with lots of compliments but no offers, girl-next-door Libby Caruso decides to give up on her singing career and focus on fulfilling her destiny of ...See full summary»"
Country Crush,"Drama, Family, Music",Small town mechanic meets aspiring country singer. Is it love at first sight for this young adult couple or just mutual attraction in a musical without warning?
King of Jazz,"Animation, Comedy, Musical",American Pre-Code color film starring Paul Whiteman and his Jazz orchestra.
Felix the Cat: The Movie,"Animation, Adventure, Comedy","In another dimension, the villainous scientist Duke of Zill, with the help of his mechanical, geometric army, takes over the Land of Oriana, prompting Felix the Cat to save its princess and restore order once again."
Pakeezah,"Musical, Romance, Drama","In Lucknow at the turn of the century, a dancer and courtesan believes that her pure soul and body will enable her to find true love and honor."
Sagara Sangamam,"Drama, Music, Musical","A classical dancer, Balakrishna, faces many struggles, but is eventually redeemed."
Zubeidaa,"Biography, Drama, History","Zubeidaa, an aspiring Muslim actress, marries a Sikh prince to become his second wife. Her tumultuous relationship with her husband, and her inner demons lead her to a decision which has fatal consequences for them all."
"Red, Hot and Blue","Comedy, Crime, Musical","An aspiring actress finds herself in a jam when a gangster, who is backing the show she is in, is found dead in her apartment."
State Property 2,"Musical, Action, Crime","Three Philadelphia-based gangstas -- Beans, Dame and Loco -- are on a collision course with one another for turf. Alliances are forged and broken and lifelong friendships end in violence as each crime lord schemes to get the upper hand."
Live Spectacle Naruto: Song of the Akatsuki,"Action, Fantasy, Musical","Based on the events of Naruto Shippuden, Team Kakashi finds a clue regarding Orochimaru and Sasuke's whereabouts. Little does he know the Akatsuki are after him with plans to extract the Nine-Tailed fox from his body."
Dead Pigs,"Comedy, Drama, Family","A bumbling pig farmer, a feisty salon owner, a sensitive busboy, an expat architect and a disenchanted rich girl converge and collide as thousands of dead pigs float down the river towards a rapidly-modernizing Shanghai."
Thank Your Lucky Stars,"Comedy, Musical","Two producers are putting together a wartime charity show with an all-star cast, but the egotism of radio personality Eddie Cantor disrupts their plans."
Naya Daur,"Action, Drama, Musical","When the son of a landlord decides to modernize his business by replacing the horse carts with buses, a horse cart rider decides to challenge him."
Words and Music,"Biography, Comedy, Musical",Musical biography chronicling the songwriting partnership ofRichard RodgersandLorenz Hart.
Vivah,"Drama, Musical, Romance","Poonam, a traditionally brought-up young woman, is to marry Prem, a groom chosen by her uncle. Poonam and Prem's faith and love are to be tested however, when an accident occurs and Poonam might be scarred for life."
Sailor Beware,"Comedy, Musical, Romance","Although allergic to kissing girls, Seaman Melvin Jones, through a fluke TV appearance, gets the undeserved reputation of a great kisser dubbed ""Mr. Temptation"" and is pursued by amorous young females."
Madhumati,"Fantasy, Musical, Mystery","A young man takes shelter in a mansion when a landslide blocks his route to the railway station. Then, he finds the mansion familiar and soon learns about the story of his previous birth."
Thelma the Unicorn,"Animation, Adventure, Comedy","When a rare pink and glitter-filled moment of fate makes Thelma the Pony's wish of being a unicorn come true, she rises to instant international pop-superstar stardom, but at an unexpected cost."
So Dear to My Heart,"Animation, Drama, Family",This heartwarming classic tells the tale of a country boy who adopts a mischevious black lamb and learns valuable lessons about love and dedication.
Sekai meisaku dôwa: Hakuchô no mizûmi,"Animation, Adventure, Family","A prince falls in love with a princess cursed to change into a swan by day, but their love is threatened by the sorcerer who keeps her imprisoned."
Mother India,"Action, Comedy, Drama","In this melodrama, a poverty-stricken woman raises her sons through many trials and tribulations. But no matter the struggles, she always sticks to her own moral code."
Yaadein...,"Musical, Drama, Romance","Raj is against love marriages and when his daughter Isha falls in love with Ronit Malhotra, he opposes their relationship. Will Ronit and Isha sacrifice their love for the sake of their parents or will they manage to convince them?"
Salaam-E-Ishq,"Comedy, Drama, Musical","Six couples in love must face different problems caused by love itself. Do they resolve their issues and face life anew, or do they succumb under pressure ?"
At War with the Army,"Comedy, Musical, War","Alvin Corwin is low man on the totem pole, and goes from one mishap to another at an army training camp in World War II."
Disco Dancer,"Drama, Musical, Romance","After years of honest work a talented amateur singer becomes a famous professional, but an old enemy of his family is envious of his success."
Khan kluay,"Animation, Adventure, Family","A young elephant goes on an extraordinary adventure and learns important lessons along the way about friendship, love and courage."
Alice Müzikali,"Fantasy, Musical","Alice, feeling stuck in her life, obeys the call of a mobile application and dives into a virtual world by following the White Rabbit."
Imaginaerum,"Drama, Fantasy, Musical","A coma sends an old man into his childhood's sinister fantasy world, where he must fight dementia and gain back his memories before it's too late."
La flor,"Drama, Fantasy, Musical","A film in six episodes, connected by the same four actresses, full of various subplots that play with narrative and different cinematic genres , everything structured in an unusual way."
Manifest Destiny Down: Spacetime,"Comedy, Musical, Romance",An awkward physics genius and an ex-Catholic sorority girl wake up after blacking out Halloween night to discover they missed the evacuation of Earth. A mystery agent pursues their Theory of Everything as they try to save humanity from AI.
Movie Movie,"Comedy, Musical, Sport","Three movie genres of the 1930s--boxing films, World War I aviation dramas, and backstage Broadway musicals--are satirized using the same cast."
Soldier,"Action, Drama, Musical",The story follows a young man (Bobby Deol) who flees India and arrives in Australia seeking vengence for something that started in India. In Australia he meets and falls in love with the daughter of a rich and powerful man(Suresh Oberoi). The story keeps the covers on Bobby Deols plan until the end when everything is revealed as to why he is a SOLDIER.
Yuvvraaj,"Comedy, Drama, Musical",Two estranged brothers must learn to work together to claim their rightful share of an inheritance left solely to their eldest sibling.
Buddha Mil Gaya,"Musical, Mystery, Drama","Two men, who have sheltered a millionaire, get drawn into a web of conspiracy."
With a Song in My Heart,"Biography, Drama, Musical",A talented singer's musical career begins to soar.
Junoon,"Drama, Horror, Musical","Tells the story of Vikram (Rahul Roy), who after nearly getting killed by a cursed tiger starts to transform into a tiger himself every fullmoon and hunts for prey."
Fast Forward,"Drama, Musical",Eight small-town teens travel to New York City for a one-in-a-million shot at stardom in a national dance competition.
A Date with Judy,"Comedy, Musical, Romance","Hyperactive teenager Judy Foster (Jane Powell) challenges, and is challenged by, her overly-proper parents, pesky brother Randolph (Jerry Hunter), and boyfriend Ogden ""Oogie"" Pringle (Scotty Beckett)."
Kiraware Matsuko no isshô,"Comedy, Drama, Musical","When Matsuko dies of murder, her nephew Sho gets to progressively unveil many details of her mysterious past, discovering she wasn't only a forgotten outcast but led a very interesting yet bizarre life."
Rangeela,"Comedy, Drama, Musical","A middle class young woman, who dreams of Bollywood fame, is caught in a love triangle between her childhood friend and a famous actor."
Oh! Calcutta!,"Comedy, Musical","Based on the controversial off-Broadway musical comedy revue, ""Oh! Calcutta! is a series of musical numbers about sex and sexual mores. Most of the skits feature one or more performers in ...See full summary»"
The Barkleys of Broadway,"Comedy, Music, Musical",A married musical team splits up so the wife can become a serious actress.
Honeydripper,"Crime, Drama, History","1950. Rural Alabama. Cotton harvest. It's a make-or-break weekend for the Honeydripper Lounge and its owner, piano player Tyrone ""Pine Top"" Purvis. Deep in debt to the liquor man, the ...See full summary»"
Take Me High,"Comedy, Musical, Romance","Merchant banker Tim, excited to hear he's to go to New York, is sent to Birmingham instead to pressure a small struggling restaurant. But he turns this into a positive by falling in love ...See full summary»"
The Little Colonel,"Comedy, Family, Music","In the post-Civil war south, a darling little girl attempts to restore the peace between her parents and her plantation owner grandfather."
Walking My Baby Back Home,"Comedy, Musical","World War II veteran Clarence ""Jigger"" Millard forms a band with several other former GIs. The band fails to take off and he is forced to join a minstrel show headed by Colonel Wallace. He soon falls for Wallace's niece Chris Hall."
Chithram,"Comedy, Drama, Musical",A woman hires a stranger to pose as her husband because she doesn't want her ailing father to know that her fiance broke their engagement.
Rumpelstiltskin,"Fantasy, Family, Musical","A musical version of the classic story about a miller's daughter who receives help from a mischievous dwarf, then ends up over her head. Now, she and a mute servant girl may be the only hope for her baby son, John."
Áfram Latibær,Musical,An athletic elf inspires indolent kids to take on healthier lifestyles and compete in a sports competition.
Yaarana,"Action, Comedy, Drama","Bishan loses his fortune while helping his friend Kishan in his singing career. Now successful, would Kishan return the favour?"
Yeh Ballet,"Drama, Musical","Discovered by an eccentric ballet master, two gifted but underprivileged Mumbai teens face bigotry and disapproval as they pursue their dancing dreams."
Ishq,"Action, Comedy, Drama","Two rich friends, hating the poor, were challenged by their children's love lives. Thus starts the war between love and money."
At the Circus,"Comedy, Musical",The Marx Brothers try to help the owner of a circus recover some stolen funds before he finds himself out of a job.
The Caddy,"Comedy, Musical, Sport","Although gifted golfer Harvey Miller is too nervous to golf in public tournaments, he acts as coach and caddy for friend Joe Anthony."
Le magasin des suicides,"Animation, Comedy, Musical",A family-run shop that sells everything you need to take your own life finds it hard to focus on business after a new baby -- one who makes everyone around him happy -- is born into the family.
Haathi Mere Saathi,"Drama, Family, Musical","Orphaned Raju, in the company of four elephants, has to perform with them at street corners, in order to keep alive. Slowly he amasses a fortune, and is able to build his own private zoo, ...See full summary»"
Diana,"Biography, Drama, Musical","The dazzling and devastating life of Princess Diana takes center stage in this original musical, filmed in advance of its official Broadway opening."
Snoopy Come Home,"Animation, Adventure, Comedy","When Snoopy receives a letter from a girl named Lila, who's in a hospital, he goes on a journey with Woodstock to see her."
The Gang's All Here,"Music, Musical, Romance",A soldier falls for a chorus girl and then experiences trouble when he is posted to the Pacific.
Tomorrow Morning,Musical,"Director Nick Winston said: ""Tomorrow Morning is the story of one couple seen in two separate timelines, a decade apart. This is a story of life, love, misunderstanding and hope... a universal and timeless tale"""
Alice in Wonderland,"Animation, Adventure, Family",This exceptional theatrical version of Lewis Carroll's 1865 classic features a combination of live characters and stop-motion animation.
The Sound of Christmas,Musical,A woman facing eviction just before Christmas who must navigate budding romantic feelings for a handsome billionaire when she takes a job nannying for his two children right before Christmas.
La reine des pommes,"Comedy, Drama, Musical","Adele's attempt to recover from a devastating breakup leads to surprisingly hilarious results as she bounces from one lover to the next, but can't escape the vision of her ex. France. Official Selection - Locarno Int'l FF."
Cenerentola '80,"Drama, Fantasy, Musical","In this contemporary retelling of the Cinderella story, a feisty 18-year-old Italian-American New Yorker named Cindy is sent off to Rome with her irascible stepmother and vain stepsisters. ...See full summary»"
Zachariah,"Comedy, Drama, Musical",Two gunfighters separate and experience surreal visions on their journey through the west.
Love,"Drama, Musical, Romance","Prithvi and Maggie fall in love and decide to get married, but Maggie's mother objects looking at Prithvi's past."
The City,"Drama, Musical","The first ever Hebrew rap musicalinspired by black music, film noir, and detective films, the plot focuses on the character of Joe, a cynical and bitter detective working in a corrupt, ...See full summary»"
Saawariya,"Drama, Musical, Romance","Two souls arrive in a small town, one on vacation, the other to meet a lover. They spend the most magical dream-like days of their lives in that town... with each other."
Becks,"Drama, Musical, Romance","After breaking up with her girlfriend, a Brooklyn musician moves back in with her mother. Playing for tip money in an old friend's bar, an unexpected relationship begins to take shape. Based on the life and times of Alyssa Robbins."
Hero,"Biography, Drama, History",Korean independence activist in a fight to free his motherland.
42nd Street: The Musical,Musical,"Peggy Sawyer, a talented young performer with stars in her eyes gets her big break on Broadway."
Easy to Love,"Comedy, Music, Musical",An aquatic performer tries to attract the man she loves.
Prem Ratan Dhan Payo,"Action, Drama, Musical","While recovering from an assassination attempt four days before his coronation, a stern prince is replaced by a romantic lookalike."
Kally's Mashup ¡Un cumpleaños muy Kally!,Musical,"Kally embarks on a crazy trip to Colombia days before her birthday to play on the next catwalk of a famous designer in the country, while she is going through the best time of her life. The...See full summary»"
Amar Prem,"Drama, Musical, Romance",A village woman abandoned by her husband is forced into prostitution in Kolkata and forms nameless yet strong relations with a wealthy patron as well as an abused boy in the neighbourhood.
The Merry Widow,"Comedy, Musical, Romance","When a small kingdom's main taxpayer leaves for Paris, its king dispatches a dashing count to win back her allegiance."
The Man Called Flintstone,"Animation, Action, Adventure","While preparing for a camping trip, Fred Flintstone is enlisted by the Bedrock Secret Service to capture a criminal mastermind after a spy who looks like him is injured on the job."
Girl Crazy,"Comedy, Musical","A philandering young playboy is sent to college somewhere in the American West, and organizes a show, together with his sweetheart, to save the college from closure due to falling enrollments."
Dancin': It's On!,"Family, Musical, Romance",Two young dancers fall in love and eventually work together to win a dance competition.
Bhalobasa Bhalobasa,"Comedy, Drama, Musical","Sidhu breaks his father's trust when he defies him and continues his relationship with Priya, the girl he loves. Determined to win Sidhu's father's heart, Priya decides to stay with his family."
Curly Top,"Family, Musical, Romance","Wealthy Edward Morgan becomes charmed with a curly-haired orphan and her pretty older sister Mary and arranges to adopt both under the alias of ""Mr. Jones."" As he spends more time with them, he soon finds himself falling in love with Mary."
Blondie of the Follies,"Comedy, Musical","Two young women find their friendship strained when one wins a role in a Broadway show, and the other's boyfriend begins to fall for her."
Bindaas,"Action, Comedy, Musical",Kajol (Sayantika Banerjee) became friends with Abhimanyu aka Abhi (Dev) after the later saves the former from some goons in Italy. But one day she asks Abhi to leave her and go as she ...See full summary»
Beauty and the Beast,"Family, Fantasy, Musical","To save her father, a girl who always puts others before herself promises to live her life in a lavish castle with a strange beast."
Rusalochka,"Family, Fantasy, Musical","After her sisters wreck his ship, a mermaid saves a human prince from drowning and is helped by a traveling handyman to reach out to him on land."
Roti Kapada Aur Makaan,"Action, Drama, Musical",Bharat faces challenges in leading his family after taking the responsibilities following his father's death.
Bright Eyes,"Comedy, Drama, Family","An orphaned girl is taken in by a snobbish family at the insistence of their rich, crotchety uncle, even as her devoted aviator godfather fights for custody."
Voy a pasármelo bien,"Adventure, Comedy, Musical","David and Layla, two teenagers who really like ""Hombres G"" and they like each other too, but everything he does to win her over ends badly. Thirty years later they meet again and realize that the feelings have not completely disappeared."
Apna Sapna Money Money,"Comedy, Musical, Romance","Kishan is a young man from Goa whose brain is full of every conceivable trick to make a quick buck. He cons people by slipping into different outfits and by assuming many guises. Julie, is ...See full summary»"
Bade Miyan Chote Miyan,"Action, Comedy, Musical","Arjun and Pyare Mohan are honest policemen who work together. Trouble follows when thieves Bade Miyan and Chote Miyan, look-alikes of Arjun and Pyare, commit crimes and the hapless duo are blamed for it."
Turned Out Nice Again,"Comedy, Musical","George Pearson, who works for a underwear firm that is 20 years out of date, invests his own money in a new type of thread. The company are not interested in changes, and he quits. Later ...See full summary»"
The Reef 2: High Tide,"Animation, Adventure, Comedy","Trained in the skills of sea power, Pi the fish can fight a shark, sink a squid or batter any random predator that ever threatens his friends and neighbors on the reef. Unfortunately, being...See full summary»"
Ijaazat,"Drama, Musical, Romance","Meeting accidentally five years after their divorce, a couple reflects on how their marriage collapsed despite transparency."
Rock-a-Bye Baby,"Comedy, Musical","A TV repair man must care for the newborn triplets of his former hometown sweetheart, now a famous movie star, so her career will not suffer."
Aan Milo Sajna,"Drama, Musical, Romance","Widowed and ailing Savitri Choudhury lives a wealthy lifestyle along with her son, Anil, in a palatial mansion in India. She knows that Anil is only waiting for her to die so that he can ...See full summary»"
Umrao Jaan,"Drama, Musical, Romance","In Faizabad, British India, Dilawar is sentenced to several years in prison after Amiran's Daroga dad testifies against him. After his discharge around 1840, he extracts his vengeance by ...See full summary»"
Emo the Musical,"Comedy, Music, Musical","Ethan, a sullen high-school student whose life is defined by what he hates, finds love with a blindly optimistic Christian girl Trinity, much to the annoyance of his angst-filled band mates and her evangelistic brethren."
Gumnaam,"Drama, Mystery, Thriller","Eight people are stranded on an island. They reach a mansion where a butler is awaiting them. Then an unknown, vengeful person starts killing them, one by one."
Follow the Fleet,"Comedy, Musical, Romance",A Navy sailor tries to rekindle a romance with the woman he loves while on liberty in San Francisco.
I'd Rather Be Rich,"Comedy, Musical, Romance","A young heiress is summoned to the bedside of her dying grandfather. The man's last wish is to meet her fiance, but problems arise when the fiance is delayed and a young chemical engineer ...See full summary»"
Anand,"Drama, Musical","The story of a terminally ill man who wishes to live life to the fullest before the inevitable occurs, as told by his best friend."
Bo we mnie jest seks,"Biography, Drama, Musical","Polish film and music icon Kalina Jedrusik, a scandalous free-spirited sex symbol, fights for her independence in the prude society of the 1960s."
Heidi's Song,"Animation, Adventure, Drama","Orphan Heidi lives with her grandpa in Swiss Alps. She brings joy to all there. However, her aunt takes her to the city to live as a servant girl to a cold rich strict family and their nice but sad handicapped daughter."
Sonic Villains,"Animation, Action, Adventure","Sonic Villains follows Eggman after the events of Sonic Forces as he uses the last of the mysterious Phantom Ruby to gather villains across EVERY SONIC UNIVERSE to regain control, and destroy Sonic in the craziest battle he's faced yet."
Haré Rama Haré Krishna,"Drama, Musical","In the background of the rise of the International Hare Krishna movement in the 1970s, is a Montreal-based family of the Jaiswals, consisting of mom, dad, son, Prashant, and daughter, ...See full summary»"
Road to Bethlehem,Musical,Plot under wraps.
Ski Party,"Comedy, Musical","In this musical, college classmates Todd Armstrong (Frankie Avalon) and Craig Gamble (Dwayne Hickman) head out on a group ski vacation, and agree that if they're going to get girlfriends, they need to understand how women think."
Laawaris,"Drama, Action, Musical","A man, abandoned as a baby and forced to live as an orphan, is unknowingly employed by his biological father."
Babes in Arms,"Comedy, Musical","A group of vaudevillians struggling to compete with talkies hits the road hoping for a comeback. Frustrated to be left behind, all of their kids put on a show themselves to raise money for the families and to prove they've got talent, too."
Gunda,"Action, Comedy, Crime","When a coolie's family is murdered by a group of gangsters and politicians, he swears revenge on them."
Gulliver's Travels,"Animation, Adventure, Comedy",Lemuel Gulliver washes ashore on Lilliput and attempts to prevent war between that tiny kingdom and its equally minuscule rival Blefuscu.
Koochie Koochie Hota Hai,"Animation, Family, Musical","The film is an animated take on Kuch Kuch Hota Hai, and it marks the 20 year anniversary of its release."
Les Misérables: The Staged Concert,"Drama, History, Musical",Seen by over 120 million people worldwide one of the world's most popular musicals. Now cinema audiences can experience a live broadcast of the musical phenomenon which broke box office records and sold out its entire 16-week season.
April Love,"Comedy, Drama, Musical",A young man visiting his relatives' farm in Kentucky falls in love with their neighbor.
Viktor und Viktoria,"Comedy, Musical","Aspiring singer Susanne takes over for ham actor Viktor at a small cabaret in Berlin where he works a woman impersonator and per chance she's discovered by an agent, who thinks that she ...See full summary»"
Journey Back to Oz,"Animation, Adventure, Comedy","During another twister, Dorothy is hit on the head by a gate and once again whisked away to the Land of Oz. But this time, on her way to the Emerald City, she discovers the witch Mombi's ...See full summary»"
Rudolph the Red-Nosed Reindeer: The Movie,"Animation, Adventure, Family",It's up to Santa's most famous reindeer to save the day when an evil queen conjures up a storm on Christmas.
The War of the Worlds: The Musical Drama,"Adventure, Musical, Sci-Fi","An Audible Original Production in which H.G. Wells' classic, War of the Worlds, is revisited"
The Land of Dreams,"Drama, Musical",A young immigrant named Eva living in New York during the 1920s dreams of becoming a singer and falls for a pianist with an active imagination.
Groupie Girl,"Drama, Musical","A bored teenage girl decides that she wants to meet rock stars, and the best way to do that is to become a groupie. She finds herself going on the road with a rock band called Opal ...See full summary»"
Ajab Prem Ki Ghazab Kahani,"Action, Comedy, Musical","The wacky adventures of a young man who is willing to sacrifice his own love to insure the happiness of others, even trying to get the girl of his dreams married to the guy of her dreams."
Raja Hindustani,"Action, Comedy, Drama","Raja, a taxi driver, falls in love with Aarti, a rich girl, and marries her against her parents' wishes. Later, her parents try to create differences amongst the couple."
