The Little Mermaid,"Adventure, Family, Fantasy",A young mermaid makes a deal with a sea witch to trade her beautiful voice for human legs so she can discover the world above water and impress a prince.
Satyaprem Ki Katha,"Comedy, Drama, Musical","A middle-class boy in Ahmedabad, Satyaprem falling in one-sided love with Katha, who is coping with her breakup with Tapan. Through the journey, they discover each other's life and complement in accomplishing what was left halfway."
1776,"Drama, Family, History",A musical retelling of the American Revolution's political struggle in the Continental Congress to declare independence.
Roald Dahl's Matilda the Musical,"Comedy, Drama, Family","An adaptation of the Tony and Olivier award-winning musical. Matilda tells the story of an extraordinary girl who, armed with a sharp mind and a vivid imagination, dares to take a stand to change her story with miraculous results."
Wonka,"Adventure, Comedy, Family",The story will focus specifically on a young Willy Wonka and how he met the Oompa-Loompas on one of his earliest adventures.
Mulan,"Animation, Adventure, Comedy","To save her father from death in the army, a young maiden secretly goes in his place and becomes one of China's greatest heroines in the process."
Yankee Doodle Dandy,"Biography, Drama, Family","The life of the renowned musical composer, playwright, actor, dancer, and singerGeorge M. Cohan."
Les Misérables,"Drama, Musical, Romance","In 19th-century France, Jean Valjean, who for decades has been hunted by the ruthless policeman Javert after breaking parole, agrees to care for a factory worker's daughter. The decision changes their lives forever."
The Ballad of Buster Scruggs,"Comedy, Drama, Musical","Six tales of life and violence in the Old West, following a singing gunslinger, a bank robber, a traveling impresario, an elderly prospector, a wagon train, and a perverse pair of bounty hunters."
Sing 2,"Animation, Adventure, Comedy",Buster Moon and his friends must persuade reclusive rock star Clay Calloway to join them for the opening of a new show.
Hamilton,"Biography, Drama, History","The real life of one of America's foremost founding fathers and first Secretary of the Treasury, Alexander Hamilton. Captured live on Broadway from the Richard Rodgers Theater with the original Broadway cast."
The Music Man,"Comedy, Family, Musical",Traveling con artist Harold Hill targets the naïve residents of a small town in 1910s Iowa by posing as a boys' band leader to raise money before he can skip town.
Joker: Folie à Deux,"Crime, Drama, Musical",Plot unknown. Sequel to the 2019 film 'Joker.'
Encanto,"Animation, Comedy, Family",A Colombian teenage girl has to face the frustration of being the only member of her family without magical powers.
The Greatest Showman,"Biography, Drama, Musical",Celebrates the birth of show business and tells of a visionary who rose from nothing to create a spectacle that became a worldwide sensation.
La La Land,"Comedy, Drama, Music","While navigating their careers in Los Angeles, a pianist and an actress fall in love while attempting to reconcile their aspirations for the future."
Mamma Mia!,"Comedy, Musical, Romance",The story of a bride-to-be trying to find her real father told using hit songs by the popular 1970s groupABBA.
Moana,"Animation, Adventure, Comedy","In Ancient Polynesia, when a terrible curse incurred by the Demigod Maui reaches Moana's island, she answers the Ocean's call to seek out the Demigod to set things right."
The Lion King,"Animation, Adventure, Drama","Lion prince Simba and his father are targeted by his bitter uncle, who wants to ascend the throne himself."
Grease,"Comedy, Musical, Romance","Good girl Sandy Olsson and greaser Danny Zuko fell in love over the summer. When they unexpectedly discover they're now in the same high school, will they be able to rekindle their romance?"
Sing,"Animation, Comedy, Family","In a city of humanoid animals, a hustling theater impresario's attempt to save his theater with a singing competition becomes grander than he anticipates even as its finalists find that their lives will never be the same."
Peter Pan & Wendy,"Action, Adventure, Comedy","Follow the adventures of Peter Pan, a boy who does not want to grow up, and how he recruits three siblings in London, and together they embark on a magical adventure on the enchanted island of Neverland."
Mamma Mia! Here We Go Again,"Comedy, Musical, Romance","Five years after the events ofMamma Mia!(2008), Sophie prepares for the grand reopening of the Hotel Bella Donna as she learns more about her mother's past."
Beauty and the Beast,"Adventure, Family, Fantasy","A selfish Prince is cursed to become a monster for the rest of his life, unless he learns to fall in love with a beautiful young woman he keeps prisoner."
Miraculous - Le film,"Animation, Action, Adventure","Ordinary teenager Marinette's life in Paris goes superhuman when she becomes Ladybug. Bestowed with magical powers of creation, Ladybug must unite with her opposite, Cat Noir, to save Paris as a new villain unleashes chaos unto the city."
Charlie and the Chocolate Factory,"Adventure, Comedy, Family","A young boy wins a tour through the most magnificent chocolate factory in the world, led by the world's most unusual candy maker."
The Lion King,"Animation, Adventure, Drama","After the murder of his father, a young lion prince flees his kingdom only to learn the true meaning of responsibility and bravery."
The Little Mermaid,"Animation, Adventure, Family",A mermaid princess makes a Faustian bargain in an attempt to become human and win a prince's love.
The Wizard of Oz,"Adventure, Family, Fantasy","Young Dorothy Gale and her dog Toto are swept away by a tornado from their Kansas farm to the magical Land of Oz, and embark on a quest with three new friends to see the Wizard, who can return her to her home and fulfill the others' wishes."
Hercules,"Animation, Adventure, Comedy",The son of Zeus and Hera is stripped of his immortality as an infant and must become a true hero in order to reclaim it.
Aladdin,"Adventure, Comedy, Family",A kind-hearted street urchin and a power-hungry Grand Vizier vie for a magic lamp that has the power to make their deepest wishes come true.
Snow White,"Adventure, Drama, Family",Live-action adaptation of the 1937 Disney animated film 'Snow White and the Seven Dwarfs'.
The Rocky Horror Picture Show,"Comedy, Horror, Musical",A newly-engaged couple have a breakdown in an isolated area and must seek shelter at the bizarre residence of Dr. Frank-n-Furter.
Frozen,"Animation, Adventure, Comedy","When the newly crowned Queen Elsa accidentally uses her power to turn things into ice to curse her home in infinite winter, her sister Anna teams up with a mountain man, his playful reindeer, and a snowman to change the weather condition."
World's Best,"Comedy, Family, Music","Follows Raj Patel, who is an expert at math but is also secretly obsessed with his late father's dream of becoming a rap musician, and he almost loses everything in his attempt to achieve multiple goals in life."
The Lorax,"Animation, Adventure, Comedy","A 12-year-old boy searches for the one thing that will enable him to win the affection of the girl of his dreams. To find it he must discover the story of the Lorax, the grumpy yet charming creature who fights to protect his world."
Tangled,"Animation, Adventure, Comedy","The magically long-haired Rapunzel has spent her entire life in a tower, but now that a runaway thief has stumbled upon her, she is about to discover the world for the first time, and who she really is."
The Sound of Music,"Biography, Drama, Family",A young novice is sent by her convent in 1930s Austria to become a governess to the seven children of a widowed naval officer.
Wicked: Part One,"Comedy, Drama, Family",The story of how a green-skinned woman framed by the Wizard of Oz becomes the Wicked Witch of the West. The first of a two-part feature film adaptation of the Broadway musical.
Cats,"Comedy, Drama, Family",A tribe of cats called the Jellicles must decide yearly which one will ascend to the Heaviside Layer and come back to a new Jellicle life.
Guillermo del Toro's Pinocchio,"Animation, Drama, Family","A father's wish magically brings a wooden boy to life in Italy, giving him a chance to care for the child."
Willy Wonka & the Chocolate Factory,"Family, Fantasy, Musical",A poor but hopeful boy seeks one of the five coveted golden tickets that will send him on a tour of Willy Wonka's mysterious chocolate factory.
The Blues Brothers,"Action, Adventure, Comedy","Jake Blues rejoins with his brother Elwood after being released from prison, but the duo has just days to reunite their old R&B band and save the Catholic home where the two were raised, outrunning the police as they tear through Chicago."
Aladdin,"Animation, Adventure, Comedy",A kind-hearted street urchin and a power-hungry Grand Vizier vie for a magic lamp that has the power to make their deepest wishes come true.
West Side Story,"Crime, Drama, Musical","An adaptation of the 1957 musical, West Side Story explores forbidden love and the rivalry between the Jets and the Sharks, two teenage street gangs of different ethnic backgrounds."
Labyrinth,"Adventure, Family, Fantasy",Sixteen-year-old Sarah is given thirteen hours to solve a labyrinth and rescue her baby brother Toby when her wish for him to be taken away is granted by the Goblin King Jareth.
FernGully: The Last Rainforest,"Animation, Adventure, Family","The magical inhabitants of a rainforest fight to save their home, which is threatened by logging and a polluting force of destruction called Hexxus."
Seven Brides for Seven Brothers,"Comedy, Drama, Musical","In 1850 Oregon, when a backwoodsman brings a wife home to his farm, his six brothers decide that they want to get married too."
Little Shop of Horrors,"Comedy, Horror, Musical",A nerdy florist finds his chance for success and romance with the help of a giant man-eating plant who demands to be fed.
The Phantom of the Opera,"Drama, Musical, Romance",A young soprano becomes the obsession of a disfigured and murderous musical genius who lives beneath the Paris Opéra House.
Moulin Rouge!,"Drama, Musical, Romance",A poor Bohemian poet in 1890s Paris falls for a beautiful courtesan and nightclub star coveted by a jealous duke.
The Color Purple,"Drama, Musical",Musical adaptation of Alice Walker's novel about the life-long struggles of an African American woman living in the south during the early 1900s.
Tenacious D in The Pick of Destiny,"Adventure, Comedy, Music","To become the greatest band of all time, two slacker, wannabe-rockers set out on a quest to steal a legendary guitar pick that gives its holders incredible guitar skills, from a maximum security Rock and Roll museum."
Mary Poppins,"Comedy, Family, Fantasy","In turn of the century London, a magical nanny employs music and adventure to help two neglected children become closer to their father."
"Lyle, Lyle, Crocodile","Animation, Adventure, Comedy",Feature film based on the children's book about a crocodile that lives in New York City.
Anastasia,"Animation, Adventure, Drama","The last surviving child of the Russian Royal Family joins two con men to reunite with her grandmother, the Dowager Empress, while the undead Rasputin seeks her death."
Sweeney Todd: The Demon Barber of Fleet Street,"Drama, Horror, Musical","The legendary tale of a barber who returns from wrongful imprisonment to 1840s London, bent on revenge for the rape and death of his wife, and resumes his trade while forming a sinister partnership with his fellow tenant, Mrs. Lovett."
The Princess and the Frog,"Animation, Adventure, Comedy","A waitress, desperate to fulfill her dreams as a restaurant owner, is set on a journey to turn a frog prince back into a human being, but she has to face the same problem after she kisses him."
On the Town,"Comedy, Musical, Romance",Three sailors wreak havoc as they search for love during a whirlwind 24-hour leave in New York City.
Robin Hood: Men in Tights,"Adventure, Comedy, Musical","A spoof of Robin Hood in general, andRobin Hood: Prince of Thieves(1991) in particular."
Beauty and the Beast,"Animation, Family, Fantasy",A prince cursed to spend his days as a hideous monster sets out to regain his humanity by earning a young woman's love.
Trolls,"Animation, Adventure, Comedy","After the Bergens invade Troll Village, Poppy, the happiest Troll ever born, and the curmudgeonly Branch set off on a journey to rescue her friends."
Rio,"Animation, Adventure, Comedy","When Blu, a domesticated macaw from small-town Minnesota, meets the fiercely independent Jewel, he takes off on an adventure to Rio de Janeiro with the bird of his dreams."
Wish,"Animation, Adventure, Comedy",Wish will follow a young girl named Asha who wishes on a star and gets a more direct answer than she bargained for when a trouble-making star comes down from the sky to join her.
Road to Singapore,"Comedy, Musical, Romance",Two playboys try to forget previous romances in Singapore - until they meet a beautiful dancer.
Into the Woods,"Adventure, Comedy, Drama",A witch tasks a childless baker and his wife with procuring magical items from classic fairy tales to reverse the curse put on their family tree.
Enchanted,"Animation, Adventure, Comedy","A young maiden in a land called Andalasia, who is prepared to be wed, is sent away to New York City by an evil Queen, where she falls in love with a lawyer."
Disenchanted,"Animation, Adventure, Comedy","Fifteen years after her happily ever after, Giselle questions her happiness, inadvertently turning the lives of those in the real world and Andalasia upside down in the process."
Frozen II,"Animation, Adventure, Comedy","Anna, Elsa, Kristoff, Olaf and Sven leave Arendelle to travel to an ancient, autumn-bound forest of an enchanted land. They set out to find the origin of Elsa's powers in order to save their kingdom."
Cinderella,"Comedy, Family, Fantasy","A modern movie musical with a bold take on the classic fairy tale. Our ambitious heroine has big dreams and with the help of her fab Godmother, she perseveres to make them come true."
Pinocchio,"Adventure, Comedy, Drama","A puppet is brought to life by a fairy, who assigns him to lead a virtuous life in order to become a real boy."
Chicago,"Comedy, Crime, Musical","Two death-row murderesses develop a fierce rivalry while competing for publicity, celebrity, and a sleazy lawyer's attention."
The Jungle Book,"Animation, Adventure, Comedy",Bagheera the Panther and Baloo the Bear have a difficult time trying to convince a boy to leave the jungle for human civilization.
Singin' in the Rain,"Comedy, Musical, Romance",A silent film star falls for a chorus girl just as he and his delusionally jealous screen partner are trying to make the difficult transition to talking pictures in 1920s Hollywood.
Annie,"Comedy, Drama, Family","A spunky young orphan is taken in by a rich eccentric, much to the chagrin of the cantankerous woman who runs the orphanage."
The Wiz,"Adventure, Family, Fantasy","An adaptation of ""The Wizard of Oz"" that tries to capture the essence of the African-American experience."
"tick, tick...BOOM!","Biography, Comedy, Drama","On the cusp of his 30th birthday, a promising young theater composer navigates love, friendship and the pressures of life as an artist in New York City."
Mufasa: The Lion King,"Animation, Adventure, Drama","Simba, having become king of the Pride Lands, is determined for his cub to follow in his paw prints while the origins of his late father Mufasa are explored."
Grease 2,"Comedy, Music, Musical",A British student at a 1960s American high school must prove himself to the leader of a girls' gang whose members can only date greasers.
The Prince of Egypt,"Animation, Adventure, Drama",Egyptian Prince Moses learns of his identity as a Hebrew and his destiny to become the chosen deliverer of his people.
Carmen,"Drama, Musical",Benjamin Millepied's complete reimagining of CARMEN tells a story through an experimental dreamscape featuring an original score and songs.
Burlesque,"Drama, Music, Musical",A small-town girl ventures to Los Angeles and finds her place in a neo-burlesque club run by a former dancer.
The Harvey Girls,"Comedy, Drama, History","On a train trip West to become a mail-order bride, Susan Bradley (Judy Garland) meets a cheery crew of young women travelling out to open a ""Harvey House"" restaurant at a remote whistle-stop."
Rock of Ages,"Comedy, Drama, Musical",A small-town girl and a city boy meet on the Sunset Strip while pursuing their Hollywood dreams.
The Hunchback of Notre Dame,"Animation, Drama, Family","A deformed bell-ringer must assert his independence from a vicious government minister in order to help his friend, a gypsy dancer."
Chitty Chitty Bang Bang,"Adventure, Family, Fantasy","A down-on-his-luck inventor turns a broken-down Grand Prix car into a fancy vehicle for his children, and then they go off on a magical fantasy adventure to save their grandfather in a far-off land."
In the Heights,"Drama, Musical, Romance","A film version of the Broadway musical in which Usnavi, a sympathetic New York bodega owner, saves every penny every day as he imagines and sings about a better life."
The Nightmare Before Christmas,"Animation, Family, Fantasy","Jack Skellington, king of Halloween Town, discovers Christmas Town, but his attempts to bring Christmas to his home causes confusion."
Hairspray,"Comedy, Drama, Musical",Pleasantly plump teenager Tracy Turnblad teaches 1962 Baltimore a thing or two about integration after landing a spot on a local TV dance show.
Popeye,"Adventure, Comedy, Family",The adventures of the famous sailor man and his friends in the seaside town of Sweethaven.
Pocahontas,"Animation, Adventure, Drama",An English soldier and the daughter of an Algonquin chief share a romance when English colonists invade seventeenth century Virginia.
Alvin and the Chipmunks,"Animation, Adventure, Comedy",Three musical chipmunks are discovered by an aspiring songwriter who wants to use their amazing singing abilities to become famous.
Bedknobs and Broomsticks,"Animation, Adventure, Comedy","An apprentice witch, three kids and a cynical magician conman search for the missing component to a magic spell to be used in the defense of Britain in World War II."
Trolls World Tour,"Animation, Adventure, Comedy","When the Queen of the Hard Rock Trolls tries to take over all the Troll kingdoms, Queen Poppy and her friends try different ways to save all the Trolls."
Mary Poppins Returns,"Adventure, Comedy, Family","A few decades after her original visit, Mary Poppins, the magical nanny, returns to help the Banks siblings and Michael's children through a difficult time in their lives."
Earth Girls Are Easy,"Comedy, Musical, Romance",A Southern California girl befriends three furry aliens after their spaceship lands in her swimming pool.
Robin Hood,"Animation, Adventure, Comedy",The story of the legendary British outlaw portrayed with the characters as anthropomorphic animals.
A Goofy Movie,"Animation, Adventure, Comedy","When Max makes a preposterous promise to a girl he has a crush on, his chances to fulfilling it seem hopeless when he is dragged onto a cross-country trip with his embarrassing father, Goofy."
Walking on Sunshine,"Comedy, Drama, Musical","Set to the music of popular hit songs from the 1980s. A beautiful coastal village, present day Italy. After a whirlwind romance, Maddie is preparing to marry gorgeous Italian Raf, and has ...See full summary»"
Take Me Out to the Ball Game,"Comedy, Musical, Romance","Two turn-of-the-century baseball players, who work in vaudeville during the off-season, run into trouble with their team's new female owner and a gambler who doesn't want them to win the pennant."
Cry-Baby,"Comedy, Musical","In 1950s Baltimore, a bad boy with a heart of gold wins the love of a good girl, whose boyfriend sets out for revenge."
Newsies,"Drama, Family, History",A musical based on the New York City newsboy strike of 1899. When young newspaper sellers are exploited beyond reason by their bosses they set out to enact change and are met by the ruthlessness of big business.
Rent,"Drama, Musical, Romance","This is the film version of the Pulitzer and Tony Award winning musical about Bohemians in the East Village of New York City struggling with life, love and AIDS, and the impacts they have on America."
Snow White and the Seven Dwarfs,"Animation, Adventure, Family","Exiled into the dangerous forest by her wicked stepmother, a princess is rescued by seven dwarf miners who make her part of their household."
Dear Evan Hansen,"Drama, Musical","Film adaptation of the Tony and Grammy Award-winning musical about Evan Hansen, a high-school senior with social anxiety disorder, and his journey of self-discovery and acceptance after a classmate's suicide."
Hair,"Comedy, Drama, Musical","Claude Bukowski leaves the family ranch in Oklahoma for New York where he is rapidly embraced into the hippie group of youngsters led by Berger, yet he's already been drafted. He soon falls in love with Sheila Franklin, a rich girl but still a rebel inside."
West Side Story,"Crime, Drama, Musical","Two youngsters from rival New York City gangs fall in love, but tensions between their respective friends build toward tragedy."
The Book of Life,"Animation, Adventure, Comedy","Manolo, a young man who is torn between fulfilling the expectations of his family and following his heart, embarks on an adventure that spans three fantastic worlds where he must face his greatest fears."
Beach Blanket Bingo,"Comedy, Musical, Romance","Frankie, DeeDee, and the gang meet singing sensation Sugar Kane in a publicity stunt; they all get introduced to skydiving and get caught up in love."
The Road to El Dorado,"Animation, Adventure, Comedy","Two swindlers get their hands on a map to the fabled city of gold, El Dorado."
"South Park: Bigger, Longer & Uncut","Animation, Comedy, Fantasy","When Stan Marsh and his friends go see an R-rated movie, they start cursing and their parents think that Canada is to blame."
Lisztomania,"Biography, Comedy, Music",Composer and pianist Franz Liszt (Roger Daltrey) attempts to overcome his hedonistic life-style while repeatedly being drawn back into it by the many women in his life and fellow composer Richard Wagner (Paul Nicholas).
Dreamgirls,"Drama, Music, Musical","A trio of black female soul singers cross over to the pop charts in the early 1960s, facing their own personal struggles along the way."
Meet the Robinsons,"Animation, Adventure, Comedy","Lewis is a brilliant inventor who meets mysterious stranger named Wilbur Robinson, whisking Lewis away in a time machine and together they team up to track down Bowler Hat Guy in a showdown that ends with an unexpected twist of fate."
The AristoCats,"Animation, Adventure, Comedy","With the help of a smooth talking tomcat, a family of Parisian felines set to inherit a fortune from their owner try to make it back home after a jealous butler kidnaps them and leaves them in the country."
Spirited,"Comedy, Family, Musical",A musical version of Charles Dickens's story of a miserly misanthrope who is taken on a magical journey.
Vivo,"Animation, Adventure, Comedy","Vivo, Sony Pictures Animation's first-ever musical adventure featuring all-new original songs from Lin-Manuel Miranda, will take audiences on an epic adventure to gorgeous and vibrant locations never before seen in animation."
Greatest Days,"Comedy, Drama, Music","A feature adaptation of the 'The Band' musical, featuring the songs of Take That."
O Saathiya,"Comedy, Musical, Romance",The evolving love story of Arjun and Keerthi and the trials and tribulations they face as they mature from adolescence to adulthood.
Mean Girls Musical,"Comedy, Musical",Add a Plot
Annie,"Comedy, Drama, Family",A foster kid who lives with her mean foster mom sees her life change when business tycoon and New York City mayoral candidate Will Stacks makes a thinly-veiled campaign move and takes her in.
Gold Diggers of 1933,"Comedy, Drama, Musical","A wealthy composer rescues unemployed Broadway performers with a new play, but insists on remaining anonymous."
Dancer in the Dark,"Crime, Drama, Musical",An Eastern European US immigrant with a love for musicals has to cope with the gradual loss of her vision.
Road to Zanzibar,"Adventure, Comedy, Musical","Stranded in Africa, Chuck and his pal Fearless have comic versions of jungle adventures, featuring two attractive con-women."
An American Tail,"Animation, Adventure, Comedy","While emigrating to the United States, a young Russian mouse gets separated from his family and must relocate them while trying to survive in a new country."
Brother Bear,"Animation, Adventure, Comedy","When a young Inuit hunter needlessly kills a bear, he is magically changed into a bear himself as punishment with a talkative cub being his only guide to changing back."
The Lego Movie 2: The Second Part,"Animation, Action, Adventure","It's been five years since everything was awesome and the citizens are facing a huge new threat: Lego Duplo invaders from outer space, wrecking everything faster than they can rebuild."
The Garbage Pail Kids Movie,"Adventure, Comedy, Family",Dodger must confront the struggles of life as he is visited by the Garbage Pail Kids and intimidated by some older bullies.
Fiddler on the Roof,"Drama, Family, Musical","In pre-revolutionary Russia, a Jewish peasant with traditional values contends with marrying off three of his daughters with modern romantic ideals while growing anti-Semitic sentiment threatens his village."
Alice in Wonderland,"Animation, Adventure, Comedy",Alice stumbles into the world of Wonderland. Will she get home? Not if the Queen of Hearts has her way.
