The Wiggles Movie,"Animation, Adventure, Comedy","The Wiggles throw a surprise party for Dorothy the Dinosaur, while she goes after a magician who takes Greg's magic wand to become popular."
Jingle Jangle: A Christmas Journey,"Family, Fantasy, Musical","An imaginary world comes to life in a holiday tale of an eccentric toymaker, his adventurous granddaughter, and a magical invention that has the power to change their lives forever."
Swing Time,"Comedy, Musical, Romance","Roguish gambler/dancer ""Lucky"" Garnett is challenged by his fiance's father to come up with $25,000 to prove he's worthy of her hand. But after he falls in love with a dance instructor, Lucky'll do anything to keep from earning the bucks."
Pardes,"Drama, Musical, Romance","Kishorilal wants an Indian bride for his westernised son. He gets him engaged to Ganga, his friend's daughter, and brings her to USA. But she shares a deeper bond with Arjun, Kishorilal's foster son."
Mujhse Dosti Karoge!,"Comedy, Drama, Family",A young man in England regularly mails his childhood sweetheart in India is unaware that the replies he receives are written by another girl.
Daddy Long Legs,"Musical, Romance","A wealthy American has a chance encounter with a joyful young French woman, and anonymously pays for her education. She writes letters to her mysterious benefactor, nicknaming him from the description given by some of her fellow orphans."
The Seven Little Foys,"Biography, Comedy, Drama","After the young wife of vaudevillian Eddie Foy passes away, he incorporates their seven children into the act and takes it on the road."
Life in a Metro,"Comedy, Drama, Musical","Six different stories, about nine people, each with different issues and problems, all occurring within one place: the METRO."
Rehnaa Hai Terre Dil Mein,"Comedy, Drama, Musical","Maddy impersonates Rajeev, the person his love interest, Reena, is about to marry and attempts to woo her. However, he is unprepared for the moment when the truth will be revealed."
Priyotama,"Drama, Musical, Romance",Add a Plot
Kabhi Haan Kabhi Naa,"Comedy, Drama, Music",A dreamer falls for a girl who is in love with someone else and tries to create a rift between her and the man she loves.
Pepe,"Comedy, Musical","The young Mexican Pepe's beloved horse is sold to Hollywood director Ted Holt, leading to Pepe's journey to Hollywood to get the horse back, and Pepe's encounter with half the stars working in Hollywood at the time."
Goliyon Ki Rasleela Ram-Leela,"Drama, Musical, Romance","Modern adaptation of William Shakespeare's 'Romeo and Juliet' with an Indian twist, the film focuses on the story of Ram and Leela, their love, lust and the drama afterwards."
Grace Stirs Up Success,"Comedy, Family, Musical","Grace is excited for the summer so she can start a business with her friends, but things take an unexpected turn when her mom announces a trip to Paris. There, Grace must learn to get along...See full summary»"
The Pebble and the Penguin,"Animation, Adventure, Comedy",A lovable but introverted penguin named Hubie plans to present his betrothal pebble to the bird of his dreams.
"Paradise, Hawaiian Style","Comedy, Musical","Rick Richards is a helicopter pilot who wants to set up a charter flying service in Hawaii -- along the way he makes some friends, including a young Hawaiian girl and her father, romances Judy Hudson, and sings a few songs."
Snow White,"Family, Fantasy, Musical","The ageless tale of a beautiful young princess whose jealous stepmother orders her killed so that she will be 'the fairest in the land.' When the huntsman takes pity on her, he takes her to the house of the seven dwarfs."
Summer Holiday,"Comedy, Music, Musical","A fabulous 1960s musical: Four London Bus mechanics strike up a deal with London Transport. They do up a double-decker London Bus, drive it around Europe as a hotel, and if they make it ...See full summary»"
Babes in Toyland,"Comedy, Family, Fantasy","Opposing the evil Barnaby, Ollie Dee and Stanley Dum try and fail to pay-off Mother Peep's mortgage and mislead his attempts to marry Little Bo. Enraged, Barnaby's Bogeymen are set on Toyland."
High in the Clouds,"Animation, Adventure, Comedy",A squirrel embarks on a journey to find an animal sanctuary.
There's No Business Like Show Business,"Comedy, Drama, Musical","Molly and Terry Donahue, plus their three children, are The Five Donahues. Son Tim meets hat-check girl Vicky and the family act begins to fall apart."
Verona,"Musical, Romance","Based on the real story that inspired Shakespeare's Romeo and Juliet, follows the greatest love story of all time, set as an original pop musical."
Idlewild,"Crime, Drama, Musical","At a sexy, sizzling nightclub, pianist Percival lives life by the rules, while Rooster, the club's flashy lead performer, struts his stuff on the stage. But all changes when greed, fame and murder threaten to destroy them and the joint."
Folk og røvere i Kardemomme by,"Animation, Family, Musical","The three thieves Kasper, Jesper and Jonathan lives together with their always hungry lion in the little town of Kardemomme town, the home to a fair but kind police officer, and the strict Aunt Sofie."
Deewana,"Action, Comedy, Musical","A singer (Rishi Kapoor) marries his biggest fan, but his uncle (Amrish Puri) plans to kill him in order to gain his money."
At Long Last Love,"Comedy, Musical, Romance","Four socialite old friends unexpectedly clash, and switch partners during a party and attempt to make each other jealous."
It Happened at the World's Fair,"Comedy, Musical, Romance","Mike and Danny hitch a ride to the World's Fair in Seattle after the sheriff seizes their crop duster biplane to cover Danny's gambling debts. Mike looks after the driver's 7 y.o. niece at the fair, where he meets a cute nurse."
Legends of Oz: Dorothy's Return,"Animation, Adventure, Family","Shortly after a tornado rips through her Kansas home, Dorothy returns to Oz to save her friends from a villainous jester."
Can't Stop the Music,"Biography, Comedy, Musical",A pseudo autobiography of disco's The Village People.
Silk Stockings,"Comedy, Musical, Romance",A Russian government official is sent to Paris to bring back her comrades; she soon gets a taste of Paris life and falls in love with an American movie producer.
The Monster Club,"Comedy, Horror, Musical","A writer of horror stories is invited to a ""monster club"" by a mysterious old gentleman. There, three gruesome stories are told to him; between each story some musicians play their songs."
Hum Saath-Saath Hain,"Drama, Musical","Ramkishen and Mamta have three sons Vivek , Prem and Vinod and a daughter Sangeeta. This family is part of a joint family whose close knit bond is challenged by a misunderstanding."
Come Blow Your Horn,"Comedy, Musical","After leaving his parents' home, young Buddy Baker goes to live with his womanizing older brother in a posh Manhattan apartment where he learns how to be a partying playboy."
My Dream Is Yours,"Animation, Comedy, Music","An agent must search for a new personality to replace a popular singer who refuses to renew his radio contract. He finds one in the form of a single mother, but complications soon occur."
Hans Christian Andersen,"Biography, Family, Musical","The opening scene of the movie describes it best: ""Once upon a time there lived in Denmark a great storyteller named Hans Christian Andersen. This is not the story of his life, but a fairy tale about the great spinner of fairy tales."""
The Swan Princess: A Fairytale Is Born,"Animation, Adventure, Comedy","While Uberta is preparing to give the royal sceptre to Odette and Derek, another queen is scheming to ruin the coronation."
Untitled Tap Dancing Musical Project,Musical,Plot unknown.
My Little Pony: The Movie,"Animation, Adventure, Family","Ponyland comes under attack from the Smooze, a massive purple ooze created by an evil witch who plans to destroy the ponies' annual spring festival."
Ziegfeld Follies,"Comedy, Musical","The late, great impresarioFlorenz Ziegfeld Jr.looks down from Heaven and ordains a new revue in his grand old style."
No Entry,"Comedy, Drama, Musical","Kishan and Sunny's life are troubled after their womanizing friend Prem sets them up with a hooker named Bobby, leading to web of lies and confusions."
Roustabout,"Drama, Music, Musical","After a singer loses his job at a coffee shop, he finds employment at a struggling carnival, but his attempted romance with a teenager leads to friction with her father."
"The One and Only, Genuine, Original Family Band","Comedy, Drama, Family",The eleven members of the Bower family move to Dakota Territory.
Neptune Frost,"Musical, Sci-Fi","An intersex African hacker, a coltan miner and the virtual marvel born as a result of their union."
Roman Scandals,"Comedy, Fantasy, Musical","A kind-hearted young man is thrown out of his corrupt home town of West Rome, Oklahoma. He falls asleep and dreams that he is back in the days of olden Rome, where he gets mixed up with court intrigue and a murder plot against the Emperor."
Never Give a Sucker an Even Break,"Comedy, Musical","A filmmaker attempts to sell a surreal script he has written, which comes to life as he pitches it."
Stage Fright,"Comedy, Horror, Musical",A snobby musical theater camp is terrorized by a blood-thirsty killer who hates musical theater.
The Horror of Party Beach,"Horror, Musical",Sea creatures created from radioactive sludge terrorize a beach community.
Love Never Dies,"Drama, Music, Musical","10 years has passed since a fire broke out in Paris, leaving only a mask behind - As the love story continues in Coney Island, NY, The Phantom's undying love has grown for the soprano ...See full summary»"
Pyaasa,"Drama, Musical, Romance",A talented but indigent poet Vijay struggles for love and recognition in this selfish world.
The Loud House,"Animation, Adventure, Comedy","With his parents and all 10 sisters in tow, Lincoln Loud heads to Scotland and learns that royalty runs in the family in this global musical journey."
Lili,"Drama, Musical, Romance",An orphaned young woman becomes part of a puppet act and forms a relationship with the anti-social puppeteer.
Robin and the 7 Hoods,"Comedy, Crime, Musical","In Prohibition-era Chicago, two rival gangs compete for control of the city's rackets."
Animal Crackers,"Comedy, Family, Musical",Mayhem and zaniness ensue when a valuable painting goes missing during a party in honor of famed African explorer Captain Spaulding.
The Great Ziegfeld,"Drama, Musical","The ups and downs ofFlorenz Ziegfeld Jr., famed producer of extravagant stage revues, are portrayed."
Buttons,"Drama, Family, Fantasy","Follow the heartwarming journey of two orphan girls whose only wish is to find a home for Christmas. With a little help from their guardian angels (Dick Van Dyke and Dame Angela Lansbury), they discover miracles can happen when you believe."
Terkel i knibe,"Animation, Comedy, Musical",Terkel is an average teenager whose life takes a turn for the worse when a girl who had a crush on him kills herself and an unknown maniac starts stalking him.
On the Riviera,"Comedy, Musical",An American entertainer impersonates a wealthy aviator and flirts with his lookalike's neglected wife.
Modesty Blaise,"Action, Adventure, Comedy","Stylish ex-con Modesty Blaise and her partner Willie Garvin are tasked by the British Secret Service with preventing her rival Gabriel from stealing diamonds that are to be delivered to her adoptive father, a Sheikh."
Snow Day,"Comedy, Family, Musical","Your family is in for a flurry of fun with Snow Day, a musical reimagining of the beloved classic comedy film that follows a group of kids who discover that anything is possible when you break routines and take giant risks."
A Fairy Tale After All,"Adventure, Family, Fantasy",A stubborn teenage girl finds herself confronted by whimsical characters when she is transported into a world of fantasy and fairy tales while attending a school marionette show.
Love's Labour's Lost,"Romance, Comedy, Musical","An update of the classic Shakespeare story, directorKenneth Branaghshot the film like a classic 1930s musical. It tells the story of four best friends who swear off love."
Rockula,"Comedy, Horror, Musical",A young vampire cannot lose his virginity because of a curse imposed upon him centuries ago.
Footlight Parade,"Comedy, Musical, Romance","Chester Kent struggles against time, romance, and a rival's spy to produce spectacular live ""prologues"" for movie houses."
Girltrash: All Night Long,"Comedy, Crime, Drama","The story of five girls and one epic night. The girls will find love, lust, girl-fights, rock and roll, and a whole lot of stoned sorority girls."
Les chansons d'amour,"Drama, Musical, Romance","Ismael and Julie enter a playful yet emotionally laced threesome with Alice. When tragedy strikes, these young Parisians are forced to deal with the fragility of life and love."
Summer Stock,"Musical, Romance","A small-town farmer, down on her luck, finds her homestead invaded by a theatrical troupe invited to stay by her ne'er-do-well sister."
Artists and Models,"Comedy, Musical, Romance",Rick Todd uses the dreams of his roommate Eugene as the basis for a successful comic book.
Beautiful,"Biography, Drama, Music","Chronicles the life and career of celebrated singer-songwriter, Carole King."
Sanam Teri Kasam,"Drama, Musical, Romance","After being disowned by her family, an awkward librarian relies on the help of her brooding neighbour."
Athena,"Comedy, Drama, Fantasy","The story about two sisters in love. Everything should be wonderful, but father doesn't approve of his daughters' physically underdeveloped fiancés."
Housefull 2,"Action, Comedy, Drama",A comedy of errors wherein four men help each other to fool their prospective father-in-laws creating a cascade of confusion and mayhem.
Almost Pyaar with DJ Mohabbat,"Drama, Musical, Romance","In London, a girl likes a boy, a little too much. And, in a parallel universe exists a boy that likes a girl. The two unrequited love stories, burdened by social status, caste and inequality are breathlessly, heading on towards each other."
Kid Galahad,"Drama, Musical, Sport","After completing his military service, Walter Gulick takes a job as a sparring partner at a gym, the owner of which sees potential in Walter as a professional fighter and takes him under his wing."
A Song Is Born,"Comedy, Music, Musical","With her gangster boyfriend under investigation by the police, a nightclub singer hides out in a musical research institution staffed by bachelor professors - one of whom begins to fall for her."
Pagan Love Song,"Musical, Romance","A man from Ohio inherits a coconut plantation and falls in love with a half-American, half-Tahitian beauty. Song-and-swim musical ensues in the tropical paradise."
Till the Clouds Roll By,"Biography, Musical","Biography of songwriter and Broadway pioneer, Jerome Kern (Robert Walker). Unable to find immediate success in the U.S., Kern sought recognition abroad. He journeyed to England where his dreams of success became real and where he met his future wife Eva Leale (Dorothy Patrick)."
The Co(te)lette Film,Musical,A cinematographic adaptation of the dance performance by Ann Van den Broek.
The King and I,"Animation, Family, Fantasy","Traveling to the exotic kingdom of Siam, English schoolteacher Anna Leonowens soon discovers that her most difficult challenge is the stubborn, imperious King himself."
Hello Again,"Drama, Music, Musical",Ten lost souls slip in and out of one another's arms in a daisy-chained exploration of love's bittersweet embrace.
Melody Time,"Animation, Comedy, Family",An anthology of animated vignettes set to contemporary music.
Teefa in Trouble,"Action, Comedy, Crime",Teefa goes to Poland to get Anya to Pakistan to marry Butt gangster's son but lands up in trouble with Anya's gangster father and the Polish police.
Cinderella 2000,"Musical, Sci-Fi","In the year 2047, sex is forbidden and Big Brother uses robots to keep on eye on everyone. One young girl tries to outwit the government so she can be with the man she loves."
Sing,"Drama, Musical",A teen film about an Italian punk forced to work with an innocent Jewish girl.
Pal Joey,"Drama, Musical, Romance","Joey Evans' a charming, handsome, funny, talented a-1st class, A-N°.1 - heel. When Joey meets the former chorus girl and now is the rich widow, Vera Simpson, the pair of lecherous souls seem made for each other."
Killer Rack,"Comedy, Horror, Musical","Comedy about a woman suffering from low self esteem who gets breast enhancement surgery, unaware that her surgeon worships H.P. Lovecraft's elder gods, and the surgery is part of a diabolical plot to rule the world."
Frankie and Johnny,"Comedy, Musical, Romance","A riverboat singer with a weakness for gambling wants to find his lucky redhead, but his girlfriend Frankie is not amused."
The Devil's Carnival,"Horror, Musical","Lost souls enter The Devil's Carnival, where they're each faced with the sins they committed during life."
The Covenant,Musical,"Experience the pain of Egyptian slavery through the eyes of Moses' mother as she sets down her baby in to the Nile, the loyalty of Ruth as she pledges herself to Naomi and her God, and the ...See full summary»"
Huckleberry Finn,"Adventure, Family, Musical","In 1840s Missouri, young Huckleberry Finn, wanting to escape his violent drunkard father, joins Black runaway slave Jim on a quest for freedom down the Mississippi River on a raft."
Miss Saigon: 25th Anniversary,"Drama, Musical, Romance","A filmed production of the musical 'Miss Saigon' for its 25th anniversary, performed live at London's Prince Edward Theatre, in London's West End. Including the 2hr 20minute production and a bonus 35-minute ""25th Anniversary Gala"" which included stars of the original cast, Jonathan Pryce, Lea Salonga and Simon Bowman."
Girl from the North Country,"Drama, Musical","Nick Laine's wife is suffering from dementia. Their daughter Marianne has a guarded secret that no one can explain, she will start a relationship with a convict that will change everything for everyone forever in a timeless love story."
The Gay Divorcee,"Comedy, Musical, Romance",A woman thinks a flirting man is the co-respondent her lawyer has hired to expedite her divorce.
Care Bears Movie II: A New Generation,"Animation, Adventure, Comedy","The Care Bears try to help a young girl at summer camp who, in an effort to revamp her dorky social status to agility and skill, enters into a sinister bargain with a shape-shifting demon posing as a young boy."
Speedway,"Comedy, Musical, Romance",Poor bookkeeping saddles stock car driver Steve Grayson with a huge bill for back taxes which hampers his ability to continue racing competitively.
Cinderfella,"Comedy, Family, Fantasy","A gender-swapped retelling of Charles Perrault's classic, where Cinderfella is visited by a fairy godfather to help him escape from his wicked stepmother and stepbrothers."
Maine Pyar Kiya,"Drama, Musical, Romance","After Suman's father leaves her in the care of another family while he travels abroad, she falls in love with Prem. However, in order to for them to marry, Prem has to prove to Suman's father that he is not the same as his own dad."
Hellzapoppin',"Action, Comedy, Music","Olsen and Johnson, a pair of stage comedians, try to turn their play into a movie and bring together a young couple in love, while breaking the fourth wall every step of the way."
Kaho Naa... Pyaar Hai,"Action, Musical, Romance",A young girl meets the doppelganger of her deceased boyfriend and now has a chance to find the people who have murdered him.
Hum Dil De Chuke Sanam,"Comedy, Drama, Musical","Nandini has to choose between Sameer, the man who taught her to fall in love; and Vanraj, the man from whom she learnt how to abide and fulfill promises of love."
Hansel and Gretel,"Family, Fantasy, Musical","After being told to leave their home by their mother, Hansel and Gretel wrongly walk into the 'North woods' were they discover a delicious gingerbread house. Unbeknown to them it's a witch that lives there."
Kissin' Cousins,"Comedy, Musical, Romance","An Army officer returns to the Smoky Mountains and tries to convince his kinfolk to allow the Army to build a missile site on their land. Once he gets there, he discovers he has a look-alike cousin."
Night and Day,"Biography, Drama, Musical",A fictionalized biopic of composerCole Porterfrom his days at Yale in the 1910s through the height of his success to the 1940s.
Song of the Thin Man,"Comedy, Crime, Musical",Nick and Nora Charles are on a gambling boat when someone is murdered. The two main suspects are at large and come to Nick for help. Nick turns them into the police but then sets out to figure out the mystery.
Hum Aapke Hain Koun..!,"Comedy, Drama, Musical","Prem and Nisha meet and fall in love at the wedding of their elder siblings, but their plans to be together are put in jeopardy when Nisha's sister dies, leaving behind a baby."
Snezhnaya koroleva,"Animation, Adventure, Family","When the Snow Queen, a lonely and powerful fairy, kidnaps the human boy Kay, his best friend Gerda must overcome many obstacles on her journey to rescue him."
Paris Song,"Biography, Drama, History","Based on a true story, a small-town Kazakh singer, Amre Kashaubayev, journeys to Paris to compete in an international singing competition at the 1925 Paris Expo. Along the way he befriends American songwriter George Gershwin, thus forming a beautiful and unlikely friendship."
Wingmen,"Comedy, Musical",The story follows two pilots who crash-land in Las Vegas.
Mad Monster Party?,"Animation, Comedy, Family","On the Isle of Evil, the head of the ""World Organization of Monsters"" reveals his imminent retirement and that he has refined a formula for total destruction, only to be upset when the monsters try to steal the formula and kill his nephew."
Maximum Shame,"Fantasy, Horror, Musical","A choice must be made. It won't be easy. In fact, she'd rather walk through hell. She may have nothing to fear but fear itself, but that's more than enough."
Guy and Madeline on a Park Bench,"Drama, Musical","After connecting with the shy Madeline, a jazz trumpeter embarks on a quest for a more gregarious paramour, but through a series of twists and turns punctuated by an original score, the two lovers seem destined to be together."
Easter Parade,"Musical, Romance",A nightclub performer hires a naive chorus girl to become his new dance partner to make his former partner jealous and to prove he can make any partner a star.
The Trouble with Girls,"Comedy, History, Musical",Chautauqua manager Walter Hale and his loyal business manager struggle to keep their traveling troupe together in small town America.
Opening Night,"Comedy, Musical",A failed Broadway singer who now works as a production manager must save opening night on his new production by wrangling his eccentric cast and crew.
The Three Musketeers,"Action, Adventure, Comedy",D'Artagnan sings and fronts for slapstick cowardly Ritz brothers posing as musketeers.
English Babu Desi Mem,"Comedy, Drama, Musical","After his brother dies, wealthy Vikram reluctantly goes back to India and forms a surprise bond with his orphaned nephew and the showgirl raising him."
Calypso Heat Wave,"Drama, Musical","Everything's going well at Disco Records, where singer Johnny Conroy is popular and publicity chief Marty Collins is good at her job, as well as in love with company boss Mack Adams. Everything changes when Barney Pearl shows up."
Meet Me in Las Vegas,"Comedy, Romance, Musical","In 1950s Las Vegas, a gambling rancher and a ballerina discover that some people have luck at cards while others have luck at love."
Raaz,"Drama, Horror, Musical","Sanjana and Aditya decide to give their marriage one last chance. They plan a holiday in Ooty, but they don't know that a strange figure is waiting for them to come."
Flying Down to Rio,"Comedy, Musical, Romance",A bandleader woos a Latin flame who is already engaged to his employer.
Darling Lili,"Comedy, Drama, Musical","Set during World War I, this movie is a cute spin on the Mata Hari legend."
Rebecca of Sunnybrook Farm,"Comedy, Drama, Family",Rebecca's Uncle Harry leaves her with Aunt Miranda who forbids her to associate with show people. But neighbor Anthony Kent is a talent scout who secretly set it up for her to broadcast.
My Sister Eileen,"Comedy, Musical, Romance","After submitting a story of her beautiful sister, a woman assumes her identity to maintain the attention of a playboy publisher."
Bang Bang Baby,"Drama, Fantasy, Musical",A small town teenager in the 1960s believes her dreams of becoming a famous singer will come true when her rock star idol gets stranded in town. But a leak in a nearby chemical plant that is believed to be causing mass mutations threatens to turn her dream into a nightmare.
My Little Pony: Equestria Girls,"Animation, Comedy, Family","Via a magic mirror, Twilight Sparkle travels into an alternate universe in order to recover a crown that was stolen from the Crystal Empire. Upon her arrival she is horrified to learn that she has turned into a human."
Don Juan,"Comedy, Drama, Musical",Laurent who is jilted on his wedding day and subsequently embarks upon a wild quest.
Música,"Musical, Romance","Follows a young man, plagued by the music in his head, who has to come to terms with an uncertain future while balancing love, family and Brazilian culture in Newark, New Jersey."
Funny Lady,"Biography, Comedy, Drama",Story of singer Fanny Brice's stormy relationship with showman Billy Rose.
Parineeta,"Drama, Musical, Romance",The lifelong romance between Lolita (Balan) and Shekar (Khan) is upset by the arrival of another man.
This Is the Army,Musical,A soldier wounded in the War (WWI) becomes a producer and stages a show for the forces.
